{
  "address": "0x2Eb30ffD360Db21347443efd1a421536915e48e1",
  "abi": [
    {
      "anonymous": false,
      "inputs": [
        {
          "indexed": false,
          "internalType": "address",
          "name": "_activePoolAddress",
          "type": "address"
        }
      ],
      "name": "ActivePoolAddressChanged",
      "type": "event"
    },
    {
      "anonymous": false,
      "inputs": [
        {
          "indexed": false,
          "internalType": "address",
          "name": "_newBaseFeeLMATokenAddress",
          "type": "address"
        }
      ],
      "name": "BaseFeeLMATokenAddressChanged",
      "type": "event"
    },
    {
      "anonymous": false,
      "inputs": [
        {
          "indexed": false,
          "internalType": "uint256",
          "name": "_borrowBaseRate",
          "type": "uint256"
        }
      ],
      "name": "BorrowBaseRateUpdated",
      "type": "event"
    },
    {
      "anonymous": false,
      "inputs": [
        {
          "indexed": false,
          "internalType": "address",
          "name": "_newBorrowerOperationsAddress",
          "type": "address"
        }
      ],
      "name": "BorrowerOperationsAddressChanged",
      "type": "event"
    },
    {
      "anonymous": false,
      "inputs": [
        {
          "indexed": false,
          "internalType": "address",
          "name": "_collSurplusPoolAddress",
          "type": "address"
        }
      ],
      "name": "CollSurplusPoolAddressChanged",
      "type": "event"
    },
    {
      "anonymous": false,
      "inputs": [
        {
          "indexed": false,
          "internalType": "address",
          "name": "_defaultPoolAddress",
          "type": "address"
        }
      ],
      "name": "DefaultPoolAddressChanged",
      "type": "event"
    },
    {
      "anonymous": false,
      "inputs": [
        {
          "indexed": false,
          "internalType": "address",
          "name": "_gasPoolAddress",
          "type": "address"
        }
      ],
      "name": "GasPoolAddressChanged",
      "type": "event"
    },
    {
      "anonymous": false,
      "inputs": [
        {
          "indexed": false,
          "internalType": "address",
          "name": "_hogStakingAddress",
          "type": "address"
        }
      ],
      "name": "HOGStakingAddressChanged",
      "type": "event"
    },
    {
      "anonymous": false,
      "inputs": [
        {
          "indexed": false,
          "internalType": "address",
          "name": "_hogTokenAddress",
          "type": "address"
        }
      ],
      "name": "HOGTokenAddressChanged",
      "type": "event"
    },
    {
      "anonymous": false,
      "inputs": [
        {
          "indexed": false,
          "internalType": "uint256",
          "name": "_L_StETH",
          "type": "uint256"
        },
        {
          "indexed": false,
          "internalType": "uint256",
          "name": "_L_BaseFeeLMADebt",
          "type": "uint256"
        }
      ],
      "name": "LTermsUpdated",
      "type": "event"
    },
    {
      "anonymous": false,
      "inputs": [
        {
          "indexed": false,
          "internalType": "uint256",
          "name": "_lastBorrowTime",
          "type": "uint256"
        }
      ],
      "name": "LastBorrowTimeUpdated",
      "type": "event"
    },
    {
      "anonymous": false,
      "inputs": [
        {
          "indexed": false,
          "internalType": "uint256",
          "name": "_lastRedemptionTime",
          "type": "uint256"
        }
      ],
      "name": "LastRedemptionTimeUpdated",
      "type": "event"
    },
    {
      "anonymous": false,
      "inputs": [
        {
          "indexed": false,
          "internalType": "uint256",
          "name": "_liquidatedDebt",
          "type": "uint256"
        },
        {
          "indexed": false,
          "internalType": "uint256",
          "name": "_liquidatedColl",
          "type": "uint256"
        },
        {
          "indexed": false,
          "internalType": "uint256",
          "name": "_collGasCompensation",
          "type": "uint256"
        },
        {
          "indexed": false,
          "internalType": "uint256",
          "name": "_BaseFeeLMAGasCompensation",
          "type": "uint256"
        }
      ],
      "name": "Liquidation",
      "type": "event"
    },
    {
      "anonymous": false,
      "inputs": [
        {
          "indexed": true,
          "internalType": "address",
          "name": "previousOwner",
          "type": "address"
        },
        {
          "indexed": true,
          "internalType": "address",
          "name": "newOwner",
          "type": "address"
        }
      ],
      "name": "OwnershipTransferred",
      "type": "event"
    },
    {
      "anonymous": false,
      "inputs": [
        {
          "indexed": false,
          "internalType": "address",
          "name": "_newPriceFeedAddress",
          "type": "address"
        }
      ],
      "name": "PriceFeedAddressChanged",
      "type": "event"
    },
    {
      "anonymous": false,
      "inputs": [
        {
          "indexed": false,
          "internalType": "uint256",
          "name": "_attemptedBaseFeeLMAAmount",
          "type": "uint256"
        },
        {
          "indexed": false,
          "internalType": "uint256",
          "name": "_actualBaseFeeLMAAmount",
          "type": "uint256"
        },
        {
          "indexed": false,
          "internalType": "uint256",
          "name": "_StETHSent",
          "type": "uint256"
        },
        {
          "indexed": false,
          "internalType": "uint256",
          "name": "_StETHFee",
          "type": "uint256"
        }
      ],
      "name": "Redemption",
      "type": "event"
    },
    {
      "anonymous": false,
      "inputs": [
        {
          "indexed": false,
          "internalType": "uint256",
          "name": "_redemptionBaseRate",
          "type": "uint256"
        }
      ],
      "name": "RedemptionBaseRateUpdated",
      "type": "event"
    },
    {
      "anonymous": false,
      "inputs": [
        {
          "indexed": false,
          "internalType": "address",
          "name": "_sortedTrovesAddress",
          "type": "address"
        }
      ],
      "name": "SortedTrovesAddressChanged",
      "type": "event"
    },
    {
      "anonymous": false,
      "inputs": [
        {
          "indexed": false,
          "internalType": "address",
          "name": "_stabilityPoolAddress",
          "type": "address"
        }
      ],
      "name": "StabilityPoolAddressChanged",
      "type": "event"
    },
    {
      "anonymous": false,
      "inputs": [
        {
          "indexed": false,
          "internalType": "uint256",
          "name": "_totalStakesSnapshot",
          "type": "uint256"
        },
        {
          "indexed": false,
          "internalType": "uint256",
          "name": "_totalCollateralSnapshot",
          "type": "uint256"
        }
      ],
      "name": "SystemSnapshotsUpdated",
      "type": "event"
    },
    {
      "anonymous": false,
      "inputs": [
        {
          "indexed": false,
          "internalType": "uint256",
          "name": "_newTotalStakes",
          "type": "uint256"
        }
      ],
      "name": "TotalStakesUpdated",
      "type": "event"
    },
    {
      "anonymous": false,
      "inputs": [
        {
          "indexed": false,
          "internalType": "address",
          "name": "_borrower",
          "type": "address"
        },
        {
          "indexed": false,
          "internalType": "uint256",
          "name": "_newIndex",
          "type": "uint256"
        }
      ],
      "name": "TroveIndexUpdated",
      "type": "event"
    },
    {
      "anonymous": false,
      "inputs": [
        {
          "indexed": true,
          "internalType": "address",
          "name": "_borrower",
          "type": "address"
        },
        {
          "indexed": false,
          "internalType": "uint256",
          "name": "_debt",
          "type": "uint256"
        },
        {
          "indexed": false,
          "internalType": "uint256",
          "name": "_coll",
          "type": "uint256"
        },
        {
          "indexed": false,
          "internalType": "enum TroveManager.TroveManagerOperation",
          "name": "_operation",
          "type": "uint8"
        }
      ],
      "name": "TroveLiquidated",
      "type": "event"
    },
    {
      "anonymous": false,
      "inputs": [
        {
          "indexed": false,
          "internalType": "uint256",
          "name": "_L_StETH",
          "type": "uint256"
        },
        {
          "indexed": false,
          "internalType": "uint256",
          "name": "_L_BaseFeeLMADebt",
          "type": "uint256"
        }
      ],
      "name": "TroveSnapshotsUpdated",
      "type": "event"
    },
    {
      "anonymous": false,
      "inputs": [
        {
          "indexed": true,
          "internalType": "address",
          "name": "_borrower",
          "type": "address"
        },
        {
          "indexed": false,
          "internalType": "uint256",
          "name": "_debt",
          "type": "uint256"
        },
        {
          "indexed": false,
          "internalType": "uint256",
          "name": "_coll",
          "type": "uint256"
        },
        {
          "indexed": false,
          "internalType": "uint256",
          "name": "_stake",
          "type": "uint256"
        },
        {
          "indexed": false,
          "internalType": "enum TroveManager.TroveManagerOperation",
          "name": "_operation",
          "type": "uint8"
        }
      ],
      "name": "TroveUpdated",
      "type": "event"
    },
    {
      "inputs": [],
      "name": "BETA",
      "outputs": [
        {
          "internalType": "uint256",
          "name": "",
          "type": "uint256"
        }
      ],
      "stateMutability": "view",
      "type": "function"
    },
    {
      "inputs": [],
      "name": "BOOTSTRAP_PERIOD",
      "outputs": [
        {
          "internalType": "uint256",
          "name": "",
          "type": "uint256"
        }
      ],
      "stateMutability": "view",
      "type": "function"
    },
    {
      "inputs": [],
      "name": "BORROWING_FEE_FLOOR",
      "outputs": [
        {
          "internalType": "uint256",
          "name": "",
          "type": "uint256"
        }
      ],
      "stateMutability": "view",
      "type": "function"
    },
    {
      "inputs": [],
      "name": "BaseFeeLMA_GAS_COMPENSATION",
      "outputs": [
        {
          "internalType": "uint256",
          "name": "",
          "type": "uint256"
        }
      ],
      "stateMutability": "view",
      "type": "function"
    },
    {
      "inputs": [],
      "name": "CCR",
      "outputs": [
        {
          "internalType": "uint256",
          "name": "",
          "type": "uint256"
        }
      ],
      "stateMutability": "view",
      "type": "function"
    },
    {
      "inputs": [],
      "name": "DECIMAL_PRECISION",
      "outputs": [
        {
          "internalType": "uint256",
          "name": "",
          "type": "uint256"
        }
      ],
      "stateMutability": "view",
      "type": "function"
    },
    {
      "inputs": [],
      "name": "L_BaseFeeLMADebt",
      "outputs": [
        {
          "internalType": "uint256",
          "name": "",
          "type": "uint256"
        }
      ],
      "stateMutability": "view",
      "type": "function"
    },
    {
      "inputs": [],
      "name": "L_StETH",
      "outputs": [
        {
          "internalType": "uint256",
          "name": "",
          "type": "uint256"
        }
      ],
      "stateMutability": "view",
      "type": "function"
    },
    {
      "inputs": [],
      "name": "MAX_BORROWING_FEE",
      "outputs": [
        {
          "internalType": "uint256",
          "name": "",
          "type": "uint256"
        }
      ],
      "stateMutability": "view",
      "type": "function"
    },
    {
      "inputs": [],
      "name": "MCR",
      "outputs": [
        {
          "internalType": "uint256",
          "name": "",
          "type": "uint256"
        }
      ],
      "stateMutability": "view",
      "type": "function"
    },
    {
      "inputs": [],
      "name": "MINUTE_DECAY_BORROWING_FACTOR",
      "outputs": [
        {
          "internalType": "uint256",
          "name": "",
          "type": "uint256"
        }
      ],
      "stateMutability": "view",
      "type": "function"
    },
    {
      "inputs": [],
      "name": "MINUTE_DECAY_REDEMPTION_FACTOR",
      "outputs": [
        {
          "internalType": "uint256",
          "name": "",
          "type": "uint256"
        }
      ],
      "stateMutability": "view",
      "type": "function"
    },
    {
      "inputs": [],
      "name": "MIN_NET_DEBT",
      "outputs": [
        {
          "internalType": "uint256",
          "name": "",
          "type": "uint256"
        }
      ],
      "stateMutability": "view",
      "type": "function"
    },
    {
      "inputs": [],
      "name": "NAME",
      "outputs": [
        {
          "internalType": "string",
          "name": "",
          "type": "string"
        }
      ],
      "stateMutability": "view",
      "type": "function"
    },
    {
      "inputs": [],
      "name": "PERCENT_DIVISOR",
      "outputs": [
        {
          "internalType": "uint256",
          "name": "",
          "type": "uint256"
        }
      ],
      "stateMutability": "view",
      "type": "function"
    },
    {
      "inputs": [],
      "name": "REDEMPTION_FEE_FLOOR",
      "outputs": [
        {
          "internalType": "uint256",
          "name": "",
          "type": "uint256"
        }
      ],
      "stateMutability": "view",
      "type": "function"
    },
    {
      "inputs": [],
      "name": "SECONDS_IN_ONE_MINUTE",
      "outputs": [
        {
          "internalType": "uint256",
          "name": "",
          "type": "uint256"
        }
      ],
      "stateMutability": "view",
      "type": "function"
    },
    {
      "inputs": [
        {
          "internalType": "uint256",
          "name": "",
          "type": "uint256"
        }
      ],
      "name": "TroveOwners",
      "outputs": [
        {
          "internalType": "address",
          "name": "",
          "type": "address"
        }
      ],
      "stateMutability": "view",
      "type": "function"
    },
    {
      "inputs": [
        {
          "internalType": "address",
          "name": "",
          "type": "address"
        }
      ],
      "name": "Troves",
      "outputs": [
        {
          "internalType": "uint256",
          "name": "debt",
          "type": "uint256"
        },
        {
          "internalType": "uint256",
          "name": "coll",
          "type": "uint256"
        },
        {
          "internalType": "uint256",
          "name": "stake",
          "type": "uint256"
        },
        {
          "internalType": "enum TroveManager.Status",
          "name": "status",
          "type": "uint8"
        },
        {
          "internalType": "uint128",
          "name": "arrayIndex",
          "type": "uint128"
        }
      ],
      "stateMutability": "view",
      "type": "function"
    },
    {
      "inputs": [],
      "name": "_100pct",
      "outputs": [
        {
          "internalType": "uint256",
          "name": "",
          "type": "uint256"
        }
      ],
      "stateMutability": "view",
      "type": "function"
    },
    {
      "inputs": [],
      "name": "activePool",
      "outputs": [
        {
          "internalType": "contract IActivePool",
          "name": "",
          "type": "address"
        }
      ],
      "stateMutability": "view",
      "type": "function"
    },
    {
      "inputs": [
        {
          "internalType": "address",
          "name": "_borrower",
          "type": "address"
        }
      ],
      "name": "addTroveOwnerToArray",
      "outputs": [
        {
          "internalType": "uint256",
          "name": "index",
          "type": "uint256"
        }
      ],
      "stateMutability": "nonpayable",
      "type": "function"
    },
    {
      "inputs": [
        {
          "internalType": "address",
          "name": "_borrower",
          "type": "address"
        }
      ],
      "name": "applyPendingRewards",
      "outputs": [],
      "stateMutability": "nonpayable",
      "type": "function"
    },
    {
      "inputs": [],
      "name": "baseFeeLMAToken",
      "outputs": [
        {
          "internalType": "contract IBaseFeeLMAToken",
          "name": "",
          "type": "address"
        }
      ],
      "stateMutability": "view",
      "type": "function"
    },
    {
      "inputs": [
        {
          "internalType": "address[]",
          "name": "_troveArray",
          "type": "address[]"
        }
      ],
      "name": "batchLiquidateTroves",
      "outputs": [],
      "stateMutability": "nonpayable",
      "type": "function"
    },
    {
      "inputs": [],
      "name": "borrowBaseRate",
      "outputs": [
        {
          "internalType": "uint256",
          "name": "",
          "type": "uint256"
        }
      ],
      "stateMutability": "view",
      "type": "function"
    },
    {
      "inputs": [],
      "name": "borrowerOperationsAddress",
      "outputs": [
        {
          "internalType": "address",
          "name": "",
          "type": "address"
        }
      ],
      "stateMutability": "view",
      "type": "function"
    },
    {
      "inputs": [
        {
          "internalType": "uint256",
          "name": "_price",
          "type": "uint256"
        }
      ],
      "name": "checkRecoveryMode",
      "outputs": [
        {
          "internalType": "bool",
          "name": "",
          "type": "bool"
        }
      ],
      "stateMutability": "view",
      "type": "function"
    },
    {
      "inputs": [],
      "name": "checkUnreliableRecoveryMode",
      "outputs": [
        {
          "internalType": "bool",
          "name": "",
          "type": "bool"
        }
      ],
      "stateMutability": "view",
      "type": "function"
    },
    {
      "inputs": [
        {
          "internalType": "address",
          "name": "_borrower",
          "type": "address"
        }
      ],
      "name": "closeTrove",
      "outputs": [],
      "stateMutability": "nonpayable",
      "type": "function"
    },
    {
      "inputs": [],
      "name": "decayBaseRateFromBorrowing",
      "outputs": [],
      "stateMutability": "nonpayable",
      "type": "function"
    },
    {
      "inputs": [
        {
          "internalType": "address",
          "name": "_borrower",
          "type": "address"
        },
        {
          "internalType": "uint256",
          "name": "_collDecrease",
          "type": "uint256"
        }
      ],
      "name": "decreaseTroveColl",
      "outputs": [
        {
          "internalType": "uint256",
          "name": "",
          "type": "uint256"
        }
      ],
      "stateMutability": "nonpayable",
      "type": "function"
    },
    {
      "inputs": [
        {
          "internalType": "address",
          "name": "_borrower",
          "type": "address"
        },
        {
          "internalType": "uint256",
          "name": "_debtDecrease",
          "type": "uint256"
        }
      ],
      "name": "decreaseTroveDebt",
      "outputs": [
        {
          "internalType": "uint256",
          "name": "",
          "type": "uint256"
        }
      ],
      "stateMutability": "nonpayable",
      "type": "function"
    },
    {
      "inputs": [],
      "name": "defaultPool",
      "outputs": [
        {
          "internalType": "contract IDefaultPool",
          "name": "",
          "type": "address"
        }
      ],
      "stateMutability": "view",
      "type": "function"
    },
    {
      "inputs": [
        {
          "internalType": "uint256",
          "name": "_BaseFeeLMADebt",
          "type": "uint256"
        }
      ],
      "name": "getBorrowingFee",
      "outputs": [
        {
          "internalType": "uint256",
          "name": "",
          "type": "uint256"
        },
        {
          "internalType": "uint256",
          "name": "",
          "type": "uint256"
        }
      ],
      "stateMutability": "view",
      "type": "function"
    },
    {
      "inputs": [
        {
          "internalType": "uint256",
          "name": "_BaseFeeLMADebt",
          "type": "uint256"
        }
      ],
      "name": "getBorrowingFeeWithDecay",
      "outputs": [
        {
          "internalType": "uint256",
          "name": "",
          "type": "uint256"
        }
      ],
      "stateMutability": "view",
      "type": "function"
    },
    {
      "inputs": [
        {
          "internalType": "uint256",
          "name": "_issuedBaseFeeLMA",
          "type": "uint256"
        }
      ],
      "name": "getBorrowingRate",
      "outputs": [
        {
          "internalType": "uint256",
          "name": "",
          "type": "uint256"
        }
      ],
      "stateMutability": "view",
      "type": "function"
    },
    {
      "inputs": [
        {
          "internalType": "uint256",
          "name": "_issuedBaseFeeLMA",
          "type": "uint256"
        }
      ],
      "name": "getBorrowingRateWithDecay",
      "outputs": [
        {
          "internalType": "uint256",
          "name": "",
          "type": "uint256"
        }
      ],
      "stateMutability": "view",
      "type": "function"
    },
    {
      "inputs": [
        {
          "internalType": "address",
          "name": "_borrower",
          "type": "address"
        },
        {
          "internalType": "uint256",
          "name": "_price",
          "type": "uint256"
        }
      ],
      "name": "getCurrentICR",
      "outputs": [
        {
          "internalType": "uint256",
          "name": "",
          "type": "uint256"
        }
      ],
      "stateMutability": "view",
      "type": "function"
    },
    {
      "inputs": [
        {
          "internalType": "address",
          "name": "_borrower",
          "type": "address"
        }
      ],
      "name": "getEntireDebtAndColl",
      "outputs": [
        {
          "internalType": "uint256",
          "name": "debt",
          "type": "uint256"
        },
        {
          "internalType": "uint256",
          "name": "coll",
          "type": "uint256"
        },
        {
          "internalType": "uint256",
          "name": "pendingBaseFeeLMADebtReward",
          "type": "uint256"
        },
        {
          "internalType": "uint256",
          "name": "pendingStETHReward",
          "type": "uint256"
        }
      ],
      "stateMutability": "view",
      "type": "function"
    },
    {
      "inputs": [],
      "name": "getEntireSystemColl",
      "outputs": [
        {
          "internalType": "uint256",
          "name": "entireSystemColl",
          "type": "uint256"
        }
      ],
      "stateMutability": "view",
      "type": "function"
    },
    {
      "inputs": [],
      "name": "getEntireSystemDebt",
      "outputs": [
        {
          "internalType": "uint256",
          "name": "entireSystemDebt",
          "type": "uint256"
        }
      ],
      "stateMutability": "view",
      "type": "function"
    },
    {
      "inputs": [
        {
          "internalType": "address",
          "name": "_borrower",
          "type": "address"
        }
      ],
      "name": "getNominalICR",
      "outputs": [
        {
          "internalType": "uint256",
          "name": "",
          "type": "uint256"
        }
      ],
      "stateMutability": "view",
      "type": "function"
    },
    {
      "inputs": [
        {
          "internalType": "uint256",
          "name": "_coll",
          "type": "uint256"
        },
        {
          "internalType": "uint256",
          "name": "_debt",
          "type": "uint256"
        }
      ],
      "name": "getNormalLiquidationPrice",
      "outputs": [
        {
          "internalType": "uint256",
          "name": "",
          "type": "uint256"
        }
      ],
      "stateMutability": "pure",
      "type": "function"
    },
    {
      "inputs": [
        {
          "internalType": "address",
          "name": "_borrower",
          "type": "address"
        }
      ],
      "name": "getPendingBaseFeeLMADebtReward",
      "outputs": [
        {
          "internalType": "uint256",
          "name": "",
          "type": "uint256"
        }
      ],
      "stateMutability": "view",
      "type": "function"
    },
    {
      "inputs": [
        {
          "internalType": "address",
          "name": "_borrower",
          "type": "address"
        }
      ],
      "name": "getPendingStETHReward",
      "outputs": [
        {
          "internalType": "uint256",
          "name": "",
          "type": "uint256"
        }
      ],
      "stateMutability": "view",
      "type": "function"
    },
    {
      "inputs": [
        {
          "internalType": "uint256",
          "name": "_coll",
          "type": "uint256"
        },
        {
          "internalType": "uint256",
          "name": "_debt",
          "type": "uint256"
        }
      ],
      "name": "getRecoveryLiquidationPrice",
      "outputs": [
        {
          "internalType": "uint256",
          "name": "",
          "type": "uint256"
        }
      ],
      "stateMutability": "pure",
      "type": "function"
    },
    {
      "inputs": [
        {
          "internalType": "uint256",
          "name": "_StETHDrawn",
          "type": "uint256"
        }
      ],
      "name": "getRedemptionFeeWithDecay",
      "outputs": [
        {
          "internalType": "uint256",
          "name": "",
          "type": "uint256"
        }
      ],
      "stateMutability": "view",
      "type": "function"
    },
    {
      "inputs": [
        {
          "internalType": "uint256",
          "name": "_redemptionColl",
          "type": "uint256"
        }
      ],
      "name": "getRedemptionRate",
      "outputs": [
        {
          "internalType": "uint256",
          "name": "",
          "type": "uint256"
        }
      ],
      "stateMutability": "view",
      "type": "function"
    },
    {
      "inputs": [
        {
          "internalType": "uint256",
          "name": "_redemptionColl",
          "type": "uint256"
        }
      ],
      "name": "getRedemptionRateWithDecay",
      "outputs": [
        {
          "internalType": "uint256",
          "name": "",
          "type": "uint256"
        }
      ],
      "stateMutability": "view",
      "type": "function"
    },
    {
      "inputs": [
        {
          "internalType": "uint256",
          "name": "_price",
          "type": "uint256"
        }
      ],
      "name": "getTCR",
      "outputs": [
        {
          "internalType": "uint256",
          "name": "",
          "type": "uint256"
        }
      ],
      "stateMutability": "view",
      "type": "function"
    },
    {
      "inputs": [
        {
          "internalType": "address",
          "name": "_borrower",
          "type": "address"
        }
      ],
      "name": "getTroveColl",
      "outputs": [
        {
          "internalType": "uint256",
          "name": "",
          "type": "uint256"
        }
      ],
      "stateMutability": "view",
      "type": "function"
    },
    {
      "inputs": [
        {
          "internalType": "address",
          "name": "_borrower",
          "type": "address"
        }
      ],
      "name": "getTroveDebt",
      "outputs": [
        {
          "internalType": "uint256",
          "name": "",
          "type": "uint256"
        }
      ],
      "stateMutability": "view",
      "type": "function"
    },
    {
      "inputs": [
        {
          "internalType": "uint256",
          "name": "_index",
          "type": "uint256"
        }
      ],
      "name": "getTroveFromTroveOwnersArray",
      "outputs": [
        {
          "internalType": "address",
          "name": "",
          "type": "address"
        }
      ],
      "stateMutability": "view",
      "type": "function"
    },
    {
      "inputs": [],
      "name": "getTroveOwnersCount",
      "outputs": [
        {
          "internalType": "uint256",
          "name": "",
          "type": "uint256"
        }
      ],
      "stateMutability": "view",
      "type": "function"
    },
    {
      "inputs": [
        {
          "internalType": "address",
          "name": "_borrower",
          "type": "address"
        }
      ],
      "name": "getTroveStake",
      "outputs": [
        {
          "internalType": "uint256",
          "name": "",
          "type": "uint256"
        }
      ],
      "stateMutability": "view",
      "type": "function"
    },
    {
      "inputs": [
        {
          "internalType": "address",
          "name": "_borrower",
          "type": "address"
        }
      ],
      "name": "getTroveStatus",
      "outputs": [
        {
          "internalType": "uint256",
          "name": "",
          "type": "uint256"
        }
      ],
      "stateMutability": "view",
      "type": "function"
    },
    {
      "inputs": [],
      "name": "getUnreliableTCR",
      "outputs": [
        {
          "internalType": "uint256",
          "name": "",
          "type": "uint256"
        }
      ],
      "stateMutability": "view",
      "type": "function"
    },
    {
      "inputs": [
        {
          "internalType": "address",
          "name": "_borrower",
          "type": "address"
        }
      ],
      "name": "getUnreliableTroveICR",
      "outputs": [
        {
          "internalType": "uint256",
          "name": "",
          "type": "uint256"
        }
      ],
      "stateMutability": "view",
      "type": "function"
    },
    {
      "inputs": [
        {
          "internalType": "address",
          "name": "_borrower",
          "type": "address"
        }
      ],
      "name": "hasPendingRewards",
      "outputs": [
        {
          "internalType": "bool",
          "name": "",
          "type": "bool"
        }
      ],
      "stateMutability": "view",
      "type": "function"
    },
    {
      "inputs": [],
      "name": "hogStaking",
      "outputs": [
        {
          "internalType": "contract IHOGStaking",
          "name": "",
          "type": "address"
        }
      ],
      "stateMutability": "view",
      "type": "function"
    },
    {
      "inputs": [],
      "name": "hogToken",
      "outputs": [
        {
          "internalType": "contract IHOGToken",
          "name": "",
          "type": "address"
        }
      ],
      "stateMutability": "view",
      "type": "function"
    },
    {
      "inputs": [
        {
          "internalType": "address",
          "name": "_borrower",
          "type": "address"
        },
        {
          "internalType": "uint256",
          "name": "_collIncrease",
          "type": "uint256"
        }
      ],
      "name": "increaseTroveColl",
      "outputs": [
        {
          "internalType": "uint256",
          "name": "",
          "type": "uint256"
        }
      ],
      "stateMutability": "nonpayable",
      "type": "function"
    },
    {
      "inputs": [
        {
          "internalType": "address",
          "name": "_borrower",
          "type": "address"
        },
        {
          "internalType": "uint256",
          "name": "_debtIncrease",
          "type": "uint256"
        }
      ],
      "name": "increaseTroveDebt",
      "outputs": [
        {
          "internalType": "uint256",
          "name": "",
          "type": "uint256"
        }
      ],
      "stateMutability": "nonpayable",
      "type": "function"
    },
    {
      "inputs": [],
      "name": "lastBaseFeeLMADebtError_Redistribution",
      "outputs": [
        {
          "internalType": "uint256",
          "name": "",
          "type": "uint256"
        }
      ],
      "stateMutability": "view",
      "type": "function"
    },
    {
      "inputs": [],
      "name": "lastBorrowTime",
      "outputs": [
        {
          "internalType": "uint256",
          "name": "",
          "type": "uint256"
        }
      ],
      "stateMutability": "view",
      "type": "function"
    },
    {
      "inputs": [],
      "name": "lastRedemptionTime",
      "outputs": [
        {
          "internalType": "uint256",
          "name": "",
          "type": "uint256"
        }
      ],
      "stateMutability": "view",
      "type": "function"
    },
    {
      "inputs": [],
      "name": "lastStETHError_Redistribution",
      "outputs": [
        {
          "internalType": "uint256",
          "name": "",
          "type": "uint256"
        }
      ],
      "stateMutability": "view",
      "type": "function"
    },
    {
      "inputs": [
        {
          "internalType": "address",
          "name": "_borrower",
          "type": "address"
        }
      ],
      "name": "liquidate",
      "outputs": [],
      "stateMutability": "nonpayable",
      "type": "function"
    },
    {
      "inputs": [
        {
          "internalType": "uint256",
          "name": "_n",
          "type": "uint256"
        }
      ],
      "name": "liquidateTroves",
      "outputs": [],
      "stateMutability": "nonpayable",
      "type": "function"
    },
    {
      "inputs": [],
      "name": "owner",
      "outputs": [
        {
          "internalType": "address",
          "name": "",
          "type": "address"
        }
      ],
      "stateMutability": "view",
      "type": "function"
    },
    {
      "inputs": [],
      "name": "priceFeed",
      "outputs": [
        {
          "internalType": "contract IPriceFeed",
          "name": "",
          "type": "address"
        }
      ],
      "stateMutability": "view",
      "type": "function"
    },
    {
      "inputs": [
        {
          "internalType": "uint256",
          "name": "_BaseFeeLMAamount",
          "type": "uint256"
        },
        {
          "internalType": "address",
          "name": "_firstRedemptionHint",
          "type": "address"
        },
        {
          "internalType": "address",
          "name": "_upperPartialRedemptionHint",
          "type": "address"
        },
        {
          "internalType": "address",
          "name": "_lowerPartialRedemptionHint",
          "type": "address"
        },
        {
          "internalType": "uint256",
          "name": "_partialRedemptionHintNICR",
          "type": "uint256"
        },
        {
          "internalType": "uint256",
          "name": "_maxIterations",
          "type": "uint256"
        },
        {
          "internalType": "uint256",
          "name": "_maxFeePercentage",
          "type": "uint256"
        }
      ],
      "name": "redeemCollateral",
      "outputs": [],
      "stateMutability": "nonpayable",
      "type": "function"
    },
    {
      "inputs": [],
      "name": "redemptionBaseRate",
      "outputs": [
        {
          "internalType": "uint256",
          "name": "",
          "type": "uint256"
        }
      ],
      "stateMutability": "view",
      "type": "function"
    },
    {
      "inputs": [
        {
          "internalType": "address",
          "name": "_borrower",
          "type": "address"
        }
      ],
      "name": "removeStake",
      "outputs": [],
      "stateMutability": "nonpayable",
      "type": "function"
    },
    {
      "inputs": [],
      "name": "renounceOwnership",
      "outputs": [],
      "stateMutability": "nonpayable",
      "type": "function"
    },
    {
      "inputs": [
        {
          "internalType": "address",
          "name": "",
          "type": "address"
        }
      ],
      "name": "rewardSnapshots",
      "outputs": [
        {
          "internalType": "uint256",
          "name": "StETH",
          "type": "uint256"
        },
        {
          "internalType": "uint256",
          "name": "BaseFeeLMADebt",
          "type": "uint256"
        }
      ],
      "stateMutability": "view",
      "type": "function"
    },
    {
      "inputs": [
        {
          "internalType": "address",
          "name": "_borrowerOperationsAddress",
          "type": "address"
        },
        {
          "internalType": "address",
          "name": "_activePoolAddress",
          "type": "address"
        },
        {
          "internalType": "address",
          "name": "_defaultPoolAddress",
          "type": "address"
        },
        {
          "internalType": "address",
          "name": "_stabilityPoolAddress",
          "type": "address"
        },
        {
          "internalType": "address",
          "name": "_gasPoolAddress",
          "type": "address"
        },
        {
          "internalType": "address",
          "name": "_collSurplusPoolAddress",
          "type": "address"
        },
        {
          "internalType": "address",
          "name": "_priceFeedAddress",
          "type": "address"
        },
        {
          "internalType": "address",
          "name": "_baseFeeLMATokenAddress",
          "type": "address"
        },
        {
          "internalType": "address",
          "name": "_sortedTrovesAddress",
          "type": "address"
        },
        {
          "internalType": "address",
          "name": "_hogTokenAddress",
          "type": "address"
        },
        {
          "internalType": "address",
          "name": "_hogStakingAddress",
          "type": "address"
        }
      ],
      "name": "setAddresses",
      "outputs": [],
      "stateMutability": "nonpayable",
      "type": "function"
    },
    {
      "inputs": [
        {
          "internalType": "address",
          "name": "_borrower",
          "type": "address"
        },
        {
          "internalType": "uint256",
          "name": "_num",
          "type": "uint256"
        }
      ],
      "name": "setTroveStatus",
      "outputs": [],
      "stateMutability": "nonpayable",
      "type": "function"
    },
    {
      "inputs": [],
      "name": "sortedTroves",
      "outputs": [
        {
          "internalType": "contract ISortedTroves",
          "name": "",
          "type": "address"
        }
      ],
      "stateMutability": "view",
      "type": "function"
    },
    {
      "inputs": [],
      "name": "stabilityPool",
      "outputs": [
        {
          "internalType": "contract IStabilityPool",
          "name": "",
          "type": "address"
        }
      ],
      "stateMutability": "view",
      "type": "function"
    },
    {
      "inputs": [],
      "name": "totalCollateralSnapshot",
      "outputs": [
        {
          "internalType": "uint256",
          "name": "",
          "type": "uint256"
        }
      ],
      "stateMutability": "view",
      "type": "function"
    },
    {
      "inputs": [],
      "name": "totalStakes",
      "outputs": [
        {
          "internalType": "uint256",
          "name": "",
          "type": "uint256"
        }
      ],
      "stateMutability": "view",
      "type": "function"
    },
    {
      "inputs": [],
      "name": "totalStakesSnapshot",
      "outputs": [
        {
          "internalType": "uint256",
          "name": "",
          "type": "uint256"
        }
      ],
      "stateMutability": "view",
      "type": "function"
    },
    {
      "inputs": [
        {
          "internalType": "address",
          "name": "newOwner",
          "type": "address"
        }
      ],
      "name": "transferOwnership",
      "outputs": [],
      "stateMutability": "nonpayable",
      "type": "function"
    },
    {
      "inputs": [
        {
          "internalType": "uint256",
          "name": "_newBaseRate",
          "type": "uint256"
        }
      ],
      "name": "updateBaseRateFromBorrowing",
      "outputs": [],
      "stateMutability": "nonpayable",
      "type": "function"
    },
    {
      "inputs": [
        {
          "internalType": "address",
          "name": "_borrower",
          "type": "address"
        }
      ],
      "name": "updateStakeAndTotalStakes",
      "outputs": [
        {
          "internalType": "uint256",
          "name": "",
          "type": "uint256"
        }
      ],
      "stateMutability": "nonpayable",
      "type": "function"
    },
    {
      "inputs": [
        {
          "internalType": "address",
          "name": "_borrower",
          "type": "address"
        }
      ],
      "name": "updateTroveRewardSnapshots",
      "outputs": [],
      "stateMutability": "nonpayable",
      "type": "function"
    }
  ],
  "transactionHash": "0x814ede14257267d1b11f94961fec3f522eeb90b1cee4458ccaad72532a9aa8d6",
  "receipt": {
    "to": null,
    "from": "0x796EcfBe7a2A424f9D905dfC38b8994aB2db9FD6",
    "contractAddress": "0x2Eb30ffD360Db21347443efd1a421536915e48e1",
    "transactionIndex": 6,
    "gasUsed": "5333744",
    "logsBloom": "0x00000000000000000000000000000000000000000000000100800000020000000000000002000000000000000000000000008000000000000000000000000000000000000000000000000000000000800001000000000000000100000000000000000004020000000000000000000800000000000080000080000000000000400000000000000000000000000000000000000000000000000000000000000000200000000000000000000000000000000000000000000000000000000000004000000000000000000001000000000080800000000000000080100000000020000000000000000080000000000000000000000000000000000000000000100000",
    "blockHash": "0x4db2ccc9021ca0c22f27f2e6656a006e02c709920d636ba87137c2a9db214770",
    "transactionHash": "0x814ede14257267d1b11f94961fec3f522eeb90b1cee4458ccaad72532a9aa8d6",
    "logs": [
      {
        "transactionIndex": 6,
        "blockNumber": 40867210,
        "transactionHash": "0x814ede14257267d1b11f94961fec3f522eeb90b1cee4458ccaad72532a9aa8d6",
        "address": "0x2Eb30ffD360Db21347443efd1a421536915e48e1",
        "topics": [
          "0x8be0079c531659141344cd1fd0a4f28419497f9722a3daafe3b4186f6b6457e0",
          "0x0000000000000000000000000000000000000000000000000000000000000000",
          "0x000000000000000000000000796ecfbe7a2a424f9d905dfc38b8994ab2db9fd6"
        ],
        "data": "0x",
        "logIndex": 16,
        "blockHash": "0x4db2ccc9021ca0c22f27f2e6656a006e02c709920d636ba87137c2a9db214770"
      },
      {
        "transactionIndex": 6,
        "blockNumber": 40867210,
        "transactionHash": "0x814ede14257267d1b11f94961fec3f522eeb90b1cee4458ccaad72532a9aa8d6",
        "address": "0x0000000000000000000000000000000000001010",
        "topics": [
          "0x4dfe1bbbcf077ddc3e01291eea2d5c70c2b422b415d95645b9adcfd678cb1d63",
          "0x0000000000000000000000000000000000000000000000000000000000001010",
          "0x000000000000000000000000796ecfbe7a2a424f9d905dfc38b8994ab2db9fd6",
          "0x0000000000000000000000005082f249cdb2f2c1ee035e4f423c46ea2dab3ab1"
        ],
        "data": "0x000000000000000000000000000000000000000000000000001c6c8492aa100000000000000000000000000000000000000000000000000002e02a6dbcf911fb0000000000000000000000000000000000000000000002558bc8faeeac09820000000000000000000000000000000000000000000000000002c3bde92a4f01fb0000000000000000000000000000000000000000000002558be567733eb39200",
        "logIndex": 17,
        "blockHash": "0x4db2ccc9021ca0c22f27f2e6656a006e02c709920d636ba87137c2a9db214770"
      }
    ],
    "blockNumber": 40867210,
    "cumulativeGasUsed": "11749086",
    "status": 1,
    "byzantium": true
  },
  "args": [],
  "numDeployments": 1,
  "solcInputHash": "12e72a8935c547e69b961442ac1acb6d",
  "metadata": "{\"compiler\":{\"version\":\"0.8.19+commit.7dd6d404\"},\"language\":\"Solidity\",\"output\":{\"abi\":[{\"anonymous\":false,\"inputs\":[{\"indexed\":false,\"internalType\":\"address\",\"name\":\"_activePoolAddress\",\"type\":\"address\"}],\"name\":\"ActivePoolAddressChanged\",\"type\":\"event\"},{\"anonymous\":false,\"inputs\":[{\"indexed\":false,\"internalType\":\"address\",\"name\":\"_newBaseFeeLMATokenAddress\",\"type\":\"address\"}],\"name\":\"BaseFeeLMATokenAddressChanged\",\"type\":\"event\"},{\"anonymous\":false,\"inputs\":[{\"indexed\":false,\"internalType\":\"uint256\",\"name\":\"_borrowBaseRate\",\"type\":\"uint256\"}],\"name\":\"BorrowBaseRateUpdated\",\"type\":\"event\"},{\"anonymous\":false,\"inputs\":[{\"indexed\":false,\"internalType\":\"address\",\"name\":\"_newBorrowerOperationsAddress\",\"type\":\"address\"}],\"name\":\"BorrowerOperationsAddressChanged\",\"type\":\"event\"},{\"anonymous\":false,\"inputs\":[{\"indexed\":false,\"internalType\":\"address\",\"name\":\"_collSurplusPoolAddress\",\"type\":\"address\"}],\"name\":\"CollSurplusPoolAddressChanged\",\"type\":\"event\"},{\"anonymous\":false,\"inputs\":[{\"indexed\":false,\"internalType\":\"address\",\"name\":\"_defaultPoolAddress\",\"type\":\"address\"}],\"name\":\"DefaultPoolAddressChanged\",\"type\":\"event\"},{\"anonymous\":false,\"inputs\":[{\"indexed\":false,\"internalType\":\"address\",\"name\":\"_gasPoolAddress\",\"type\":\"address\"}],\"name\":\"GasPoolAddressChanged\",\"type\":\"event\"},{\"anonymous\":false,\"inputs\":[{\"indexed\":false,\"internalType\":\"address\",\"name\":\"_hogStakingAddress\",\"type\":\"address\"}],\"name\":\"HOGStakingAddressChanged\",\"type\":\"event\"},{\"anonymous\":false,\"inputs\":[{\"indexed\":false,\"internalType\":\"address\",\"name\":\"_hogTokenAddress\",\"type\":\"address\"}],\"name\":\"HOGTokenAddressChanged\",\"type\":\"event\"},{\"anonymous\":false,\"inputs\":[{\"indexed\":false,\"internalType\":\"uint256\",\"name\":\"_L_StETH\",\"type\":\"uint256\"},{\"indexed\":false,\"internalType\":\"uint256\",\"name\":\"_L_BaseFeeLMADebt\",\"type\":\"uint256\"}],\"name\":\"LTermsUpdated\",\"type\":\"event\"},{\"anonymous\":false,\"inputs\":[{\"indexed\":false,\"internalType\":\"uint256\",\"name\":\"_lastBorrowTime\",\"type\":\"uint256\"}],\"name\":\"LastBorrowTimeUpdated\",\"type\":\"event\"},{\"anonymous\":false,\"inputs\":[{\"indexed\":false,\"internalType\":\"uint256\",\"name\":\"_lastRedemptionTime\",\"type\":\"uint256\"}],\"name\":\"LastRedemptionTimeUpdated\",\"type\":\"event\"},{\"anonymous\":false,\"inputs\":[{\"indexed\":false,\"internalType\":\"uint256\",\"name\":\"_liquidatedDebt\",\"type\":\"uint256\"},{\"indexed\":false,\"internalType\":\"uint256\",\"name\":\"_liquidatedColl\",\"type\":\"uint256\"},{\"indexed\":false,\"internalType\":\"uint256\",\"name\":\"_collGasCompensation\",\"type\":\"uint256\"},{\"indexed\":false,\"internalType\":\"uint256\",\"name\":\"_BaseFeeLMAGasCompensation\",\"type\":\"uint256\"}],\"name\":\"Liquidation\",\"type\":\"event\"},{\"anonymous\":false,\"inputs\":[{\"indexed\":true,\"internalType\":\"address\",\"name\":\"previousOwner\",\"type\":\"address\"},{\"indexed\":true,\"internalType\":\"address\",\"name\":\"newOwner\",\"type\":\"address\"}],\"name\":\"OwnershipTransferred\",\"type\":\"event\"},{\"anonymous\":false,\"inputs\":[{\"indexed\":false,\"internalType\":\"address\",\"name\":\"_newPriceFeedAddress\",\"type\":\"address\"}],\"name\":\"PriceFeedAddressChanged\",\"type\":\"event\"},{\"anonymous\":false,\"inputs\":[{\"indexed\":false,\"internalType\":\"uint256\",\"name\":\"_attemptedBaseFeeLMAAmount\",\"type\":\"uint256\"},{\"indexed\":false,\"internalType\":\"uint256\",\"name\":\"_actualBaseFeeLMAAmount\",\"type\":\"uint256\"},{\"indexed\":false,\"internalType\":\"uint256\",\"name\":\"_StETHSent\",\"type\":\"uint256\"},{\"indexed\":false,\"internalType\":\"uint256\",\"name\":\"_StETHFee\",\"type\":\"uint256\"}],\"name\":\"Redemption\",\"type\":\"event\"},{\"anonymous\":false,\"inputs\":[{\"indexed\":false,\"internalType\":\"uint256\",\"name\":\"_redemptionBaseRate\",\"type\":\"uint256\"}],\"name\":\"RedemptionBaseRateUpdated\",\"type\":\"event\"},{\"anonymous\":false,\"inputs\":[{\"indexed\":false,\"internalType\":\"address\",\"name\":\"_sortedTrovesAddress\",\"type\":\"address\"}],\"name\":\"SortedTrovesAddressChanged\",\"type\":\"event\"},{\"anonymous\":false,\"inputs\":[{\"indexed\":false,\"internalType\":\"address\",\"name\":\"_stabilityPoolAddress\",\"type\":\"address\"}],\"name\":\"StabilityPoolAddressChanged\",\"type\":\"event\"},{\"anonymous\":false,\"inputs\":[{\"indexed\":false,\"internalType\":\"uint256\",\"name\":\"_totalStakesSnapshot\",\"type\":\"uint256\"},{\"indexed\":false,\"internalType\":\"uint256\",\"name\":\"_totalCollateralSnapshot\",\"type\":\"uint256\"}],\"name\":\"SystemSnapshotsUpdated\",\"type\":\"event\"},{\"anonymous\":false,\"inputs\":[{\"indexed\":false,\"internalType\":\"uint256\",\"name\":\"_newTotalStakes\",\"type\":\"uint256\"}],\"name\":\"TotalStakesUpdated\",\"type\":\"event\"},{\"anonymous\":false,\"inputs\":[{\"indexed\":false,\"internalType\":\"address\",\"name\":\"_borrower\",\"type\":\"address\"},{\"indexed\":false,\"internalType\":\"uint256\",\"name\":\"_newIndex\",\"type\":\"uint256\"}],\"name\":\"TroveIndexUpdated\",\"type\":\"event\"},{\"anonymous\":false,\"inputs\":[{\"indexed\":true,\"internalType\":\"address\",\"name\":\"_borrower\",\"type\":\"address\"},{\"indexed\":false,\"internalType\":\"uint256\",\"name\":\"_debt\",\"type\":\"uint256\"},{\"indexed\":false,\"internalType\":\"uint256\",\"name\":\"_coll\",\"type\":\"uint256\"},{\"indexed\":false,\"internalType\":\"enum TroveManager.TroveManagerOperation\",\"name\":\"_operation\",\"type\":\"uint8\"}],\"name\":\"TroveLiquidated\",\"type\":\"event\"},{\"anonymous\":false,\"inputs\":[{\"indexed\":false,\"internalType\":\"uint256\",\"name\":\"_L_StETH\",\"type\":\"uint256\"},{\"indexed\":false,\"internalType\":\"uint256\",\"name\":\"_L_BaseFeeLMADebt\",\"type\":\"uint256\"}],\"name\":\"TroveSnapshotsUpdated\",\"type\":\"event\"},{\"anonymous\":false,\"inputs\":[{\"indexed\":true,\"internalType\":\"address\",\"name\":\"_borrower\",\"type\":\"address\"},{\"indexed\":false,\"internalType\":\"uint256\",\"name\":\"_debt\",\"type\":\"uint256\"},{\"indexed\":false,\"internalType\":\"uint256\",\"name\":\"_coll\",\"type\":\"uint256\"},{\"indexed\":false,\"internalType\":\"uint256\",\"name\":\"_stake\",\"type\":\"uint256\"},{\"indexed\":false,\"internalType\":\"enum TroveManager.TroveManagerOperation\",\"name\":\"_operation\",\"type\":\"uint8\"}],\"name\":\"TroveUpdated\",\"type\":\"event\"},{\"inputs\":[],\"name\":\"BETA\",\"outputs\":[{\"internalType\":\"uint256\",\"name\":\"\",\"type\":\"uint256\"}],\"stateMutability\":\"view\",\"type\":\"function\"},{\"inputs\":[],\"name\":\"BOOTSTRAP_PERIOD\",\"outputs\":[{\"internalType\":\"uint256\",\"name\":\"\",\"type\":\"uint256\"}],\"stateMutability\":\"view\",\"type\":\"function\"},{\"inputs\":[],\"name\":\"BORROWING_FEE_FLOOR\",\"outputs\":[{\"internalType\":\"uint256\",\"name\":\"\",\"type\":\"uint256\"}],\"stateMutability\":\"view\",\"type\":\"function\"},{\"inputs\":[],\"name\":\"BaseFeeLMA_GAS_COMPENSATION\",\"outputs\":[{\"internalType\":\"uint256\",\"name\":\"\",\"type\":\"uint256\"}],\"stateMutability\":\"view\",\"type\":\"function\"},{\"inputs\":[],\"name\":\"CCR\",\"outputs\":[{\"internalType\":\"uint256\",\"name\":\"\",\"type\":\"uint256\"}],\"stateMutability\":\"view\",\"type\":\"function\"},{\"inputs\":[],\"name\":\"DECIMAL_PRECISION\",\"outputs\":[{\"internalType\":\"uint256\",\"name\":\"\",\"type\":\"uint256\"}],\"stateMutability\":\"view\",\"type\":\"function\"},{\"inputs\":[],\"name\":\"L_BaseFeeLMADebt\",\"outputs\":[{\"internalType\":\"uint256\",\"name\":\"\",\"type\":\"uint256\"}],\"stateMutability\":\"view\",\"type\":\"function\"},{\"inputs\":[],\"name\":\"L_StETH\",\"outputs\":[{\"internalType\":\"uint256\",\"name\":\"\",\"type\":\"uint256\"}],\"stateMutability\":\"view\",\"type\":\"function\"},{\"inputs\":[],\"name\":\"MAX_BORROWING_FEE\",\"outputs\":[{\"internalType\":\"uint256\",\"name\":\"\",\"type\":\"uint256\"}],\"stateMutability\":\"view\",\"type\":\"function\"},{\"inputs\":[],\"name\":\"MCR\",\"outputs\":[{\"internalType\":\"uint256\",\"name\":\"\",\"type\":\"uint256\"}],\"stateMutability\":\"view\",\"type\":\"function\"},{\"inputs\":[],\"name\":\"MINUTE_DECAY_BORROWING_FACTOR\",\"outputs\":[{\"internalType\":\"uint256\",\"name\":\"\",\"type\":\"uint256\"}],\"stateMutability\":\"view\",\"type\":\"function\"},{\"inputs\":[],\"name\":\"MINUTE_DECAY_REDEMPTION_FACTOR\",\"outputs\":[{\"internalType\":\"uint256\",\"name\":\"\",\"type\":\"uint256\"}],\"stateMutability\":\"view\",\"type\":\"function\"},{\"inputs\":[],\"name\":\"MIN_NET_DEBT\",\"outputs\":[{\"internalType\":\"uint256\",\"name\":\"\",\"type\":\"uint256\"}],\"stateMutability\":\"view\",\"type\":\"function\"},{\"inputs\":[],\"name\":\"NAME\",\"outputs\":[{\"internalType\":\"string\",\"name\":\"\",\"type\":\"string\"}],\"stateMutability\":\"view\",\"type\":\"function\"},{\"inputs\":[],\"name\":\"PERCENT_DIVISOR\",\"outputs\":[{\"internalType\":\"uint256\",\"name\":\"\",\"type\":\"uint256\"}],\"stateMutability\":\"view\",\"type\":\"function\"},{\"inputs\":[],\"name\":\"REDEMPTION_FEE_FLOOR\",\"outputs\":[{\"internalType\":\"uint256\",\"name\":\"\",\"type\":\"uint256\"}],\"stateMutability\":\"view\",\"type\":\"function\"},{\"inputs\":[],\"name\":\"SECONDS_IN_ONE_MINUTE\",\"outputs\":[{\"internalType\":\"uint256\",\"name\":\"\",\"type\":\"uint256\"}],\"stateMutability\":\"view\",\"type\":\"function\"},{\"inputs\":[{\"internalType\":\"uint256\",\"name\":\"\",\"type\":\"uint256\"}],\"name\":\"TroveOwners\",\"outputs\":[{\"internalType\":\"address\",\"name\":\"\",\"type\":\"address\"}],\"stateMutability\":\"view\",\"type\":\"function\"},{\"inputs\":[{\"internalType\":\"address\",\"name\":\"\",\"type\":\"address\"}],\"name\":\"Troves\",\"outputs\":[{\"internalType\":\"uint256\",\"name\":\"debt\",\"type\":\"uint256\"},{\"internalType\":\"uint256\",\"name\":\"coll\",\"type\":\"uint256\"},{\"internalType\":\"uint256\",\"name\":\"stake\",\"type\":\"uint256\"},{\"internalType\":\"enum TroveManager.Status\",\"name\":\"status\",\"type\":\"uint8\"},{\"internalType\":\"uint128\",\"name\":\"arrayIndex\",\"type\":\"uint128\"}],\"stateMutability\":\"view\",\"type\":\"function\"},{\"inputs\":[],\"name\":\"_100pct\",\"outputs\":[{\"internalType\":\"uint256\",\"name\":\"\",\"type\":\"uint256\"}],\"stateMutability\":\"view\",\"type\":\"function\"},{\"inputs\":[],\"name\":\"activePool\",\"outputs\":[{\"internalType\":\"contract IActivePool\",\"name\":\"\",\"type\":\"address\"}],\"stateMutability\":\"view\",\"type\":\"function\"},{\"inputs\":[{\"internalType\":\"address\",\"name\":\"_borrower\",\"type\":\"address\"}],\"name\":\"addTroveOwnerToArray\",\"outputs\":[{\"internalType\":\"uint256\",\"name\":\"index\",\"type\":\"uint256\"}],\"stateMutability\":\"nonpayable\",\"type\":\"function\"},{\"inputs\":[{\"internalType\":\"address\",\"name\":\"_borrower\",\"type\":\"address\"}],\"name\":\"applyPendingRewards\",\"outputs\":[],\"stateMutability\":\"nonpayable\",\"type\":\"function\"},{\"inputs\":[],\"name\":\"baseFeeLMAToken\",\"outputs\":[{\"internalType\":\"contract IBaseFeeLMAToken\",\"name\":\"\",\"type\":\"address\"}],\"stateMutability\":\"view\",\"type\":\"function\"},{\"inputs\":[{\"internalType\":\"address[]\",\"name\":\"_troveArray\",\"type\":\"address[]\"}],\"name\":\"batchLiquidateTroves\",\"outputs\":[],\"stateMutability\":\"nonpayable\",\"type\":\"function\"},{\"inputs\":[],\"name\":\"borrowBaseRate\",\"outputs\":[{\"internalType\":\"uint256\",\"name\":\"\",\"type\":\"uint256\"}],\"stateMutability\":\"view\",\"type\":\"function\"},{\"inputs\":[],\"name\":\"borrowerOperationsAddress\",\"outputs\":[{\"internalType\":\"address\",\"name\":\"\",\"type\":\"address\"}],\"stateMutability\":\"view\",\"type\":\"function\"},{\"inputs\":[{\"internalType\":\"uint256\",\"name\":\"_price\",\"type\":\"uint256\"}],\"name\":\"checkRecoveryMode\",\"outputs\":[{\"internalType\":\"bool\",\"name\":\"\",\"type\":\"bool\"}],\"stateMutability\":\"view\",\"type\":\"function\"},{\"inputs\":[],\"name\":\"checkUnreliableRecoveryMode\",\"outputs\":[{\"internalType\":\"bool\",\"name\":\"\",\"type\":\"bool\"}],\"stateMutability\":\"view\",\"type\":\"function\"},{\"inputs\":[{\"internalType\":\"address\",\"name\":\"_borrower\",\"type\":\"address\"}],\"name\":\"closeTrove\",\"outputs\":[],\"stateMutability\":\"nonpayable\",\"type\":\"function\"},{\"inputs\":[],\"name\":\"decayBaseRateFromBorrowing\",\"outputs\":[],\"stateMutability\":\"nonpayable\",\"type\":\"function\"},{\"inputs\":[{\"internalType\":\"address\",\"name\":\"_borrower\",\"type\":\"address\"},{\"internalType\":\"uint256\",\"name\":\"_collDecrease\",\"type\":\"uint256\"}],\"name\":\"decreaseTroveColl\",\"outputs\":[{\"internalType\":\"uint256\",\"name\":\"\",\"type\":\"uint256\"}],\"stateMutability\":\"nonpayable\",\"type\":\"function\"},{\"inputs\":[{\"internalType\":\"address\",\"name\":\"_borrower\",\"type\":\"address\"},{\"internalType\":\"uint256\",\"name\":\"_debtDecrease\",\"type\":\"uint256\"}],\"name\":\"decreaseTroveDebt\",\"outputs\":[{\"internalType\":\"uint256\",\"name\":\"\",\"type\":\"uint256\"}],\"stateMutability\":\"nonpayable\",\"type\":\"function\"},{\"inputs\":[],\"name\":\"defaultPool\",\"outputs\":[{\"internalType\":\"contract IDefaultPool\",\"name\":\"\",\"type\":\"address\"}],\"stateMutability\":\"view\",\"type\":\"function\"},{\"inputs\":[{\"internalType\":\"uint256\",\"name\":\"_BaseFeeLMADebt\",\"type\":\"uint256\"}],\"name\":\"getBorrowingFee\",\"outputs\":[{\"internalType\":\"uint256\",\"name\":\"\",\"type\":\"uint256\"},{\"internalType\":\"uint256\",\"name\":\"\",\"type\":\"uint256\"}],\"stateMutability\":\"view\",\"type\":\"function\"},{\"inputs\":[{\"internalType\":\"uint256\",\"name\":\"_BaseFeeLMADebt\",\"type\":\"uint256\"}],\"name\":\"getBorrowingFeeWithDecay\",\"outputs\":[{\"internalType\":\"uint256\",\"name\":\"\",\"type\":\"uint256\"}],\"stateMutability\":\"view\",\"type\":\"function\"},{\"inputs\":[{\"internalType\":\"uint256\",\"name\":\"_issuedBaseFeeLMA\",\"type\":\"uint256\"}],\"name\":\"getBorrowingRate\",\"outputs\":[{\"internalType\":\"uint256\",\"name\":\"\",\"type\":\"uint256\"}],\"stateMutability\":\"view\",\"type\":\"function\"},{\"inputs\":[{\"internalType\":\"uint256\",\"name\":\"_issuedBaseFeeLMA\",\"type\":\"uint256\"}],\"name\":\"getBorrowingRateWithDecay\",\"outputs\":[{\"internalType\":\"uint256\",\"name\":\"\",\"type\":\"uint256\"}],\"stateMutability\":\"view\",\"type\":\"function\"},{\"inputs\":[{\"internalType\":\"address\",\"name\":\"_borrower\",\"type\":\"address\"},{\"internalType\":\"uint256\",\"name\":\"_price\",\"type\":\"uint256\"}],\"name\":\"getCurrentICR\",\"outputs\":[{\"internalType\":\"uint256\",\"name\":\"\",\"type\":\"uint256\"}],\"stateMutability\":\"view\",\"type\":\"function\"},{\"inputs\":[{\"internalType\":\"address\",\"name\":\"_borrower\",\"type\":\"address\"}],\"name\":\"getEntireDebtAndColl\",\"outputs\":[{\"internalType\":\"uint256\",\"name\":\"debt\",\"type\":\"uint256\"},{\"internalType\":\"uint256\",\"name\":\"coll\",\"type\":\"uint256\"},{\"internalType\":\"uint256\",\"name\":\"pendingBaseFeeLMADebtReward\",\"type\":\"uint256\"},{\"internalType\":\"uint256\",\"name\":\"pendingStETHReward\",\"type\":\"uint256\"}],\"stateMutability\":\"view\",\"type\":\"function\"},{\"inputs\":[],\"name\":\"getEntireSystemColl\",\"outputs\":[{\"internalType\":\"uint256\",\"name\":\"entireSystemColl\",\"type\":\"uint256\"}],\"stateMutability\":\"view\",\"type\":\"function\"},{\"inputs\":[],\"name\":\"getEntireSystemDebt\",\"outputs\":[{\"internalType\":\"uint256\",\"name\":\"entireSystemDebt\",\"type\":\"uint256\"}],\"stateMutability\":\"view\",\"type\":\"function\"},{\"inputs\":[{\"internalType\":\"address\",\"name\":\"_borrower\",\"type\":\"address\"}],\"name\":\"getNominalICR\",\"outputs\":[{\"internalType\":\"uint256\",\"name\":\"\",\"type\":\"uint256\"}],\"stateMutability\":\"view\",\"type\":\"function\"},{\"inputs\":[{\"internalType\":\"uint256\",\"name\":\"_coll\",\"type\":\"uint256\"},{\"internalType\":\"uint256\",\"name\":\"_debt\",\"type\":\"uint256\"}],\"name\":\"getNormalLiquidationPrice\",\"outputs\":[{\"internalType\":\"uint256\",\"name\":\"\",\"type\":\"uint256\"}],\"stateMutability\":\"pure\",\"type\":\"function\"},{\"inputs\":[{\"internalType\":\"address\",\"name\":\"_borrower\",\"type\":\"address\"}],\"name\":\"getPendingBaseFeeLMADebtReward\",\"outputs\":[{\"internalType\":\"uint256\",\"name\":\"\",\"type\":\"uint256\"}],\"stateMutability\":\"view\",\"type\":\"function\"},{\"inputs\":[{\"internalType\":\"address\",\"name\":\"_borrower\",\"type\":\"address\"}],\"name\":\"getPendingStETHReward\",\"outputs\":[{\"internalType\":\"uint256\",\"name\":\"\",\"type\":\"uint256\"}],\"stateMutability\":\"view\",\"type\":\"function\"},{\"inputs\":[{\"internalType\":\"uint256\",\"name\":\"_coll\",\"type\":\"uint256\"},{\"internalType\":\"uint256\",\"name\":\"_debt\",\"type\":\"uint256\"}],\"name\":\"getRecoveryLiquidationPrice\",\"outputs\":[{\"internalType\":\"uint256\",\"name\":\"\",\"type\":\"uint256\"}],\"stateMutability\":\"pure\",\"type\":\"function\"},{\"inputs\":[{\"internalType\":\"uint256\",\"name\":\"_StETHDrawn\",\"type\":\"uint256\"}],\"name\":\"getRedemptionFeeWithDecay\",\"outputs\":[{\"internalType\":\"uint256\",\"name\":\"\",\"type\":\"uint256\"}],\"stateMutability\":\"view\",\"type\":\"function\"},{\"inputs\":[{\"internalType\":\"uint256\",\"name\":\"_redemptionColl\",\"type\":\"uint256\"}],\"name\":\"getRedemptionRate\",\"outputs\":[{\"internalType\":\"uint256\",\"name\":\"\",\"type\":\"uint256\"}],\"stateMutability\":\"view\",\"type\":\"function\"},{\"inputs\":[{\"internalType\":\"uint256\",\"name\":\"_redemptionColl\",\"type\":\"uint256\"}],\"name\":\"getRedemptionRateWithDecay\",\"outputs\":[{\"internalType\":\"uint256\",\"name\":\"\",\"type\":\"uint256\"}],\"stateMutability\":\"view\",\"type\":\"function\"},{\"inputs\":[{\"internalType\":\"uint256\",\"name\":\"_price\",\"type\":\"uint256\"}],\"name\":\"getTCR\",\"outputs\":[{\"internalType\":\"uint256\",\"name\":\"\",\"type\":\"uint256\"}],\"stateMutability\":\"view\",\"type\":\"function\"},{\"inputs\":[{\"internalType\":\"address\",\"name\":\"_borrower\",\"type\":\"address\"}],\"name\":\"getTroveColl\",\"outputs\":[{\"internalType\":\"uint256\",\"name\":\"\",\"type\":\"uint256\"}],\"stateMutability\":\"view\",\"type\":\"function\"},{\"inputs\":[{\"internalType\":\"address\",\"name\":\"_borrower\",\"type\":\"address\"}],\"name\":\"getTroveDebt\",\"outputs\":[{\"internalType\":\"uint256\",\"name\":\"\",\"type\":\"uint256\"}],\"stateMutability\":\"view\",\"type\":\"function\"},{\"inputs\":[{\"internalType\":\"uint256\",\"name\":\"_index\",\"type\":\"uint256\"}],\"name\":\"getTroveFromTroveOwnersArray\",\"outputs\":[{\"internalType\":\"address\",\"name\":\"\",\"type\":\"address\"}],\"stateMutability\":\"view\",\"type\":\"function\"},{\"inputs\":[],\"name\":\"getTroveOwnersCount\",\"outputs\":[{\"internalType\":\"uint256\",\"name\":\"\",\"type\":\"uint256\"}],\"stateMutability\":\"view\",\"type\":\"function\"},{\"inputs\":[{\"internalType\":\"address\",\"name\":\"_borrower\",\"type\":\"address\"}],\"name\":\"getTroveStake\",\"outputs\":[{\"internalType\":\"uint256\",\"name\":\"\",\"type\":\"uint256\"}],\"stateMutability\":\"view\",\"type\":\"function\"},{\"inputs\":[{\"internalType\":\"address\",\"name\":\"_borrower\",\"type\":\"address\"}],\"name\":\"getTroveStatus\",\"outputs\":[{\"internalType\":\"uint256\",\"name\":\"\",\"type\":\"uint256\"}],\"stateMutability\":\"view\",\"type\":\"function\"},{\"inputs\":[],\"name\":\"getUnreliableTCR\",\"outputs\":[{\"internalType\":\"uint256\",\"name\":\"\",\"type\":\"uint256\"}],\"stateMutability\":\"view\",\"type\":\"function\"},{\"inputs\":[{\"internalType\":\"address\",\"name\":\"_borrower\",\"type\":\"address\"}],\"name\":\"getUnreliableTroveICR\",\"outputs\":[{\"internalType\":\"uint256\",\"name\":\"\",\"type\":\"uint256\"}],\"stateMutability\":\"view\",\"type\":\"function\"},{\"inputs\":[{\"internalType\":\"address\",\"name\":\"_borrower\",\"type\":\"address\"}],\"name\":\"hasPendingRewards\",\"outputs\":[{\"internalType\":\"bool\",\"name\":\"\",\"type\":\"bool\"}],\"stateMutability\":\"view\",\"type\":\"function\"},{\"inputs\":[],\"name\":\"hogStaking\",\"outputs\":[{\"internalType\":\"contract IHOGStaking\",\"name\":\"\",\"type\":\"address\"}],\"stateMutability\":\"view\",\"type\":\"function\"},{\"inputs\":[],\"name\":\"hogToken\",\"outputs\":[{\"internalType\":\"contract IHOGToken\",\"name\":\"\",\"type\":\"address\"}],\"stateMutability\":\"view\",\"type\":\"function\"},{\"inputs\":[{\"internalType\":\"address\",\"name\":\"_borrower\",\"type\":\"address\"},{\"internalType\":\"uint256\",\"name\":\"_collIncrease\",\"type\":\"uint256\"}],\"name\":\"increaseTroveColl\",\"outputs\":[{\"internalType\":\"uint256\",\"name\":\"\",\"type\":\"uint256\"}],\"stateMutability\":\"nonpayable\",\"type\":\"function\"},{\"inputs\":[{\"internalType\":\"address\",\"name\":\"_borrower\",\"type\":\"address\"},{\"internalType\":\"uint256\",\"name\":\"_debtIncrease\",\"type\":\"uint256\"}],\"name\":\"increaseTroveDebt\",\"outputs\":[{\"internalType\":\"uint256\",\"name\":\"\",\"type\":\"uint256\"}],\"stateMutability\":\"nonpayable\",\"type\":\"function\"},{\"inputs\":[],\"name\":\"lastBaseFeeLMADebtError_Redistribution\",\"outputs\":[{\"internalType\":\"uint256\",\"name\":\"\",\"type\":\"uint256\"}],\"stateMutability\":\"view\",\"type\":\"function\"},{\"inputs\":[],\"name\":\"lastBorrowTime\",\"outputs\":[{\"internalType\":\"uint256\",\"name\":\"\",\"type\":\"uint256\"}],\"stateMutability\":\"view\",\"type\":\"function\"},{\"inputs\":[],\"name\":\"lastRedemptionTime\",\"outputs\":[{\"internalType\":\"uint256\",\"name\":\"\",\"type\":\"uint256\"}],\"stateMutability\":\"view\",\"type\":\"function\"},{\"inputs\":[],\"name\":\"lastStETHError_Redistribution\",\"outputs\":[{\"internalType\":\"uint256\",\"name\":\"\",\"type\":\"uint256\"}],\"stateMutability\":\"view\",\"type\":\"function\"},{\"inputs\":[{\"internalType\":\"address\",\"name\":\"_borrower\",\"type\":\"address\"}],\"name\":\"liquidate\",\"outputs\":[],\"stateMutability\":\"nonpayable\",\"type\":\"function\"},{\"inputs\":[{\"internalType\":\"uint256\",\"name\":\"_n\",\"type\":\"uint256\"}],\"name\":\"liquidateTroves\",\"outputs\":[],\"stateMutability\":\"nonpayable\",\"type\":\"function\"},{\"inputs\":[],\"name\":\"owner\",\"outputs\":[{\"internalType\":\"address\",\"name\":\"\",\"type\":\"address\"}],\"stateMutability\":\"view\",\"type\":\"function\"},{\"inputs\":[],\"name\":\"priceFeed\",\"outputs\":[{\"internalType\":\"contract IPriceFeed\",\"name\":\"\",\"type\":\"address\"}],\"stateMutability\":\"view\",\"type\":\"function\"},{\"inputs\":[{\"internalType\":\"uint256\",\"name\":\"_BaseFeeLMAamount\",\"type\":\"uint256\"},{\"internalType\":\"address\",\"name\":\"_firstRedemptionHint\",\"type\":\"address\"},{\"internalType\":\"address\",\"name\":\"_upperPartialRedemptionHint\",\"type\":\"address\"},{\"internalType\":\"address\",\"name\":\"_lowerPartialRedemptionHint\",\"type\":\"address\"},{\"internalType\":\"uint256\",\"name\":\"_partialRedemptionHintNICR\",\"type\":\"uint256\"},{\"internalType\":\"uint256\",\"name\":\"_maxIterations\",\"type\":\"uint256\"},{\"internalType\":\"uint256\",\"name\":\"_maxFeePercentage\",\"type\":\"uint256\"}],\"name\":\"redeemCollateral\",\"outputs\":[],\"stateMutability\":\"nonpayable\",\"type\":\"function\"},{\"inputs\":[],\"name\":\"redemptionBaseRate\",\"outputs\":[{\"internalType\":\"uint256\",\"name\":\"\",\"type\":\"uint256\"}],\"stateMutability\":\"view\",\"type\":\"function\"},{\"inputs\":[{\"internalType\":\"address\",\"name\":\"_borrower\",\"type\":\"address\"}],\"name\":\"removeStake\",\"outputs\":[],\"stateMutability\":\"nonpayable\",\"type\":\"function\"},{\"inputs\":[],\"name\":\"renounceOwnership\",\"outputs\":[],\"stateMutability\":\"nonpayable\",\"type\":\"function\"},{\"inputs\":[{\"internalType\":\"address\",\"name\":\"\",\"type\":\"address\"}],\"name\":\"rewardSnapshots\",\"outputs\":[{\"internalType\":\"uint256\",\"name\":\"StETH\",\"type\":\"uint256\"},{\"internalType\":\"uint256\",\"name\":\"BaseFeeLMADebt\",\"type\":\"uint256\"}],\"stateMutability\":\"view\",\"type\":\"function\"},{\"inputs\":[{\"internalType\":\"address\",\"name\":\"_borrowerOperationsAddress\",\"type\":\"address\"},{\"internalType\":\"address\",\"name\":\"_activePoolAddress\",\"type\":\"address\"},{\"internalType\":\"address\",\"name\":\"_defaultPoolAddress\",\"type\":\"address\"},{\"internalType\":\"address\",\"name\":\"_stabilityPoolAddress\",\"type\":\"address\"},{\"internalType\":\"address\",\"name\":\"_gasPoolAddress\",\"type\":\"address\"},{\"internalType\":\"address\",\"name\":\"_collSurplusPoolAddress\",\"type\":\"address\"},{\"internalType\":\"address\",\"name\":\"_priceFeedAddress\",\"type\":\"address\"},{\"internalType\":\"address\",\"name\":\"_baseFeeLMATokenAddress\",\"type\":\"address\"},{\"internalType\":\"address\",\"name\":\"_sortedTrovesAddress\",\"type\":\"address\"},{\"internalType\":\"address\",\"name\":\"_hogTokenAddress\",\"type\":\"address\"},{\"internalType\":\"address\",\"name\":\"_hogStakingAddress\",\"type\":\"address\"}],\"name\":\"setAddresses\",\"outputs\":[],\"stateMutability\":\"nonpayable\",\"type\":\"function\"},{\"inputs\":[{\"internalType\":\"address\",\"name\":\"_borrower\",\"type\":\"address\"},{\"internalType\":\"uint256\",\"name\":\"_num\",\"type\":\"uint256\"}],\"name\":\"setTroveStatus\",\"outputs\":[],\"stateMutability\":\"nonpayable\",\"type\":\"function\"},{\"inputs\":[],\"name\":\"sortedTroves\",\"outputs\":[{\"internalType\":\"contract ISortedTroves\",\"name\":\"\",\"type\":\"address\"}],\"stateMutability\":\"view\",\"type\":\"function\"},{\"inputs\":[],\"name\":\"stabilityPool\",\"outputs\":[{\"internalType\":\"contract IStabilityPool\",\"name\":\"\",\"type\":\"address\"}],\"stateMutability\":\"view\",\"type\":\"function\"},{\"inputs\":[],\"name\":\"totalCollateralSnapshot\",\"outputs\":[{\"internalType\":\"uint256\",\"name\":\"\",\"type\":\"uint256\"}],\"stateMutability\":\"view\",\"type\":\"function\"},{\"inputs\":[],\"name\":\"totalStakes\",\"outputs\":[{\"internalType\":\"uint256\",\"name\":\"\",\"type\":\"uint256\"}],\"stateMutability\":\"view\",\"type\":\"function\"},{\"inputs\":[],\"name\":\"totalStakesSnapshot\",\"outputs\":[{\"internalType\":\"uint256\",\"name\":\"\",\"type\":\"uint256\"}],\"stateMutability\":\"view\",\"type\":\"function\"},{\"inputs\":[{\"internalType\":\"address\",\"name\":\"newOwner\",\"type\":\"address\"}],\"name\":\"transferOwnership\",\"outputs\":[],\"stateMutability\":\"nonpayable\",\"type\":\"function\"},{\"inputs\":[{\"internalType\":\"uint256\",\"name\":\"_newBaseRate\",\"type\":\"uint256\"}],\"name\":\"updateBaseRateFromBorrowing\",\"outputs\":[],\"stateMutability\":\"nonpayable\",\"type\":\"function\"},{\"inputs\":[{\"internalType\":\"address\",\"name\":\"_borrower\",\"type\":\"address\"}],\"name\":\"updateStakeAndTotalStakes\",\"outputs\":[{\"internalType\":\"uint256\",\"name\":\"\",\"type\":\"uint256\"}],\"stateMutability\":\"nonpayable\",\"type\":\"function\"},{\"inputs\":[{\"internalType\":\"address\",\"name\":\"_borrower\",\"type\":\"address\"}],\"name\":\"updateTroveRewardSnapshots\",\"outputs\":[],\"stateMutability\":\"nonpayable\",\"type\":\"function\"}],\"devdoc\":{\"kind\":\"dev\",\"methods\":{\"owner()\":{\"details\":\"Returns the address of the current owner.\"},\"renounceOwnership()\":{\"details\":\"Leaves the contract without owner. It will not be possible to call `onlyOwner` functions. Can only be called by the current owner. NOTE: Renouncing ownership will leave the contract without an owner, thereby disabling any functionality that is only available to the owner.\"},\"transferOwnership(address)\":{\"details\":\"Transfers ownership of the contract to a new account (`newOwner`). Can only be called by the current owner.\"}},\"version\":1},\"userdoc\":{\"kind\":\"user\",\"methods\":{\"getCurrentICR(address,uint256)\":{\"notice\":\"Hedgehog changes: Get Price directly from the price feed instead of param passing\"}},\"notice\":\"Fork of Liquity's TroveManager. Logic remains unchanged. Changes to the contract: - Raised pragma version - Removed an import of ActivePool Interface Even though SafeMath is no longer required, the decision was made to keep it to avoid human factor errors\",\"version\":1}},\"settings\":{\"compilationTarget\":{\"contracts/TroveManager.sol\":\"TroveManager\"},\"evmVersion\":\"paris\",\"libraries\":{},\"metadata\":{\"bytecodeHash\":\"ipfs\",\"useLiteralContent\":true},\"optimizer\":{\"enabled\":true,\"runs\":100},\"remappings\":[]},\"sources\":{\"@openzeppelin/contracts/access/Ownable.sol\":{\"content\":\"// SPDX-License-Identifier: MIT\\n// OpenZeppelin Contracts (last updated v4.9.0) (access/Ownable.sol)\\n\\npragma solidity ^0.8.0;\\n\\nimport \\\"../utils/Context.sol\\\";\\n\\n/**\\n * @dev Contract module which provides a basic access control mechanism, where\\n * there is an account (an owner) that can be granted exclusive access to\\n * specific functions.\\n *\\n * By default, the owner account will be the one that deploys the contract. This\\n * can later be changed with {transferOwnership}.\\n *\\n * This module is used through inheritance. It will make available the modifier\\n * `onlyOwner`, which can be applied to your functions to restrict their use to\\n * the owner.\\n */\\nabstract contract Ownable is Context {\\n    address private _owner;\\n\\n    event OwnershipTransferred(address indexed previousOwner, address indexed newOwner);\\n\\n    /**\\n     * @dev Initializes the contract setting the deployer as the initial owner.\\n     */\\n    constructor() {\\n        _transferOwnership(_msgSender());\\n    }\\n\\n    /**\\n     * @dev Throws if called by any account other than the owner.\\n     */\\n    modifier onlyOwner() {\\n        _checkOwner();\\n        _;\\n    }\\n\\n    /**\\n     * @dev Returns the address of the current owner.\\n     */\\n    function owner() public view virtual returns (address) {\\n        return _owner;\\n    }\\n\\n    /**\\n     * @dev Throws if the sender is not the owner.\\n     */\\n    function _checkOwner() internal view virtual {\\n        require(owner() == _msgSender(), \\\"Ownable: caller is not the owner\\\");\\n    }\\n\\n    /**\\n     * @dev Leaves the contract without owner. It will not be possible to call\\n     * `onlyOwner` functions. Can only be called by the current owner.\\n     *\\n     * NOTE: Renouncing ownership will leave the contract without an owner,\\n     * thereby disabling any functionality that is only available to the owner.\\n     */\\n    function renounceOwnership() public virtual onlyOwner {\\n        _transferOwnership(address(0));\\n    }\\n\\n    /**\\n     * @dev Transfers ownership of the contract to a new account (`newOwner`).\\n     * Can only be called by the current owner.\\n     */\\n    function transferOwnership(address newOwner) public virtual onlyOwner {\\n        require(newOwner != address(0), \\\"Ownable: new owner is the zero address\\\");\\n        _transferOwnership(newOwner);\\n    }\\n\\n    /**\\n     * @dev Transfers ownership of the contract to a new account (`newOwner`).\\n     * Internal function without access restriction.\\n     */\\n    function _transferOwnership(address newOwner) internal virtual {\\n        address oldOwner = _owner;\\n        _owner = newOwner;\\n        emit OwnershipTransferred(oldOwner, newOwner);\\n    }\\n}\\n\",\"keccak256\":\"0xba43b97fba0d32eb4254f6a5a297b39a19a247082a02d6e69349e071e2946218\",\"license\":\"MIT\"},\"@openzeppelin/contracts/token/ERC20/IERC20.sol\":{\"content\":\"// SPDX-License-Identifier: MIT\\n// OpenZeppelin Contracts (last updated v4.9.0) (token/ERC20/IERC20.sol)\\n\\npragma solidity ^0.8.0;\\n\\n/**\\n * @dev Interface of the ERC20 standard as defined in the EIP.\\n */\\ninterface IERC20 {\\n    /**\\n     * @dev Emitted when `value` tokens are moved from one account (`from`) to\\n     * another (`to`).\\n     *\\n     * Note that `value` may be zero.\\n     */\\n    event Transfer(address indexed from, address indexed to, uint256 value);\\n\\n    /**\\n     * @dev Emitted when the allowance of a `spender` for an `owner` is set by\\n     * a call to {approve}. `value` is the new allowance.\\n     */\\n    event Approval(address indexed owner, address indexed spender, uint256 value);\\n\\n    /**\\n     * @dev Returns the amount of tokens in existence.\\n     */\\n    function totalSupply() external view returns (uint256);\\n\\n    /**\\n     * @dev Returns the amount of tokens owned by `account`.\\n     */\\n    function balanceOf(address account) external view returns (uint256);\\n\\n    /**\\n     * @dev Moves `amount` tokens from the caller's account to `to`.\\n     *\\n     * Returns a boolean value indicating whether the operation succeeded.\\n     *\\n     * Emits a {Transfer} event.\\n     */\\n    function transfer(address to, uint256 amount) external returns (bool);\\n\\n    /**\\n     * @dev Returns the remaining number of tokens that `spender` will be\\n     * allowed to spend on behalf of `owner` through {transferFrom}. This is\\n     * zero by default.\\n     *\\n     * This value changes when {approve} or {transferFrom} are called.\\n     */\\n    function allowance(address owner, address spender) external view returns (uint256);\\n\\n    /**\\n     * @dev Sets `amount` as the allowance of `spender` over the caller's tokens.\\n     *\\n     * Returns a boolean value indicating whether the operation succeeded.\\n     *\\n     * IMPORTANT: Beware that changing an allowance with this method brings the risk\\n     * that someone may use both the old and the new allowance by unfortunate\\n     * transaction ordering. One possible solution to mitigate this race\\n     * condition is to first reduce the spender's allowance to 0 and set the\\n     * desired value afterwards:\\n     * https://github.com/ethereum/EIPs/issues/20#issuecomment-263524729\\n     *\\n     * Emits an {Approval} event.\\n     */\\n    function approve(address spender, uint256 amount) external returns (bool);\\n\\n    /**\\n     * @dev Moves `amount` tokens from `from` to `to` using the\\n     * allowance mechanism. `amount` is then deducted from the caller's\\n     * allowance.\\n     *\\n     * Returns a boolean value indicating whether the operation succeeded.\\n     *\\n     * Emits a {Transfer} event.\\n     */\\n    function transferFrom(address from, address to, uint256 amount) external returns (bool);\\n}\\n\",\"keccak256\":\"0x287b55befed2961a7eabd7d7b1b2839cbca8a5b80ef8dcbb25ed3d4c2002c305\",\"license\":\"MIT\"},\"@openzeppelin/contracts/utils/Context.sol\":{\"content\":\"// SPDX-License-Identifier: MIT\\n// OpenZeppelin Contracts v4.4.1 (utils/Context.sol)\\n\\npragma solidity ^0.8.0;\\n\\n/**\\n * @dev Provides information about the current execution context, including the\\n * sender of the transaction and its data. While these are generally available\\n * via msg.sender and msg.data, they should not be accessed in such a direct\\n * manner, since when dealing with meta-transactions the account sending and\\n * paying for execution may not be the actual sender (as far as an application\\n * is concerned).\\n *\\n * This contract is only required for intermediate, library-like contracts.\\n */\\nabstract contract Context {\\n    function _msgSender() internal view virtual returns (address) {\\n        return msg.sender;\\n    }\\n\\n    function _msgData() internal view virtual returns (bytes calldata) {\\n        return msg.data;\\n    }\\n}\\n\",\"keccak256\":\"0xe2e337e6dde9ef6b680e07338c493ebea1b5fd09b43424112868e9cc1706bca7\",\"license\":\"MIT\"},\"@openzeppelin/contracts/utils/math/SafeMath.sol\":{\"content\":\"// SPDX-License-Identifier: MIT\\n// OpenZeppelin Contracts (last updated v4.9.0) (utils/math/SafeMath.sol)\\n\\npragma solidity ^0.8.0;\\n\\n// CAUTION\\n// This version of SafeMath should only be used with Solidity 0.8 or later,\\n// because it relies on the compiler's built in overflow checks.\\n\\n/**\\n * @dev Wrappers over Solidity's arithmetic operations.\\n *\\n * NOTE: `SafeMath` is generally not needed starting with Solidity 0.8, since the compiler\\n * now has built in overflow checking.\\n */\\nlibrary SafeMath {\\n    /**\\n     * @dev Returns the addition of two unsigned integers, with an overflow flag.\\n     *\\n     * _Available since v3.4._\\n     */\\n    function tryAdd(uint256 a, uint256 b) internal pure returns (bool, uint256) {\\n        unchecked {\\n            uint256 c = a + b;\\n            if (c < a) return (false, 0);\\n            return (true, c);\\n        }\\n    }\\n\\n    /**\\n     * @dev Returns the subtraction of two unsigned integers, with an overflow flag.\\n     *\\n     * _Available since v3.4._\\n     */\\n    function trySub(uint256 a, uint256 b) internal pure returns (bool, uint256) {\\n        unchecked {\\n            if (b > a) return (false, 0);\\n            return (true, a - b);\\n        }\\n    }\\n\\n    /**\\n     * @dev Returns the multiplication of two unsigned integers, with an overflow flag.\\n     *\\n     * _Available since v3.4._\\n     */\\n    function tryMul(uint256 a, uint256 b) internal pure returns (bool, uint256) {\\n        unchecked {\\n            // Gas optimization: this is cheaper than requiring 'a' not being zero, but the\\n            // benefit is lost if 'b' is also tested.\\n            // See: https://github.com/OpenZeppelin/openzeppelin-contracts/pull/522\\n            if (a == 0) return (true, 0);\\n            uint256 c = a * b;\\n            if (c / a != b) return (false, 0);\\n            return (true, c);\\n        }\\n    }\\n\\n    /**\\n     * @dev Returns the division of two unsigned integers, with a division by zero flag.\\n     *\\n     * _Available since v3.4._\\n     */\\n    function tryDiv(uint256 a, uint256 b) internal pure returns (bool, uint256) {\\n        unchecked {\\n            if (b == 0) return (false, 0);\\n            return (true, a / b);\\n        }\\n    }\\n\\n    /**\\n     * @dev Returns the remainder of dividing two unsigned integers, with a division by zero flag.\\n     *\\n     * _Available since v3.4._\\n     */\\n    function tryMod(uint256 a, uint256 b) internal pure returns (bool, uint256) {\\n        unchecked {\\n            if (b == 0) return (false, 0);\\n            return (true, a % b);\\n        }\\n    }\\n\\n    /**\\n     * @dev Returns the addition of two unsigned integers, reverting on\\n     * overflow.\\n     *\\n     * Counterpart to Solidity's `+` operator.\\n     *\\n     * Requirements:\\n     *\\n     * - Addition cannot overflow.\\n     */\\n    function add(uint256 a, uint256 b) internal pure returns (uint256) {\\n        return a + b;\\n    }\\n\\n    /**\\n     * @dev Returns the subtraction of two unsigned integers, reverting on\\n     * overflow (when the result is negative).\\n     *\\n     * Counterpart to Solidity's `-` operator.\\n     *\\n     * Requirements:\\n     *\\n     * - Subtraction cannot overflow.\\n     */\\n    function sub(uint256 a, uint256 b) internal pure returns (uint256) {\\n        return a - b;\\n    }\\n\\n    /**\\n     * @dev Returns the multiplication of two unsigned integers, reverting on\\n     * overflow.\\n     *\\n     * Counterpart to Solidity's `*` operator.\\n     *\\n     * Requirements:\\n     *\\n     * - Multiplication cannot overflow.\\n     */\\n    function mul(uint256 a, uint256 b) internal pure returns (uint256) {\\n        return a * b;\\n    }\\n\\n    /**\\n     * @dev Returns the integer division of two unsigned integers, reverting on\\n     * division by zero. The result is rounded towards zero.\\n     *\\n     * Counterpart to Solidity's `/` operator.\\n     *\\n     * Requirements:\\n     *\\n     * - The divisor cannot be zero.\\n     */\\n    function div(uint256 a, uint256 b) internal pure returns (uint256) {\\n        return a / b;\\n    }\\n\\n    /**\\n     * @dev Returns the remainder of dividing two unsigned integers. (unsigned integer modulo),\\n     * reverting when dividing by zero.\\n     *\\n     * Counterpart to Solidity's `%` operator. This function uses a `revert`\\n     * opcode (which leaves remaining gas untouched) while Solidity uses an\\n     * invalid opcode to revert (consuming all remaining gas).\\n     *\\n     * Requirements:\\n     *\\n     * - The divisor cannot be zero.\\n     */\\n    function mod(uint256 a, uint256 b) internal pure returns (uint256) {\\n        return a % b;\\n    }\\n\\n    /**\\n     * @dev Returns the subtraction of two unsigned integers, reverting with custom message on\\n     * overflow (when the result is negative).\\n     *\\n     * CAUTION: This function is deprecated because it requires allocating memory for the error\\n     * message unnecessarily. For custom revert reasons use {trySub}.\\n     *\\n     * Counterpart to Solidity's `-` operator.\\n     *\\n     * Requirements:\\n     *\\n     * - Subtraction cannot overflow.\\n     */\\n    function sub(uint256 a, uint256 b, string memory errorMessage) internal pure returns (uint256) {\\n        unchecked {\\n            require(b <= a, errorMessage);\\n            return a - b;\\n        }\\n    }\\n\\n    /**\\n     * @dev Returns the integer division of two unsigned integers, reverting with custom message on\\n     * division by zero. The result is rounded towards zero.\\n     *\\n     * Counterpart to Solidity's `/` operator. Note: this function uses a\\n     * `revert` opcode (which leaves remaining gas untouched) while Solidity\\n     * uses an invalid opcode to revert (consuming all remaining gas).\\n     *\\n     * Requirements:\\n     *\\n     * - The divisor cannot be zero.\\n     */\\n    function div(uint256 a, uint256 b, string memory errorMessage) internal pure returns (uint256) {\\n        unchecked {\\n            require(b > 0, errorMessage);\\n            return a / b;\\n        }\\n    }\\n\\n    /**\\n     * @dev Returns the remainder of dividing two unsigned integers. (unsigned integer modulo),\\n     * reverting with custom message when dividing by zero.\\n     *\\n     * CAUTION: This function is deprecated because it requires allocating memory for the error\\n     * message unnecessarily. For custom revert reasons use {tryMod}.\\n     *\\n     * Counterpart to Solidity's `%` operator. This function uses a `revert`\\n     * opcode (which leaves remaining gas untouched) while Solidity uses an\\n     * invalid opcode to revert (consuming all remaining gas).\\n     *\\n     * Requirements:\\n     *\\n     * - The divisor cannot be zero.\\n     */\\n    function mod(uint256 a, uint256 b, string memory errorMessage) internal pure returns (uint256) {\\n        unchecked {\\n            require(b > 0, errorMessage);\\n            return a % b;\\n        }\\n    }\\n}\\n\",\"keccak256\":\"0x58b21219689909c4f8339af00813760337f7e2e7f169a97fe49e2896dcfb3b9a\",\"license\":\"MIT\"},\"contracts/TroveManager.sol\":{\"content\":\"// SPDX-License-Identifier: MIT\\n\\npragma solidity 0.8.19;\\n\\nimport \\\"./interfaces/ITroveManager.sol\\\";\\nimport \\\"./interfaces/IStabilityPool.sol\\\";\\nimport \\\"./interfaces/ICollSurplusPool.sol\\\";\\nimport \\\"./interfaces/IBaseFeeLMAToken.sol\\\";\\nimport \\\"./interfaces/ISortedTroves.sol\\\";\\nimport \\\"./interfaces/IHOGToken.sol\\\";\\nimport \\\"./interfaces/IHOGStaking.sol\\\";\\nimport \\\"./dependencies/HedgehogBase.sol\\\";\\nimport \\\"@openzeppelin/contracts/utils/math/SafeMath.sol\\\";\\nimport \\\"@openzeppelin/contracts/access/Ownable.sol\\\";\\nimport \\\"./dependencies/CheckContract.sol\\\";\\nimport \\\"hardhat/console.sol\\\";\\n\\n/**\\n * @notice Fork of Liquity's TroveManager. Logic remains unchanged.\\n * Changes to the contract:\\n * - Raised pragma version\\n * - Removed an import of ActivePool Interface\\n * Even though SafeMath is no longer required, the decision was made to keep it to avoid human factor errors\\n */\\n\\ncontract TroveManager is HedgehogBase, Ownable, CheckContract {\\n    using SafeMath for uint256;\\n    string public constant NAME = \\\"TroveManager\\\";\\n\\n    // --- Connected contract declarations ---\\n\\n    address public borrowerOperationsAddress;\\n\\n    IStabilityPool public stabilityPool;\\n\\n    address gasPoolAddress;\\n\\n    ICollSurplusPool collSurplusPool;\\n\\n    IBaseFeeLMAToken public baseFeeLMAToken;\\n\\n    IHOGToken public hogToken;\\n\\n    IHOGStaking public hogStaking;\\n\\n    // A doubly linked list of Troves, sorted by their sorted by their collateral ratios\\n    ISortedTroves public sortedTroves;\\n\\n    // --- Data structures ---\\n\\n    uint public constant SECONDS_IN_ONE_MINUTE = 60;\\n    /*\\n     * Half-life of 12h. 12h = 720 min\\n     * (1/2) = d^720 => d = (1/2)^(1/720)\\n     */\\n    uint public constant MINUTE_DECAY_REDEMPTION_FACTOR = 999037758833783000;\\n    uint public constant MINUTE_DECAY_BORROWING_FACTOR = 991152865945140000;\\n    uint public constant REDEMPTION_FEE_FLOOR = (DECIMAL_PRECISION / 1000) * 5; // 0.5%\\n    uint public constant MAX_BORROWING_FEE = DECIMAL_PRECISION; // 100%\\n\\n    // During bootsrap period redemptions are not allowed\\n    uint public constant BOOTSTRAP_PERIOD = 14 days;\\n\\n    /*\\n     * BETA: 18 digit decimal. Parameter by which to divide the redeemed fraction, in order to calc the new base rate from a redemption.\\n     * Corresponds to (1 / ALPHA) in the white paper.\\n     */\\n    uint public constant BETA = 2;\\n\\n    // HEDGEHOG LOGIC UPDATES: BaseRate is different for redemption and minting tokens\\n    // 1) Remove baseRate variable\\n    // 2) Create redemptionBaseRate public state variable\\n    // 3) Create borrowBaseRate public state variable\\n    uint public redemptionBaseRate;\\n    uint public borrowBaseRate;\\n\\n    // HEDGEHOG LOGIC UPDATES: lastFeeOperationTime is different for redemption and minting tokens\\n    // 1) Remove lastFeeOperationTime variable\\n    // 2) Create lastRedemptionTime public state variable\\n    // 3) Create lastBorrowTime public state variable\\n    uint public lastRedemptionTime;\\n    uint public lastBorrowTime;\\n\\n    enum Status {\\n        nonExistent,\\n        active,\\n        closedByOwner,\\n        closedByLiquidation,\\n        closedByRedemption\\n    }\\n\\n    // Store the necessary data for a trove\\n    struct Trove {\\n        uint debt;\\n        uint coll;\\n        uint stake;\\n        Status status;\\n        uint128 arrayIndex;\\n    }\\n\\n    mapping(address => Trove) public Troves;\\n\\n    uint public totalStakes;\\n\\n    // Snapshot of the value of totalStakes, taken immediately after the latest liquidation\\n    uint public totalStakesSnapshot;\\n\\n    // Snapshot of the total collateral across the ActivePool and DefaultPool, immediately after the latest liquidation.\\n    uint public totalCollateralSnapshot;\\n\\n    /*\\n     * L_StETH and L_BaseFeeLMADebt track the sums of accumulated liquidation rewards per unit staked. During its lifetime, each stake earns:\\n     *\\n     * An StETH gain of ( stake * [L_StETH - L_StETH(0)] )\\n     * A BaseFeeLMADebt increase  of ( stake * [L_BaseFeeLMADebt - L_BaseFeeLMADebt(0)] )\\n     *\\n     * Where L_StETH(0) and L_BaseFeeLMADebt(0) are snapshots of L_StETH and L_BaseFeeLMADebt for the active Trove taken at the instant the stake was made\\n     */\\n    uint public L_StETH;\\n    uint public L_BaseFeeLMADebt;\\n\\n    // Map addresses with active troves to their RewardSnapshot\\n    mapping(address => RewardSnapshot) public rewardSnapshots;\\n\\n    // Object containing the StETH and BaseFeeLMA snapshots for a given active trove\\n    struct RewardSnapshot {\\n        uint StETH;\\n        uint BaseFeeLMADebt;\\n    }\\n\\n    // Array of all active trove addresses - used to to compute an approximate hint off-chain, for the sorted list insertion\\n    address[] public TroveOwners;\\n\\n    // Error trackers for the trove redistribution calculation\\n    uint public lastStETHError_Redistribution;\\n    uint public lastBaseFeeLMADebtError_Redistribution;\\n\\n    /*\\n     * --- Variable container structs for liquidations ---\\n     *\\n     * These structs are used to hold, return and assign variables inside the liquidation functions,\\n     * in order to avoid the error: \\\"CompilerError: Stack too deep\\\".\\n     **/\\n\\n    struct LocalVariables_OuterLiquidationFunction {\\n        uint price;\\n        uint BaseFeeLMAInStabPool;\\n        bool recoveryModeAtStart;\\n        uint liquidatedDebt;\\n        uint liquidatedColl;\\n    }\\n\\n    struct LocalVariables_InnerSingleLiquidateFunction {\\n        uint collToLiquidate;\\n        uint pendingDebtReward;\\n        uint pendingCollReward;\\n    }\\n\\n    struct LocalVariables_LiquidationSequence {\\n        uint remainingBaseFeeLMAInStabPool;\\n        uint i;\\n        uint ICR;\\n        address user;\\n        bool backToNormalMode;\\n        uint entireSystemDebt;\\n        uint entireSystemColl;\\n    }\\n\\n    struct LiquidationValues {\\n        uint entireTroveDebt;\\n        uint entireTroveColl;\\n        uint collGasCompensation;\\n        uint BaseFeeLMAGasCompensation;\\n        uint debtToOffset;\\n        uint collToSendToSP;\\n        uint debtToRedistribute;\\n        uint collToRedistribute;\\n        uint collSurplus;\\n    }\\n\\n    struct LiquidationTotals {\\n        uint totalCollInSequence;\\n        uint totalDebtInSequence;\\n        uint totalCollGasCompensation;\\n        uint totalBaseFeeLMAGasCompensation;\\n        uint totalDebtToOffset;\\n        uint totalCollToSendToSP;\\n        uint totalDebtToRedistribute;\\n        uint totalCollToRedistribute;\\n        uint totalCollSurplus;\\n    }\\n\\n    struct ContractsCache {\\n        IActivePool activePool;\\n        IDefaultPool defaultPool;\\n        IBaseFeeLMAToken baseFeeLMAToken;\\n        IHOGStaking hogStaking;\\n        ISortedTroves sortedTroves;\\n        ICollSurplusPool collSurplusPool;\\n        address gasPoolAddress;\\n    }\\n    // --- Variable container structs for redemptions ---\\n\\n    struct RedemptionTotals {\\n        uint remainingBaseFeeLMA;\\n        uint totalBaseFeeLMAToRedeem;\\n        uint totalStETHDrawn;\\n        uint StETHFee;\\n        uint StETHToSendToRedeemer;\\n        // HEDGEHOG LOGIC UPDATES: BaseRate is different for redemption and minting tokens\\n        // Rename decayedBaseRate into decayedRedemptionBaseRate\\n        uint decayedRedemptionBaseRate;\\n        uint price;\\n        uint totalBaseFeeLMASupplyAtStart;\\n    }\\n\\n    struct SingleRedemptionValues {\\n        uint BaseFeeLMALot;\\n        uint StETHLot;\\n        bool cancelledPartial;\\n    }\\n\\n    // --- Events ---\\n\\n    event BorrowerOperationsAddressChanged(\\n        address _newBorrowerOperationsAddress\\n    );\\n    event PriceFeedAddressChanged(address _newPriceFeedAddress);\\n    event BaseFeeLMATokenAddressChanged(address _newBaseFeeLMATokenAddress);\\n    event ActivePoolAddressChanged(address _activePoolAddress);\\n    event DefaultPoolAddressChanged(address _defaultPoolAddress);\\n    event StabilityPoolAddressChanged(address _stabilityPoolAddress);\\n    event GasPoolAddressChanged(address _gasPoolAddress);\\n    event CollSurplusPoolAddressChanged(address _collSurplusPoolAddress);\\n    event SortedTrovesAddressChanged(address _sortedTrovesAddress);\\n    event HOGTokenAddressChanged(address _hogTokenAddress);\\n    event HOGStakingAddressChanged(address _hogStakingAddress);\\n\\n    event Liquidation(\\n        uint _liquidatedDebt,\\n        uint _liquidatedColl,\\n        uint _collGasCompensation,\\n        uint _BaseFeeLMAGasCompensation\\n    );\\n    event Redemption(\\n        uint _attemptedBaseFeeLMAAmount,\\n        uint _actualBaseFeeLMAAmount,\\n        uint _StETHSent,\\n        uint _StETHFee\\n    );\\n    event TroveUpdated(\\n        address indexed _borrower,\\n        uint _debt,\\n        uint _coll,\\n        uint _stake,\\n        TroveManagerOperation _operation\\n    );\\n    event TroveLiquidated(\\n        address indexed _borrower,\\n        uint _debt,\\n        uint _coll,\\n        TroveManagerOperation _operation\\n    );\\n\\n    // HEDGEHOG LOGIC UPDATES: BaseRate is different for redemption and minting tokens\\n    // 1) Remove BaseRateUpdated event\\n    // 2) Create RedemptionBaseRateUpdated event that accepts _redemptionBaseRate\\n    // 3) Create BorrowBaseRateUpdated event that accepts _borrowBaseRate\\n    event RedemptionBaseRateUpdated(uint _redemptionBaseRate);\\n    event BorrowBaseRateUpdated(uint _borrowBaseRate);\\n\\n    // HEDGEHOG LOGIC UPDATES: BaseRate is different for redemption and minting tokens\\n    // 1) Remove LastFeeOpTimeUpdated event\\n    // 2) Create LastRedemptionTimeUpdated event that accepts _lastRedemptionTime\\n    // 3) Create LastBorrowTimeUpdated event that accepts _lastBorrowTime\\n    event LastRedemptionTimeUpdated(uint _lastRedemptionTime);\\n    event LastBorrowTimeUpdated(uint _lastBorrowTime);\\n    event TotalStakesUpdated(uint _newTotalStakes);\\n    event SystemSnapshotsUpdated(\\n        uint _totalStakesSnapshot,\\n        uint _totalCollateralSnapshot\\n    );\\n    event LTermsUpdated(uint _L_StETH, uint _L_BaseFeeLMADebt);\\n    event TroveSnapshotsUpdated(uint _L_StETH, uint _L_BaseFeeLMADebt);\\n    event TroveIndexUpdated(address _borrower, uint _newIndex);\\n\\n    enum TroveManagerOperation {\\n        applyPendingRewards,\\n        liquidateInNormalMode,\\n        liquidateInRecoveryMode,\\n        redeemCollateral\\n    }\\n\\n    // --- Dependency setter ---\\n\\n    function setAddresses(\\n        address _borrowerOperationsAddress,\\n        address _activePoolAddress,\\n        address _defaultPoolAddress,\\n        address _stabilityPoolAddress,\\n        address _gasPoolAddress,\\n        address _collSurplusPoolAddress,\\n        address _priceFeedAddress,\\n        address _baseFeeLMATokenAddress,\\n        address _sortedTrovesAddress,\\n        address _hogTokenAddress,\\n        address _hogStakingAddress\\n    ) external onlyOwner {\\n        checkContract(_borrowerOperationsAddress);\\n        checkContract(_activePoolAddress);\\n        checkContract(_defaultPoolAddress);\\n        checkContract(_stabilityPoolAddress);\\n        checkContract(_gasPoolAddress);\\n        checkContract(_collSurplusPoolAddress);\\n        checkContract(_priceFeedAddress);\\n        checkContract(_baseFeeLMATokenAddress);\\n        checkContract(_sortedTrovesAddress);\\n        checkContract(_hogTokenAddress);\\n        checkContract(_hogStakingAddress);\\n\\n        borrowerOperationsAddress = _borrowerOperationsAddress;\\n        activePool = IActivePool(_activePoolAddress);\\n        defaultPool = IDefaultPool(_defaultPoolAddress);\\n        stabilityPool = IStabilityPool(_stabilityPoolAddress);\\n        gasPoolAddress = _gasPoolAddress;\\n        collSurplusPool = ICollSurplusPool(_collSurplusPoolAddress);\\n        priceFeed = IPriceFeed(_priceFeedAddress);\\n        baseFeeLMAToken = IBaseFeeLMAToken(_baseFeeLMATokenAddress);\\n        sortedTroves = ISortedTroves(_sortedTrovesAddress);\\n        hogToken = IHOGToken(_hogTokenAddress);\\n        hogStaking = IHOGStaking(_hogStakingAddress);\\n\\n        emit BorrowerOperationsAddressChanged(_borrowerOperationsAddress);\\n        emit ActivePoolAddressChanged(_activePoolAddress);\\n        emit DefaultPoolAddressChanged(_defaultPoolAddress);\\n        emit StabilityPoolAddressChanged(_stabilityPoolAddress);\\n        emit GasPoolAddressChanged(_gasPoolAddress);\\n        emit CollSurplusPoolAddressChanged(_collSurplusPoolAddress);\\n        emit PriceFeedAddressChanged(_priceFeedAddress);\\n        emit BaseFeeLMATokenAddressChanged(_baseFeeLMATokenAddress);\\n        emit SortedTrovesAddressChanged(_sortedTrovesAddress);\\n        emit HOGTokenAddressChanged(_hogTokenAddress);\\n        emit HOGStakingAddressChanged(_hogStakingAddress);\\n\\n        renounceOwnership();\\n    }\\n\\n    // --- Getters ---\\n\\n    function getTroveOwnersCount() external view returns (uint) {\\n        return TroveOwners.length;\\n    }\\n\\n    function getTroveFromTroveOwnersArray(\\n        uint _index\\n    ) external view returns (address) {\\n        return TroveOwners[_index];\\n    }\\n\\n    // --- Trove Liquidation functions ---\\n\\n    // Single liquidation function. Closes the trove if its ICR is lower than the minimum collateral ratio.\\n    function liquidate(address _borrower) external {\\n        _requireTroveIsActive(_borrower);\\n\\n        address[] memory borrowers = new address[](1);\\n        borrowers[0] = _borrower;\\n        batchLiquidateTroves(borrowers);\\n    }\\n\\n    // --- Inner single liquidation functions ---\\n\\n    // Liquidate one trove, in Normal Mode.\\n    function _liquidateNormalMode(\\n        IActivePool _activePool,\\n        IDefaultPool _defaultPool,\\n        address _borrower,\\n        uint _BaseFeeLMAInStabPool\\n    ) internal returns (LiquidationValues memory singleLiquidation) {\\n        LocalVariables_InnerSingleLiquidateFunction memory vars;\\n\\n        (\\n            singleLiquidation.entireTroveDebt,\\n            singleLiquidation.entireTroveColl,\\n            vars.pendingDebtReward,\\n            vars.pendingCollReward\\n        ) = getEntireDebtAndColl(_borrower);\\n\\n        _movePendingTroveRewardsToActivePool(\\n            _activePool,\\n            _defaultPool,\\n            vars.pendingDebtReward,\\n            vars.pendingCollReward\\n        );\\n        _removeStake(_borrower);\\n\\n        singleLiquidation.collGasCompensation = _getCollGasCompensation(\\n            singleLiquidation.entireTroveColl\\n        );\\n        singleLiquidation\\n            .BaseFeeLMAGasCompensation = BaseFeeLMA_GAS_COMPENSATION; // TODO: Why is that being done if BaseFeeLMA_GAS_COMP is static\\n        uint collToLiquidate = singleLiquidation.entireTroveColl.sub(\\n            singleLiquidation.collGasCompensation\\n        );\\n\\n        (\\n            singleLiquidation.debtToOffset,\\n            singleLiquidation.collToSendToSP,\\n            singleLiquidation.debtToRedistribute,\\n            singleLiquidation.collToRedistribute\\n        ) = _getOffsetAndRedistributionVals(\\n            singleLiquidation.entireTroveDebt,\\n            collToLiquidate,\\n            _BaseFeeLMAInStabPool\\n        );\\n\\n        _closeTrove(_borrower, Status.closedByLiquidation);\\n        emit TroveLiquidated(\\n            _borrower,\\n            singleLiquidation.entireTroveDebt,\\n            singleLiquidation.entireTroveColl,\\n            TroveManagerOperation.liquidateInNormalMode\\n        );\\n        emit TroveUpdated(\\n            _borrower,\\n            0,\\n            0,\\n            0,\\n            TroveManagerOperation.liquidateInNormalMode\\n        );\\n        return singleLiquidation;\\n    }\\n\\n    // Liquidate one trove, in Recovery Mode.\\n    function _liquidateRecoveryMode(\\n        IActivePool _activePool,\\n        IDefaultPool _defaultPool,\\n        address _borrower,\\n        uint _ICR,\\n        uint _BaseFeeLMAInStabPool,\\n        uint _TCR,\\n        uint _price\\n    ) internal returns (LiquidationValues memory singleLiquidation) {\\n        LocalVariables_InnerSingleLiquidateFunction memory vars;\\n        if (TroveOwners.length <= 1) {\\n            return singleLiquidation;\\n        } // don't liquidate if last trove\\n        (\\n            singleLiquidation.entireTroveDebt,\\n            singleLiquidation.entireTroveColl,\\n            vars.pendingDebtReward,\\n            vars.pendingCollReward\\n        ) = getEntireDebtAndColl(_borrower);\\n\\n        singleLiquidation.collGasCompensation = _getCollGasCompensation(\\n            singleLiquidation.entireTroveColl\\n        );\\n        singleLiquidation\\n            .BaseFeeLMAGasCompensation = BaseFeeLMA_GAS_COMPENSATION;\\n        vars.collToLiquidate = singleLiquidation.entireTroveColl.sub(\\n            singleLiquidation.collGasCompensation\\n        );\\n\\n        // If ICR <= 100%, purely redistribute the Trove across all active Troves\\n        if (_ICR <= _100pct) {\\n            _movePendingTroveRewardsToActivePool(\\n                _activePool,\\n                _defaultPool,\\n                vars.pendingDebtReward,\\n                vars.pendingCollReward\\n            );\\n            _removeStake(_borrower);\\n\\n            singleLiquidation.debtToOffset = 0;\\n            singleLiquidation.collToSendToSP = 0;\\n            singleLiquidation.debtToRedistribute = singleLiquidation\\n                .entireTroveDebt;\\n            singleLiquidation.collToRedistribute = vars.collToLiquidate;\\n\\n            _closeTrove(_borrower, Status.closedByLiquidation);\\n            emit TroveLiquidated(\\n                _borrower,\\n                singleLiquidation.entireTroveDebt,\\n                singleLiquidation.entireTroveColl,\\n                TroveManagerOperation.liquidateInRecoveryMode\\n            );\\n            emit TroveUpdated(\\n                _borrower,\\n                0,\\n                0,\\n                0,\\n                TroveManagerOperation.liquidateInRecoveryMode\\n            );\\n\\n            // If 100% < ICR < MCR, offset as much as possible, and redistribute the remainder\\n        } else if ((_ICR > _100pct) && (_ICR < MCR)) {\\n            _movePendingTroveRewardsToActivePool(\\n                _activePool,\\n                _defaultPool,\\n                vars.pendingDebtReward,\\n                vars.pendingCollReward\\n            );\\n            _removeStake(_borrower);\\n\\n            (\\n                singleLiquidation.debtToOffset,\\n                singleLiquidation.collToSendToSP,\\n                singleLiquidation.debtToRedistribute,\\n                singleLiquidation.collToRedistribute\\n            ) = _getOffsetAndRedistributionVals(\\n                singleLiquidation.entireTroveDebt,\\n                vars.collToLiquidate,\\n                _BaseFeeLMAInStabPool\\n            );\\n\\n            _closeTrove(_borrower, Status.closedByLiquidation);\\n            emit TroveLiquidated(\\n                _borrower,\\n                singleLiquidation.entireTroveDebt,\\n                singleLiquidation.entireTroveColl,\\n                TroveManagerOperation.liquidateInRecoveryMode\\n            );\\n            emit TroveUpdated(\\n                _borrower,\\n                0,\\n                0,\\n                0,\\n                TroveManagerOperation.liquidateInRecoveryMode\\n            );\\n            /*\\n             * If 110% <= ICR < current TCR (accounting for the preceding liquidations in the current sequence)\\n             * and there is BaseFeeLMA in the Stability Pool, only offset, with no redistribution,\\n             * but at a capped rate of 1.1 and only if the whole debt can be liquidated.\\n             * The remainder due to the capped rate will be claimable as collateral surplus.\\n             */\\n        } else if (\\n            (_ICR >= MCR) &&\\n            (_ICR < _TCR) &&\\n            (singleLiquidation.entireTroveDebt <= _BaseFeeLMAInStabPool)\\n        ) {\\n            _movePendingTroveRewardsToActivePool(\\n                _activePool,\\n                _defaultPool,\\n                vars.pendingDebtReward,\\n                vars.pendingCollReward\\n            );\\n            assert(_BaseFeeLMAInStabPool != 0);\\n\\n            _removeStake(_borrower);\\n            singleLiquidation = _getCappedOffsetVals(\\n                singleLiquidation.entireTroveDebt,\\n                singleLiquidation.entireTroveColl,\\n                _price\\n            );\\n\\n            _closeTrove(_borrower, Status.closedByLiquidation);\\n            if (singleLiquidation.collSurplus > 0) {\\n                collSurplusPool.accountSurplus(\\n                    _borrower,\\n                    singleLiquidation.collSurplus\\n                );\\n            }\\n\\n            emit TroveLiquidated(\\n                _borrower,\\n                singleLiquidation.entireTroveDebt,\\n                singleLiquidation.collToSendToSP,\\n                TroveManagerOperation.liquidateInRecoveryMode\\n            );\\n            emit TroveUpdated(\\n                _borrower,\\n                0,\\n                0,\\n                0,\\n                TroveManagerOperation.liquidateInRecoveryMode\\n            );\\n        } else {\\n            // if (_ICR >= MCR && ( _ICR >= _TCR || singleLiquidation.entireTroveDebt > _BaseFeeLMAInStabPool))\\n            LiquidationValues memory zeroVals;\\n            return zeroVals;\\n        }\\n\\n        return singleLiquidation;\\n    }\\n\\n    /* In a full liquidation, returns the values for a trove's coll and debt to be offset, and coll and debt to be\\n     * redistributed to active troves.\\n     */\\n    function _getOffsetAndRedistributionVals(\\n        uint _debt,\\n        uint _coll,\\n        uint _BaseFeeLMAInStabPool\\n    )\\n        internal\\n        pure\\n        returns (\\n            uint debtToOffset,\\n            uint collToSendToSP,\\n            uint debtToRedistribute,\\n            uint collToRedistribute\\n        )\\n    {\\n        if (_BaseFeeLMAInStabPool > 0) {\\n            /*\\n             * Offset as much debt & collateral as possible against the Stability Pool, and redistribute the remainder\\n             * between all active troves.\\n             *\\n             *  If the trove's debt is larger than the deposited BaseFeeLMA in the Stability Pool:\\n             *\\n             *  - Offset an amount of the trove's debt equal to the BaseFeeLMA in the Stability Pool\\n             *  - Send a fraction of the trove's collateral to the Stability Pool, equal to the fraction of its offset debt\\n             *\\n             */\\n            debtToOffset = LiquityMath._min(_debt, _BaseFeeLMAInStabPool);\\n            collToSendToSP = _coll.mul(debtToOffset).div(_debt);\\n            debtToRedistribute = _debt.sub(debtToOffset);\\n            collToRedistribute = _coll.sub(collToSendToSP);\\n        } else {\\n            debtToOffset = 0;\\n            collToSendToSP = 0;\\n            debtToRedistribute = _debt;\\n            collToRedistribute = _coll;\\n        }\\n    }\\n\\n    /*\\n     *  Get its offset coll/debt and StETH gas comp, and close the trove.\\n     */\\n    function _getCappedOffsetVals(\\n        uint _entireTroveDebt,\\n        uint _entireTroveColl,\\n        uint _price\\n    ) internal pure returns (LiquidationValues memory singleLiquidation) {\\n        singleLiquidation.entireTroveDebt = _entireTroveDebt;\\n        singleLiquidation.entireTroveColl = _entireTroveColl;\\n        uint cappedCollPortion = _entireTroveDebt.mul(MCR).div(_price);\\n\\n        singleLiquidation.collGasCompensation = _getCollGasCompensation(\\n            cappedCollPortion\\n        );\\n        singleLiquidation\\n            .BaseFeeLMAGasCompensation = BaseFeeLMA_GAS_COMPENSATION;\\n\\n        singleLiquidation.debtToOffset = _entireTroveDebt;\\n        singleLiquidation.collToSendToSP = cappedCollPortion.sub(\\n            singleLiquidation.collGasCompensation\\n        );\\n        singleLiquidation.collSurplus = _entireTroveColl.sub(cappedCollPortion);\\n        singleLiquidation.debtToRedistribute = 0;\\n        singleLiquidation.collToRedistribute = 0;\\n    }\\n\\n    /*\\n     * Liquidate a sequence of troves. Closes a maximum number of n under-collateralized Troves,\\n     * starting from the one with the lowest collateral ratio in the system, and moving upwards\\n     */\\n    function liquidateTroves(uint _n) external {\\n        ContractsCache memory contractsCache = ContractsCache(\\n            activePool,\\n            defaultPool,\\n            IBaseFeeLMAToken(address(0)),\\n            IHOGStaking(address(0)),\\n            sortedTroves,\\n            ICollSurplusPool(address(0)),\\n            address(0)\\n        );\\n        IStabilityPool stabilityPoolCached = stabilityPool;\\n\\n        LocalVariables_OuterLiquidationFunction memory vars;\\n\\n        LiquidationTotals memory totals;\\n\\n        vars.price = priceFeed.fetchPrice();\\n        vars.BaseFeeLMAInStabPool = stabilityPoolCached\\n            .getTotalBaseFeeLMADeposits();\\n        vars.recoveryModeAtStart = _checkRecoveryMode(vars.price);\\n\\n        // Perform the appropriate liquidation sequence - tally the values, and obtain their totals\\n        if (vars.recoveryModeAtStart) {\\n            totals = _getTotalsFromLiquidateTrovesSequence_RecoveryMode(\\n                contractsCache,\\n                vars.price,\\n                vars.BaseFeeLMAInStabPool,\\n                _n\\n            );\\n        } else {\\n            // if !vars.recoveryModeAtStart\\n            totals = _getTotalsFromLiquidateTrovesSequence_NormalMode(\\n                contractsCache.activePool,\\n                contractsCache.defaultPool,\\n                vars.price,\\n                vars.BaseFeeLMAInStabPool,\\n                _n\\n            );\\n        }\\n\\n        require(\\n            totals.totalDebtInSequence > 0,\\n            \\\"TroveManager: nothing to liquidate\\\"\\n        );\\n\\n        // Move liquidated StETH and BaseFeeLMA to the appropriate pools\\n        stabilityPoolCached.offset(\\n            totals.totalDebtToOffset,\\n            totals.totalCollToSendToSP\\n        );\\n        _redistributeDebtAndColl(\\n            contractsCache.activePool,\\n            contractsCache.defaultPool,\\n            totals.totalDebtToRedistribute,\\n            totals.totalCollToRedistribute\\n        );\\n        if (totals.totalCollSurplus > 0) {\\n            contractsCache.activePool.sendStETH(\\n                address(collSurplusPool),\\n                totals.totalCollSurplus\\n            );\\n        }\\n\\n        // Update system snapshots\\n        _updateSystemSnapshots_excludeCollRemainder(\\n            contractsCache.activePool,\\n            totals.totalCollGasCompensation\\n        );\\n\\n        vars.liquidatedDebt = totals.totalDebtInSequence;\\n        vars.liquidatedColl = totals\\n            .totalCollInSequence\\n            .sub(totals.totalCollGasCompensation)\\n            .sub(totals.totalCollSurplus);\\n        emit Liquidation(\\n            vars.liquidatedDebt,\\n            vars.liquidatedColl,\\n            totals.totalCollGasCompensation,\\n            totals.totalBaseFeeLMAGasCompensation\\n        );\\n\\n        // Send gas compensation to caller\\n        _sendGasCompensation(\\n            contractsCache.activePool,\\n            msg.sender,\\n            totals.totalBaseFeeLMAGasCompensation,\\n            totals.totalCollGasCompensation\\n        );\\n    }\\n\\n    /*\\n     * This function is used when the liquidateTroves sequence starts during Recovery Mode. However, it\\n     * handle the case where the system *leaves* Recovery Mode, part way through the liquidation sequence\\n     */\\n    function _getTotalsFromLiquidateTrovesSequence_RecoveryMode(\\n        ContractsCache memory _contractsCache,\\n        uint _price,\\n        uint _BaseFeeLMAInStabPool,\\n        uint _n\\n    ) internal returns (LiquidationTotals memory totals) {\\n        LocalVariables_LiquidationSequence memory vars;\\n        LiquidationValues memory singleLiquidation;\\n\\n        vars.remainingBaseFeeLMAInStabPool = _BaseFeeLMAInStabPool;\\n        vars.backToNormalMode = false;\\n        vars.entireSystemDebt = getEntireSystemDebt();\\n        vars.entireSystemColl = getEntireSystemColl();\\n\\n        vars.user = _contractsCache.sortedTroves.getLast();\\n        address firstUser = _contractsCache.sortedTroves.getFirst();\\n        for (vars.i = 0; vars.i < _n && vars.user != firstUser; vars.i++) {\\n            // we need to cache it, because current user is likely going to be deleted\\n            address nextUser = _contractsCache.sortedTroves.getPrev(vars.user);\\n\\n            vars.ICR = getCurrentICR(vars.user, _price);\\n\\n            if (!vars.backToNormalMode) {\\n                // Break the loop if ICR is greater than MCR and Stability Pool is empty\\n                if (\\n                    vars.ICR >= MCR && vars.remainingBaseFeeLMAInStabPool == 0\\n                ) {\\n                    break;\\n                }\\n\\n                uint TCR = LiquityMath._computeCR(\\n                    vars.entireSystemColl,\\n                    vars.entireSystemDebt,\\n                    _price\\n                );\\n\\n                singleLiquidation = _liquidateRecoveryMode(\\n                    _contractsCache.activePool,\\n                    _contractsCache.defaultPool,\\n                    vars.user,\\n                    vars.ICR,\\n                    vars.remainingBaseFeeLMAInStabPool,\\n                    TCR,\\n                    _price\\n                );\\n\\n                // Update aggregate trackers\\n                vars.remainingBaseFeeLMAInStabPool = vars\\n                    .remainingBaseFeeLMAInStabPool\\n                    .sub(singleLiquidation.debtToOffset);\\n                vars.entireSystemDebt = vars.entireSystemDebt.sub(\\n                    singleLiquidation.debtToOffset\\n                );\\n                vars.entireSystemColl = vars\\n                    .entireSystemColl\\n                    .sub(singleLiquidation.collToSendToSP)\\n                    .sub(singleLiquidation.collGasCompensation)\\n                    .sub(singleLiquidation.collSurplus);\\n\\n                // Add liquidation values to their respective running totals\\n                totals = _addLiquidationValuesToTotals(\\n                    totals,\\n                    singleLiquidation\\n                );\\n\\n                vars.backToNormalMode = !_checkPotentialRecoveryMode(\\n                    vars.entireSystemColl,\\n                    vars.entireSystemDebt,\\n                    _price\\n                );\\n            } else if (vars.backToNormalMode && vars.ICR < MCR) {\\n                singleLiquidation = _liquidateNormalMode(\\n                    _contractsCache.activePool,\\n                    _contractsCache.defaultPool,\\n                    vars.user,\\n                    vars.remainingBaseFeeLMAInStabPool\\n                );\\n\\n                vars.remainingBaseFeeLMAInStabPool = vars\\n                    .remainingBaseFeeLMAInStabPool\\n                    .sub(singleLiquidation.debtToOffset);\\n\\n                // Add liquidation values to their respective running totals\\n                totals = _addLiquidationValuesToTotals(\\n                    totals,\\n                    singleLiquidation\\n                );\\n            } else break; // break if the loop reaches a Trove with ICR >= MCR\\n\\n            vars.user = nextUser;\\n        }\\n    }\\n\\n    function _getTotalsFromLiquidateTrovesSequence_NormalMode(\\n        IActivePool _activePool,\\n        IDefaultPool _defaultPool,\\n        uint _price,\\n        uint _BaseFeeLMAInStabPool,\\n        uint _n\\n    ) internal returns (LiquidationTotals memory totals) {\\n        LocalVariables_LiquidationSequence memory vars;\\n        LiquidationValues memory singleLiquidation;\\n        ISortedTroves sortedTrovesCached = sortedTroves;\\n\\n        vars.remainingBaseFeeLMAInStabPool = _BaseFeeLMAInStabPool;\\n\\n        for (vars.i = 0; vars.i < _n; vars.i++) {\\n            vars.user = sortedTrovesCached.getLast();\\n            vars.ICR = getCurrentICR(vars.user, _price);\\n\\n            if (vars.ICR < MCR) {\\n                singleLiquidation = _liquidateNormalMode(\\n                    _activePool,\\n                    _defaultPool,\\n                    vars.user,\\n                    vars.remainingBaseFeeLMAInStabPool\\n                );\\n\\n                vars.remainingBaseFeeLMAInStabPool = vars\\n                    .remainingBaseFeeLMAInStabPool\\n                    .sub(singleLiquidation.debtToOffset);\\n\\n                // Add liquidation values to their respective running totals\\n                totals = _addLiquidationValuesToTotals(\\n                    totals,\\n                    singleLiquidation\\n                );\\n            } else break; // break if the loop reaches a Trove with ICR >= MCR\\n        }\\n    }\\n\\n    /*\\n     * Attempt to liquidate a custom list of troves provided by the caller.\\n     */\\n    function batchLiquidateTroves(address[] memory _troveArray) public {\\n        require(\\n            _troveArray.length != 0,\\n            \\\"TroveManager: Calldata address array must not be empty\\\"\\n        );\\n\\n        IActivePool activePoolCached = activePool;\\n        IDefaultPool defaultPoolCached = defaultPool;\\n        IStabilityPool stabilityPoolCached = stabilityPool;\\n\\n        LocalVariables_OuterLiquidationFunction memory vars;\\n        LiquidationTotals memory totals;\\n\\n        vars.price = priceFeed.fetchPrice();\\n        vars.BaseFeeLMAInStabPool = stabilityPoolCached\\n            .getTotalBaseFeeLMADeposits();\\n        vars.recoveryModeAtStart = _checkRecoveryMode(vars.price);\\n\\n        // Perform the appropriate liquidation sequence - tally values and obtain their totals.\\n        if (vars.recoveryModeAtStart) {\\n            totals = _getTotalFromBatchLiquidate_RecoveryMode(\\n                activePoolCached,\\n                defaultPoolCached,\\n                vars.price,\\n                vars.BaseFeeLMAInStabPool,\\n                _troveArray\\n            );\\n        } else {\\n            //  if !vars.recoveryModeAtStart\\n            totals = _getTotalsFromBatchLiquidate_NormalMode(\\n                activePoolCached,\\n                defaultPoolCached,\\n                vars.price,\\n                vars.BaseFeeLMAInStabPool,\\n                _troveArray\\n            );\\n        }\\n\\n        require(\\n            totals.totalDebtInSequence > 0,\\n            \\\"TroveManager: nothing to liquidate\\\"\\n        );\\n\\n        // Move liquidated StETH and BaseFeeLMA to the appropriate pools\\n        stabilityPoolCached.offset(\\n            totals.totalDebtToOffset,\\n            totals.totalCollToSendToSP\\n        );\\n        _redistributeDebtAndColl(\\n            activePoolCached,\\n            defaultPoolCached,\\n            totals.totalDebtToRedistribute,\\n            totals.totalCollToRedistribute\\n        );\\n        if (totals.totalCollSurplus > 0) {\\n            activePoolCached.sendStETH(\\n                address(collSurplusPool),\\n                totals.totalCollSurplus\\n            );\\n        }\\n\\n        // Update system snapshots\\n        _updateSystemSnapshots_excludeCollRemainder(\\n            activePoolCached,\\n            totals.totalCollGasCompensation\\n        );\\n\\n        vars.liquidatedDebt = totals.totalDebtInSequence;\\n        vars.liquidatedColl = totals\\n            .totalCollInSequence\\n            .sub(totals.totalCollGasCompensation)\\n            .sub(totals.totalCollSurplus);\\n        emit Liquidation(\\n            vars.liquidatedDebt,\\n            vars.liquidatedColl,\\n            totals.totalCollGasCompensation,\\n            totals.totalBaseFeeLMAGasCompensation\\n        );\\n\\n        // Send gas compensation to caller\\n        _sendGasCompensation(\\n            activePoolCached,\\n            msg.sender,\\n            totals.totalBaseFeeLMAGasCompensation,\\n            totals.totalCollGasCompensation\\n        );\\n    }\\n\\n    /*\\n     * This function is used when the batch liquidation sequence starts during Recovery Mode. However, it\\n     * handle the case where the system *leaves* Recovery Mode, part way through the liquidation sequence\\n     */\\n    function _getTotalFromBatchLiquidate_RecoveryMode(\\n        IActivePool _activePool,\\n        IDefaultPool _defaultPool,\\n        uint _price,\\n        uint _BaseFeeLMAInStabPool,\\n        address[] memory _troveArray\\n    ) internal returns (LiquidationTotals memory totals) {\\n        LocalVariables_LiquidationSequence memory vars;\\n        LiquidationValues memory singleLiquidation;\\n\\n        vars.remainingBaseFeeLMAInStabPool = _BaseFeeLMAInStabPool;\\n        vars.backToNormalMode = false;\\n        vars.entireSystemDebt = getEntireSystemDebt();\\n        vars.entireSystemColl = getEntireSystemColl();\\n\\n        for (vars.i = 0; vars.i < _troveArray.length; vars.i++) {\\n            vars.user = _troveArray[vars.i];\\n            // Skip non-active troves\\n            if (Troves[vars.user].status != Status.active) {\\n                continue;\\n            }\\n            vars.ICR = getCurrentICR(vars.user, _price);\\n\\n            if (!vars.backToNormalMode) {\\n                // Skip this trove if ICR is greater than MCR and Stability Pool is empty\\n                if (\\n                    vars.ICR >= MCR && vars.remainingBaseFeeLMAInStabPool == 0\\n                ) {\\n                    continue;\\n                }\\n\\n                uint TCR = LiquityMath._computeCR(\\n                    vars.entireSystemColl,\\n                    vars.entireSystemDebt,\\n                    _price\\n                );\\n\\n                singleLiquidation = _liquidateRecoveryMode(\\n                    _activePool,\\n                    _defaultPool,\\n                    vars.user,\\n                    vars.ICR,\\n                    vars.remainingBaseFeeLMAInStabPool,\\n                    TCR,\\n                    _price\\n                );\\n\\n                // Update aggregate trackers\\n                vars.remainingBaseFeeLMAInStabPool = vars\\n                    .remainingBaseFeeLMAInStabPool\\n                    .sub(singleLiquidation.debtToOffset);\\n                vars.entireSystemDebt = vars.entireSystemDebt.sub(\\n                    singleLiquidation.debtToOffset\\n                );\\n                vars.entireSystemColl = vars\\n                    .entireSystemColl\\n                    .sub(singleLiquidation.collToSendToSP)\\n                    .sub(singleLiquidation.collGasCompensation)\\n                    .sub(singleLiquidation.collSurplus);\\n\\n                // Add liquidation values to their respective running totals\\n                totals = _addLiquidationValuesToTotals(\\n                    totals,\\n                    singleLiquidation\\n                );\\n\\n                vars.backToNormalMode = !_checkPotentialRecoveryMode(\\n                    vars.entireSystemColl,\\n                    vars.entireSystemDebt,\\n                    _price\\n                );\\n            } else if (vars.backToNormalMode && vars.ICR < MCR) {\\n                singleLiquidation = _liquidateNormalMode(\\n                    _activePool,\\n                    _defaultPool,\\n                    vars.user,\\n                    vars.remainingBaseFeeLMAInStabPool\\n                );\\n                vars.remainingBaseFeeLMAInStabPool = vars\\n                    .remainingBaseFeeLMAInStabPool\\n                    .sub(singleLiquidation.debtToOffset);\\n\\n                // Add liquidation values to their respective running totals\\n                totals = _addLiquidationValuesToTotals(\\n                    totals,\\n                    singleLiquidation\\n                );\\n            } else continue; // In Normal Mode skip troves with ICR >= MCR\\n        }\\n    }\\n\\n    function _getTotalsFromBatchLiquidate_NormalMode(\\n        IActivePool _activePool,\\n        IDefaultPool _defaultPool,\\n        uint _price,\\n        uint _BaseFeeLMAInStabPool,\\n        address[] memory _troveArray\\n    ) internal returns (LiquidationTotals memory totals) {\\n        LocalVariables_LiquidationSequence memory vars;\\n        LiquidationValues memory singleLiquidation;\\n\\n        vars.remainingBaseFeeLMAInStabPool = _BaseFeeLMAInStabPool;\\n\\n        for (vars.i = 0; vars.i < _troveArray.length; vars.i++) {\\n            vars.user = _troveArray[vars.i];\\n            vars.ICR = getCurrentICR(vars.user, _price);\\n\\n            if (vars.ICR < MCR) {\\n                singleLiquidation = _liquidateNormalMode(\\n                    _activePool,\\n                    _defaultPool,\\n                    vars.user,\\n                    vars.remainingBaseFeeLMAInStabPool\\n                );\\n                vars.remainingBaseFeeLMAInStabPool = vars\\n                    .remainingBaseFeeLMAInStabPool\\n                    .sub(singleLiquidation.debtToOffset);\\n\\n                // Add liquidation values to their respective running totals\\n                totals = _addLiquidationValuesToTotals(\\n                    totals,\\n                    singleLiquidation\\n                );\\n            }\\n        }\\n    }\\n\\n    // --- Liquidation helper functions ---\\n\\n    function _addLiquidationValuesToTotals(\\n        LiquidationTotals memory oldTotals,\\n        LiquidationValues memory singleLiquidation\\n    ) internal pure returns (LiquidationTotals memory newTotals) {\\n        // Tally all the values with their respective running totals\\n        newTotals.totalCollGasCompensation = oldTotals\\n            .totalCollGasCompensation\\n            .add(singleLiquidation.collGasCompensation);\\n        newTotals.totalBaseFeeLMAGasCompensation = oldTotals\\n            .totalBaseFeeLMAGasCompensation\\n            .add(singleLiquidation.BaseFeeLMAGasCompensation);\\n        newTotals.totalDebtInSequence = oldTotals.totalDebtInSequence.add(\\n            singleLiquidation.entireTroveDebt\\n        );\\n        newTotals.totalCollInSequence = oldTotals.totalCollInSequence.add(\\n            singleLiquidation.entireTroveColl\\n        );\\n        newTotals.totalDebtToOffset = oldTotals.totalDebtToOffset.add(\\n            singleLiquidation.debtToOffset\\n        );\\n        newTotals.totalCollToSendToSP = oldTotals.totalCollToSendToSP.add(\\n            singleLiquidation.collToSendToSP\\n        );\\n        newTotals.totalDebtToRedistribute = oldTotals\\n            .totalDebtToRedistribute\\n            .add(singleLiquidation.debtToRedistribute);\\n        newTotals.totalCollToRedistribute = oldTotals\\n            .totalCollToRedistribute\\n            .add(singleLiquidation.collToRedistribute);\\n        newTotals.totalCollSurplus = oldTotals.totalCollSurplus.add(\\n            singleLiquidation.collSurplus\\n        );\\n\\n        return newTotals;\\n    }\\n\\n    function _sendGasCompensation(\\n        IActivePool _activePool,\\n        address _liquidator,\\n        uint _BaseFeeLMA,\\n        uint _StETH\\n    ) internal {\\n        if (_BaseFeeLMA > 0) {\\n            baseFeeLMAToken.returnFromPool(\\n                gasPoolAddress,\\n                _liquidator,\\n                _BaseFeeLMA\\n            );\\n        }\\n\\n        if (_StETH > 0) {\\n            _activePool.sendStETH(_liquidator, _StETH);\\n        }\\n    }\\n\\n    // Move a Trove's pending debt and collateral rewards from distributions, from the Default Pool to the Active Pool\\n    function _movePendingTroveRewardsToActivePool(\\n        IActivePool _activePool,\\n        IDefaultPool _defaultPool,\\n        uint _BaseFeeLMA,\\n        uint _StETH\\n    ) internal {\\n        _defaultPool.decreaseBaseFeeLMADebt(_BaseFeeLMA);\\n        _activePool.increaseBaseFeeLMADebt(_BaseFeeLMA);\\n        _defaultPool.sendStETHToActivePool(_StETH);\\n    }\\n\\n    // --- Redemption functions ---\\n\\n    // Redeem as much collateral as possible from _borrower's Trove in exchange for BaseFeeLMA up to _maxBaseFeeLMAamount\\n    function _redeemCollateralFromTrove(\\n        ContractsCache memory _contractsCache,\\n        address _borrower,\\n        uint _maxBaseFeeLMAamount,\\n        uint _price,\\n        address _upperPartialRedemptionHint,\\n        address _lowerPartialRedemptionHint,\\n        uint _partialRedemptionHintNICR\\n    ) internal returns (SingleRedemptionValues memory singleRedemption) {\\n        // Determine the remaining amount (lot) to be redeemed, capped by the entire debt of the Trove minus the liquidation reserve\\n        singleRedemption.BaseFeeLMALot = LiquityMath._min(\\n            _maxBaseFeeLMAamount,\\n            Troves[_borrower].debt.sub(BaseFeeLMA_GAS_COMPENSATION)\\n        );\\n\\n        // Get the StETHLot of equivalent value in USD\\n        // HEDGEHOG UPDATES: Change StETHLOT calculations formula from [debtToBeRedeemed * price * 10e9] to [debtToBeRedeemed / price * 1e18]\\n        singleRedemption.StETHLot = singleRedemption.BaseFeeLMALot.mul(_price);\\n\\n        // Decrease the debt and collateral of the current Trove according to the BaseFeeLMA lot and corresponding StETH to send\\n        uint newDebt = (Troves[_borrower].debt).sub(\\n            singleRedemption.BaseFeeLMALot\\n        );\\n        uint newColl = (Troves[_borrower].coll).sub(singleRedemption.StETHLot);\\n\\n        if (newDebt == BaseFeeLMA_GAS_COMPENSATION) {\\n            // No debt left in the Trove (except for the liquidation reserve), therefore the trove gets closed\\n            _removeStake(_borrower);\\n            _closeTrove(_borrower, Status.closedByRedemption);\\n            _redeemCloseTrove(\\n                _contractsCache,\\n                _borrower,\\n                BaseFeeLMA_GAS_COMPENSATION,\\n                newColl\\n            );\\n            emit TroveUpdated(\\n                _borrower,\\n                0,\\n                0,\\n                0,\\n                TroveManagerOperation.redeemCollateral\\n            );\\n        } else {\\n            uint newNICR = LiquityMath._computeNominalCR(newColl, newDebt);\\n\\n            /*\\n             * If the provided hint is out of date, we bail since trying to reinsert without a good hint will almost\\n             * certainly result in running out of gas.\\n             *\\n             * If the resultant net debt of the partial is less than the minimum, net debt we bail.\\n             */\\n\\n            if (\\n                newNICR != _partialRedemptionHintNICR ||\\n                _getNetDebt(newDebt) < MIN_NET_DEBT\\n            ) {\\n                singleRedemption.cancelledPartial = true;\\n                return singleRedemption;\\n            }\\n\\n            _contractsCache.sortedTroves.reInsert(\\n                _borrower,\\n                newNICR,\\n                _upperPartialRedemptionHint,\\n                _lowerPartialRedemptionHint\\n            );\\n\\n            Troves[_borrower].debt = newDebt;\\n            Troves[_borrower].coll = newColl;\\n            _updateStakeAndTotalStakes(_borrower);\\n\\n            emit TroveUpdated(\\n                _borrower,\\n                newDebt,\\n                newColl,\\n                Troves[_borrower].stake,\\n                TroveManagerOperation.redeemCollateral\\n            );\\n        }\\n\\n        return singleRedemption;\\n    }\\n\\n    /*\\n     * Called when a full redemption occurs, and closes the trove.\\n     * The redeemer swaps (debt - liquidation reserve) BaseFeeLMA for (debt - liquidation reserve) worth of StETH, so the BaseFeeLMA liquidation reserve left corresponds to the remaining debt.\\n     * In order to close the trove, the BaseFeeLMA liquidation reserve is burned, and the corresponding debt is removed from the active pool.\\n     * The debt recorded on the trove's struct is zero'd elswhere, in _closeTrove.\\n     * Any surplus StETH left in the trove, is sent to the Coll surplus pool, and can be later claimed by the borrower.\\n     */\\n    function _redeemCloseTrove(\\n        ContractsCache memory _contractsCache,\\n        address _borrower,\\n        uint _BaseFeeLMA,\\n        uint _StETH\\n    ) internal {\\n        _contractsCache.baseFeeLMAToken.burn(gasPoolAddress, _BaseFeeLMA);\\n        // Update Active Pool BaseFeeLMA, and send StETH to account\\n        _contractsCache.activePool.decreaseBaseFeeLMADebt(_BaseFeeLMA);\\n\\n        // send StETH from Active Pool to CollSurplus Pool\\n        _contractsCache.collSurplusPool.accountSurplus(_borrower, _StETH);\\n        _contractsCache.activePool.sendStETH(\\n            address(_contractsCache.collSurplusPool),\\n            _StETH\\n        );\\n    }\\n\\n    function _isValidFirstRedemptionHint(\\n        ISortedTroves _sortedTroves,\\n        address _firstRedemptionHint,\\n        uint _price\\n    ) internal view returns (bool) {\\n        if (\\n            _firstRedemptionHint == address(0) ||\\n            !_sortedTroves.contains(_firstRedemptionHint) ||\\n            getCurrentICR(_firstRedemptionHint, _price) < MCR\\n        ) {\\n            return false;\\n        }\\n\\n        address nextTrove = _sortedTroves.getNext(_firstRedemptionHint);\\n        return\\n            nextTrove == address(0) || getCurrentICR(nextTrove, _price) < MCR;\\n    }\\n\\n    /* Send _BaseFeeLMAamount BaseFeeLMA to the system and redeem the corresponding amount of collateral from as many Troves as are needed to fill the redemption\\n     * request.  Applies pending rewards to a Trove before reducing its debt and coll.\\n     *\\n     * Note that if _amount is very large, this function can run out of gas, specially if traversed troves are small. This can be easily avoided by\\n     * splitting the total _amount in appropriate chunks and calling the function multiple times.\\n     *\\n     * Param `_maxIterations` can also be provided, so the loop through Troves is capped (if it\\u2019s zero, it will be ignored).This makes it easier to\\n     * avoid OOG for the frontend, as only knowing approximately the average cost of an iteration is enough, without needing to know the \\u201ctopology\\u201d\\n     * of the trove list. It also avoids the need to set the cap in stone in the contract, nor doing gas calculations, as both gas price and opcode\\n     * costs can vary.\\n     *\\n     * All Troves that are redeemed from -- with the likely exception of the last one -- will end up with no debt left, therefore they will be closed.\\n     * If the last Trove does have some remaining debt, it has a finite ICR, and the reinsertion could be anywhere in the list, therefore it requires a hint.\\n     * A frontend should use getRedemptionHints() to calculate what the ICR of this Trove will be after redemption, and pass a hint for its position\\n     * in the sortedTroves list along with the ICR value that the hint was found for.\\n     *\\n     * If another transaction modifies the list between calling getRedemptionHints() and passing the hints to redeemCollateral(), it\\n     * is very likely that the last (partially) redeemed Trove would end up with a different ICR than what the hint is for. In this case the\\n     * redemption will stop after the last completely redeemed Trove and the sender will keep the remaining BaseFeeLMA amount, which they can attempt\\n     * to redeem later.\\n     */\\n    function redeemCollateral(\\n        uint _BaseFeeLMAamount,\\n        address _firstRedemptionHint,\\n        address _upperPartialRedemptionHint,\\n        address _lowerPartialRedemptionHint,\\n        uint _partialRedemptionHintNICR,\\n        uint _maxIterations,\\n        uint _maxFeePercentage\\n    ) external {\\n        ContractsCache memory contractsCache = ContractsCache(\\n            activePool,\\n            defaultPool,\\n            baseFeeLMAToken,\\n            hogStaking,\\n            sortedTroves,\\n            collSurplusPool,\\n            gasPoolAddress\\n        );\\n        RedemptionTotals memory totals;\\n\\n        _requireValidMaxFeePercentage(_maxFeePercentage);\\n        //_requireAfterBootstrapPeriod();\\n        totals.price = priceFeed.fetchPrice();\\n\\n        _requireTCRoverMCR(totals.price);\\n        _requireAmountGreaterThanZero(_BaseFeeLMAamount);\\n        _requireBaseFeeLMABalanceCoversRedemption(\\n            contractsCache.baseFeeLMAToken,\\n            msg.sender,\\n            _BaseFeeLMAamount\\n        );\\n\\n        totals.totalBaseFeeLMASupplyAtStart = getEntireSystemDebt();\\n        // Confirm redeemer's balance is less than total BaseFeeLMA supply\\n        assert(\\n            contractsCache.baseFeeLMAToken.balanceOf(msg.sender) <=\\n                totals.totalBaseFeeLMASupplyAtStart\\n        );\\n\\n        totals.remainingBaseFeeLMA = _BaseFeeLMAamount;\\n        address currentBorrower;\\n\\n        if (\\n            _isValidFirstRedemptionHint(\\n                contractsCache.sortedTroves,\\n                _firstRedemptionHint,\\n                totals.price\\n            )\\n        ) {\\n            currentBorrower = _firstRedemptionHint;\\n        } else {\\n            currentBorrower = contractsCache.sortedTroves.getLast();\\n            // Find the first trove with ICR >= MCR\\n            while (\\n                currentBorrower != address(0) &&\\n                getCurrentICR(currentBorrower, totals.price) < MCR\\n            ) {\\n                currentBorrower = contractsCache.sortedTroves.getPrev(\\n                    currentBorrower\\n                );\\n            }\\n        }\\n        // Loop through the Troves starting from the one with lowest collateral ratio until _amount of BaseFeeLMA is exchanged for collateral\\n        if (_maxIterations == 0) {\\n            // Previous implementation: _maxIterations = uint(-1);\\n            // Updated since 8th pragma does not allow anymore\\n            _maxIterations = type(uint).max;\\n        }\\n        while (\\n            currentBorrower != address(0) &&\\n            totals.remainingBaseFeeLMA > 0 &&\\n            _maxIterations > 0\\n        ) {\\n            _maxIterations--;\\n            // Save the address of the Trove preceding the current one, before potentially modifying the list\\n            address nextUserToCheck = contractsCache.sortedTroves.getPrev(\\n                currentBorrower\\n            );\\n\\n            _applyPendingRewards(\\n                contractsCache.activePool,\\n                contractsCache.defaultPool,\\n                currentBorrower\\n            );\\n            SingleRedemptionValues\\n                memory singleRedemption = _redeemCollateralFromTrove(\\n                    contractsCache,\\n                    currentBorrower,\\n                    totals.remainingBaseFeeLMA,\\n                    totals.price,\\n                    _upperPartialRedemptionHint,\\n                    _lowerPartialRedemptionHint,\\n                    _partialRedemptionHintNICR\\n                );\\n\\n            if (singleRedemption.cancelledPartial) break; // Partial redemption was cancelled (out-of-date hint, or new net debt < minimum), therefore we could not redeem from the last Trove\\n            totals.totalBaseFeeLMAToRedeem = totals.totalBaseFeeLMAToRedeem.add(\\n                singleRedemption.BaseFeeLMALot\\n            );\\n            totals.totalStETHDrawn = totals.totalStETHDrawn.add(\\n                singleRedemption.StETHLot\\n            );\\n\\n            totals.remainingBaseFeeLMA = totals.remainingBaseFeeLMA.sub(\\n                singleRedemption.BaseFeeLMALot\\n            );\\n            currentBorrower = nextUserToCheck;\\n        }\\n\\n        require(\\n            totals.totalStETHDrawn > 0,\\n            \\\"TroveManager: Unable to redeem any amount\\\"\\n        );\\n        // HEDGEHOG LOGIC UPDATE:\\n        // 1) rename _updateBaseRateFromRedemption into _updateRedemptionBaseRateFromRedemption\\n        // 2) update commented explanation (baseRate => redemptionBaseRate)\\n        // Decay the redemptionBaseRate due to time passed, and then increase it according to the size of this redemption.\\n        // Use the saved total BaseFeeLMA supply value, from before it was reduced by the redemption.\\n        _updateRedemptionBaseRateFromRedemption(\\n            totals.totalStETHDrawn,\\n            totals.price,\\n            totals.totalBaseFeeLMASupplyAtStart\\n        );\\n        // Calculate the StETH fee\\n        totals.StETHFee = _getRedemptionFee(totals.totalStETHDrawn);\\n        console.log(\\\"Redemption fee: \\\", totals.StETHFee);\\n\\n        _requireUserAcceptsFee(\\n            totals.StETHFee,\\n            totals.totalStETHDrawn,\\n            _maxFeePercentage\\n        );\\n        // Send the StETH fee to the HOG staking contract\\n        contractsCache.activePool.sendStETH(\\n            address(contractsCache.hogStaking),\\n            totals.StETHFee\\n        );\\n        contractsCache.hogStaking.increaseF_StETH(totals.StETHFee);\\n\\n        totals.StETHToSendToRedeemer = totals.totalStETHDrawn.sub(\\n            totals.StETHFee\\n        );\\n        console.log(\\n            \\\"What actually gets transferred: \\\",\\n            totals.StETHToSendToRedeemer\\n        );\\n        emit Redemption(\\n            _BaseFeeLMAamount,\\n            totals.totalBaseFeeLMAToRedeem,\\n            totals.totalStETHDrawn,\\n            totals.StETHFee\\n        );\\n        // Burn the total BaseFeeLMA that is cancelled with debt, and send the redeemed StETH to msg.sender\\n        contractsCache.baseFeeLMAToken.burn(\\n            msg.sender,\\n            totals.totalBaseFeeLMAToRedeem\\n        );\\n        // Update Active Pool BaseFeeLMA, and send StETH to account\\n        contractsCache.activePool.decreaseBaseFeeLMADebt(\\n            totals.totalBaseFeeLMAToRedeem\\n        );\\n        contractsCache.activePool.sendStETH(\\n            msg.sender,\\n            totals.StETHToSendToRedeemer\\n        );\\n    }\\n\\n    // --- Helper functions ---\\n\\n    // Return the nominal collateral ratio (ICR) of a given Trove, without the price. Takes a trove's pending coll and debt rewards from redistributions into account.\\n    function getNominalICR(address _borrower) public view returns (uint) {\\n        (\\n            uint currentStETH,\\n            uint currentBaseFeeLMADebt\\n        ) = _getCurrentTroveAmounts(_borrower);\\n\\n        uint NICR = LiquityMath._computeNominalCR(\\n            currentStETH,\\n            currentBaseFeeLMADebt\\n        );\\n        return NICR;\\n    }\\n\\n    /**\\n     * Hedgehog changes:\\n     * Get Price directly from the price feed instead of param passing\\n     */\\n    // Return the current collateral ratio (ICR) of a given Trove. Takes a trove's pending coll and debt rewards from redistributions into account.\\n    function getCurrentICR(\\n        address _borrower,\\n        uint _price\\n    ) public view returns (uint) {\\n        (\\n            uint currentStETH,\\n            uint currentBaseFeeLMADebt\\n        ) = _getCurrentTroveAmounts(_borrower);\\n\\n        uint ICR = LiquityMath._computeCR(\\n            currentStETH,\\n            currentBaseFeeLMADebt,\\n            _price\\n        );\\n        return ICR;\\n    }\\n\\n    function getUnreliableTroveICR(\\n        address _borrower\\n    ) public view returns (uint) {\\n        uint256 price = priceFeed.lastGoodPrice();\\n        (\\n            uint currentStETH,\\n            uint currentBaseFeeLMADebt\\n        ) = _getCurrentTroveAmounts(_borrower);\\n\\n        uint ICR = LiquityMath._computeCR(\\n            currentStETH,\\n            currentBaseFeeLMADebt,\\n            price\\n        );\\n        return ICR;\\n    }\\n\\n    function _getCurrentTroveAmounts(\\n        address _borrower\\n    ) internal view returns (uint, uint) {\\n        uint pendingStETHReward = getPendingStETHReward(_borrower);\\n        uint pendingBaseFeeLMADebtReward = getPendingBaseFeeLMADebtReward(\\n            _borrower\\n        );\\n\\n        uint currentStETH = Troves[_borrower].coll.add(pendingStETHReward);\\n        uint currentBaseFeeLMADebt = Troves[_borrower].debt.add(\\n            pendingBaseFeeLMADebtReward\\n        );\\n\\n        return (currentStETH, currentBaseFeeLMADebt);\\n    }\\n\\n    function applyPendingRewards(address _borrower) external {\\n        _requireCallerIsBorrowerOperations();\\n        return _applyPendingRewards(activePool, defaultPool, _borrower);\\n    }\\n\\n    // Add the borrowers's coll and debt rewards earned from redistributions, to their Trove\\n    function _applyPendingRewards(\\n        IActivePool _activePool,\\n        IDefaultPool _defaultPool,\\n        address _borrower\\n    ) internal {\\n        if (hasPendingRewards(_borrower)) {\\n            _requireTroveIsActive(_borrower);\\n\\n            // Compute pending rewards\\n            uint pendingStETHReward = getPendingStETHReward(_borrower);\\n            uint pendingBaseFeeLMADebtReward = getPendingBaseFeeLMADebtReward(\\n                _borrower\\n            );\\n\\n            // Apply pending rewards to trove's state\\n            Troves[_borrower].coll = Troves[_borrower].coll.add(\\n                pendingStETHReward\\n            );\\n            Troves[_borrower].debt = Troves[_borrower].debt.add(\\n                pendingBaseFeeLMADebtReward\\n            );\\n\\n            _updateTroveRewardSnapshots(_borrower);\\n\\n            // Transfer from DefaultPool to ActivePool\\n            _movePendingTroveRewardsToActivePool(\\n                _activePool,\\n                _defaultPool,\\n                pendingBaseFeeLMADebtReward,\\n                pendingStETHReward\\n            );\\n\\n            emit TroveUpdated(\\n                _borrower,\\n                Troves[_borrower].debt,\\n                Troves[_borrower].coll,\\n                Troves[_borrower].stake,\\n                TroveManagerOperation.applyPendingRewards\\n            );\\n        }\\n    }\\n\\n    // Update borrower's snapshots of L_StETH and L_BaseFeeLMADebt to reflect the current values\\n    function updateTroveRewardSnapshots(address _borrower) external {\\n        _requireCallerIsBorrowerOperations();\\n        return _updateTroveRewardSnapshots(_borrower);\\n    }\\n\\n    function _updateTroveRewardSnapshots(address _borrower) internal {\\n        rewardSnapshots[_borrower].StETH = L_StETH;\\n        rewardSnapshots[_borrower].BaseFeeLMADebt = L_BaseFeeLMADebt;\\n        emit TroveSnapshotsUpdated(L_StETH, L_BaseFeeLMADebt);\\n    }\\n\\n    // Get the borrower's pending accumulated StETH reward, earned by their stake\\n    function getPendingStETHReward(\\n        address _borrower\\n    ) public view returns (uint) {\\n        uint snapshotStETH = rewardSnapshots[_borrower].StETH;\\n        uint rewardPerUnitStaked = L_StETH.sub(snapshotStETH);\\n\\n        if (\\n            rewardPerUnitStaked == 0 ||\\n            Troves[_borrower].status != Status.active\\n        ) {\\n            return 0;\\n        }\\n\\n        uint stake = Troves[_borrower].stake;\\n\\n        uint pendingStETHReward = stake.mul(rewardPerUnitStaked).div(\\n            DECIMAL_PRECISION\\n        );\\n\\n        return pendingStETHReward;\\n    }\\n\\n    // Get the borrower's pending accumulated BaseFeeLMA reward, earned by their stake\\n    function getPendingBaseFeeLMADebtReward(\\n        address _borrower\\n    ) public view returns (uint) {\\n        uint snapshotBaseFeeLMADebt = rewardSnapshots[_borrower].BaseFeeLMADebt;\\n        uint rewardPerUnitStaked = L_BaseFeeLMADebt.sub(snapshotBaseFeeLMADebt);\\n\\n        if (\\n            rewardPerUnitStaked == 0 ||\\n            Troves[_borrower].status != Status.active\\n        ) {\\n            return 0;\\n        }\\n\\n        uint stake = Troves[_borrower].stake;\\n\\n        uint pendingBaseFeeLMADebtReward = stake.mul(rewardPerUnitStaked).div(\\n            DECIMAL_PRECISION\\n        );\\n\\n        return pendingBaseFeeLMADebtReward;\\n    }\\n\\n    function hasPendingRewards(address _borrower) public view returns (bool) {\\n        /*\\n         * A Trove has pending rewards if its snapshot is less than the current rewards per-unit-staked sum:\\n         * this indicates that rewards have occured since the snapshot was made, and the user therefore has\\n         * pending rewards\\n         */\\n        if (Troves[_borrower].status != Status.active) {\\n            return false;\\n        }\\n\\n        return (rewardSnapshots[_borrower].StETH < L_StETH);\\n    }\\n\\n    // Return the Troves entire debt and coll, including pending rewards from redistributions.\\n    function getEntireDebtAndColl(\\n        address _borrower\\n    )\\n        public\\n        view\\n        returns (\\n            uint debt,\\n            uint coll,\\n            uint pendingBaseFeeLMADebtReward,\\n            uint pendingStETHReward\\n        )\\n    {\\n        debt = Troves[_borrower].debt;\\n        coll = Troves[_borrower].coll;\\n\\n        pendingBaseFeeLMADebtReward = getPendingBaseFeeLMADebtReward(_borrower);\\n        pendingStETHReward = getPendingStETHReward(_borrower);\\n\\n        debt = debt.add(pendingBaseFeeLMADebtReward);\\n        coll = coll.add(pendingStETHReward);\\n    }\\n\\n    function removeStake(address _borrower) external {\\n        _requireCallerIsBorrowerOperations();\\n        return _removeStake(_borrower);\\n    }\\n\\n    // Remove borrower's stake from the totalStakes sum, and set their stake to 0\\n    function _removeStake(address _borrower) internal {\\n        uint stake = Troves[_borrower].stake;\\n        totalStakes = totalStakes.sub(stake);\\n        Troves[_borrower].stake = 0;\\n    }\\n\\n    function updateStakeAndTotalStakes(\\n        address _borrower\\n    ) external returns (uint) {\\n        _requireCallerIsBorrowerOperations();\\n        return _updateStakeAndTotalStakes(_borrower);\\n    }\\n\\n    // Update borrower's stake based on their latest collateral value\\n    function _updateStakeAndTotalStakes(\\n        address _borrower\\n    ) internal returns (uint) {\\n        uint newStake = _computeNewStake(Troves[_borrower].coll);\\n        uint oldStake = Troves[_borrower].stake;\\n        Troves[_borrower].stake = newStake;\\n\\n        totalStakes = totalStakes.sub(oldStake).add(newStake);\\n        emit TotalStakesUpdated(totalStakes);\\n\\n        return newStake;\\n    }\\n\\n    // Calculate a new stake based on the snapshots of the totalStakes and totalCollateral taken at the last liquidation\\n    function _computeNewStake(uint _coll) internal view returns (uint) {\\n        uint stake;\\n        if (totalCollateralSnapshot == 0) {\\n            stake = _coll;\\n        } else {\\n            /*\\n             * The following assert() holds true because:\\n             * - The system always contains >= 1 trove\\n             * - When we close or liquidate a trove, we redistribute the pending rewards, so if all troves were closed/liquidated,\\n             * rewards would\\u2019ve been emptied and totalCollateralSnapshot would be zero too.\\n             */\\n            assert(totalStakesSnapshot > 0);\\n            stake = _coll.mul(totalStakesSnapshot).div(totalCollateralSnapshot);\\n        }\\n        return stake;\\n    }\\n\\n    function _redistributeDebtAndColl(\\n        IActivePool _activePool,\\n        IDefaultPool _defaultPool,\\n        uint _debt,\\n        uint _coll\\n    ) internal {\\n        if (_debt == 0) {\\n            return;\\n        }\\n\\n        /*\\n         * Add distributed coll and debt rewards-per-unit-staked to the running totals. Division uses a \\\"feedback\\\"\\n         * error correction, to keep the cumulative error low in the running totals L_StETH and L_BaseFeeLMADebt:\\n         *\\n         * 1) Form numerators which compensate for the floor division errors that occurred the last time this\\n         * function was called.\\n         * 2) Calculate \\\"per-unit-staked\\\" ratios.\\n         * 3) Multiply each ratio back by its denominator, to reveal the current floor division error.\\n         * 4) Store these errors for use in the next correction when this function is called.\\n         * 5) Note: static analysis tools complain about this \\\"division before multiplication\\\", however, it is intended.\\n         */\\n        uint StETHNumerator = _coll.mul(DECIMAL_PRECISION).add(\\n            lastStETHError_Redistribution\\n        );\\n        uint BaseFeeLMADebtNumerator = _debt.mul(DECIMAL_PRECISION).add(\\n            lastBaseFeeLMADebtError_Redistribution\\n        );\\n\\n        // Get the per-unit-staked terms\\n        uint StETHRewardPerUnitStaked = StETHNumerator.div(totalStakes);\\n        uint BaseFeeLMADebtRewardPerUnitStaked = BaseFeeLMADebtNumerator.div(\\n            totalStakes\\n        );\\n\\n        lastStETHError_Redistribution = StETHNumerator.sub(\\n            StETHRewardPerUnitStaked.mul(totalStakes)\\n        );\\n        lastBaseFeeLMADebtError_Redistribution = BaseFeeLMADebtNumerator.sub(\\n            BaseFeeLMADebtRewardPerUnitStaked.mul(totalStakes)\\n        );\\n\\n        // Add per-unit-staked terms to the running totals\\n        L_StETH = L_StETH.add(StETHRewardPerUnitStaked);\\n        L_BaseFeeLMADebt = L_BaseFeeLMADebt.add(\\n            BaseFeeLMADebtRewardPerUnitStaked\\n        );\\n\\n        emit LTermsUpdated(L_StETH, L_BaseFeeLMADebt);\\n\\n        // Transfer coll and debt from ActivePool to DefaultPool\\n        _activePool.decreaseBaseFeeLMADebt(_debt);\\n        _defaultPool.increaseBaseFeeLMADebt(_debt);\\n        _activePool.sendStETH(address(_defaultPool), _coll);\\n    }\\n\\n    function closeTrove(address _borrower) external {\\n        _requireCallerIsBorrowerOperations();\\n        return _closeTrove(_borrower, Status.closedByOwner);\\n    }\\n\\n    function _closeTrove(address _borrower, Status closedStatus) internal {\\n        assert(\\n            closedStatus != Status.nonExistent && closedStatus != Status.active\\n        );\\n\\n        uint TroveOwnersArrayLength = TroveOwners.length;\\n        _requireMoreThanOneTroveInSystem(TroveOwnersArrayLength);\\n\\n        Troves[_borrower].status = closedStatus;\\n        Troves[_borrower].coll = 0;\\n        Troves[_borrower].debt = 0;\\n\\n        rewardSnapshots[_borrower].StETH = 0;\\n        rewardSnapshots[_borrower].BaseFeeLMADebt = 0;\\n\\n        _removeTroveOwner(_borrower, TroveOwnersArrayLength);\\n        sortedTroves.remove(_borrower);\\n    }\\n\\n    /*\\n     * Updates snapshots of system total stakes and total collateral, excluding a given collateral remainder from the calculation.\\n     * Used in a liquidation sequence.\\n     *\\n     * The calculation excludes a portion of collateral that is in the ActivePool:\\n     *\\n     * the total StETH gas compensation from the liquidation sequence\\n     *\\n     * The StETH as compensation must be excluded as it is always sent out at the very end of the liquidation sequence.\\n     */\\n    function _updateSystemSnapshots_excludeCollRemainder(\\n        IActivePool _activePool,\\n        uint _collRemainder\\n    ) internal {\\n        totalStakesSnapshot = totalStakes;\\n\\n        uint activeColl = _activePool.getStETH();\\n        uint liquidatedColl = defaultPool.getStETH();\\n        totalCollateralSnapshot = activeColl.sub(_collRemainder).add(\\n            liquidatedColl\\n        );\\n\\n        emit SystemSnapshotsUpdated(\\n            totalStakesSnapshot,\\n            totalCollateralSnapshot\\n        );\\n    }\\n\\n    // Push the owner's address to the Trove owners list, and record the corresponding array index on the Trove struct\\n    function addTroveOwnerToArray(\\n        address _borrower\\n    ) external returns (uint index) {\\n        _requireCallerIsBorrowerOperations();\\n        return _addTroveOwnerToArray(_borrower);\\n    }\\n\\n    function _addTroveOwnerToArray(\\n        address _borrower\\n    ) internal returns (uint128 index) {\\n        /* Max array size is 2**128 - 1, i.e. ~3e30 troves. No risk of overflow, since troves have minimum BaseFeeLMA\\n        debt of liquidation reserve plus MIN_NET_DEBT. 3e30 BaseFeeLMA dwarfs the value of all wealth in the world ( which is < 1e15 USD). */\\n\\n        // Push the Troveowner to the array\\n        TroveOwners.push(_borrower);\\n\\n        // Record the index of the new Troveowner on their Trove struct\\n        index = uint128(TroveOwners.length.sub(1));\\n        Troves[_borrower].arrayIndex = index;\\n\\n        return index;\\n    }\\n\\n    /*\\n     * Remove a Trove owner from the TroveOwners array, not preserving array order. Removing owner 'B' does the following:\\n     * [A B C D E] => [A E C D], and updates E's Trove struct to point to its new array index.\\n     */\\n    function _removeTroveOwner(\\n        address _borrower,\\n        uint TroveOwnersArrayLength\\n    ) internal {\\n        Status troveStatus = Troves[_borrower].status;\\n        // It\\u2019s set in caller function `_closeTrove`\\n        assert(\\n            troveStatus != Status.nonExistent && troveStatus != Status.active\\n        );\\n\\n        uint128 index = Troves[_borrower].arrayIndex;\\n        uint length = TroveOwnersArrayLength;\\n        uint idxLast = length.sub(1);\\n\\n        assert(index <= idxLast);\\n\\n        address addressToMove = TroveOwners[idxLast];\\n\\n        TroveOwners[index] = addressToMove;\\n        Troves[addressToMove].arrayIndex = index;\\n        emit TroveIndexUpdated(addressToMove, index);\\n\\n        TroveOwners.pop();\\n    }\\n\\n    // --- Recovery Mode and TCR functions ---\\n\\n    function getTCR(uint _price) external view returns (uint) {\\n        return _getTCR(_price);\\n    }\\n\\n    function getUnreliableTCR() external view returns (uint) {\\n        return _getTCR(priceFeed.lastGoodPrice());\\n    }\\n\\n    function checkRecoveryMode(uint _price) external view returns (bool) {\\n        return _checkRecoveryMode(_price);\\n    }\\n\\n    function checkUnreliableRecoveryMode() external view returns (bool) {\\n        return _checkRecoveryMode(priceFeed.lastGoodPrice());\\n    }\\n\\n    // Check whether or not the system *would be* in Recovery Mode, given an StETH:USD price, and the entire system coll and debt.\\n    function _checkPotentialRecoveryMode(\\n        uint _entireSystemColl,\\n        uint _entireSystemDebt,\\n        uint _price\\n    ) internal pure returns (bool) {\\n        uint TCR = LiquityMath._computeCR(\\n            _entireSystemColl,\\n            _entireSystemDebt,\\n            _price\\n        );\\n\\n        return TCR < CCR;\\n    }\\n\\n    // --- Redemption fee functions ---\\n\\n    /*\\n     * HEDGEHOG LOGIC UPDATES:\\n     * 1) Rename variable in docs (baseRate => redemptionBaseRate)\\n     * 2) decayedRemeptionBaseRate (decayedBaseRate) is now calculated by _calcDecayedRedemptionBaseRate();\\n     * 3) Updating RedemptionBaseRate state variable instead of baseRate\\n     * 4) Emiting RedemptionBaseRateUpdated instead of BaseRateUpdates();\\n     * 5) Now updates time only of redemeption operation instead of both redemption and borrow\\n     *\\n     * This function has two impacts on the redemptionBaseRate state variable:\\n     * 1) decays the redemptionBaseRate based on time passed since last redemption or BaseFeeLMA borrowing operation.\\n     * then,\\n     * 2) increases the redemptionBaseRate based on the amount redeemed, as a proportion of total supply\\n     */\\n    function _updateRedemptionBaseRateFromRedemption(\\n        uint _StETHDrawn,\\n        uint _price,\\n        uint _totalBaseFeeLMASupply\\n    ) internal returns (uint) {\\n        uint decayedRedemptionBaseRate = _calcDecayedRedemptionBaseRate();\\n        // Hedgehog updates: Now calculating what part of total collateral is getting withdrawn from the\\n        // system\\n        /* Convert the drawn StETH back to BaseFeeLMA at face value rate (1 BaseFeeLMA:1 USD), in order to get\\n         * the fraction of total supply that was redeemed at face value. */\\n        console.log(\\\"total coll: \\\", activePool.getStETH());\\n        uint redeemedBaseFeeLMAFraction = _StETHDrawn\\n            .mul(DECIMAL_PRECISION)\\n            .div(activePool.getStETH()); // TODO: Fix the error\\n\\n        // Hedgehog Updates: Remove division by BETA\\n        uint newBaseRate = decayedRedemptionBaseRate.add(\\n            redeemedBaseFeeLMAFraction\\n        );\\n        console.log(\\\"redeemed lma fraction\\\", redeemedBaseFeeLMAFraction);\\n        newBaseRate = LiquityMath._min(newBaseRate, DECIMAL_PRECISION); // cap baseRate at a maximum of 100%\\n        //assert(newBaseRate <= DECIMAL_PRECISION); // This is already enforced in the line above\\n        assert(newBaseRate > 0); // Base rate is always non-zero after redemption\\n\\n        // Update the baseRate state variable\\n        redemptionBaseRate = newBaseRate;\\n        emit RedemptionBaseRateUpdated(newBaseRate);\\n\\n        _updateLastRedemptionTime();\\n        return newBaseRate;\\n    }\\n\\n    /*\\n     * HEDGEHOG LOGIC UPDATES:\\n     * 1) Now passing redemptionBaseRate instead of combined baseRate\\n     */\\n    function getRedemptionRate(\\n        uint _redemptionColl\\n    ) public view returns (uint) {\\n        return _calcRedemptionRate(redemptionBaseRate, _redemptionColl);\\n    }\\n\\n    function getRedemptionRateWithDecay(\\n        uint _redemptionColl\\n    ) public view returns (uint) {\\n        return\\n            _calcRedemptionRate(\\n                _calcDecayedRedemptionBaseRate(),\\n                _redemptionColl\\n            );\\n    }\\n\\n    /*\\n     * HEDGEHOG UPDATES:\\n     * Redemption Rate formula now is: RedFloor + RedBaseRate*MinuteDecayFactorMinutes + RedemptionETH/TotalColl\\n     * 1) Rename param name (_baseRate => _redemptionBaseRate)\\n     * 2) Now redeemed collateral divided by total collateral in active pool is added to the sum of redemption floor and redeem base rate\\n     */\\n    function _calcRedemptionRate(\\n        uint _redemptionBaseRate,\\n        uint _redemptionColl\\n    ) internal view returns (uint) {\\n        console.log(\\\"Active Pool eth\\\", activePool.getStETH());\\n\\n        return\\n            LiquityMath._min(\\n                REDEMPTION_FEE_FLOOR.add(_redemptionBaseRate).add(\\n                    _redemptionColl.div(activePool.getStETH())\\n                ),\\n                DECIMAL_PRECISION // cap at a maximum of 100%\\n            );\\n    }\\n\\n    function _getRedemptionFee(uint _StETHDrawn) internal view returns (uint) {\\n        return _calcRedemptionFee(getRedemptionRate(_StETHDrawn), _StETHDrawn);\\n    }\\n\\n    function getRedemptionFeeWithDecay(\\n        uint _StETHDrawn\\n    ) external view returns (uint) {\\n        return\\n            _calcRedemptionFee(\\n                getRedemptionRateWithDecay(_StETHDrawn),\\n                _StETHDrawn\\n            );\\n    }\\n\\n    function _calcRedemptionFee(\\n        uint _redemptionRate,\\n        uint _StETHDrawn\\n    ) internal pure returns (uint) {\\n        uint redemptionFee = _redemptionRate.mul(_StETHDrawn).div(\\n            DECIMAL_PRECISION\\n        );\\n        require(\\n            redemptionFee < _StETHDrawn,\\n            \\\"TroveManager: Fee would eat up all returned collateral\\\"\\n        );\\n        return redemptionFee;\\n    }\\n\\n    // --- Borrowing fee functions ---\\n\\n    /*\\n     * HEDGEHOG LOGIC UPDATES:\\n     * 1) Now passing borrowBaseRate instead of combined baseRate\\n     */\\n    function getBorrowingRate(\\n        uint _issuedBaseFeeLMA\\n    ) public view returns (uint) {\\n        return _calcBorrowingRate(borrowBaseRate, _issuedBaseFeeLMA);\\n    }\\n\\n    /*\\n     * HEDGEHOG LOGIC UPDATES:\\n     * 1) Now passing _calcDecayedBorrowBaseRate instead of _calcDecayedBaseRate function to calculate the decayed borrowBaseRate\\n     */\\n    function getBorrowingRateWithDecay(\\n        uint _issuedBaseFeeLMA\\n    ) public view returns (uint) {\\n        return\\n            _calcBorrowingRate(\\n                _calcDecayedRedemptionBaseRate(),\\n                _issuedBaseFeeLMA\\n            );\\n    }\\n\\n    /*\\n     * HEDGEHOG UPDATES:\\n     * Now full dynamic fees formula is as follows: RedRate = RedFloor + RedBaseRate*MinuteDecayFactorMinutes + RedemptionETH / Total Collateral in the system\\n     * 1) Rename param name (_baseRate => _borrowBaseRate)\\n     * 2) Now adding issued asset divided by total supply of the asset to the sum of borrow flor and borrow decayed baseRate\\n     */\\n    function _calcBorrowingRate(\\n        uint _borrowBaseRate,\\n        uint _issuedBaseFeeLMA\\n    ) internal view returns (uint) {\\n        uint256 supply = baseFeeLMAToken.totalSupply();\\n        // Checking if there are tokens in supply, otherwise return 1 to avoid division by zero\\n        if (supply == 0) {\\n            return BORROWING_FEE_FLOOR;\\n        }\\n\\n        return\\n            LiquityMath._min(\\n                BORROWING_FEE_FLOOR.add(_borrowBaseRate).add(\\n                    _issuedBaseFeeLMA.mul(DECIMAL_PRECISION).div(supply)\\n                ),\\n                MAX_BORROWING_FEE\\n            );\\n    }\\n\\n    function getBorrowingFee(\\n        uint _BaseFeeLMADebt // TODO: Double check that it's only newly issues tokens and not the full debt\\n    ) external view returns (uint, uint) {\\n        uint baseRate = getBorrowingRate(_BaseFeeLMADebt);\\n        return (_calcBorrowingFee(baseRate, _BaseFeeLMADebt), baseRate);\\n    }\\n\\n    function getBorrowingFeeWithDecay(\\n        uint _BaseFeeLMADebt\\n    ) external view returns (uint) {\\n        return\\n            _calcBorrowingFee(\\n                getBorrowingRateWithDecay(_BaseFeeLMADebt),\\n                _BaseFeeLMADebt\\n            );\\n    }\\n\\n    /**\\n     * HEDGEHOG UPDATES:\\n     * TODO: _BaseFeeLMADebt.div(baseFeeLMAToken.totalSupply()) is going to return 0, so have to adjust such calculations\\n     */\\n    function _calcBorrowingFee(\\n        uint _borrowingRate,\\n        uint _BaseFeeLMADebt // TODO: Check that it's not total but newly issues tokens\\n    ) internal pure returns (uint) {\\n        return _borrowingRate.mul(_BaseFeeLMADebt).div(DECIMAL_PRECISION);\\n    }\\n\\n    function updateBaseRateFromBorrowing(uint _newBaseRate) external {\\n        require(\\n            msg.sender == borrowerOperationsAddress,\\n            \\\"TroveManager: Only Borrower operations may call\\\"\\n        );\\n        if (_newBaseRate >= BORROWING_FEE_FLOOR) {\\n            borrowBaseRate = _newBaseRate - BORROWING_FEE_FLOOR;\\n        } else {\\n            borrowBaseRate = 0;\\n        }\\n\\n        emit BorrowBaseRateUpdated(_newBaseRate);\\n    }\\n\\n    /*\\n     * HEDGEHOG LOGIC UPDATES:\\n     * 1) Now updates borrowBaseRate instead of baseRate used by both redemption and minting functions\\n     * 2) Emit BorrowBaseRateUpdated instead of BaseRateUpdated\\n     * 3) Now updates time only of borrow operation instead of both redemption and borrow\\n     * 4) Update doc variable name baseRate => borrowBaseRate\\n     */\\n    // Updates the borrowBaseRate state variable based on time elapsed since the last redemption or BaseFeeLMA borrowing operation.\\n    function decayBaseRateFromBorrowing() external {\\n        _requireCallerIsBorrowerOperations();\\n        console.log(\\\"BASE RATE BEFORE DECAY: \\\", borrowBaseRate);\\n        uint decayedBaseRate = _calcDecayedBorrowBaseRate();\\n        assert(decayedBaseRate <= DECIMAL_PRECISION); // The baseRate can decay to 0\\n        // HEDGEHOG LOGIC CHANGES: Updating borrowing base rate instead\\n        borrowBaseRate = decayedBaseRate;\\n        console.log(\\\"BASE RATE AFTER DECAY: \\\", borrowBaseRate);\\n\\n        emit BorrowBaseRateUpdated(decayedBaseRate);\\n\\n        _updateLastBorrowTime();\\n    }\\n\\n    // --- Internal fee functions ---\\n\\n    /*\\n     * HEDGEHOG LOGIC UPDATES:\\n     * removed _updateLastFeeOpTime\\n     * New function _updateLastRedemptionTime simmilar to _updateLastFeeOpTime, that sets lastRedemptionTime and emits respective event.\\n     */\\n    // Update the last fee operation time only if time passed >= decay interval. This prevents base rate griefing.\\n    function _updateLastRedemptionTime() internal {\\n        uint timePassed = block.timestamp.sub(lastRedemptionTime);\\n\\n        if (timePassed >= SECONDS_IN_ONE_MINUTE) {\\n            lastRedemptionTime = block.timestamp;\\n            emit LastRedemptionTimeUpdated(block.timestamp);\\n        }\\n    }\\n\\n    /*\\n     * HEDGEHOG LOGIC UPDATES:\\n     * removed _updateLastFeeOpTime\\n     * New function _updateLastBorrowTime simmilar to _updateLastFeeOpTime, that sets lastBorrowTime and emits respective event.\\n     */\\n    // Update the last fee operation time only if time passed >= decay interval. This prevents base rate griefing.\\n    function _updateLastBorrowTime() internal {\\n        uint timePassed = block.timestamp.sub(lastBorrowTime);\\n\\n        if (timePassed >= SECONDS_IN_ONE_MINUTE) {\\n            lastBorrowTime = block.timestamp;\\n            emit LastBorrowTimeUpdated(block.timestamp);\\n        }\\n    }\\n\\n    /*\\n     * HEDGEHOG LOGIC UPDATES:\\n     * New function simmilar to _calcDecayedBaseRate. However used particularly for redemptionBaseRate calculation\\n     */\\n    function _calcDecayedRedemptionBaseRate() internal view returns (uint) {\\n        uint minutesPassed = _minutesPassedSinceLastRedemption();\\n\\n        uint decayFactor = LiquityMath._decPow(\\n            MINUTE_DECAY_REDEMPTION_FACTOR,\\n            minutesPassed\\n        );\\n\\n        return redemptionBaseRate.mul(decayFactor).div(DECIMAL_PRECISION);\\n    }\\n\\n    /*\\n     * HEDGEHOG LOGIC UPDATES:\\n     * New function simmilar to _calcDecayedBaseRate. However used particularly for borrowBaseRate calculation\\n     */\\n    function _calcDecayedBorrowBaseRate() internal view returns (uint) {\\n        uint minutesPassed = _minutesPassedSinceLastBorrow();\\n        uint decayFactor = LiquityMath._decPow(\\n            MINUTE_DECAY_BORROWING_FACTOR,\\n            minutesPassed\\n        );\\n\\n        console.log(\\\"minutes passed: \\\", minutesPassed);\\n        return borrowBaseRate.mul(decayFactor).div(DECIMAL_PRECISION);\\n    }\\n\\n    /*\\n     * HEDGEHOG LOGIC UPDATES:\\n     * removed _minutesPassedSinceLastFeeOp\\n     * New function _minutesPassedSinceLastRedemption simmilar to _minutesPassedSinceLastFeeOp, that returns amount of minutes since last registered redemption\\n     */\\n    function _minutesPassedSinceLastRedemption() internal view returns (uint) {\\n        return\\n            (block.timestamp.sub(lastRedemptionTime)).div(\\n                SECONDS_IN_ONE_MINUTE\\n            );\\n    }\\n\\n    /*\\n     * HEDGEHOG LOGIC UPDATES:\\n     * removed _minutesPassedSinceLastFeeOp\\n     * New function _minutesPassedSinceLastBorrow simmilar to _minutesPassedSinceLastFeeOp, that returns amount of minutes since last registered borrow\\n     */\\n    function _minutesPassedSinceLastBorrow() internal view returns (uint) {\\n        return (block.timestamp.sub(lastBorrowTime)).div(SECONDS_IN_ONE_MINUTE);\\n    }\\n\\n    // --- 'require' wrapper functions ---\\n\\n    function _requireCallerIsBorrowerOperations() internal view {\\n        require(\\n            msg.sender == borrowerOperationsAddress,\\n            \\\"TroveManager: Caller is not the BorrowerOperations contract\\\"\\n        );\\n    }\\n\\n    function _requireTroveIsActive(address _borrower) internal view {\\n        require(\\n            Troves[_borrower].status == Status.active,\\n            \\\"TroveManager: Trove does not exist or is closed\\\"\\n        );\\n    }\\n\\n    function _requireBaseFeeLMABalanceCoversRedemption(\\n        IBaseFeeLMAToken _baseFeeLMAToken,\\n        address _redeemer,\\n        uint _amount\\n    ) internal view {\\n        require(\\n            _baseFeeLMAToken.balanceOf(_redeemer) >= _amount,\\n            \\\"TroveManager: Requested redemption amount must be <= user's BaseFeeLMA token balance\\\"\\n        );\\n    }\\n\\n    function _requireMoreThanOneTroveInSystem(\\n        uint TroveOwnersArrayLength\\n    ) internal view {\\n        require(\\n            TroveOwnersArrayLength > 1 && sortedTroves.getSize() > 1,\\n            \\\"TroveManager: Only one trove in the system\\\"\\n        );\\n    }\\n\\n    function _requireAmountGreaterThanZero(uint _amount) internal pure {\\n        require(_amount > 0, \\\"TroveManager: Amount must be greater than zero\\\");\\n    }\\n\\n    function _requireTCRoverMCR(uint _price) internal view {\\n        require(\\n            _getTCR(_price) >= MCR,\\n            \\\"TroveManager: Cannot redeem when TCR < MCR\\\"\\n        );\\n    }\\n\\n    function _requireAfterBootstrapPeriod() internal view {\\n        uint systemDeploymentTime = hogToken.getDeploymentStartTime();\\n        require(\\n            block.timestamp >= systemDeploymentTime.add(BOOTSTRAP_PERIOD),\\n            \\\"TroveManager: Redemptions are not allowed during bootstrap phase\\\"\\n        );\\n    }\\n\\n    function _requireValidMaxFeePercentage(\\n        uint _maxFeePercentage\\n    ) internal pure {\\n        require(\\n            _maxFeePercentage >= REDEMPTION_FEE_FLOOR &&\\n                _maxFeePercentage <= DECIMAL_PRECISION,\\n            \\\"Max fee percentage must be between 0.5% and 100%\\\"\\n        );\\n    }\\n\\n    // --- Trove property getters ---\\n\\n    function getTroveStatus(address _borrower) external view returns (uint) {\\n        return uint(Troves[_borrower].status);\\n    }\\n\\n    function getTroveStake(address _borrower) external view returns (uint) {\\n        return Troves[_borrower].stake;\\n    }\\n\\n    function getTroveDebt(address _borrower) external view returns (uint) {\\n        return Troves[_borrower].debt;\\n    }\\n\\n    function getTroveColl(address _borrower) external view returns (uint) {\\n        return Troves[_borrower].coll;\\n    }\\n\\n    // --- Trove property setters, called by BorrowerOperations ---\\n\\n    function setTroveStatus(address _borrower, uint _num) external {\\n        _requireCallerIsBorrowerOperations();\\n        Troves[_borrower].status = Status(_num);\\n    }\\n\\n    function increaseTroveColl(\\n        address _borrower,\\n        uint _collIncrease\\n    ) external returns (uint) {\\n        _requireCallerIsBorrowerOperations();\\n        uint newColl = Troves[_borrower].coll.add(_collIncrease);\\n        Troves[_borrower].coll = newColl;\\n        return newColl;\\n    }\\n\\n    function decreaseTroveColl(\\n        address _borrower,\\n        uint _collDecrease\\n    ) external returns (uint) {\\n        _requireCallerIsBorrowerOperations();\\n        uint newColl = Troves[_borrower].coll.sub(_collDecrease);\\n        Troves[_borrower].coll = newColl;\\n        return newColl;\\n    }\\n\\n    function increaseTroveDebt(\\n        address _borrower,\\n        uint _debtIncrease\\n    ) external returns (uint) {\\n        _requireCallerIsBorrowerOperations();\\n        uint newDebt = Troves[_borrower].debt.add(_debtIncrease);\\n        Troves[_borrower].debt = newDebt;\\n        return newDebt;\\n    }\\n\\n    function decreaseTroveDebt(\\n        address _borrower,\\n        uint _debtDecrease\\n    ) external returns (uint) {\\n        _requireCallerIsBorrowerOperations();\\n        uint newDebt = Troves[_borrower].debt.sub(_debtDecrease);\\n        Troves[_borrower].debt = newDebt;\\n        return newDebt;\\n    }\\n\\n    function getNormalLiquidationPrice(\\n        uint256 _coll,\\n        uint256 _debt\\n    ) external pure returns (uint256) {\\n        uint256 price = LiquityMath._findPriceBelowMCR(\\n            _coll,\\n            _debt,\\n            20,\\n            HedgehogBase.MCR\\n        );\\n        return price;\\n    }\\n\\n    function getRecoveryLiquidationPrice(\\n        uint256 _coll,\\n        uint256 _debt\\n    ) external pure returns (uint256) {\\n        uint256 price = LiquityMath._findPriceBelowMCR(\\n            _coll,\\n            _debt,\\n            20,\\n            HedgehogBase._100pct\\n        );\\n        return price;\\n    }\\n}\\n\",\"keccak256\":\"0x7f5f8cf0f9871f7de3cf887aec839504bcf35410d13a60c435c712b86b751a85\",\"license\":\"MIT\"},\"contracts/dependencies/BaseMath.sol\":{\"content\":\"// SPDX-License-Identifier: MIT\\npragma solidity 0.8.19;\\n\\ncontract BaseMath {\\n    uint public constant DECIMAL_PRECISION = 1e18;\\n}\\n\",\"keccak256\":\"0x5338502be04e32035bbf0310600c8724281edc81b312f5d89c683b23d0bb3fa7\",\"license\":\"MIT\"},\"contracts/dependencies/CheckContract.sol\":{\"content\":\"// SPDX-License-Identifier: MIT\\n\\npragma solidity 0.8.19;\\n\\ncontract CheckContract {\\n    /**\\n     * Check that the account is an already deployed non-destroyed contract.\\n     * See: https://github.com/OpenZeppelin/openzeppelin-contracts/blob/master/contracts/utils/Address.sol#L12\\n     */\\n    function checkContract(address _account) internal view {\\n        require(_account != address(0), \\\"Account cannot be zero address\\\");\\n\\n        uint256 size;\\n        // solhint-disable-next-line no-inline-assembly\\n        assembly {\\n            size := extcodesize(_account)\\n        }\\n        require(size > 0, \\\"Account code size cannot be zero\\\");\\n    }\\n}\\n\",\"keccak256\":\"0x4860bce12806bb81c1e91ec617f2f95dd1774148b15645eaca94a67220096f2f\",\"license\":\"MIT\"},\"contracts/dependencies/HedgehogBase.sol\":{\"content\":\"// SPDX-License-Identifier: MIT\\n\\npragma solidity 0.8.19;\\n\\nimport \\\"./BaseMath.sol\\\";\\nimport \\\"./LiquityMath.sol\\\";\\nimport \\\"../interfaces/IActivePool.sol\\\";\\nimport \\\"../interfaces/IDefaultPool.sol\\\";\\nimport \\\"../interfaces/IPriceFeed.sol\\\";\\nimport \\\"../interfaces/IHedgehogBase.sol\\\";\\n\\n/**\\n * @notice Fork of LiquityMath with an upgraded pragma and:\\n * [ - Get OZ contracts from a package\\n * TODO: List changes to HedgehogBase File and variables ]\\n * Base contract for TroveManager, BorrowerOperations and StabilityPool. Contains global system constants and\\n * common functions.\\n */\\ncontract HedgehogBase is BaseMath, IHedgehogBase {\\n    using SafeMath for uint;\\n\\n    uint public constant _100pct = 1000000000000000000; // 1e18 == 100%\\n\\n    // Minimum collateral ratio for individual troves\\n    uint public constant MCR = 1500000000000000000; // 150%\\n\\n    // Critical system collateral ratio. If the system's total collateral ratio (TCR) falls below the CCR, Recovery Mode is triggered.\\n    uint public constant CCR = 1500000000000000000; // 150%\\n\\n    // Amount of BaseFeeLMA to be locked in gas pool on opening troves\\n    uint public constant BaseFeeLMA_GAS_COMPENSATION = 50000;\\n\\n    // Minimum amount of net BaseFeeLMA debt a trove must have\\n    uint public constant MIN_NET_DEBT = 1; // TODO: Update that value\\n    // uint constant public MIN_NET_DEBT = 0;\\n\\n    uint public constant PERCENT_DIVISOR = 200; // dividing by 200 yields 0.5%\\n\\n    uint public constant BORROWING_FEE_FLOOR = (DECIMAL_PRECISION / 1000) * 5; // 0.5%\\n\\n    IActivePool public activePool;\\n\\n    IDefaultPool public defaultPool;\\n\\n    IPriceFeed public override priceFeed;\\n\\n    // --- Gas compensation functions ---\\n\\n    // Returns the composite debt (drawn debt + gas compensation) of a trove, for the purpose of ICR calculation\\n    function _getCompositeDebt(uint _debt) internal pure returns (uint) {\\n        return _debt.add(BaseFeeLMA_GAS_COMPENSATION);\\n    }\\n\\n    function _getNetDebt(uint _debt) internal pure returns (uint) {\\n        return _debt.sub(BaseFeeLMA_GAS_COMPENSATION);\\n    }\\n\\n    // Return the amount of StETH to be drawn from a trove's collateral and sent as gas compensation.\\n    function _getCollGasCompensation(\\n        uint _entireColl\\n    ) internal pure returns (uint) {\\n        return _entireColl / PERCENT_DIVISOR;\\n    }\\n\\n    function getEntireSystemColl() public view returns (uint entireSystemColl) {\\n        uint activeColl = activePool.getStETH();\\n        uint liquidatedColl = defaultPool.getStETH();\\n\\n        return activeColl.add(liquidatedColl);\\n    }\\n\\n    function getEntireSystemDebt() public view returns (uint entireSystemDebt) {\\n        uint activeDebt = activePool.getBaseFeeLMADebt();\\n        uint closedDebt = defaultPool.getBaseFeeLMADebt();\\n\\n        return activeDebt.add(closedDebt);\\n    }\\n\\n    function _getTCR(uint _price) internal view returns (uint TCR) {\\n        uint entireSystemColl = getEntireSystemColl();\\n        uint entireSystemDebt = getEntireSystemDebt();\\n\\n        TCR = LiquityMath._computeCR(\\n            entireSystemColl,\\n            entireSystemDebt,\\n            _price\\n        );\\n\\n        return TCR;\\n    }\\n\\n    function _checkRecoveryMode(uint _price) internal view returns (bool) {\\n        uint TCR = _getTCR(_price);\\n\\n        return TCR < CCR;\\n    }\\n\\n    function _requireUserAcceptsFee(\\n        uint _fee,\\n        uint _amount,\\n        uint _maxFeePercentage\\n    ) internal pure {\\n        uint feePercentage = _fee.mul(DECIMAL_PRECISION).div(_amount);\\n        require(\\n            feePercentage <= _maxFeePercentage,\\n            \\\"Fee exceeded provided maximum\\\"\\n        );\\n    }\\n}\\n\",\"keccak256\":\"0x373f3553e8478dcf863a67b71f0d09b096eca1a6700dff94d86c6c0253fbd787\",\"license\":\"MIT\"},\"contracts/dependencies/IERC2612.sol\":{\"content\":\"// SPDX-License-Identifier: MIT\\n\\npragma solidity 0.8.19;\\n\\n/**\\n * @dev Interface of the ERC2612 standard as defined in the EIP.\\n *\\n * Adds the {permit} method, which can be used to change one's\\n * {IERC20-allowance} without having to send a transaction, by signing a\\n * message. This allows users to spend tokens without having to hold StETH.\\n *\\n * See https://eips.stETHeum.org/EIPS/eip-2612.\\n *\\n * Code adapted from https://github.com/OpenZeppelin/openzeppelin-contracts/pull/2237/\\n */\\ninterface IERC2612 {\\n    /**\\n     * @dev Sets `amount` as the allowance of `spender` over `owner`'s tokens,\\n     * given `owner`'s signed approval.\\n     *\\n     * IMPORTANT: The same issues {IERC20-approve} has related to transaction\\n     * ordering also apply here.\\n     *\\n     * Emits an {Approval} event.\\n     *\\n     * Requirements:\\n     *\\n     * - `owner` cannot be the zero address.\\n     * - `spender` cannot be the zero address.\\n     * - `deadline` must be a timestamp in the future.\\n     * - `v`, `r` and `s` must be a valid `secp256k1` signature from `owner`\\n     * over the EIP712-formatted function arguments.\\n     * - the signature must use ``owner``'s current nonce (see {nonces}).\\n     *\\n     * For more information on the signature format, see the\\n     * https://eips.stETHeum.org/EIPS/eip-2612#specification[relevant EIP\\n     * section].\\n     */\\n    function permit(\\n        address owner,\\n        address spender,\\n        uint256 amount,\\n        uint256 deadline,\\n        uint8 v,\\n        bytes32 r,\\n        bytes32 s\\n    ) external;\\n\\n    /**\\n     * @dev Returns the current ERC2612 nonce for `owner`. This value must be\\n     * included whenever a signature is generated for {permit}.\\n     *\\n     * Every successful call to {permit} increases `owner`'s nonce by one. This\\n     * prevents a signature from being used multiple times.\\n     *\\n     * `owner` can limit the time a Permit is valid for by setting `deadline` to\\n     * a value in the near future. The deadline argument can be set to uint(-1) to\\n     * create Permits that effectively never expire.\\n     */\\n    function nonces(address owner) external view returns (uint256);\\n\\n    function version() external view returns (string memory);\\n\\n    function permitTypeHash() external view returns (bytes32);\\n\\n    function domainSeparator() external view returns (bytes32);\\n}\\n\",\"keccak256\":\"0xd862d70e8c9d8f912e73151567a70f47f3a7e52c9ec766ccc4e02f87bd0d32b9\",\"license\":\"MIT\"},\"contracts/dependencies/LiquityMath.sol\":{\"content\":\"// SPDX-License-Identifier: MIT\\n\\npragma solidity 0.8.19;\\n\\nimport \\\"@openzeppelin/contracts/utils/math/SafeMath.sol\\\";\\nimport \\\"hardhat/console.sol\\\";\\n\\n/**\\n * @notice A fork of Liquity Math library with an upgraded pragma\\n *\\n * Even though SafeMath is no longer required, the decision was made to keep it to avoid human factor errors\\n */\\n\\nlibrary LiquityMath {\\n    using SafeMath for uint;\\n\\n    uint internal constant DECIMAL_PRECISION = 1e18;\\n\\n    /* Precision for Nominal ICR (independent of price). Rationale for the value:\\n     *\\n     * - Making it \\u201ctoo high\\u201d could lead to overflows.\\n     * - Making it \\u201ctoo low\\u201d could lead to an ICR equal to zero, due to truncation from Solidity floor division.\\n     *\\n     * This value of 1e20 is chosen for safety: the NICR will only overflow for numerator > ~1e39 StETH,\\n     * and will only truncate to 0 if the denominator is at least 1e20 times greater than the numerator.\\n     *\\n     */\\n    uint internal constant NICR_PRECISION = 1e20;\\n\\n    function _min(uint _a, uint _b) internal pure returns (uint) {\\n        return (_a < _b) ? _a : _b;\\n    }\\n\\n    function _max(uint _a, uint _b) internal pure returns (uint) {\\n        return (_a >= _b) ? _a : _b;\\n    }\\n\\n    /*\\n     * Multiply two decimal numbers and use normal rounding rules:\\n     * -round product up if 19'th mantissa digit >= 5\\n     * -round product down if 19'th mantissa digit < 5\\n     *\\n     * Used only inside the exponentiation, _decPow().\\n     */\\n    function decMul(uint x, uint y) internal pure returns (uint decProd) {\\n        uint prod_xy = x.mul(y);\\n\\n        decProd = prod_xy.add(DECIMAL_PRECISION / 2).div(DECIMAL_PRECISION);\\n    }\\n\\n    /*\\n     * _decPow: Exponentiation function for 18-digit decimal base, and integer exponent n.\\n     *\\n     * Uses the efficient \\\"exponentiation by squaring\\\" algorithm. O(log(n)) complexity.\\n     *\\n     * Called by two functions that represent time in units of minutes:\\n     * 1) TroveManager._calcDecayedBaseRate\\n     * 2) CommunityIssuance._getCumulativeIssuanceFraction\\n     *\\n     * The exponent is capped to avoid reverting due to overflow. The cap 525600000 equals\\n     * \\\"minutes in 1000 years\\\": 60 * 24 * 365 * 1000\\n     *\\n     * If a period of > 1000 years is ever used as an exponent in either of the above functions, the result will be\\n     * negligibly different from just passing the cap, since:\\n     *\\n     * In function 1), the decayed base rate will be 0 for 1000 years or > 1000 years\\n     * In function 2), the difference in tokens issued at 1000 years and any time > 1000 years, will be negligible\\n     */\\n    function _decPow(uint _base, uint _minutes) internal pure returns (uint) {\\n        if (_minutes > 525600000) {\\n            _minutes = 525600000;\\n        } // cap to avoid overflow\\n\\n        if (_minutes == 0) {\\n            return DECIMAL_PRECISION;\\n        }\\n\\n        uint y = DECIMAL_PRECISION;\\n        uint x = _base;\\n        uint n = _minutes;\\n\\n        // Exponentiation-by-squaring\\n        while (n > 1) {\\n            if (n % 2 == 0) {\\n                x = decMul(x, x);\\n                n = n.div(2);\\n            } else {\\n                // if (n % 2 != 0)\\n                y = decMul(x, y);\\n                x = decMul(x, x);\\n                n = (n.sub(1)).div(2);\\n            }\\n        }\\n\\n        return decMul(x, y);\\n    }\\n\\n    function _getAbsoluteDifference(\\n        uint _a,\\n        uint _b\\n    ) internal pure returns (uint) {\\n        return (_a >= _b) ? _a.sub(_b) : _b.sub(_a);\\n    }\\n\\n    function _computeNominalCR(\\n        uint _coll,\\n        uint _debt\\n    ) internal pure returns (uint) {\\n        if (_debt > 0) {\\n            return _coll.mul(NICR_PRECISION).div(_debt);\\n        }\\n        // Return the maximal value for uint256 if the Trove has a debt of 0. Represents \\\"infinite\\\" CR.\\n        else {\\n            // if (_debt == 0)\\n            return 2 ** 256 - 1;\\n        }\\n    }\\n\\n    /**\\n     * HEDGEHOG UPDATES:\\n     * Change coll ration calculation from [coll] * [price] / [debt] to\\n     * [coll] / [debt] / [gasPrice]\\n     */\\n    function _computeCR(\\n        uint _coll,\\n        uint _debt,\\n        uint _price\\n    ) internal pure returns (uint) {\\n        if (_debt > 0) {\\n            // TODO: Check precision\\n            uint newCollRatio = _coll.mul(DECIMAL_PRECISION).div(_debt).div(\\n                _price\\n            );\\n            console.log(_coll);\\n            console.log(_debt);\\n            console.log(newCollRatio);\\n            return newCollRatio;\\n        }\\n        // Return the maximal value for uint256 if the Trove has a debt of 0. Represents \\\"infinite\\\" CR.\\n        else {\\n            // if (_debt == 0)\\n            return 2 ** 256 - 1;\\n        }\\n    }\\n\\n    function _findPriceBelowMCR(\\n        uint256 _coll,\\n        uint256 _debt,\\n        uint256 _startPrice,\\n        uint _mcr\\n    ) internal pure returns (uint256) {\\n        uint256 step = 1; // Starting with the smallest step size\\n        uint256 GWEI = 10 ** 9;\\n        uint256 previousPrice = _startPrice * GWEI; // To track previous iteration's price\\n\\n        for (\\n            uint256 price = _startPrice * GWEI;\\n            price <= 750 * GWEI;\\n            price += step\\n        ) {\\n            uint256 cr = _computeCR(_coll, _debt, price);\\n\\n            if (cr < _mcr) {\\n                // Start decreasing the price to find the exact threshold\\n                for (\\n                    uint256 decreasedPrice = previousPrice;\\n                    decreasedPrice <= price &&\\n                        decreasedPrice >= _startPrice * GWEI; // Added protection against underflow\\n                    decreasedPrice -= GWEI\\n                ) {\\n                    if (_computeCR(_coll, _debt, decreasedPrice) < _mcr) {\\n                        return decreasedPrice;\\n                    }\\n                }\\n            }\\n\\n            // Dynamically adjust step size\\n            if (cr < (_mcr - 200000000000000000)) {\\n                step = 20 * GWEI; // Increase step size if CR is much lower than MCR\\n            } else if (cr > (_mcr + 50000000000000000)) {\\n                step = GWEI; // Decrease step size if CR is much higher than MCR\\n            }\\n\\n            previousPrice = price; // Update previous price for the next iteration\\n        }\\n\\n        return 0; // return 0 if no price was found that brings the CR below MCR\\n    }\\n}\\n\",\"keccak256\":\"0x6b3f2d4905b380d7366402e4b7c5bad45026a5b080cbc835b481077ad3a458e5\",\"license\":\"MIT\"},\"contracts/interfaces/IActivePool.sol\":{\"content\":\"// SPDX-License-Identifier: MIT\\n\\npragma solidity 0.8.19;\\n\\nimport \\\"./IPool.sol\\\";\\n\\ninterface IActivePool is IPool {\\n    // --- Events ---\\n    event BorrowerOperationsAddressChanged(\\n        address _newBorrowerOperationsAddress\\n    );\\n    event TroveManagerAddressChanged(address _newTroveManagerAddress);\\n    event ActivePoolBaseFeeLMADebtUpdated(uint _BaseFeeLMADebt);\\n    event ActivePoolStETHBalanceUpdated(uint _StETH);\\n\\n    // --- Functions ---\\n    function sendStETH(address _account, uint _amount) external;\\n\\n    function getStETH() external view returns (uint256);\\n\\n    function increaseBalance(uint256 _amount) external;\\n}\\n\",\"keccak256\":\"0x2750510caa258ed427582dcbc994400b837c5ddd0974c7a122c8265a37672d5a\",\"license\":\"MIT\"},\"contracts/interfaces/IBaseFeeLMAToken.sol\":{\"content\":\"// SPDX-License-Identifier: MIT\\n\\npragma solidity 0.8.19;\\n\\nimport \\\"@openzeppelin/contracts/token/ERC20/IERC20.sol\\\";\\nimport \\\"../dependencies/IERC2612.sol\\\";\\n\\ninterface IBaseFeeLMAToken is IERC20, IERC2612 {\\n    // --- Events ---\\n\\n    event TroveManagerAddressChanged(address _troveManagerAddress);\\n    event StabilityPoolAddressChanged(address _newStabilityPoolAddress);\\n    event BorrowerOperationsAddressChanged(\\n        address _newBorrowerOperationsAddress\\n    );\\n\\n    event BaseFeeLMATokenBalanceUpdated(address _user, uint _amount);\\n\\n    // --- Functions ---\\n\\n    function mint(address _account, uint256 _amount) external;\\n\\n    function burn(address _account, uint256 _amount) external;\\n\\n    function sendToPool(\\n        address _sender,\\n        address poolAddress,\\n        uint256 _amount\\n    ) external;\\n\\n    function returnFromPool(\\n        address poolAddress,\\n        address user,\\n        uint256 _amount\\n    ) external;\\n\\n    function totalSupply() external view returns (uint256);\\n}\\n\",\"keccak256\":\"0x4f46da70de4bab049b8e24afec10e5308ab86fbbfb77f2314c1607ff8e77a4d2\",\"license\":\"MIT\"},\"contracts/interfaces/ICollSurplusPool.sol\":{\"content\":\"// SPDX-License-Identifier: MIT\\n\\npragma solidity 0.8.19;\\n\\ninterface ICollSurplusPool {\\n    // --- Events ---\\n\\n    event BorrowerOperationsAddressChanged(\\n        address _newBorrowerOperationsAddress\\n    );\\n    event TroveManagerAddressChanged(address _newTroveManagerAddress);\\n    event ActivePoolAddressChanged(address _newActivePoolAddress);\\n\\n    event CollBalanceUpdated(address indexed _account, uint _newBalance);\\n    event StETHSent(address _to, uint _amount);\\n\\n    // --- Contract setters ---\\n\\n    function setAddresses(\\n        address _borrowerOperationsAddress,\\n        address _troveManagerAddress,\\n        address _activePoolAddress\\n    ) external;\\n\\n    function getStETH() external view returns (uint);\\n\\n    function getCollateral(address _account) external view returns (uint);\\n\\n    function accountSurplus(address _account, uint _amount) external;\\n\\n    function claimColl(address _account) external;\\n}\\n\",\"keccak256\":\"0x9251089c900a0871d73a021fc7e16239cbcc9702a0875ae916c748ba636be09e\",\"license\":\"MIT\"},\"contracts/interfaces/IDefaultPool.sol\":{\"content\":\"// SPDX-License-Identifier: MIT\\n\\npragma solidity 0.8.19;\\n\\nimport \\\"./IPool.sol\\\";\\n\\ninterface IDefaultPool is IPool {\\n    // --- Events ---\\n    event TroveManagerAddressChanged(address _newTroveManagerAddress);\\n    event DefaultPoolBaseFeeLMADebtUpdated(uint _BaseFeeLMADebt);\\n    event DefaultPoolStETHBalanceUpdated(uint _StETH);\\n\\n    // --- Functions ---\\n    function sendStETHToActivePool(uint _amount) external;\\n}\\n\",\"keccak256\":\"0x978b1d254b1ef5473bad5530d42a8786083044682b3a3f99df87a4b48a90e42b\",\"license\":\"MIT\"},\"contracts/interfaces/IHOGStaking.sol\":{\"content\":\"// SPDX-License-Identifier: MIT\\n\\npragma solidity 0.8.19;\\n\\ninterface IHOGStaking {\\n    // --- Events --\\n\\n    event HOGTokenAddressSet(address _hogTokenAddress);\\n    event BaseFeeLMATokenAddressSet(address _baseFeeLMATokenAddress);\\n    event TroveManagerAddressSet(address _troveManager);\\n    event BorrowerOperationsAddressSet(address _borrowerOperationsAddress);\\n    event ActivePoolAddressSet(address _activePoolAddress);\\n\\n    event StakeChanged(address indexed staker, uint newStake);\\n    event StakingGainsWithdrawn(\\n        address indexed staker,\\n        uint BaseFeeLMAGain,\\n        uint StETHGain\\n    );\\n    event F_StETHUpdated(uint _F_StETH);\\n    event F_BaseFeeLMAUpdated(uint _F_BaseFeeLMA);\\n    event TotalHOGStakedUpdated(uint _totalHOGStaked);\\n    event StETHSent(address _account, uint _amount);\\n    event StakerSnapshotsUpdated(\\n        address _staker,\\n        uint _F_StETH,\\n        uint _F_BaseFeeLMA\\n    );\\n\\n    // --- Functions ---\\n\\n    function setAddresses(\\n        address _hogTokenAddress,\\n        address _baseFeeLMATokenAddress,\\n        address _troveManagerAddress,\\n        address _borrowerOperationsAddress,\\n        address _activePoolAddress\\n    ) external;\\n\\n    function stake(uint _HOGamount) external;\\n\\n    function unstake(uint _HOGamount) external;\\n\\n    function increaseF_StETH(uint _StETHFee) external;\\n\\n    function increaseF_BaseFeeLMA(uint _HOGFee) external;\\n\\n    function getPendingStETHGain(address _user) external view returns (uint);\\n\\n    function getPendingBaseFeeLMAGain(\\n        address _user\\n    ) external view returns (uint);\\n}\\n\",\"keccak256\":\"0x13e4a173500e5e3f5645d39df65bad38ba953e7438a9cd3fd170b928d0264926\",\"license\":\"MIT\"},\"contracts/interfaces/IHOGToken.sol\":{\"content\":\"// SPDX-License-Identifier: MIT\\n\\npragma solidity 0.8.19;\\n\\nimport \\\"@openzeppelin/contracts/token/ERC20/IERC20.sol\\\";\\nimport \\\"../dependencies/IERC2612.sol\\\";\\n\\ninterface IHOGToken is IERC20, IERC2612 {\\n    // --- Events ---\\n\\n    event CommunityIssuanceAddressSet(address _communityIssuanceAddress);\\n    event HOGStakingAddressSet(address _hogStakingAddress);\\n    event LockupContractFactoryAddressSet(\\n        address _lockupContractFactoryAddress\\n    );\\n\\n    // --- Functions ---\\n\\n    function sendToHOGStaking(address _sender, uint256 _amount) external;\\n\\n    function getDeploymentStartTime() external view returns (uint256);\\n\\n    function getLpRewardsEntitlement() external view returns (uint256);\\n\\n    function increaseAllowance(\\n        address _spender,\\n        uint256 _addedValues\\n    ) external returns (bool);\\n\\n    function decreaseAllowance(\\n        address _spender,\\n        uint256 _decreasedValue\\n    ) external returns (bool);\\n}\\n\",\"keccak256\":\"0x2c56d03787067551d0947fc59ba84d41d4163856163557d5e59c023552d99f04\",\"license\":\"MIT\"},\"contracts/interfaces/IHedgehogBase.sol\":{\"content\":\"// SPDX-License-Identifier: MIT\\n\\npragma solidity 0.8.19;\\n\\nimport \\\"./IPriceFeed.sol\\\";\\n\\ninterface IHedgehogBase {\\n    function priceFeed() external view returns (IPriceFeed);\\n}\\n\",\"keccak256\":\"0x9832f1daa908607df4b572f561b27463d7fc4eb27847a26b1c399c2ee6ee6110\",\"license\":\"MIT\"},\"contracts/interfaces/IPool.sol\":{\"content\":\"// SPDX-License-Identifier: MIT\\n\\npragma solidity 0.8.19;\\n\\n// Common interface for the Pools.\\ninterface IPool {\\n    // --- Events ---\\n\\n    event StETHBalanceUpdated(uint _newBalance);\\n    event BaseFeeLMABalanceUpdated(uint _newBalance);\\n    event ActivePoolAddressChanged(address _newActivePoolAddress);\\n    event DefaultPoolAddressChanged(address _newDefaultPoolAddress);\\n    event StabilityPoolAddressChanged(address _newStabilityPoolAddress);\\n    event StETHSent(address _to, uint _amount);\\n\\n    // --- Functions ---\\n\\n    function getStETH() external view returns (uint);\\n\\n    function getBaseFeeLMADebt() external view returns (uint);\\n\\n    function increaseBaseFeeLMADebt(uint _amount) external;\\n\\n    function decreaseBaseFeeLMADebt(uint _amount) external;\\n\\n    // function increaseCollCountInPool(uint256 _amount) external;\\n}\\n\",\"keccak256\":\"0xf2a64f0723f44525f25e56cc6b421542b5a9da52b33e4e490e4e41f7f98cd52b\",\"license\":\"MIT\"},\"contracts/interfaces/IPriceFeed.sol\":{\"content\":\"// SPDX-License-Identifier: MIT\\n\\npragma solidity 0.8.19;\\n\\ninterface IPriceFeed {\\n    // --- Events ---\\n    event LastGoodPriceUpdated(uint _lastGoodPrice);\\n\\n    // --- Function ---\\n    function fetchPrice() external returns (uint);\\n\\n    function lastGoodPrice() external view returns (uint);\\n}\\n\",\"keccak256\":\"0xdee620e51756443b2cdd8ac54df2e6d7b38f700a9d1a3cc4d1a2f31ce09bbd1e\",\"license\":\"MIT\"},\"contracts/interfaces/ISortedTroves.sol\":{\"content\":\"// SPDX-License-Identifier: MIT\\n\\npragma solidity 0.8.19;\\n\\n// Common interface for the SortedTroves Doubly Linked List.\\ninterface ISortedTroves {\\n    // --- Events ---\\n\\n    event SortedTrovesAddressChanged(address _sortedDoublyLLAddress);\\n    event BorrowerOperationsAddressChanged(address _borrowerOperationsAddress);\\n    event NodeAdded(address _id, uint _NICR);\\n    event NodeRemoved(address _id);\\n\\n    // --- Functions ---\\n\\n    function setParams(\\n        uint256 _size,\\n        address _TroveManagerAddress,\\n        address _borrowerOperationsAddress\\n    ) external;\\n\\n    function insert(\\n        address _id,\\n        uint256 _ICR,\\n        address _prevId,\\n        address _nextId\\n    ) external;\\n\\n    function remove(address _id) external;\\n\\n    function reInsert(\\n        address _id,\\n        uint256 _newICR,\\n        address _prevId,\\n        address _nextId\\n    ) external;\\n\\n    function contains(address _id) external view returns (bool);\\n\\n    function isFull() external view returns (bool);\\n\\n    function isEmpty() external view returns (bool);\\n\\n    function getSize() external view returns (uint256);\\n\\n    function getMaxSize() external view returns (uint256);\\n\\n    function getFirst() external view returns (address);\\n\\n    function getLast() external view returns (address);\\n\\n    function getNext(address _id) external view returns (address);\\n\\n    function getPrev(address _id) external view returns (address);\\n\\n    function validInsertPosition(\\n        uint256 _ICR,\\n        address _prevId,\\n        address _nextId\\n    ) external view returns (bool);\\n\\n    function findInsertPosition(\\n        uint256 _ICR,\\n        address _prevId,\\n        address _nextId\\n    ) external view returns (address, address);\\n}\\n\",\"keccak256\":\"0xee69ee66b0db6c873a5a1177e5e9178aa8be6c57aa988d1d7e7526f484862ecd\",\"license\":\"MIT\"},\"contracts/interfaces/IStabilityPool.sol\":{\"content\":\"// SPDX-License-Identifier: MIT\\n\\npragma solidity 0.8.19;\\n\\n/*\\n * The Stability Pool holds BaseFeeLMA tokens deposited by Stability Pool depositors.\\n *\\n * When a trove is liquidated, then depending on system conditions, some of its BaseFeeLMA debt gets offset with\\n * BaseFeeLMA in the Stability Pool:  that is, the offset debt evaporates, and an equal amount of BaseFeeLMA tokens in the Stability Pool is burned.\\n *\\n * Thus, a liquidation causes each depositor to receive a BaseFeeLMA loss, in proportion to their deposit as a share of total deposits.\\n * They also receive an StETH gain, as the StETH collateral of the liquidated trove is distributed among Stability depositors,\\n * in the same proportion.\\n *\\n * When a liquidation occurs, it depletes every deposit by the same fraction: for example, a liquidation that depletes 40%\\n * of the total BaseFeeLMA in the Stability Pool, depletes 40% of each deposit.\\n *\\n * A deposit that has experienced a series of liquidations is termed a \\\"compounded deposit\\\": each liquidation depletes the deposit,\\n * multiplying it by some factor in range ]0,1[\\n *\\n * Please see the implementation spec in the proof document, which closely follows on from the compounded deposit / StETH gain derivations:\\n * https://github.com/liquity/liquity/blob/master/papers/Scalable_Reward_Distribution_with_Compounding_Stakes.pdf\\n *\\n * --- HOG ISSUANCE TO STABILITY POOL DEPOSITORS ---\\n *\\n * A HOG issuance event occurs at every deposit operation, and every liquidation.\\n *\\n * Each deposit is tagged with the address of the front end through which it was made.\\n *\\n * All deposits earn a share of the issued HOG in proportion to the deposit as a share of total deposits. The HOG earned\\n * by a given deposit, is split between the depositor and the front end through which the deposit was made, based on the front end's kickbackRate.\\n *\\n * Please see the system Readme for an overview:\\n * https://github.com/liquity/dev/blob/main/README.md#hog-issuance-to-stability-providers\\n */\\ninterface IStabilityPool {\\n    // --- Events ---\\n\\n    event StabilityPoolStETHBalanceUpdated(uint _newBalance);\\n    event StabilityPoolBaseFeeLMABalanceUpdated(uint _newBalance);\\n\\n    event BorrowerOperationsAddressChanged(\\n        address _newBorrowerOperationsAddress\\n    );\\n    event TroveManagerAddressChanged(address _newTroveManagerAddress);\\n    event ActivePoolAddressChanged(address _newActivePoolAddress);\\n    event DefaultPoolAddressChanged(address _newDefaultPoolAddress);\\n    event BaseFeeLMATokenAddressChanged(address _newBaseFeeLMATokenAddress);\\n    event SortedTrovesAddressChanged(address _newSortedTrovesAddress);\\n    event PriceFeedAddressChanged(address _newPriceFeedAddress);\\n    event CommunityIssuanceAddressChanged(address _newCommunityIssuanceAddress);\\n\\n    event P_Updated(uint _P);\\n    event S_Updated(uint _S, uint128 _epoch, uint128 _scale);\\n    event G_Updated(uint _G, uint128 _epoch, uint128 _scale);\\n    event EpochUpdated(uint128 _currentEpoch);\\n    event ScaleUpdated(uint128 _currentScale);\\n\\n    event DepositSnapshotUpdated(\\n        address indexed _depositor,\\n        uint _P,\\n        uint _S,\\n        uint _G\\n    );\\n\\n    event StETHGainWithdrawn(\\n        address indexed _depositor,\\n        uint _StETH,\\n        uint _BaseFeeLMALoss\\n    );\\n    event HOGPaidToDepositor(address indexed _depositor, uint _HOG);\\n    event StETHSent(address _to, uint _amount);\\n\\n    // --- Functions ---\\n\\n    /*\\n     * Called only once on init, to set addresses of other Hedgehog contracts\\n     * Callable only by owner, renounces ownership at the end\\n     */\\n    function setAddresses(\\n        address _borrowerOperationsAddress,\\n        address _troveManagerAddress,\\n        address _activePoolAddress,\\n        address _baseFeeLMATokenAddress,\\n        address _sortedTrovesAddress,\\n        address _priceFeedAddress,\\n        address _communityIssuanceAddress\\n    ) external;\\n\\n    /*\\n     * Initial checks:\\n     * - _amount is not zero\\n     * ---\\n     * - Triggers a HOG issuance, based on time passed since the last issuance. The HOG issuance is shared between *all* depositors and front ends\\n     * - Tags the deposit with the provided front end tag param, if it's a new deposit\\n     * - Sends depositor's accumulated gains (HOG, StETH) to depositor\\n     * - Sends the tagged front end's accumulated HOG gains to the tagged front end\\n     * - Increases deposit and tagged front end's stake, and takes new snapshots for each.\\n     */\\n    function provideToSP(uint _amount) external;\\n\\n    /*\\n     * Initial checks:\\n     * - _amount is zero or there are no under collateralized troves left in the system\\n     * - User has a non zero deposit\\n     * ---\\n     * - Triggers a HOG issuance, based on time passed since the last issuance. The HOG issuance is shared between *all* depositors and front ends\\n     * - Removes the deposit's front end tag if it is a full withdrawal\\n     * - Sends all depositor's accumulated gains (HOG, StETH) to depositor\\n     * - Sends the tagged front end's accumulated HOG gains to the tagged front end\\n     * - Decreases deposit and tagged front end's stake, and takes new snapshots for each.\\n     *\\n     * If _amount > userDeposit, the user withdraws all of their compounded deposit.\\n     */\\n    function withdrawFromSP(uint _amount) external;\\n\\n    /*\\n     * Initial checks:\\n     * - User has a non zero deposit\\n     * - User has an open trove\\n     * - User has some StETH gain\\n     * ---\\n     * - Triggers a HOG issuance, based on time passed since the last issuance. The HOG issuance is shared between *all* depositors and front ends\\n     * - Sends all depositor's HOG gain to  depositor\\n     * - Sends all tagged front end's HOG gain to the tagged front end\\n     * - Transfers the depositor's entire StETH gain from the Stability Pool to the caller's trove\\n     * - Leaves their compounded deposit in the Stability Pool\\n     * - Updates snapshots for deposit and tagged front end stake\\n     */\\n    function withdrawStETHGainToTrove(\\n        address _upperHint,\\n        address _lowerHint\\n    ) external;\\n\\n    /*\\n     * Initial checks:\\n     * - Caller is TroveManager\\n     * ---\\n     * Cancels out the specified debt against the BaseFeeLMA contained in the Stability Pool (as far as possible)\\n     * and transfers the Trove's StETH collateral from ActivePool to StabilityPool.\\n     * Only called by liquidation functions in the TroveManager.\\n     */\\n    function offset(uint _debt, uint _coll) external;\\n\\n    /*\\n     * Returns the total amount of StETH held by the pool, accounted in an internal variable instead of `balance`,\\n     * to exclude edge cases like StETH received from a self-destruct.\\n     */\\n    function getStETH() external view returns (uint);\\n\\n    /*\\n     * Returns BaseFeeLMA held in the pool. Changes when users deposit/withdraw, and when Trove debt is offset.\\n     */\\n    function getTotalBaseFeeLMADeposits() external view returns (uint);\\n\\n    /*\\n     * Calculates the StETH gain earned by the deposit since its last snapshots were taken.\\n     */\\n    function getDepositorStETHGain(\\n        address _depositor\\n    ) external view returns (uint);\\n\\n    /*\\n     * Calculate the HOG gain earned by a deposit since its last snapshots were taken.\\n     * If not tagged with a front end, the depositor gets a 100% cut of what their deposit earned.\\n     * Otherwise, their cut of the deposit's earnings is equal to the kickbackRate, set by the front end through\\n     * which they made their deposit.\\n     */\\n    function getDepositorHOGGain(\\n        address _depositor\\n    ) external view returns (uint);\\n\\n    /*\\n     * Return the user's compounded deposit.\\n     */\\n    function getCompoundedBaseFeeLMADeposit(\\n        address _depositor\\n    ) external view returns (uint);\\n}\\n\",\"keccak256\":\"0xabf6fb0fd220a7b67010f1ddab008cc9a15b3485b24caf25f9e44220d5c55d6a\",\"license\":\"MIT\"},\"contracts/interfaces/ITroveManager.sol\":{\"content\":\"// SPDX-License-Identifier: MIT\\n\\npragma solidity 0.8.19;\\n\\nimport \\\"./IHedgehogBase.sol\\\";\\nimport \\\"./IStabilityPool.sol\\\";\\nimport \\\"./IBaseFeeLMAToken.sol\\\";\\nimport \\\"./IHOGToken.sol\\\";\\nimport \\\"./IHOGStaking.sol\\\";\\n\\n// Common interface for the Trove Manager.\\ninterface ITroveManager is IHedgehogBase {\\n    // --- Events ---\\n\\n    event BorrowerOperationsAddressChanged(\\n        address _newBorrowerOperationsAddress\\n    );\\n    event PriceFeedAddressChanged(address _newPriceFeedAddress);\\n    event BaseFeeLMATokenAddressChanged(address _newBaseFeeLMATokenAddress);\\n    event ActivePoolAddressChanged(address _activePoolAddress);\\n    event DefaultPoolAddressChanged(address _defaultPoolAddress);\\n    event StabilityPoolAddressChanged(address _stabilityPoolAddress);\\n    event GasPoolAddressChanged(address _gasPoolAddress);\\n    event CollSurplusPoolAddressChanged(address _collSurplusPoolAddress);\\n    event SortedTrovesAddressChanged(address _sortedTrovesAddress);\\n    event HOGTokenAddressChanged(address _hogTokenAddress);\\n    event HOGStakingAddressChanged(address _hogStakingAddress);\\n\\n    event Liquidation(\\n        uint _liquidatedDebt,\\n        uint _liquidatedColl,\\n        uint _collGasCompensation,\\n        uint _BaseFeeLMAGasCompensation\\n    );\\n    event Redemption(\\n        uint _attemptedBaseFeeLMAAmount,\\n        uint _actualBaseFeeLMAAmount,\\n        uint _StETHSent,\\n        uint _StETHFee\\n    );\\n    event TroveUpdated(\\n        address indexed _borrower,\\n        uint _debt,\\n        uint _coll,\\n        uint stake,\\n        uint8 operation\\n    );\\n    event TroveLiquidated(\\n        address indexed _borrower,\\n        uint _debt,\\n        uint _coll,\\n        uint8 operation\\n    );\\n    event BaseRateUpdated(uint _baseRate);\\n    event LastFeeOpTimeUpdated(uint _lastFeeOpTime);\\n    event TotalStakesUpdated(uint _newTotalStakes);\\n    event SystemSnapshotsUpdated(\\n        uint _totalStakesSnapshot,\\n        uint _totalCollateralSnapshot\\n    );\\n    event LTermsUpdated(uint _L_StETH, uint _L_BaseFeeLMADebt);\\n    event TroveSnapshotsUpdated(uint _L_StETH, uint _L_BaseFeeLMADebt);\\n    event TroveIndexUpdated(address _borrower, uint _newIndex);\\n\\n    // --- Functions ---\\n\\n    function setAddresses(\\n        address _borrowerOperationsAddress,\\n        address _activePoolAddress,\\n        address _defaultPoolAddress,\\n        address _stabilityPoolAddress,\\n        address _gasPoolAddress,\\n        address _collSurplusPoolAddress,\\n        address _priceFeedAddress,\\n        address _baseFeeLMATokenAddress,\\n        address _sortedTrovesAddress,\\n        address _hogTokenAddress,\\n        address _hogStakingAddress\\n    ) external;\\n\\n    function stabilityPool() external view returns (IStabilityPool);\\n\\n    function baseFeeLMAToken() external view returns (IBaseFeeLMAToken);\\n\\n    function hogToken() external view returns (IHOGToken);\\n\\n    function hogStaking() external view returns (IHOGStaking);\\n\\n    function getTroveOwnersCount() external view returns (uint);\\n\\n    function getTroveFromTroveOwnersArray(\\n        uint _index\\n    ) external view returns (address);\\n\\n    function getNominalICR(address _borrower) external view returns (uint);\\n\\n    function getCurrentICR(\\n        address _borrower,\\n        uint _price\\n    ) external view returns (uint);\\n\\n    function liquidate(address _borrower) external;\\n\\n    function liquidateTroves(uint _n) external;\\n\\n    function batchLiquidateTroves(address[] calldata _troveArray) external;\\n\\n    function redeemCollateral(\\n        uint _BaseFeeLMAAmount,\\n        address _firstRedemptionHint,\\n        address _upperPartialRedemptionHint,\\n        address _lowerPartialRedemptionHint,\\n        uint _partialRedemptionHintNICR,\\n        uint _maxIterations,\\n        uint _maxFee\\n    ) external;\\n\\n    function updateStakeAndTotalStakes(\\n        address _borrower\\n    ) external returns (uint);\\n\\n    function updateTroveRewardSnapshots(address _borrower) external;\\n\\n    function addTroveOwnerToArray(\\n        address _borrower\\n    ) external returns (uint index);\\n\\n    function applyPendingRewards(address _borrower) external;\\n\\n    function getPendingStETHReward(\\n        address _borrower\\n    ) external view returns (uint);\\n\\n    function getPendingBaseFeeLMADebtReward(\\n        address _borrower\\n    ) external view returns (uint);\\n\\n    function hasPendingRewards(address _borrower) external view returns (bool);\\n\\n    function getEntireDebtAndColl(\\n        address _borrower\\n    )\\n        external\\n        view\\n        returns (\\n            uint debt,\\n            uint coll,\\n            uint pendingBaseFeeLMADebtReward,\\n            uint pendingStETHReward\\n        );\\n\\n    function closeTrove(address _borrower) external;\\n\\n    function removeStake(address _borrower) external;\\n\\n    function getRedemptionRate(\\n        uint _redemptionColl\\n    ) external view returns (uint);\\n\\n    function getRedemptionRateWithDecay(\\n        uint _redemptionColl\\n    ) external view returns (uint);\\n\\n    function getRedemptionFeeWithDecay(\\n        uint _StETHDrawn\\n    ) external view returns (uint);\\n\\n    function getBorrowingRate(\\n        uint _issuedBaseFeeLMA\\n    ) external view returns (uint);\\n\\n    function getBorrowingRateWithDecay(\\n        uint _issuedBaseFeeLMA\\n    ) external view returns (uint);\\n\\n    function getBorrowingFee(\\n        uint BaseFeeLMADebt\\n    ) external view returns (uint, uint);\\n\\n    function getBorrowingFeeWithDecay(\\n        uint _BaseFeeLMADebt\\n    ) external view returns (uint);\\n\\n    function updateBaseRateFromBorrowing(uint _baseRate) external;\\n\\n    function decayBaseRateFromBorrowing() external;\\n\\n    function getTroveStatus(address _borrower) external view returns (uint);\\n\\n    function getTroveStake(address _borrower) external view returns (uint);\\n\\n    function getTroveDebt(address _borrower) external view returns (uint);\\n\\n    function getTroveColl(address _borrower) external view returns (uint);\\n\\n    function setTroveStatus(address _borrower, uint num) external;\\n\\n    function increaseTroveColl(\\n        address _borrower,\\n        uint _collIncrease\\n    ) external returns (uint);\\n\\n    function decreaseTroveColl(\\n        address _borrower,\\n        uint _collDecrease\\n    ) external returns (uint);\\n\\n    function increaseTroveDebt(\\n        address _borrower,\\n        uint _debtIncrease\\n    ) external returns (uint);\\n\\n    function decreaseTroveDebt(\\n        address _borrower,\\n        uint _collDecrease\\n    ) external returns (uint);\\n\\n    function getTCR(uint _price) external view returns (uint);\\n\\n    function checkRecoveryMode(uint _price) external view returns (bool);\\n}\\n\",\"keccak256\":\"0x33b2744d95fae4541cfb11a799aa434885d1b30ac376faf25f487ddc4f7113a5\",\"license\":\"MIT\"},\"hardhat/console.sol\":{\"content\":\"// SPDX-License-Identifier: MIT\\npragma solidity >=0.4.22 <0.9.0;\\n\\nlibrary console {\\n    address constant CONSOLE_ADDRESS =\\n        0x000000000000000000636F6e736F6c652e6c6f67;\\n\\n    function _sendLogPayloadImplementation(bytes memory payload) internal view {\\n        address consoleAddress = CONSOLE_ADDRESS;\\n        /// @solidity memory-safe-assembly\\n        assembly {\\n            pop(\\n                staticcall(\\n                    gas(),\\n                    consoleAddress,\\n                    add(payload, 32),\\n                    mload(payload),\\n                    0,\\n                    0\\n                )\\n            )\\n        }\\n    }\\n\\n    function _castToPure(\\n      function(bytes memory) internal view fnIn\\n    ) internal pure returns (function(bytes memory) pure fnOut) {\\n        assembly {\\n            fnOut := fnIn\\n        }\\n    }\\n\\n    function _sendLogPayload(bytes memory payload) internal pure {\\n        _castToPure(_sendLogPayloadImplementation)(payload);\\n    }\\n\\n    function log() internal pure {\\n        _sendLogPayload(abi.encodeWithSignature(\\\"log()\\\"));\\n    }\\n    function logInt(int256 p0) internal pure {\\n        _sendLogPayload(abi.encodeWithSignature(\\\"log(int256)\\\", p0));\\n    }\\n\\n    function logUint(uint256 p0) internal pure {\\n        _sendLogPayload(abi.encodeWithSignature(\\\"log(uint256)\\\", p0));\\n    }\\n\\n    function logString(string memory p0) internal pure {\\n        _sendLogPayload(abi.encodeWithSignature(\\\"log(string)\\\", p0));\\n    }\\n\\n    function logBool(bool p0) internal pure {\\n        _sendLogPayload(abi.encodeWithSignature(\\\"log(bool)\\\", p0));\\n    }\\n\\n    function logAddress(address p0) internal pure {\\n        _sendLogPayload(abi.encodeWithSignature(\\\"log(address)\\\", p0));\\n    }\\n\\n    function logBytes(bytes memory p0) internal pure {\\n        _sendLogPayload(abi.encodeWithSignature(\\\"log(bytes)\\\", p0));\\n    }\\n\\n    function logBytes1(bytes1 p0) internal pure {\\n        _sendLogPayload(abi.encodeWithSignature(\\\"log(bytes1)\\\", p0));\\n    }\\n\\n    function logBytes2(bytes2 p0) internal pure {\\n        _sendLogPayload(abi.encodeWithSignature(\\\"log(bytes2)\\\", p0));\\n    }\\n\\n    function logBytes3(bytes3 p0) internal pure {\\n        _sendLogPayload(abi.encodeWithSignature(\\\"log(bytes3)\\\", p0));\\n    }\\n\\n    function logBytes4(bytes4 p0) internal pure {\\n        _sendLogPayload(abi.encodeWithSignature(\\\"log(bytes4)\\\", p0));\\n    }\\n\\n    function logBytes5(bytes5 p0) internal pure {\\n        _sendLogPayload(abi.encodeWithSignature(\\\"log(bytes5)\\\", p0));\\n    }\\n\\n    function logBytes6(bytes6 p0) internal pure {\\n        _sendLogPayload(abi.encodeWithSignature(\\\"log(bytes6)\\\", p0));\\n    }\\n\\n    function logBytes7(bytes7 p0) internal pure {\\n        _sendLogPayload(abi.encodeWithSignature(\\\"log(bytes7)\\\", p0));\\n    }\\n\\n    function logBytes8(bytes8 p0) internal pure {\\n        _sendLogPayload(abi.encodeWithSignature(\\\"log(bytes8)\\\", p0));\\n    }\\n\\n    function logBytes9(bytes9 p0) internal pure {\\n        _sendLogPayload(abi.encodeWithSignature(\\\"log(bytes9)\\\", p0));\\n    }\\n\\n    function logBytes10(bytes10 p0) internal pure {\\n        _sendLogPayload(abi.encodeWithSignature(\\\"log(bytes10)\\\", p0));\\n    }\\n\\n    function logBytes11(bytes11 p0) internal pure {\\n        _sendLogPayload(abi.encodeWithSignature(\\\"log(bytes11)\\\", p0));\\n    }\\n\\n    function logBytes12(bytes12 p0) internal pure {\\n        _sendLogPayload(abi.encodeWithSignature(\\\"log(bytes12)\\\", p0));\\n    }\\n\\n    function logBytes13(bytes13 p0) internal pure {\\n        _sendLogPayload(abi.encodeWithSignature(\\\"log(bytes13)\\\", p0));\\n    }\\n\\n    function logBytes14(bytes14 p0) internal pure {\\n        _sendLogPayload(abi.encodeWithSignature(\\\"log(bytes14)\\\", p0));\\n    }\\n\\n    function logBytes15(bytes15 p0) internal pure {\\n        _sendLogPayload(abi.encodeWithSignature(\\\"log(bytes15)\\\", p0));\\n    }\\n\\n    function logBytes16(bytes16 p0) internal pure {\\n        _sendLogPayload(abi.encodeWithSignature(\\\"log(bytes16)\\\", p0));\\n    }\\n\\n    function logBytes17(bytes17 p0) internal pure {\\n        _sendLogPayload(abi.encodeWithSignature(\\\"log(bytes17)\\\", p0));\\n    }\\n\\n    function logBytes18(bytes18 p0) internal pure {\\n        _sendLogPayload(abi.encodeWithSignature(\\\"log(bytes18)\\\", p0));\\n    }\\n\\n    function logBytes19(bytes19 p0) internal pure {\\n        _sendLogPayload(abi.encodeWithSignature(\\\"log(bytes19)\\\", p0));\\n    }\\n\\n    function logBytes20(bytes20 p0) internal pure {\\n        _sendLogPayload(abi.encodeWithSignature(\\\"log(bytes20)\\\", p0));\\n    }\\n\\n    function logBytes21(bytes21 p0) internal pure {\\n        _sendLogPayload(abi.encodeWithSignature(\\\"log(bytes21)\\\", p0));\\n    }\\n\\n    function logBytes22(bytes22 p0) internal pure {\\n        _sendLogPayload(abi.encodeWithSignature(\\\"log(bytes22)\\\", p0));\\n    }\\n\\n    function logBytes23(bytes23 p0) internal pure {\\n        _sendLogPayload(abi.encodeWithSignature(\\\"log(bytes23)\\\", p0));\\n    }\\n\\n    function logBytes24(bytes24 p0) internal pure {\\n        _sendLogPayload(abi.encodeWithSignature(\\\"log(bytes24)\\\", p0));\\n    }\\n\\n    function logBytes25(bytes25 p0) internal pure {\\n        _sendLogPayload(abi.encodeWithSignature(\\\"log(bytes25)\\\", p0));\\n    }\\n\\n    function logBytes26(bytes26 p0) internal pure {\\n        _sendLogPayload(abi.encodeWithSignature(\\\"log(bytes26)\\\", p0));\\n    }\\n\\n    function logBytes27(bytes27 p0) internal pure {\\n        _sendLogPayload(abi.encodeWithSignature(\\\"log(bytes27)\\\", p0));\\n    }\\n\\n    function logBytes28(bytes28 p0) internal pure {\\n        _sendLogPayload(abi.encodeWithSignature(\\\"log(bytes28)\\\", p0));\\n    }\\n\\n    function logBytes29(bytes29 p0) internal pure {\\n        _sendLogPayload(abi.encodeWithSignature(\\\"log(bytes29)\\\", p0));\\n    }\\n\\n    function logBytes30(bytes30 p0) internal pure {\\n        _sendLogPayload(abi.encodeWithSignature(\\\"log(bytes30)\\\", p0));\\n    }\\n\\n    function logBytes31(bytes31 p0) internal pure {\\n        _sendLogPayload(abi.encodeWithSignature(\\\"log(bytes31)\\\", p0));\\n    }\\n\\n    function logBytes32(bytes32 p0) internal pure {\\n        _sendLogPayload(abi.encodeWithSignature(\\\"log(bytes32)\\\", p0));\\n    }\\n\\n    function log(uint256 p0) internal pure {\\n        _sendLogPayload(abi.encodeWithSignature(\\\"log(uint256)\\\", p0));\\n    }\\n\\n    function log(string memory p0) internal pure {\\n        _sendLogPayload(abi.encodeWithSignature(\\\"log(string)\\\", p0));\\n    }\\n\\n    function log(bool p0) internal pure {\\n        _sendLogPayload(abi.encodeWithSignature(\\\"log(bool)\\\", p0));\\n    }\\n\\n    function log(address p0) internal pure {\\n        _sendLogPayload(abi.encodeWithSignature(\\\"log(address)\\\", p0));\\n    }\\n\\n    function log(uint256 p0, uint256 p1) internal pure {\\n        _sendLogPayload(abi.encodeWithSignature(\\\"log(uint256,uint256)\\\", p0, p1));\\n    }\\n\\n    function log(uint256 p0, string memory p1) internal pure {\\n        _sendLogPayload(abi.encodeWithSignature(\\\"log(uint256,string)\\\", p0, p1));\\n    }\\n\\n    function log(uint256 p0, bool p1) internal pure {\\n        _sendLogPayload(abi.encodeWithSignature(\\\"log(uint256,bool)\\\", p0, p1));\\n    }\\n\\n    function log(uint256 p0, address p1) internal pure {\\n        _sendLogPayload(abi.encodeWithSignature(\\\"log(uint256,address)\\\", p0, p1));\\n    }\\n\\n    function log(string memory p0, uint256 p1) internal pure {\\n        _sendLogPayload(abi.encodeWithSignature(\\\"log(string,uint256)\\\", p0, p1));\\n    }\\n\\n    function log(string memory p0, string memory p1) internal pure {\\n        _sendLogPayload(abi.encodeWithSignature(\\\"log(string,string)\\\", p0, p1));\\n    }\\n\\n    function log(string memory p0, bool p1) internal pure {\\n        _sendLogPayload(abi.encodeWithSignature(\\\"log(string,bool)\\\", p0, p1));\\n    }\\n\\n    function log(string memory p0, address p1) internal pure {\\n        _sendLogPayload(abi.encodeWithSignature(\\\"log(string,address)\\\", p0, p1));\\n    }\\n\\n    function log(bool p0, uint256 p1) internal pure {\\n        _sendLogPayload(abi.encodeWithSignature(\\\"log(bool,uint256)\\\", p0, p1));\\n    }\\n\\n    function log(bool p0, string memory p1) internal pure {\\n        _sendLogPayload(abi.encodeWithSignature(\\\"log(bool,string)\\\", p0, p1));\\n    }\\n\\n    function log(bool p0, bool p1) internal pure {\\n        _sendLogPayload(abi.encodeWithSignature(\\\"log(bool,bool)\\\", p0, p1));\\n    }\\n\\n    function log(bool p0, address p1) internal pure {\\n        _sendLogPayload(abi.encodeWithSignature(\\\"log(bool,address)\\\", p0, p1));\\n    }\\n\\n    function log(address p0, uint256 p1) internal pure {\\n        _sendLogPayload(abi.encodeWithSignature(\\\"log(address,uint256)\\\", p0, p1));\\n    }\\n\\n    function log(address p0, string memory p1) internal pure {\\n        _sendLogPayload(abi.encodeWithSignature(\\\"log(address,string)\\\", p0, p1));\\n    }\\n\\n    function log(address p0, bool p1) internal pure {\\n        _sendLogPayload(abi.encodeWithSignature(\\\"log(address,bool)\\\", p0, p1));\\n    }\\n\\n    function log(address p0, address p1) internal pure {\\n        _sendLogPayload(abi.encodeWithSignature(\\\"log(address,address)\\\", p0, p1));\\n    }\\n\\n    function log(uint256 p0, uint256 p1, uint256 p2) internal pure {\\n        _sendLogPayload(abi.encodeWithSignature(\\\"log(uint256,uint256,uint256)\\\", p0, p1, p2));\\n    }\\n\\n    function log(uint256 p0, uint256 p1, string memory p2) internal pure {\\n        _sendLogPayload(abi.encodeWithSignature(\\\"log(uint256,uint256,string)\\\", p0, p1, p2));\\n    }\\n\\n    function log(uint256 p0, uint256 p1, bool p2) internal pure {\\n        _sendLogPayload(abi.encodeWithSignature(\\\"log(uint256,uint256,bool)\\\", p0, p1, p2));\\n    }\\n\\n    function log(uint256 p0, uint256 p1, address p2) internal pure {\\n        _sendLogPayload(abi.encodeWithSignature(\\\"log(uint256,uint256,address)\\\", p0, p1, p2));\\n    }\\n\\n    function log(uint256 p0, string memory p1, uint256 p2) internal pure {\\n        _sendLogPayload(abi.encodeWithSignature(\\\"log(uint256,string,uint256)\\\", p0, p1, p2));\\n    }\\n\\n    function log(uint256 p0, string memory p1, string memory p2) internal pure {\\n        _sendLogPayload(abi.encodeWithSignature(\\\"log(uint256,string,string)\\\", p0, p1, p2));\\n    }\\n\\n    function log(uint256 p0, string memory p1, bool p2) internal pure {\\n        _sendLogPayload(abi.encodeWithSignature(\\\"log(uint256,string,bool)\\\", p0, p1, p2));\\n    }\\n\\n    function log(uint256 p0, string memory p1, address p2) internal pure {\\n        _sendLogPayload(abi.encodeWithSignature(\\\"log(uint256,string,address)\\\", p0, p1, p2));\\n    }\\n\\n    function log(uint256 p0, bool p1, uint256 p2) internal pure {\\n        _sendLogPayload(abi.encodeWithSignature(\\\"log(uint256,bool,uint256)\\\", p0, p1, p2));\\n    }\\n\\n    function log(uint256 p0, bool p1, string memory p2) internal pure {\\n        _sendLogPayload(abi.encodeWithSignature(\\\"log(uint256,bool,string)\\\", p0, p1, p2));\\n    }\\n\\n    function log(uint256 p0, bool p1, bool p2) internal pure {\\n        _sendLogPayload(abi.encodeWithSignature(\\\"log(uint256,bool,bool)\\\", p0, p1, p2));\\n    }\\n\\n    function log(uint256 p0, bool p1, address p2) internal pure {\\n        _sendLogPayload(abi.encodeWithSignature(\\\"log(uint256,bool,address)\\\", p0, p1, p2));\\n    }\\n\\n    function log(uint256 p0, address p1, uint256 p2) internal pure {\\n        _sendLogPayload(abi.encodeWithSignature(\\\"log(uint256,address,uint256)\\\", p0, p1, p2));\\n    }\\n\\n    function log(uint256 p0, address p1, string memory p2) internal pure {\\n        _sendLogPayload(abi.encodeWithSignature(\\\"log(uint256,address,string)\\\", p0, p1, p2));\\n    }\\n\\n    function log(uint256 p0, address p1, bool p2) internal pure {\\n        _sendLogPayload(abi.encodeWithSignature(\\\"log(uint256,address,bool)\\\", p0, p1, p2));\\n    }\\n\\n    function log(uint256 p0, address p1, address p2) internal pure {\\n        _sendLogPayload(abi.encodeWithSignature(\\\"log(uint256,address,address)\\\", p0, p1, p2));\\n    }\\n\\n    function log(string memory p0, uint256 p1, uint256 p2) internal pure {\\n        _sendLogPayload(abi.encodeWithSignature(\\\"log(string,uint256,uint256)\\\", p0, p1, p2));\\n    }\\n\\n    function log(string memory p0, uint256 p1, string memory p2) internal pure {\\n        _sendLogPayload(abi.encodeWithSignature(\\\"log(string,uint256,string)\\\", p0, p1, p2));\\n    }\\n\\n    function log(string memory p0, uint256 p1, bool p2) internal pure {\\n        _sendLogPayload(abi.encodeWithSignature(\\\"log(string,uint256,bool)\\\", p0, p1, p2));\\n    }\\n\\n    function log(string memory p0, uint256 p1, address p2) internal pure {\\n        _sendLogPayload(abi.encodeWithSignature(\\\"log(string,uint256,address)\\\", p0, p1, p2));\\n    }\\n\\n    function log(string memory p0, string memory p1, uint256 p2) internal pure {\\n        _sendLogPayload(abi.encodeWithSignature(\\\"log(string,string,uint256)\\\", p0, p1, p2));\\n    }\\n\\n    function log(string memory p0, string memory p1, string memory p2) internal pure {\\n        _sendLogPayload(abi.encodeWithSignature(\\\"log(string,string,string)\\\", p0, p1, p2));\\n    }\\n\\n    function log(string memory p0, string memory p1, bool p2) internal pure {\\n        _sendLogPayload(abi.encodeWithSignature(\\\"log(string,string,bool)\\\", p0, p1, p2));\\n    }\\n\\n    function log(string memory p0, string memory p1, address p2) internal pure {\\n        _sendLogPayload(abi.encodeWithSignature(\\\"log(string,string,address)\\\", p0, p1, p2));\\n    }\\n\\n    function log(string memory p0, bool p1, uint256 p2) internal pure {\\n        _sendLogPayload(abi.encodeWithSignature(\\\"log(string,bool,uint256)\\\", p0, p1, p2));\\n    }\\n\\n    function log(string memory p0, bool p1, string memory p2) internal pure {\\n        _sendLogPayload(abi.encodeWithSignature(\\\"log(string,bool,string)\\\", p0, p1, p2));\\n    }\\n\\n    function log(string memory p0, bool p1, bool p2) internal pure {\\n        _sendLogPayload(abi.encodeWithSignature(\\\"log(string,bool,bool)\\\", p0, p1, p2));\\n    }\\n\\n    function log(string memory p0, bool p1, address p2) internal pure {\\n        _sendLogPayload(abi.encodeWithSignature(\\\"log(string,bool,address)\\\", p0, p1, p2));\\n    }\\n\\n    function log(string memory p0, address p1, uint256 p2) internal pure {\\n        _sendLogPayload(abi.encodeWithSignature(\\\"log(string,address,uint256)\\\", p0, p1, p2));\\n    }\\n\\n    function log(string memory p0, address p1, string memory p2) internal pure {\\n        _sendLogPayload(abi.encodeWithSignature(\\\"log(string,address,string)\\\", p0, p1, p2));\\n    }\\n\\n    function log(string memory p0, address p1, bool p2) internal pure {\\n        _sendLogPayload(abi.encodeWithSignature(\\\"log(string,address,bool)\\\", p0, p1, p2));\\n    }\\n\\n    function log(string memory p0, address p1, address p2) internal pure {\\n        _sendLogPayload(abi.encodeWithSignature(\\\"log(string,address,address)\\\", p0, p1, p2));\\n    }\\n\\n    function log(bool p0, uint256 p1, uint256 p2) internal pure {\\n        _sendLogPayload(abi.encodeWithSignature(\\\"log(bool,uint256,uint256)\\\", p0, p1, p2));\\n    }\\n\\n    function log(bool p0, uint256 p1, string memory p2) internal pure {\\n        _sendLogPayload(abi.encodeWithSignature(\\\"log(bool,uint256,string)\\\", p0, p1, p2));\\n    }\\n\\n    function log(bool p0, uint256 p1, bool p2) internal pure {\\n        _sendLogPayload(abi.encodeWithSignature(\\\"log(bool,uint256,bool)\\\", p0, p1, p2));\\n    }\\n\\n    function log(bool p0, uint256 p1, address p2) internal pure {\\n        _sendLogPayload(abi.encodeWithSignature(\\\"log(bool,uint256,address)\\\", p0, p1, p2));\\n    }\\n\\n    function log(bool p0, string memory p1, uint256 p2) internal pure {\\n        _sendLogPayload(abi.encodeWithSignature(\\\"log(bool,string,uint256)\\\", p0, p1, p2));\\n    }\\n\\n    function log(bool p0, string memory p1, string memory p2) internal pure {\\n        _sendLogPayload(abi.encodeWithSignature(\\\"log(bool,string,string)\\\", p0, p1, p2));\\n    }\\n\\n    function log(bool p0, string memory p1, bool p2) internal pure {\\n        _sendLogPayload(abi.encodeWithSignature(\\\"log(bool,string,bool)\\\", p0, p1, p2));\\n    }\\n\\n    function log(bool p0, string memory p1, address p2) internal pure {\\n        _sendLogPayload(abi.encodeWithSignature(\\\"log(bool,string,address)\\\", p0, p1, p2));\\n    }\\n\\n    function log(bool p0, bool p1, uint256 p2) internal pure {\\n        _sendLogPayload(abi.encodeWithSignature(\\\"log(bool,bool,uint256)\\\", p0, p1, p2));\\n    }\\n\\n    function log(bool p0, bool p1, string memory p2) internal pure {\\n        _sendLogPayload(abi.encodeWithSignature(\\\"log(bool,bool,string)\\\", p0, p1, p2));\\n    }\\n\\n    function log(bool p0, bool p1, bool p2) internal pure {\\n        _sendLogPayload(abi.encodeWithSignature(\\\"log(bool,bool,bool)\\\", p0, p1, p2));\\n    }\\n\\n    function log(bool p0, bool p1, address p2) internal pure {\\n        _sendLogPayload(abi.encodeWithSignature(\\\"log(bool,bool,address)\\\", p0, p1, p2));\\n    }\\n\\n    function log(bool p0, address p1, uint256 p2) internal pure {\\n        _sendLogPayload(abi.encodeWithSignature(\\\"log(bool,address,uint256)\\\", p0, p1, p2));\\n    }\\n\\n    function log(bool p0, address p1, string memory p2) internal pure {\\n        _sendLogPayload(abi.encodeWithSignature(\\\"log(bool,address,string)\\\", p0, p1, p2));\\n    }\\n\\n    function log(bool p0, address p1, bool p2) internal pure {\\n        _sendLogPayload(abi.encodeWithSignature(\\\"log(bool,address,bool)\\\", p0, p1, p2));\\n    }\\n\\n    function log(bool p0, address p1, address p2) internal pure {\\n        _sendLogPayload(abi.encodeWithSignature(\\\"log(bool,address,address)\\\", p0, p1, p2));\\n    }\\n\\n    function log(address p0, uint256 p1, uint256 p2) internal pure {\\n        _sendLogPayload(abi.encodeWithSignature(\\\"log(address,uint256,uint256)\\\", p0, p1, p2));\\n    }\\n\\n    function log(address p0, uint256 p1, string memory p2) internal pure {\\n        _sendLogPayload(abi.encodeWithSignature(\\\"log(address,uint256,string)\\\", p0, p1, p2));\\n    }\\n\\n    function log(address p0, uint256 p1, bool p2) internal pure {\\n        _sendLogPayload(abi.encodeWithSignature(\\\"log(address,uint256,bool)\\\", p0, p1, p2));\\n    }\\n\\n    function log(address p0, uint256 p1, address p2) internal pure {\\n        _sendLogPayload(abi.encodeWithSignature(\\\"log(address,uint256,address)\\\", p0, p1, p2));\\n    }\\n\\n    function log(address p0, string memory p1, uint256 p2) internal pure {\\n        _sendLogPayload(abi.encodeWithSignature(\\\"log(address,string,uint256)\\\", p0, p1, p2));\\n    }\\n\\n    function log(address p0, string memory p1, string memory p2) internal pure {\\n        _sendLogPayload(abi.encodeWithSignature(\\\"log(address,string,string)\\\", p0, p1, p2));\\n    }\\n\\n    function log(address p0, string memory p1, bool p2) internal pure {\\n        _sendLogPayload(abi.encodeWithSignature(\\\"log(address,string,bool)\\\", p0, p1, p2));\\n    }\\n\\n    function log(address p0, string memory p1, address p2) internal pure {\\n        _sendLogPayload(abi.encodeWithSignature(\\\"log(address,string,address)\\\", p0, p1, p2));\\n    }\\n\\n    function log(address p0, bool p1, uint256 p2) internal pure {\\n        _sendLogPayload(abi.encodeWithSignature(\\\"log(address,bool,uint256)\\\", p0, p1, p2));\\n    }\\n\\n    function log(address p0, bool p1, string memory p2) internal pure {\\n        _sendLogPayload(abi.encodeWithSignature(\\\"log(address,bool,string)\\\", p0, p1, p2));\\n    }\\n\\n    function log(address p0, bool p1, bool p2) internal pure {\\n        _sendLogPayload(abi.encodeWithSignature(\\\"log(address,bool,bool)\\\", p0, p1, p2));\\n    }\\n\\n    function log(address p0, bool p1, address p2) internal pure {\\n        _sendLogPayload(abi.encodeWithSignature(\\\"log(address,bool,address)\\\", p0, p1, p2));\\n    }\\n\\n    function log(address p0, address p1, uint256 p2) internal pure {\\n        _sendLogPayload(abi.encodeWithSignature(\\\"log(address,address,uint256)\\\", p0, p1, p2));\\n    }\\n\\n    function log(address p0, address p1, string memory p2) internal pure {\\n        _sendLogPayload(abi.encodeWithSignature(\\\"log(address,address,string)\\\", p0, p1, p2));\\n    }\\n\\n    function log(address p0, address p1, bool p2) internal pure {\\n        _sendLogPayload(abi.encodeWithSignature(\\\"log(address,address,bool)\\\", p0, p1, p2));\\n    }\\n\\n    function log(address p0, address p1, address p2) internal pure {\\n        _sendLogPayload(abi.encodeWithSignature(\\\"log(address,address,address)\\\", p0, p1, p2));\\n    }\\n\\n    function log(uint256 p0, uint256 p1, uint256 p2, uint256 p3) internal pure {\\n        _sendLogPayload(abi.encodeWithSignature(\\\"log(uint256,uint256,uint256,uint256)\\\", p0, p1, p2, p3));\\n    }\\n\\n    function log(uint256 p0, uint256 p1, uint256 p2, string memory p3) internal pure {\\n        _sendLogPayload(abi.encodeWithSignature(\\\"log(uint256,uint256,uint256,string)\\\", p0, p1, p2, p3));\\n    }\\n\\n    function log(uint256 p0, uint256 p1, uint256 p2, bool p3) internal pure {\\n        _sendLogPayload(abi.encodeWithSignature(\\\"log(uint256,uint256,uint256,bool)\\\", p0, p1, p2, p3));\\n    }\\n\\n    function log(uint256 p0, uint256 p1, uint256 p2, address p3) internal pure {\\n        _sendLogPayload(abi.encodeWithSignature(\\\"log(uint256,uint256,uint256,address)\\\", p0, p1, p2, p3));\\n    }\\n\\n    function log(uint256 p0, uint256 p1, string memory p2, uint256 p3) internal pure {\\n        _sendLogPayload(abi.encodeWithSignature(\\\"log(uint256,uint256,string,uint256)\\\", p0, p1, p2, p3));\\n    }\\n\\n    function log(uint256 p0, uint256 p1, string memory p2, string memory p3) internal pure {\\n        _sendLogPayload(abi.encodeWithSignature(\\\"log(uint256,uint256,string,string)\\\", p0, p1, p2, p3));\\n    }\\n\\n    function log(uint256 p0, uint256 p1, string memory p2, bool p3) internal pure {\\n        _sendLogPayload(abi.encodeWithSignature(\\\"log(uint256,uint256,string,bool)\\\", p0, p1, p2, p3));\\n    }\\n\\n    function log(uint256 p0, uint256 p1, string memory p2, address p3) internal pure {\\n        _sendLogPayload(abi.encodeWithSignature(\\\"log(uint256,uint256,string,address)\\\", p0, p1, p2, p3));\\n    }\\n\\n    function log(uint256 p0, uint256 p1, bool p2, uint256 p3) internal pure {\\n        _sendLogPayload(abi.encodeWithSignature(\\\"log(uint256,uint256,bool,uint256)\\\", p0, p1, p2, p3));\\n    }\\n\\n    function log(uint256 p0, uint256 p1, bool p2, string memory p3) internal pure {\\n        _sendLogPayload(abi.encodeWithSignature(\\\"log(uint256,uint256,bool,string)\\\", p0, p1, p2, p3));\\n    }\\n\\n    function log(uint256 p0, uint256 p1, bool p2, bool p3) internal pure {\\n        _sendLogPayload(abi.encodeWithSignature(\\\"log(uint256,uint256,bool,bool)\\\", p0, p1, p2, p3));\\n    }\\n\\n    function log(uint256 p0, uint256 p1, bool p2, address p3) internal pure {\\n        _sendLogPayload(abi.encodeWithSignature(\\\"log(uint256,uint256,bool,address)\\\", p0, p1, p2, p3));\\n    }\\n\\n    function log(uint256 p0, uint256 p1, address p2, uint256 p3) internal pure {\\n        _sendLogPayload(abi.encodeWithSignature(\\\"log(uint256,uint256,address,uint256)\\\", p0, p1, p2, p3));\\n    }\\n\\n    function log(uint256 p0, uint256 p1, address p2, string memory p3) internal pure {\\n        _sendLogPayload(abi.encodeWithSignature(\\\"log(uint256,uint256,address,string)\\\", p0, p1, p2, p3));\\n    }\\n\\n    function log(uint256 p0, uint256 p1, address p2, bool p3) internal pure {\\n        _sendLogPayload(abi.encodeWithSignature(\\\"log(uint256,uint256,address,bool)\\\", p0, p1, p2, p3));\\n    }\\n\\n    function log(uint256 p0, uint256 p1, address p2, address p3) internal pure {\\n        _sendLogPayload(abi.encodeWithSignature(\\\"log(uint256,uint256,address,address)\\\", p0, p1, p2, p3));\\n    }\\n\\n    function log(uint256 p0, string memory p1, uint256 p2, uint256 p3) internal pure {\\n        _sendLogPayload(abi.encodeWithSignature(\\\"log(uint256,string,uint256,uint256)\\\", p0, p1, p2, p3));\\n    }\\n\\n    function log(uint256 p0, string memory p1, uint256 p2, string memory p3) internal pure {\\n        _sendLogPayload(abi.encodeWithSignature(\\\"log(uint256,string,uint256,string)\\\", p0, p1, p2, p3));\\n    }\\n\\n    function log(uint256 p0, string memory p1, uint256 p2, bool p3) internal pure {\\n        _sendLogPayload(abi.encodeWithSignature(\\\"log(uint256,string,uint256,bool)\\\", p0, p1, p2, p3));\\n    }\\n\\n    function log(uint256 p0, string memory p1, uint256 p2, address p3) internal pure {\\n        _sendLogPayload(abi.encodeWithSignature(\\\"log(uint256,string,uint256,address)\\\", p0, p1, p2, p3));\\n    }\\n\\n    function log(uint256 p0, string memory p1, string memory p2, uint256 p3) internal pure {\\n        _sendLogPayload(abi.encodeWithSignature(\\\"log(uint256,string,string,uint256)\\\", p0, p1, p2, p3));\\n    }\\n\\n    function log(uint256 p0, string memory p1, string memory p2, string memory p3) internal pure {\\n        _sendLogPayload(abi.encodeWithSignature(\\\"log(uint256,string,string,string)\\\", p0, p1, p2, p3));\\n    }\\n\\n    function log(uint256 p0, string memory p1, string memory p2, bool p3) internal pure {\\n        _sendLogPayload(abi.encodeWithSignature(\\\"log(uint256,string,string,bool)\\\", p0, p1, p2, p3));\\n    }\\n\\n    function log(uint256 p0, string memory p1, string memory p2, address p3) internal pure {\\n        _sendLogPayload(abi.encodeWithSignature(\\\"log(uint256,string,string,address)\\\", p0, p1, p2, p3));\\n    }\\n\\n    function log(uint256 p0, string memory p1, bool p2, uint256 p3) internal pure {\\n        _sendLogPayload(abi.encodeWithSignature(\\\"log(uint256,string,bool,uint256)\\\", p0, p1, p2, p3));\\n    }\\n\\n    function log(uint256 p0, string memory p1, bool p2, string memory p3) internal pure {\\n        _sendLogPayload(abi.encodeWithSignature(\\\"log(uint256,string,bool,string)\\\", p0, p1, p2, p3));\\n    }\\n\\n    function log(uint256 p0, string memory p1, bool p2, bool p3) internal pure {\\n        _sendLogPayload(abi.encodeWithSignature(\\\"log(uint256,string,bool,bool)\\\", p0, p1, p2, p3));\\n    }\\n\\n    function log(uint256 p0, string memory p1, bool p2, address p3) internal pure {\\n        _sendLogPayload(abi.encodeWithSignature(\\\"log(uint256,string,bool,address)\\\", p0, p1, p2, p3));\\n    }\\n\\n    function log(uint256 p0, string memory p1, address p2, uint256 p3) internal pure {\\n        _sendLogPayload(abi.encodeWithSignature(\\\"log(uint256,string,address,uint256)\\\", p0, p1, p2, p3));\\n    }\\n\\n    function log(uint256 p0, string memory p1, address p2, string memory p3) internal pure {\\n        _sendLogPayload(abi.encodeWithSignature(\\\"log(uint256,string,address,string)\\\", p0, p1, p2, p3));\\n    }\\n\\n    function log(uint256 p0, string memory p1, address p2, bool p3) internal pure {\\n        _sendLogPayload(abi.encodeWithSignature(\\\"log(uint256,string,address,bool)\\\", p0, p1, p2, p3));\\n    }\\n\\n    function log(uint256 p0, string memory p1, address p2, address p3) internal pure {\\n        _sendLogPayload(abi.encodeWithSignature(\\\"log(uint256,string,address,address)\\\", p0, p1, p2, p3));\\n    }\\n\\n    function log(uint256 p0, bool p1, uint256 p2, uint256 p3) internal pure {\\n        _sendLogPayload(abi.encodeWithSignature(\\\"log(uint256,bool,uint256,uint256)\\\", p0, p1, p2, p3));\\n    }\\n\\n    function log(uint256 p0, bool p1, uint256 p2, string memory p3) internal pure {\\n        _sendLogPayload(abi.encodeWithSignature(\\\"log(uint256,bool,uint256,string)\\\", p0, p1, p2, p3));\\n    }\\n\\n    function log(uint256 p0, bool p1, uint256 p2, bool p3) internal pure {\\n        _sendLogPayload(abi.encodeWithSignature(\\\"log(uint256,bool,uint256,bool)\\\", p0, p1, p2, p3));\\n    }\\n\\n    function log(uint256 p0, bool p1, uint256 p2, address p3) internal pure {\\n        _sendLogPayload(abi.encodeWithSignature(\\\"log(uint256,bool,uint256,address)\\\", p0, p1, p2, p3));\\n    }\\n\\n    function log(uint256 p0, bool p1, string memory p2, uint256 p3) internal pure {\\n        _sendLogPayload(abi.encodeWithSignature(\\\"log(uint256,bool,string,uint256)\\\", p0, p1, p2, p3));\\n    }\\n\\n    function log(uint256 p0, bool p1, string memory p2, string memory p3) internal pure {\\n        _sendLogPayload(abi.encodeWithSignature(\\\"log(uint256,bool,string,string)\\\", p0, p1, p2, p3));\\n    }\\n\\n    function log(uint256 p0, bool p1, string memory p2, bool p3) internal pure {\\n        _sendLogPayload(abi.encodeWithSignature(\\\"log(uint256,bool,string,bool)\\\", p0, p1, p2, p3));\\n    }\\n\\n    function log(uint256 p0, bool p1, string memory p2, address p3) internal pure {\\n        _sendLogPayload(abi.encodeWithSignature(\\\"log(uint256,bool,string,address)\\\", p0, p1, p2, p3));\\n    }\\n\\n    function log(uint256 p0, bool p1, bool p2, uint256 p3) internal pure {\\n        _sendLogPayload(abi.encodeWithSignature(\\\"log(uint256,bool,bool,uint256)\\\", p0, p1, p2, p3));\\n    }\\n\\n    function log(uint256 p0, bool p1, bool p2, string memory p3) internal pure {\\n        _sendLogPayload(abi.encodeWithSignature(\\\"log(uint256,bool,bool,string)\\\", p0, p1, p2, p3));\\n    }\\n\\n    function log(uint256 p0, bool p1, bool p2, bool p3) internal pure {\\n        _sendLogPayload(abi.encodeWithSignature(\\\"log(uint256,bool,bool,bool)\\\", p0, p1, p2, p3));\\n    }\\n\\n    function log(uint256 p0, bool p1, bool p2, address p3) internal pure {\\n        _sendLogPayload(abi.encodeWithSignature(\\\"log(uint256,bool,bool,address)\\\", p0, p1, p2, p3));\\n    }\\n\\n    function log(uint256 p0, bool p1, address p2, uint256 p3) internal pure {\\n        _sendLogPayload(abi.encodeWithSignature(\\\"log(uint256,bool,address,uint256)\\\", p0, p1, p2, p3));\\n    }\\n\\n    function log(uint256 p0, bool p1, address p2, string memory p3) internal pure {\\n        _sendLogPayload(abi.encodeWithSignature(\\\"log(uint256,bool,address,string)\\\", p0, p1, p2, p3));\\n    }\\n\\n    function log(uint256 p0, bool p1, address p2, bool p3) internal pure {\\n        _sendLogPayload(abi.encodeWithSignature(\\\"log(uint256,bool,address,bool)\\\", p0, p1, p2, p3));\\n    }\\n\\n    function log(uint256 p0, bool p1, address p2, address p3) internal pure {\\n        _sendLogPayload(abi.encodeWithSignature(\\\"log(uint256,bool,address,address)\\\", p0, p1, p2, p3));\\n    }\\n\\n    function log(uint256 p0, address p1, uint256 p2, uint256 p3) internal pure {\\n        _sendLogPayload(abi.encodeWithSignature(\\\"log(uint256,address,uint256,uint256)\\\", p0, p1, p2, p3));\\n    }\\n\\n    function log(uint256 p0, address p1, uint256 p2, string memory p3) internal pure {\\n        _sendLogPayload(abi.encodeWithSignature(\\\"log(uint256,address,uint256,string)\\\", p0, p1, p2, p3));\\n    }\\n\\n    function log(uint256 p0, address p1, uint256 p2, bool p3) internal pure {\\n        _sendLogPayload(abi.encodeWithSignature(\\\"log(uint256,address,uint256,bool)\\\", p0, p1, p2, p3));\\n    }\\n\\n    function log(uint256 p0, address p1, uint256 p2, address p3) internal pure {\\n        _sendLogPayload(abi.encodeWithSignature(\\\"log(uint256,address,uint256,address)\\\", p0, p1, p2, p3));\\n    }\\n\\n    function log(uint256 p0, address p1, string memory p2, uint256 p3) internal pure {\\n        _sendLogPayload(abi.encodeWithSignature(\\\"log(uint256,address,string,uint256)\\\", p0, p1, p2, p3));\\n    }\\n\\n    function log(uint256 p0, address p1, string memory p2, string memory p3) internal pure {\\n        _sendLogPayload(abi.encodeWithSignature(\\\"log(uint256,address,string,string)\\\", p0, p1, p2, p3));\\n    }\\n\\n    function log(uint256 p0, address p1, string memory p2, bool p3) internal pure {\\n        _sendLogPayload(abi.encodeWithSignature(\\\"log(uint256,address,string,bool)\\\", p0, p1, p2, p3));\\n    }\\n\\n    function log(uint256 p0, address p1, string memory p2, address p3) internal pure {\\n        _sendLogPayload(abi.encodeWithSignature(\\\"log(uint256,address,string,address)\\\", p0, p1, p2, p3));\\n    }\\n\\n    function log(uint256 p0, address p1, bool p2, uint256 p3) internal pure {\\n        _sendLogPayload(abi.encodeWithSignature(\\\"log(uint256,address,bool,uint256)\\\", p0, p1, p2, p3));\\n    }\\n\\n    function log(uint256 p0, address p1, bool p2, string memory p3) internal pure {\\n        _sendLogPayload(abi.encodeWithSignature(\\\"log(uint256,address,bool,string)\\\", p0, p1, p2, p3));\\n    }\\n\\n    function log(uint256 p0, address p1, bool p2, bool p3) internal pure {\\n        _sendLogPayload(abi.encodeWithSignature(\\\"log(uint256,address,bool,bool)\\\", p0, p1, p2, p3));\\n    }\\n\\n    function log(uint256 p0, address p1, bool p2, address p3) internal pure {\\n        _sendLogPayload(abi.encodeWithSignature(\\\"log(uint256,address,bool,address)\\\", p0, p1, p2, p3));\\n    }\\n\\n    function log(uint256 p0, address p1, address p2, uint256 p3) internal pure {\\n        _sendLogPayload(abi.encodeWithSignature(\\\"log(uint256,address,address,uint256)\\\", p0, p1, p2, p3));\\n    }\\n\\n    function log(uint256 p0, address p1, address p2, string memory p3) internal pure {\\n        _sendLogPayload(abi.encodeWithSignature(\\\"log(uint256,address,address,string)\\\", p0, p1, p2, p3));\\n    }\\n\\n    function log(uint256 p0, address p1, address p2, bool p3) internal pure {\\n        _sendLogPayload(abi.encodeWithSignature(\\\"log(uint256,address,address,bool)\\\", p0, p1, p2, p3));\\n    }\\n\\n    function log(uint256 p0, address p1, address p2, address p3) internal pure {\\n        _sendLogPayload(abi.encodeWithSignature(\\\"log(uint256,address,address,address)\\\", p0, p1, p2, p3));\\n    }\\n\\n    function log(string memory p0, uint256 p1, uint256 p2, uint256 p3) internal pure {\\n        _sendLogPayload(abi.encodeWithSignature(\\\"log(string,uint256,uint256,uint256)\\\", p0, p1, p2, p3));\\n    }\\n\\n    function log(string memory p0, uint256 p1, uint256 p2, string memory p3) internal pure {\\n        _sendLogPayload(abi.encodeWithSignature(\\\"log(string,uint256,uint256,string)\\\", p0, p1, p2, p3));\\n    }\\n\\n    function log(string memory p0, uint256 p1, uint256 p2, bool p3) internal pure {\\n        _sendLogPayload(abi.encodeWithSignature(\\\"log(string,uint256,uint256,bool)\\\", p0, p1, p2, p3));\\n    }\\n\\n    function log(string memory p0, uint256 p1, uint256 p2, address p3) internal pure {\\n        _sendLogPayload(abi.encodeWithSignature(\\\"log(string,uint256,uint256,address)\\\", p0, p1, p2, p3));\\n    }\\n\\n    function log(string memory p0, uint256 p1, string memory p2, uint256 p3) internal pure {\\n        _sendLogPayload(abi.encodeWithSignature(\\\"log(string,uint256,string,uint256)\\\", p0, p1, p2, p3));\\n    }\\n\\n    function log(string memory p0, uint256 p1, string memory p2, string memory p3) internal pure {\\n        _sendLogPayload(abi.encodeWithSignature(\\\"log(string,uint256,string,string)\\\", p0, p1, p2, p3));\\n    }\\n\\n    function log(string memory p0, uint256 p1, string memory p2, bool p3) internal pure {\\n        _sendLogPayload(abi.encodeWithSignature(\\\"log(string,uint256,string,bool)\\\", p0, p1, p2, p3));\\n    }\\n\\n    function log(string memory p0, uint256 p1, string memory p2, address p3) internal pure {\\n        _sendLogPayload(abi.encodeWithSignature(\\\"log(string,uint256,string,address)\\\", p0, p1, p2, p3));\\n    }\\n\\n    function log(string memory p0, uint256 p1, bool p2, uint256 p3) internal pure {\\n        _sendLogPayload(abi.encodeWithSignature(\\\"log(string,uint256,bool,uint256)\\\", p0, p1, p2, p3));\\n    }\\n\\n    function log(string memory p0, uint256 p1, bool p2, string memory p3) internal pure {\\n        _sendLogPayload(abi.encodeWithSignature(\\\"log(string,uint256,bool,string)\\\", p0, p1, p2, p3));\\n    }\\n\\n    function log(string memory p0, uint256 p1, bool p2, bool p3) internal pure {\\n        _sendLogPayload(abi.encodeWithSignature(\\\"log(string,uint256,bool,bool)\\\", p0, p1, p2, p3));\\n    }\\n\\n    function log(string memory p0, uint256 p1, bool p2, address p3) internal pure {\\n        _sendLogPayload(abi.encodeWithSignature(\\\"log(string,uint256,bool,address)\\\", p0, p1, p2, p3));\\n    }\\n\\n    function log(string memory p0, uint256 p1, address p2, uint256 p3) internal pure {\\n        _sendLogPayload(abi.encodeWithSignature(\\\"log(string,uint256,address,uint256)\\\", p0, p1, p2, p3));\\n    }\\n\\n    function log(string memory p0, uint256 p1, address p2, string memory p3) internal pure {\\n        _sendLogPayload(abi.encodeWithSignature(\\\"log(string,uint256,address,string)\\\", p0, p1, p2, p3));\\n    }\\n\\n    function log(string memory p0, uint256 p1, address p2, bool p3) internal pure {\\n        _sendLogPayload(abi.encodeWithSignature(\\\"log(string,uint256,address,bool)\\\", p0, p1, p2, p3));\\n    }\\n\\n    function log(string memory p0, uint256 p1, address p2, address p3) internal pure {\\n        _sendLogPayload(abi.encodeWithSignature(\\\"log(string,uint256,address,address)\\\", p0, p1, p2, p3));\\n    }\\n\\n    function log(string memory p0, string memory p1, uint256 p2, uint256 p3) internal pure {\\n        _sendLogPayload(abi.encodeWithSignature(\\\"log(string,string,uint256,uint256)\\\", p0, p1, p2, p3));\\n    }\\n\\n    function log(string memory p0, string memory p1, uint256 p2, string memory p3) internal pure {\\n        _sendLogPayload(abi.encodeWithSignature(\\\"log(string,string,uint256,string)\\\", p0, p1, p2, p3));\\n    }\\n\\n    function log(string memory p0, string memory p1, uint256 p2, bool p3) internal pure {\\n        _sendLogPayload(abi.encodeWithSignature(\\\"log(string,string,uint256,bool)\\\", p0, p1, p2, p3));\\n    }\\n\\n    function log(string memory p0, string memory p1, uint256 p2, address p3) internal pure {\\n        _sendLogPayload(abi.encodeWithSignature(\\\"log(string,string,uint256,address)\\\", p0, p1, p2, p3));\\n    }\\n\\n    function log(string memory p0, string memory p1, string memory p2, uint256 p3) internal pure {\\n        _sendLogPayload(abi.encodeWithSignature(\\\"log(string,string,string,uint256)\\\", p0, p1, p2, p3));\\n    }\\n\\n    function log(string memory p0, string memory p1, string memory p2, string memory p3) internal pure {\\n        _sendLogPayload(abi.encodeWithSignature(\\\"log(string,string,string,string)\\\", p0, p1, p2, p3));\\n    }\\n\\n    function log(string memory p0, string memory p1, string memory p2, bool p3) internal pure {\\n        _sendLogPayload(abi.encodeWithSignature(\\\"log(string,string,string,bool)\\\", p0, p1, p2, p3));\\n    }\\n\\n    function log(string memory p0, string memory p1, string memory p2, address p3) internal pure {\\n        _sendLogPayload(abi.encodeWithSignature(\\\"log(string,string,string,address)\\\", p0, p1, p2, p3));\\n    }\\n\\n    function log(string memory p0, string memory p1, bool p2, uint256 p3) internal pure {\\n        _sendLogPayload(abi.encodeWithSignature(\\\"log(string,string,bool,uint256)\\\", p0, p1, p2, p3));\\n    }\\n\\n    function log(string memory p0, string memory p1, bool p2, string memory p3) internal pure {\\n        _sendLogPayload(abi.encodeWithSignature(\\\"log(string,string,bool,string)\\\", p0, p1, p2, p3));\\n    }\\n\\n    function log(string memory p0, string memory p1, bool p2, bool p3) internal pure {\\n        _sendLogPayload(abi.encodeWithSignature(\\\"log(string,string,bool,bool)\\\", p0, p1, p2, p3));\\n    }\\n\\n    function log(string memory p0, string memory p1, bool p2, address p3) internal pure {\\n        _sendLogPayload(abi.encodeWithSignature(\\\"log(string,string,bool,address)\\\", p0, p1, p2, p3));\\n    }\\n\\n    function log(string memory p0, string memory p1, address p2, uint256 p3) internal pure {\\n        _sendLogPayload(abi.encodeWithSignature(\\\"log(string,string,address,uint256)\\\", p0, p1, p2, p3));\\n    }\\n\\n    function log(string memory p0, string memory p1, address p2, string memory p3) internal pure {\\n        _sendLogPayload(abi.encodeWithSignature(\\\"log(string,string,address,string)\\\", p0, p1, p2, p3));\\n    }\\n\\n    function log(string memory p0, string memory p1, address p2, bool p3) internal pure {\\n        _sendLogPayload(abi.encodeWithSignature(\\\"log(string,string,address,bool)\\\", p0, p1, p2, p3));\\n    }\\n\\n    function log(string memory p0, string memory p1, address p2, address p3) internal pure {\\n        _sendLogPayload(abi.encodeWithSignature(\\\"log(string,string,address,address)\\\", p0, p1, p2, p3));\\n    }\\n\\n    function log(string memory p0, bool p1, uint256 p2, uint256 p3) internal pure {\\n        _sendLogPayload(abi.encodeWithSignature(\\\"log(string,bool,uint256,uint256)\\\", p0, p1, p2, p3));\\n    }\\n\\n    function log(string memory p0, bool p1, uint256 p2, string memory p3) internal pure {\\n        _sendLogPayload(abi.encodeWithSignature(\\\"log(string,bool,uint256,string)\\\", p0, p1, p2, p3));\\n    }\\n\\n    function log(string memory p0, bool p1, uint256 p2, bool p3) internal pure {\\n        _sendLogPayload(abi.encodeWithSignature(\\\"log(string,bool,uint256,bool)\\\", p0, p1, p2, p3));\\n    }\\n\\n    function log(string memory p0, bool p1, uint256 p2, address p3) internal pure {\\n        _sendLogPayload(abi.encodeWithSignature(\\\"log(string,bool,uint256,address)\\\", p0, p1, p2, p3));\\n    }\\n\\n    function log(string memory p0, bool p1, string memory p2, uint256 p3) internal pure {\\n        _sendLogPayload(abi.encodeWithSignature(\\\"log(string,bool,string,uint256)\\\", p0, p1, p2, p3));\\n    }\\n\\n    function log(string memory p0, bool p1, string memory p2, string memory p3) internal pure {\\n        _sendLogPayload(abi.encodeWithSignature(\\\"log(string,bool,string,string)\\\", p0, p1, p2, p3));\\n    }\\n\\n    function log(string memory p0, bool p1, string memory p2, bool p3) internal pure {\\n        _sendLogPayload(abi.encodeWithSignature(\\\"log(string,bool,string,bool)\\\", p0, p1, p2, p3));\\n    }\\n\\n    function log(string memory p0, bool p1, string memory p2, address p3) internal pure {\\n        _sendLogPayload(abi.encodeWithSignature(\\\"log(string,bool,string,address)\\\", p0, p1, p2, p3));\\n    }\\n\\n    function log(string memory p0, bool p1, bool p2, uint256 p3) internal pure {\\n        _sendLogPayload(abi.encodeWithSignature(\\\"log(string,bool,bool,uint256)\\\", p0, p1, p2, p3));\\n    }\\n\\n    function log(string memory p0, bool p1, bool p2, string memory p3) internal pure {\\n        _sendLogPayload(abi.encodeWithSignature(\\\"log(string,bool,bool,string)\\\", p0, p1, p2, p3));\\n    }\\n\\n    function log(string memory p0, bool p1, bool p2, bool p3) internal pure {\\n        _sendLogPayload(abi.encodeWithSignature(\\\"log(string,bool,bool,bool)\\\", p0, p1, p2, p3));\\n    }\\n\\n    function log(string memory p0, bool p1, bool p2, address p3) internal pure {\\n        _sendLogPayload(abi.encodeWithSignature(\\\"log(string,bool,bool,address)\\\", p0, p1, p2, p3));\\n    }\\n\\n    function log(string memory p0, bool p1, address p2, uint256 p3) internal pure {\\n        _sendLogPayload(abi.encodeWithSignature(\\\"log(string,bool,address,uint256)\\\", p0, p1, p2, p3));\\n    }\\n\\n    function log(string memory p0, bool p1, address p2, string memory p3) internal pure {\\n        _sendLogPayload(abi.encodeWithSignature(\\\"log(string,bool,address,string)\\\", p0, p1, p2, p3));\\n    }\\n\\n    function log(string memory p0, bool p1, address p2, bool p3) internal pure {\\n        _sendLogPayload(abi.encodeWithSignature(\\\"log(string,bool,address,bool)\\\", p0, p1, p2, p3));\\n    }\\n\\n    function log(string memory p0, bool p1, address p2, address p3) internal pure {\\n        _sendLogPayload(abi.encodeWithSignature(\\\"log(string,bool,address,address)\\\", p0, p1, p2, p3));\\n    }\\n\\n    function log(string memory p0, address p1, uint256 p2, uint256 p3) internal pure {\\n        _sendLogPayload(abi.encodeWithSignature(\\\"log(string,address,uint256,uint256)\\\", p0, p1, p2, p3));\\n    }\\n\\n    function log(string memory p0, address p1, uint256 p2, string memory p3) internal pure {\\n        _sendLogPayload(abi.encodeWithSignature(\\\"log(string,address,uint256,string)\\\", p0, p1, p2, p3));\\n    }\\n\\n    function log(string memory p0, address p1, uint256 p2, bool p3) internal pure {\\n        _sendLogPayload(abi.encodeWithSignature(\\\"log(string,address,uint256,bool)\\\", p0, p1, p2, p3));\\n    }\\n\\n    function log(string memory p0, address p1, uint256 p2, address p3) internal pure {\\n        _sendLogPayload(abi.encodeWithSignature(\\\"log(string,address,uint256,address)\\\", p0, p1, p2, p3));\\n    }\\n\\n    function log(string memory p0, address p1, string memory p2, uint256 p3) internal pure {\\n        _sendLogPayload(abi.encodeWithSignature(\\\"log(string,address,string,uint256)\\\", p0, p1, p2, p3));\\n    }\\n\\n    function log(string memory p0, address p1, string memory p2, string memory p3) internal pure {\\n        _sendLogPayload(abi.encodeWithSignature(\\\"log(string,address,string,string)\\\", p0, p1, p2, p3));\\n    }\\n\\n    function log(string memory p0, address p1, string memory p2, bool p3) internal pure {\\n        _sendLogPayload(abi.encodeWithSignature(\\\"log(string,address,string,bool)\\\", p0, p1, p2, p3));\\n    }\\n\\n    function log(string memory p0, address p1, string memory p2, address p3) internal pure {\\n        _sendLogPayload(abi.encodeWithSignature(\\\"log(string,address,string,address)\\\", p0, p1, p2, p3));\\n    }\\n\\n    function log(string memory p0, address p1, bool p2, uint256 p3) internal pure {\\n        _sendLogPayload(abi.encodeWithSignature(\\\"log(string,address,bool,uint256)\\\", p0, p1, p2, p3));\\n    }\\n\\n    function log(string memory p0, address p1, bool p2, string memory p3) internal pure {\\n        _sendLogPayload(abi.encodeWithSignature(\\\"log(string,address,bool,string)\\\", p0, p1, p2, p3));\\n    }\\n\\n    function log(string memory p0, address p1, bool p2, bool p3) internal pure {\\n        _sendLogPayload(abi.encodeWithSignature(\\\"log(string,address,bool,bool)\\\", p0, p1, p2, p3));\\n    }\\n\\n    function log(string memory p0, address p1, bool p2, address p3) internal pure {\\n        _sendLogPayload(abi.encodeWithSignature(\\\"log(string,address,bool,address)\\\", p0, p1, p2, p3));\\n    }\\n\\n    function log(string memory p0, address p1, address p2, uint256 p3) internal pure {\\n        _sendLogPayload(abi.encodeWithSignature(\\\"log(string,address,address,uint256)\\\", p0, p1, p2, p3));\\n    }\\n\\n    function log(string memory p0, address p1, address p2, string memory p3) internal pure {\\n        _sendLogPayload(abi.encodeWithSignature(\\\"log(string,address,address,string)\\\", p0, p1, p2, p3));\\n    }\\n\\n    function log(string memory p0, address p1, address p2, bool p3) internal pure {\\n        _sendLogPayload(abi.encodeWithSignature(\\\"log(string,address,address,bool)\\\", p0, p1, p2, p3));\\n    }\\n\\n    function log(string memory p0, address p1, address p2, address p3) internal pure {\\n        _sendLogPayload(abi.encodeWithSignature(\\\"log(string,address,address,address)\\\", p0, p1, p2, p3));\\n    }\\n\\n    function log(bool p0, uint256 p1, uint256 p2, uint256 p3) internal pure {\\n        _sendLogPayload(abi.encodeWithSignature(\\\"log(bool,uint256,uint256,uint256)\\\", p0, p1, p2, p3));\\n    }\\n\\n    function log(bool p0, uint256 p1, uint256 p2, string memory p3) internal pure {\\n        _sendLogPayload(abi.encodeWithSignature(\\\"log(bool,uint256,uint256,string)\\\", p0, p1, p2, p3));\\n    }\\n\\n    function log(bool p0, uint256 p1, uint256 p2, bool p3) internal pure {\\n        _sendLogPayload(abi.encodeWithSignature(\\\"log(bool,uint256,uint256,bool)\\\", p0, p1, p2, p3));\\n    }\\n\\n    function log(bool p0, uint256 p1, uint256 p2, address p3) internal pure {\\n        _sendLogPayload(abi.encodeWithSignature(\\\"log(bool,uint256,uint256,address)\\\", p0, p1, p2, p3));\\n    }\\n\\n    function log(bool p0, uint256 p1, string memory p2, uint256 p3) internal pure {\\n        _sendLogPayload(abi.encodeWithSignature(\\\"log(bool,uint256,string,uint256)\\\", p0, p1, p2, p3));\\n    }\\n\\n    function log(bool p0, uint256 p1, string memory p2, string memory p3) internal pure {\\n        _sendLogPayload(abi.encodeWithSignature(\\\"log(bool,uint256,string,string)\\\", p0, p1, p2, p3));\\n    }\\n\\n    function log(bool p0, uint256 p1, string memory p2, bool p3) internal pure {\\n        _sendLogPayload(abi.encodeWithSignature(\\\"log(bool,uint256,string,bool)\\\", p0, p1, p2, p3));\\n    }\\n\\n    function log(bool p0, uint256 p1, string memory p2, address p3) internal pure {\\n        _sendLogPayload(abi.encodeWithSignature(\\\"log(bool,uint256,string,address)\\\", p0, p1, p2, p3));\\n    }\\n\\n    function log(bool p0, uint256 p1, bool p2, uint256 p3) internal pure {\\n        _sendLogPayload(abi.encodeWithSignature(\\\"log(bool,uint256,bool,uint256)\\\", p0, p1, p2, p3));\\n    }\\n\\n    function log(bool p0, uint256 p1, bool p2, string memory p3) internal pure {\\n        _sendLogPayload(abi.encodeWithSignature(\\\"log(bool,uint256,bool,string)\\\", p0, p1, p2, p3));\\n    }\\n\\n    function log(bool p0, uint256 p1, bool p2, bool p3) internal pure {\\n        _sendLogPayload(abi.encodeWithSignature(\\\"log(bool,uint256,bool,bool)\\\", p0, p1, p2, p3));\\n    }\\n\\n    function log(bool p0, uint256 p1, bool p2, address p3) internal pure {\\n        _sendLogPayload(abi.encodeWithSignature(\\\"log(bool,uint256,bool,address)\\\", p0, p1, p2, p3));\\n    }\\n\\n    function log(bool p0, uint256 p1, address p2, uint256 p3) internal pure {\\n        _sendLogPayload(abi.encodeWithSignature(\\\"log(bool,uint256,address,uint256)\\\", p0, p1, p2, p3));\\n    }\\n\\n    function log(bool p0, uint256 p1, address p2, string memory p3) internal pure {\\n        _sendLogPayload(abi.encodeWithSignature(\\\"log(bool,uint256,address,string)\\\", p0, p1, p2, p3));\\n    }\\n\\n    function log(bool p0, uint256 p1, address p2, bool p3) internal pure {\\n        _sendLogPayload(abi.encodeWithSignature(\\\"log(bool,uint256,address,bool)\\\", p0, p1, p2, p3));\\n    }\\n\\n    function log(bool p0, uint256 p1, address p2, address p3) internal pure {\\n        _sendLogPayload(abi.encodeWithSignature(\\\"log(bool,uint256,address,address)\\\", p0, p1, p2, p3));\\n    }\\n\\n    function log(bool p0, string memory p1, uint256 p2, uint256 p3) internal pure {\\n        _sendLogPayload(abi.encodeWithSignature(\\\"log(bool,string,uint256,uint256)\\\", p0, p1, p2, p3));\\n    }\\n\\n    function log(bool p0, string memory p1, uint256 p2, string memory p3) internal pure {\\n        _sendLogPayload(abi.encodeWithSignature(\\\"log(bool,string,uint256,string)\\\", p0, p1, p2, p3));\\n    }\\n\\n    function log(bool p0, string memory p1, uint256 p2, bool p3) internal pure {\\n        _sendLogPayload(abi.encodeWithSignature(\\\"log(bool,string,uint256,bool)\\\", p0, p1, p2, p3));\\n    }\\n\\n    function log(bool p0, string memory p1, uint256 p2, address p3) internal pure {\\n        _sendLogPayload(abi.encodeWithSignature(\\\"log(bool,string,uint256,address)\\\", p0, p1, p2, p3));\\n    }\\n\\n    function log(bool p0, string memory p1, string memory p2, uint256 p3) internal pure {\\n        _sendLogPayload(abi.encodeWithSignature(\\\"log(bool,string,string,uint256)\\\", p0, p1, p2, p3));\\n    }\\n\\n    function log(bool p0, string memory p1, string memory p2, string memory p3) internal pure {\\n        _sendLogPayload(abi.encodeWithSignature(\\\"log(bool,string,string,string)\\\", p0, p1, p2, p3));\\n    }\\n\\n    function log(bool p0, string memory p1, string memory p2, bool p3) internal pure {\\n        _sendLogPayload(abi.encodeWithSignature(\\\"log(bool,string,string,bool)\\\", p0, p1, p2, p3));\\n    }\\n\\n    function log(bool p0, string memory p1, string memory p2, address p3) internal pure {\\n        _sendLogPayload(abi.encodeWithSignature(\\\"log(bool,string,string,address)\\\", p0, p1, p2, p3));\\n    }\\n\\n    function log(bool p0, string memory p1, bool p2, uint256 p3) internal pure {\\n        _sendLogPayload(abi.encodeWithSignature(\\\"log(bool,string,bool,uint256)\\\", p0, p1, p2, p3));\\n    }\\n\\n    function log(bool p0, string memory p1, bool p2, string memory p3) internal pure {\\n        _sendLogPayload(abi.encodeWithSignature(\\\"log(bool,string,bool,string)\\\", p0, p1, p2, p3));\\n    }\\n\\n    function log(bool p0, string memory p1, bool p2, bool p3) internal pure {\\n        _sendLogPayload(abi.encodeWithSignature(\\\"log(bool,string,bool,bool)\\\", p0, p1, p2, p3));\\n    }\\n\\n    function log(bool p0, string memory p1, bool p2, address p3) internal pure {\\n        _sendLogPayload(abi.encodeWithSignature(\\\"log(bool,string,bool,address)\\\", p0, p1, p2, p3));\\n    }\\n\\n    function log(bool p0, string memory p1, address p2, uint256 p3) internal pure {\\n        _sendLogPayload(abi.encodeWithSignature(\\\"log(bool,string,address,uint256)\\\", p0, p1, p2, p3));\\n    }\\n\\n    function log(bool p0, string memory p1, address p2, string memory p3) internal pure {\\n        _sendLogPayload(abi.encodeWithSignature(\\\"log(bool,string,address,string)\\\", p0, p1, p2, p3));\\n    }\\n\\n    function log(bool p0, string memory p1, address p2, bool p3) internal pure {\\n        _sendLogPayload(abi.encodeWithSignature(\\\"log(bool,string,address,bool)\\\", p0, p1, p2, p3));\\n    }\\n\\n    function log(bool p0, string memory p1, address p2, address p3) internal pure {\\n        _sendLogPayload(abi.encodeWithSignature(\\\"log(bool,string,address,address)\\\", p0, p1, p2, p3));\\n    }\\n\\n    function log(bool p0, bool p1, uint256 p2, uint256 p3) internal pure {\\n        _sendLogPayload(abi.encodeWithSignature(\\\"log(bool,bool,uint256,uint256)\\\", p0, p1, p2, p3));\\n    }\\n\\n    function log(bool p0, bool p1, uint256 p2, string memory p3) internal pure {\\n        _sendLogPayload(abi.encodeWithSignature(\\\"log(bool,bool,uint256,string)\\\", p0, p1, p2, p3));\\n    }\\n\\n    function log(bool p0, bool p1, uint256 p2, bool p3) internal pure {\\n        _sendLogPayload(abi.encodeWithSignature(\\\"log(bool,bool,uint256,bool)\\\", p0, p1, p2, p3));\\n    }\\n\\n    function log(bool p0, bool p1, uint256 p2, address p3) internal pure {\\n        _sendLogPayload(abi.encodeWithSignature(\\\"log(bool,bool,uint256,address)\\\", p0, p1, p2, p3));\\n    }\\n\\n    function log(bool p0, bool p1, string memory p2, uint256 p3) internal pure {\\n        _sendLogPayload(abi.encodeWithSignature(\\\"log(bool,bool,string,uint256)\\\", p0, p1, p2, p3));\\n    }\\n\\n    function log(bool p0, bool p1, string memory p2, string memory p3) internal pure {\\n        _sendLogPayload(abi.encodeWithSignature(\\\"log(bool,bool,string,string)\\\", p0, p1, p2, p3));\\n    }\\n\\n    function log(bool p0, bool p1, string memory p2, bool p3) internal pure {\\n        _sendLogPayload(abi.encodeWithSignature(\\\"log(bool,bool,string,bool)\\\", p0, p1, p2, p3));\\n    }\\n\\n    function log(bool p0, bool p1, string memory p2, address p3) internal pure {\\n        _sendLogPayload(abi.encodeWithSignature(\\\"log(bool,bool,string,address)\\\", p0, p1, p2, p3));\\n    }\\n\\n    function log(bool p0, bool p1, bool p2, uint256 p3) internal pure {\\n        _sendLogPayload(abi.encodeWithSignature(\\\"log(bool,bool,bool,uint256)\\\", p0, p1, p2, p3));\\n    }\\n\\n    function log(bool p0, bool p1, bool p2, string memory p3) internal pure {\\n        _sendLogPayload(abi.encodeWithSignature(\\\"log(bool,bool,bool,string)\\\", p0, p1, p2, p3));\\n    }\\n\\n    function log(bool p0, bool p1, bool p2, bool p3) internal pure {\\n        _sendLogPayload(abi.encodeWithSignature(\\\"log(bool,bool,bool,bool)\\\", p0, p1, p2, p3));\\n    }\\n\\n    function log(bool p0, bool p1, bool p2, address p3) internal pure {\\n        _sendLogPayload(abi.encodeWithSignature(\\\"log(bool,bool,bool,address)\\\", p0, p1, p2, p3));\\n    }\\n\\n    function log(bool p0, bool p1, address p2, uint256 p3) internal pure {\\n        _sendLogPayload(abi.encodeWithSignature(\\\"log(bool,bool,address,uint256)\\\", p0, p1, p2, p3));\\n    }\\n\\n    function log(bool p0, bool p1, address p2, string memory p3) internal pure {\\n        _sendLogPayload(abi.encodeWithSignature(\\\"log(bool,bool,address,string)\\\", p0, p1, p2, p3));\\n    }\\n\\n    function log(bool p0, bool p1, address p2, bool p3) internal pure {\\n        _sendLogPayload(abi.encodeWithSignature(\\\"log(bool,bool,address,bool)\\\", p0, p1, p2, p3));\\n    }\\n\\n    function log(bool p0, bool p1, address p2, address p3) internal pure {\\n        _sendLogPayload(abi.encodeWithSignature(\\\"log(bool,bool,address,address)\\\", p0, p1, p2, p3));\\n    }\\n\\n    function log(bool p0, address p1, uint256 p2, uint256 p3) internal pure {\\n        _sendLogPayload(abi.encodeWithSignature(\\\"log(bool,address,uint256,uint256)\\\", p0, p1, p2, p3));\\n    }\\n\\n    function log(bool p0, address p1, uint256 p2, string memory p3) internal pure {\\n        _sendLogPayload(abi.encodeWithSignature(\\\"log(bool,address,uint256,string)\\\", p0, p1, p2, p3));\\n    }\\n\\n    function log(bool p0, address p1, uint256 p2, bool p3) internal pure {\\n        _sendLogPayload(abi.encodeWithSignature(\\\"log(bool,address,uint256,bool)\\\", p0, p1, p2, p3));\\n    }\\n\\n    function log(bool p0, address p1, uint256 p2, address p3) internal pure {\\n        _sendLogPayload(abi.encodeWithSignature(\\\"log(bool,address,uint256,address)\\\", p0, p1, p2, p3));\\n    }\\n\\n    function log(bool p0, address p1, string memory p2, uint256 p3) internal pure {\\n        _sendLogPayload(abi.encodeWithSignature(\\\"log(bool,address,string,uint256)\\\", p0, p1, p2, p3));\\n    }\\n\\n    function log(bool p0, address p1, string memory p2, string memory p3) internal pure {\\n        _sendLogPayload(abi.encodeWithSignature(\\\"log(bool,address,string,string)\\\", p0, p1, p2, p3));\\n    }\\n\\n    function log(bool p0, address p1, string memory p2, bool p3) internal pure {\\n        _sendLogPayload(abi.encodeWithSignature(\\\"log(bool,address,string,bool)\\\", p0, p1, p2, p3));\\n    }\\n\\n    function log(bool p0, address p1, string memory p2, address p3) internal pure {\\n        _sendLogPayload(abi.encodeWithSignature(\\\"log(bool,address,string,address)\\\", p0, p1, p2, p3));\\n    }\\n\\n    function log(bool p0, address p1, bool p2, uint256 p3) internal pure {\\n        _sendLogPayload(abi.encodeWithSignature(\\\"log(bool,address,bool,uint256)\\\", p0, p1, p2, p3));\\n    }\\n\\n    function log(bool p0, address p1, bool p2, string memory p3) internal pure {\\n        _sendLogPayload(abi.encodeWithSignature(\\\"log(bool,address,bool,string)\\\", p0, p1, p2, p3));\\n    }\\n\\n    function log(bool p0, address p1, bool p2, bool p3) internal pure {\\n        _sendLogPayload(abi.encodeWithSignature(\\\"log(bool,address,bool,bool)\\\", p0, p1, p2, p3));\\n    }\\n\\n    function log(bool p0, address p1, bool p2, address p3) internal pure {\\n        _sendLogPayload(abi.encodeWithSignature(\\\"log(bool,address,bool,address)\\\", p0, p1, p2, p3));\\n    }\\n\\n    function log(bool p0, address p1, address p2, uint256 p3) internal pure {\\n        _sendLogPayload(abi.encodeWithSignature(\\\"log(bool,address,address,uint256)\\\", p0, p1, p2, p3));\\n    }\\n\\n    function log(bool p0, address p1, address p2, string memory p3) internal pure {\\n        _sendLogPayload(abi.encodeWithSignature(\\\"log(bool,address,address,string)\\\", p0, p1, p2, p3));\\n    }\\n\\n    function log(bool p0, address p1, address p2, bool p3) internal pure {\\n        _sendLogPayload(abi.encodeWithSignature(\\\"log(bool,address,address,bool)\\\", p0, p1, p2, p3));\\n    }\\n\\n    function log(bool p0, address p1, address p2, address p3) internal pure {\\n        _sendLogPayload(abi.encodeWithSignature(\\\"log(bool,address,address,address)\\\", p0, p1, p2, p3));\\n    }\\n\\n    function log(address p0, uint256 p1, uint256 p2, uint256 p3) internal pure {\\n        _sendLogPayload(abi.encodeWithSignature(\\\"log(address,uint256,uint256,uint256)\\\", p0, p1, p2, p3));\\n    }\\n\\n    function log(address p0, uint256 p1, uint256 p2, string memory p3) internal pure {\\n        _sendLogPayload(abi.encodeWithSignature(\\\"log(address,uint256,uint256,string)\\\", p0, p1, p2, p3));\\n    }\\n\\n    function log(address p0, uint256 p1, uint256 p2, bool p3) internal pure {\\n        _sendLogPayload(abi.encodeWithSignature(\\\"log(address,uint256,uint256,bool)\\\", p0, p1, p2, p3));\\n    }\\n\\n    function log(address p0, uint256 p1, uint256 p2, address p3) internal pure {\\n        _sendLogPayload(abi.encodeWithSignature(\\\"log(address,uint256,uint256,address)\\\", p0, p1, p2, p3));\\n    }\\n\\n    function log(address p0, uint256 p1, string memory p2, uint256 p3) internal pure {\\n        _sendLogPayload(abi.encodeWithSignature(\\\"log(address,uint256,string,uint256)\\\", p0, p1, p2, p3));\\n    }\\n\\n    function log(address p0, uint256 p1, string memory p2, string memory p3) internal pure {\\n        _sendLogPayload(abi.encodeWithSignature(\\\"log(address,uint256,string,string)\\\", p0, p1, p2, p3));\\n    }\\n\\n    function log(address p0, uint256 p1, string memory p2, bool p3) internal pure {\\n        _sendLogPayload(abi.encodeWithSignature(\\\"log(address,uint256,string,bool)\\\", p0, p1, p2, p3));\\n    }\\n\\n    function log(address p0, uint256 p1, string memory p2, address p3) internal pure {\\n        _sendLogPayload(abi.encodeWithSignature(\\\"log(address,uint256,string,address)\\\", p0, p1, p2, p3));\\n    }\\n\\n    function log(address p0, uint256 p1, bool p2, uint256 p3) internal pure {\\n        _sendLogPayload(abi.encodeWithSignature(\\\"log(address,uint256,bool,uint256)\\\", p0, p1, p2, p3));\\n    }\\n\\n    function log(address p0, uint256 p1, bool p2, string memory p3) internal pure {\\n        _sendLogPayload(abi.encodeWithSignature(\\\"log(address,uint256,bool,string)\\\", p0, p1, p2, p3));\\n    }\\n\\n    function log(address p0, uint256 p1, bool p2, bool p3) internal pure {\\n        _sendLogPayload(abi.encodeWithSignature(\\\"log(address,uint256,bool,bool)\\\", p0, p1, p2, p3));\\n    }\\n\\n    function log(address p0, uint256 p1, bool p2, address p3) internal pure {\\n        _sendLogPayload(abi.encodeWithSignature(\\\"log(address,uint256,bool,address)\\\", p0, p1, p2, p3));\\n    }\\n\\n    function log(address p0, uint256 p1, address p2, uint256 p3) internal pure {\\n        _sendLogPayload(abi.encodeWithSignature(\\\"log(address,uint256,address,uint256)\\\", p0, p1, p2, p3));\\n    }\\n\\n    function log(address p0, uint256 p1, address p2, string memory p3) internal pure {\\n        _sendLogPayload(abi.encodeWithSignature(\\\"log(address,uint256,address,string)\\\", p0, p1, p2, p3));\\n    }\\n\\n    function log(address p0, uint256 p1, address p2, bool p3) internal pure {\\n        _sendLogPayload(abi.encodeWithSignature(\\\"log(address,uint256,address,bool)\\\", p0, p1, p2, p3));\\n    }\\n\\n    function log(address p0, uint256 p1, address p2, address p3) internal pure {\\n        _sendLogPayload(abi.encodeWithSignature(\\\"log(address,uint256,address,address)\\\", p0, p1, p2, p3));\\n    }\\n\\n    function log(address p0, string memory p1, uint256 p2, uint256 p3) internal pure {\\n        _sendLogPayload(abi.encodeWithSignature(\\\"log(address,string,uint256,uint256)\\\", p0, p1, p2, p3));\\n    }\\n\\n    function log(address p0, string memory p1, uint256 p2, string memory p3) internal pure {\\n        _sendLogPayload(abi.encodeWithSignature(\\\"log(address,string,uint256,string)\\\", p0, p1, p2, p3));\\n    }\\n\\n    function log(address p0, string memory p1, uint256 p2, bool p3) internal pure {\\n        _sendLogPayload(abi.encodeWithSignature(\\\"log(address,string,uint256,bool)\\\", p0, p1, p2, p3));\\n    }\\n\\n    function log(address p0, string memory p1, uint256 p2, address p3) internal pure {\\n        _sendLogPayload(abi.encodeWithSignature(\\\"log(address,string,uint256,address)\\\", p0, p1, p2, p3));\\n    }\\n\\n    function log(address p0, string memory p1, string memory p2, uint256 p3) internal pure {\\n        _sendLogPayload(abi.encodeWithSignature(\\\"log(address,string,string,uint256)\\\", p0, p1, p2, p3));\\n    }\\n\\n    function log(address p0, string memory p1, string memory p2, string memory p3) internal pure {\\n        _sendLogPayload(abi.encodeWithSignature(\\\"log(address,string,string,string)\\\", p0, p1, p2, p3));\\n    }\\n\\n    function log(address p0, string memory p1, string memory p2, bool p3) internal pure {\\n        _sendLogPayload(abi.encodeWithSignature(\\\"log(address,string,string,bool)\\\", p0, p1, p2, p3));\\n    }\\n\\n    function log(address p0, string memory p1, string memory p2, address p3) internal pure {\\n        _sendLogPayload(abi.encodeWithSignature(\\\"log(address,string,string,address)\\\", p0, p1, p2, p3));\\n    }\\n\\n    function log(address p0, string memory p1, bool p2, uint256 p3) internal pure {\\n        _sendLogPayload(abi.encodeWithSignature(\\\"log(address,string,bool,uint256)\\\", p0, p1, p2, p3));\\n    }\\n\\n    function log(address p0, string memory p1, bool p2, string memory p3) internal pure {\\n        _sendLogPayload(abi.encodeWithSignature(\\\"log(address,string,bool,string)\\\", p0, p1, p2, p3));\\n    }\\n\\n    function log(address p0, string memory p1, bool p2, bool p3) internal pure {\\n        _sendLogPayload(abi.encodeWithSignature(\\\"log(address,string,bool,bool)\\\", p0, p1, p2, p3));\\n    }\\n\\n    function log(address p0, string memory p1, bool p2, address p3) internal pure {\\n        _sendLogPayload(abi.encodeWithSignature(\\\"log(address,string,bool,address)\\\", p0, p1, p2, p3));\\n    }\\n\\n    function log(address p0, string memory p1, address p2, uint256 p3) internal pure {\\n        _sendLogPayload(abi.encodeWithSignature(\\\"log(address,string,address,uint256)\\\", p0, p1, p2, p3));\\n    }\\n\\n    function log(address p0, string memory p1, address p2, string memory p3) internal pure {\\n        _sendLogPayload(abi.encodeWithSignature(\\\"log(address,string,address,string)\\\", p0, p1, p2, p3));\\n    }\\n\\n    function log(address p0, string memory p1, address p2, bool p3) internal pure {\\n        _sendLogPayload(abi.encodeWithSignature(\\\"log(address,string,address,bool)\\\", p0, p1, p2, p3));\\n    }\\n\\n    function log(address p0, string memory p1, address p2, address p3) internal pure {\\n        _sendLogPayload(abi.encodeWithSignature(\\\"log(address,string,address,address)\\\", p0, p1, p2, p3));\\n    }\\n\\n    function log(address p0, bool p1, uint256 p2, uint256 p3) internal pure {\\n        _sendLogPayload(abi.encodeWithSignature(\\\"log(address,bool,uint256,uint256)\\\", p0, p1, p2, p3));\\n    }\\n\\n    function log(address p0, bool p1, uint256 p2, string memory p3) internal pure {\\n        _sendLogPayload(abi.encodeWithSignature(\\\"log(address,bool,uint256,string)\\\", p0, p1, p2, p3));\\n    }\\n\\n    function log(address p0, bool p1, uint256 p2, bool p3) internal pure {\\n        _sendLogPayload(abi.encodeWithSignature(\\\"log(address,bool,uint256,bool)\\\", p0, p1, p2, p3));\\n    }\\n\\n    function log(address p0, bool p1, uint256 p2, address p3) internal pure {\\n        _sendLogPayload(abi.encodeWithSignature(\\\"log(address,bool,uint256,address)\\\", p0, p1, p2, p3));\\n    }\\n\\n    function log(address p0, bool p1, string memory p2, uint256 p3) internal pure {\\n        _sendLogPayload(abi.encodeWithSignature(\\\"log(address,bool,string,uint256)\\\", p0, p1, p2, p3));\\n    }\\n\\n    function log(address p0, bool p1, string memory p2, string memory p3) internal pure {\\n        _sendLogPayload(abi.encodeWithSignature(\\\"log(address,bool,string,string)\\\", p0, p1, p2, p3));\\n    }\\n\\n    function log(address p0, bool p1, string memory p2, bool p3) internal pure {\\n        _sendLogPayload(abi.encodeWithSignature(\\\"log(address,bool,string,bool)\\\", p0, p1, p2, p3));\\n    }\\n\\n    function log(address p0, bool p1, string memory p2, address p3) internal pure {\\n        _sendLogPayload(abi.encodeWithSignature(\\\"log(address,bool,string,address)\\\", p0, p1, p2, p3));\\n    }\\n\\n    function log(address p0, bool p1, bool p2, uint256 p3) internal pure {\\n        _sendLogPayload(abi.encodeWithSignature(\\\"log(address,bool,bool,uint256)\\\", p0, p1, p2, p3));\\n    }\\n\\n    function log(address p0, bool p1, bool p2, string memory p3) internal pure {\\n        _sendLogPayload(abi.encodeWithSignature(\\\"log(address,bool,bool,string)\\\", p0, p1, p2, p3));\\n    }\\n\\n    function log(address p0, bool p1, bool p2, bool p3) internal pure {\\n        _sendLogPayload(abi.encodeWithSignature(\\\"log(address,bool,bool,bool)\\\", p0, p1, p2, p3));\\n    }\\n\\n    function log(address p0, bool p1, bool p2, address p3) internal pure {\\n        _sendLogPayload(abi.encodeWithSignature(\\\"log(address,bool,bool,address)\\\", p0, p1, p2, p3));\\n    }\\n\\n    function log(address p0, bool p1, address p2, uint256 p3) internal pure {\\n        _sendLogPayload(abi.encodeWithSignature(\\\"log(address,bool,address,uint256)\\\", p0, p1, p2, p3));\\n    }\\n\\n    function log(address p0, bool p1, address p2, string memory p3) internal pure {\\n        _sendLogPayload(abi.encodeWithSignature(\\\"log(address,bool,address,string)\\\", p0, p1, p2, p3));\\n    }\\n\\n    function log(address p0, bool p1, address p2, bool p3) internal pure {\\n        _sendLogPayload(abi.encodeWithSignature(\\\"log(address,bool,address,bool)\\\", p0, p1, p2, p3));\\n    }\\n\\n    function log(address p0, bool p1, address p2, address p3) internal pure {\\n        _sendLogPayload(abi.encodeWithSignature(\\\"log(address,bool,address,address)\\\", p0, p1, p2, p3));\\n    }\\n\\n    function log(address p0, address p1, uint256 p2, uint256 p3) internal pure {\\n        _sendLogPayload(abi.encodeWithSignature(\\\"log(address,address,uint256,uint256)\\\", p0, p1, p2, p3));\\n    }\\n\\n    function log(address p0, address p1, uint256 p2, string memory p3) internal pure {\\n        _sendLogPayload(abi.encodeWithSignature(\\\"log(address,address,uint256,string)\\\", p0, p1, p2, p3));\\n    }\\n\\n    function log(address p0, address p1, uint256 p2, bool p3) internal pure {\\n        _sendLogPayload(abi.encodeWithSignature(\\\"log(address,address,uint256,bool)\\\", p0, p1, p2, p3));\\n    }\\n\\n    function log(address p0, address p1, uint256 p2, address p3) internal pure {\\n        _sendLogPayload(abi.encodeWithSignature(\\\"log(address,address,uint256,address)\\\", p0, p1, p2, p3));\\n    }\\n\\n    function log(address p0, address p1, string memory p2, uint256 p3) internal pure {\\n        _sendLogPayload(abi.encodeWithSignature(\\\"log(address,address,string,uint256)\\\", p0, p1, p2, p3));\\n    }\\n\\n    function log(address p0, address p1, string memory p2, string memory p3) internal pure {\\n        _sendLogPayload(abi.encodeWithSignature(\\\"log(address,address,string,string)\\\", p0, p1, p2, p3));\\n    }\\n\\n    function log(address p0, address p1, string memory p2, bool p3) internal pure {\\n        _sendLogPayload(abi.encodeWithSignature(\\\"log(address,address,string,bool)\\\", p0, p1, p2, p3));\\n    }\\n\\n    function log(address p0, address p1, string memory p2, address p3) internal pure {\\n        _sendLogPayload(abi.encodeWithSignature(\\\"log(address,address,string,address)\\\", p0, p1, p2, p3));\\n    }\\n\\n    function log(address p0, address p1, bool p2, uint256 p3) internal pure {\\n        _sendLogPayload(abi.encodeWithSignature(\\\"log(address,address,bool,uint256)\\\", p0, p1, p2, p3));\\n    }\\n\\n    function log(address p0, address p1, bool p2, string memory p3) internal pure {\\n        _sendLogPayload(abi.encodeWithSignature(\\\"log(address,address,bool,string)\\\", p0, p1, p2, p3));\\n    }\\n\\n    function log(address p0, address p1, bool p2, bool p3) internal pure {\\n        _sendLogPayload(abi.encodeWithSignature(\\\"log(address,address,bool,bool)\\\", p0, p1, p2, p3));\\n    }\\n\\n    function log(address p0, address p1, bool p2, address p3) internal pure {\\n        _sendLogPayload(abi.encodeWithSignature(\\\"log(address,address,bool,address)\\\", p0, p1, p2, p3));\\n    }\\n\\n    function log(address p0, address p1, address p2, uint256 p3) internal pure {\\n        _sendLogPayload(abi.encodeWithSignature(\\\"log(address,address,address,uint256)\\\", p0, p1, p2, p3));\\n    }\\n\\n    function log(address p0, address p1, address p2, string memory p3) internal pure {\\n        _sendLogPayload(abi.encodeWithSignature(\\\"log(address,address,address,string)\\\", p0, p1, p2, p3));\\n    }\\n\\n    function log(address p0, address p1, address p2, bool p3) internal pure {\\n        _sendLogPayload(abi.encodeWithSignature(\\\"log(address,address,address,bool)\\\", p0, p1, p2, p3));\\n    }\\n\\n    function log(address p0, address p1, address p2, address p3) internal pure {\\n        _sendLogPayload(abi.encodeWithSignature(\\\"log(address,address,address,address)\\\", p0, p1, p2, p3));\\n    }\\n\\n}\\n\",\"keccak256\":\"0x7434453e6d3b7d0e5d0eb7846ffdbc27f0ccf3b163591263739b628074dc103a\",\"license\":\"MIT\"}},\"version\":1}",
  "bytecode": "0x60806040523480156200001157600080fd5b506200001d3362000023565b62000075565b600380546001600160a01b038381166001600160a01b0319831681179093556040519116919082907f8be0079c531659141344cd1fd0a4f28419497f9722a3daafe3b4186f6b6457e090600090a35050565b615f1480620000856000396000f3fe608060405234801561001057600080fd5b50600436106104d85760003560e01c8063807d138d11610283578063bb6f030c1161015c578063d5b35635116100ce578063e2ac77b011610092578063e2ac77b014610ae3578063e324634914610af6578063f2fde38b14610aff578063f92d3433146105ff578063fb0cbd4b14610b12578063fe2ba84814610b2157600080fd5b8063d5b3563514610a79578063d66a255314610a8c578063d696629714610ab5578063d9a7244414610ac8578063e1f787e914610adb57600080fd5b8063c35bc55011610120578063c35bc55014610a24578063c3eb5c6714610a2e578063c91a7e2f14610a37578063cbd138ae14610a40578063d293c71014610a53578063d3d6f84314610a6657600080fd5b8063bb6f030c146109ed578063bcd37526146109f6578063bf9befb114610a09578063bf9ebee214610a12578063c26c880014610a1b57600080fd5b8063a2014152116101f5578063aead9dcc116101b9578063aead9dcc1461095b578063b0d8e1811461096e578063b36cd07f14610981578063b7f8cf9b14610994578063b82f263d146109a7578063b91af97c146109ba57600080fd5b8063a2014152146108f4578063a20baee6146105f0578063a22b7d68146108fd578063a3f4df7e14610910578063ae9187541461094857600080fd5b8063900e664b11610247578063900e664b14610896578063948ba6d21461089f57806396d711ff146108b2578063981c4f48146108bb5780639976cf45146108ce5780639f7adb5e146108e157600080fd5b8063807d138d1461084e57806382fe3eb914610857578063887105d31461086a5780638da5cb5b146108725780638f9137891461088357600080fd5b80634e443d9e116103b5578063715018a611610327578063756b253e116102eb578063756b253e146107fe578063794e5724146106d8578063795d26c3146108115780637985c5e4146108195780637e024ad61461082c5780637f7dde4a1461083b57600080fd5b8063715018a6146107c857806371f256e2146107d057806372423c17146107d857806372fe25aa146105f0578063741bef1a146107eb57600080fd5b80635dba4c4a116103795780635dba4c4a1461070d57806361ec893d14610715578063631203b01461071d57806364cee26014610730578063653d46e71461075c5780636ef643381461076f57600080fd5b80634e443d9e146106a2578063570dc45e146106c55780635733d58f146106d857806358b8a5d6146106e75780635d6b480f146106fa57600080fd5b806321e378011161044e5780633cc74225116104125780633cc742251461062d57806347142aa314610640578063477d66cf14610653578063480cd578146106665780634870dd9a1461069257806349eefeee1461069a57600080fd5b806321e37801146105dd57806324092669146105f057806328d28b5b146105ff5780632d81dd56146106075780632f8655681461061a57600080fd5b806315d549f1116104a057806315d549f1146105575780631673c79a1461056a57806318f2817a146105a65780631b199a64146105b95780631bf43555146105c25780631e8b1c2b146105ca57600080fd5b8063048c661d146104dd578063071a7541146105065780630b0765571461051c5780630c08ff5f1461053157806312610e9214610544575b600080fd5b6005546104f0906001600160a01b031681565b6040516104fd91906158dc565b60405180910390f35b61050e600281565b6040519081526020016104fd565b61052f61052a366004615915565b610b34565b005b61050e61053f366004615915565b610b5c565b61050e610552366004615932565b610c18565b61050e610565366004615915565b610c6a565b610591610578366004615915565b6016602052600090815260409020805460019091015482565b604080519283526020830191909152016104fd565b61050e6105b4366004615915565b610c8c565b61050e60195481565b61050e600181565b61052f6105d8366004615974565b610c9f565b61050e6105eb366004615915565b611041565b61050e670de0b6b3a764000081565b61050e611071565b61050e610615366004615a39565b611093565b61052f610628366004615915565b6110b3565b6001546104f0906001600160a01b031681565b61050e61064e366004615a39565b61111f565b61050e610661366004615a5b565b611137565b61050e610674366004615915565b6001600160a01b031660009081526010602052604090206001015490565b61050e60c881565b60175461050e565b6106b56106b0366004615a5b565b61114b565b60405190151581526020016104fd565b6009546104f0906001600160a01b031681565b61050e6714d1120d7b16000081565b61050e6106f5366004615a5b565b611156565b61052f610708366004615932565b611164565b61052f6111bc565b61050e603c81565b61059161072b366004615a5b565b61129c565b61050e61073e366004615915565b6001600160a01b031660009081526010602052604090206002015490565b61052f61076a366004615a5b565b6112bf565b6107b761077d366004615915565b60106020526000908152604090208054600182015460028301546003909301549192909160ff81169061010090046001600160801b031685565b6040516104fd959493929190615a8a565b61052f611630565b6106b5611644565b61050e6107e6366004615932565b6116ca565b6002546104f0906001600160a01b031681565b6104f061080c366004615a5b565b611721565b61050e61174b565b61052f610827366004615ad0565b611847565b61050e670ddd4b8c6c7d70d881565b6000546104f0906001600160a01b031681565b61050e60125481565b61052f610865366004615915565b611bc3565b61050e611bd4565b6003546001600160a01b03166104f0565b6008546104f0906001600160a01b031681565b61050e60155481565b61050e6108ad366004615a5b565b611c99565b61050e60135481565b61050e6108c9366004615915565b611cac565b61050e6108dc366004615932565b611cd4565b61052f6108ef366004615a5b565b611d01565b61050e61c35081565b61050e61090b366004615a5b565b611e06565b61093b6040518060400160405280600c81526020016b2a3937bb32a6b0b730b3b2b960a11b81525081565b6040516104fd9190615bf4565b600b546104f0906001600160a01b031681565b600a546104f0906001600160a01b031681565b61050e61097c366004615915565b611e19565b61050e61098f366004615a5b565b611e40565b6004546104f0906001600160a01b031681565b61050e6109b5366004615a5b565b611e4e565b6109cd6109c8366004615915565b611e59565b6040805194855260208501939093529183015260608201526080016104fd565b61050e600c5481565b61052f610a04366004615c07565b611eb1565b61050e60115481565b61050e60145481565b61050e600f5481565b61050e6212750081565b61050e600d5481565b61050e60185481565b61052f610a4e366004615915565b6126a9565b61050e610a61366004615932565b6126bc565b61050e610a74366004615932565b6126db565b61050e610a87366004615a5b565b61270b565b61050e610a9a366004615915565b6001600160a01b031660009081526010602052604090205490565b61050e610ac3366004615915565b61271f565b6104f0610ad6366004615a5b565b6127b8565b61050e6127e8565b6106b5610af1366004615915565b612869565b61050e600e5481565b61052f610b0d366004615915565b6128cc565b61050e670dc14847bcc53b2081565b61052f610b2f366004615915565b612942565b610b3c612953565b600054600154610b59916001600160a01b039081169116836129d3565b50565b6001600160a01b0381166000908152601660205260408120600101546015548290610b879083612ad9565b9050801580610bc6575060016001600160a01b03851660009081526010602052604090206003015460ff166004811115610bc357610bc3615a74565b14155b15610bd5575060009392505050565b6001600160a01b03841660009081526010602052604081206002015490610c0e670de0b6b3a7640000610c088486612aec565b90612af8565b9695505050505050565b6000610c22612953565b6001600160a01b038316600090815260106020526040812054610c459084612ad9565b6001600160a01b03851660009081526010602052604090208190559150505b92915050565b6000610c74612953565b610c7d82612b04565b6001600160801b031692915050565b6000610c96612953565b610c6482612b9e565b8051600003610d145760405162461bcd60e51b815260206004820152603660248201527f54726f76654d616e616765723a2043616c6c646174612061646472657373206160448201527572726179206d757374206e6f7420626520656d70747960501b60648201526084015b60405180910390fd5b6000546001546005546001600160a01b03928316929182169116610d36615817565b610d3e615848565b600260009054906101000a90046001600160a01b03166001600160a01b0316630fdb11cf6040518163ffffffff1660e01b81526004016020604051808303816000875af1158015610d93573d6000803e3d6000fd5b505050506040513d601f19601f82011682018060405250810190610db79190615c75565b826000018181525050826001600160a01b031663488df0fc6040518163ffffffff1660e01b8152600401602060405180830381865afa158015610dfe573d6000803e3d6000fd5b505050506040513d601f19601f82011682018060405250810190610e229190615c75565b60208301528151610e3290612c42565b1580156040840152610e5a57610e538585846000015185602001518a612c5f565b9050610e72565b610e6f8585846000015185602001518a612e86565b90505b6000816020015111610e965760405162461bcd60e51b8152600401610d0b90615c8e565b608081015160a082015160405163335525ad60e01b81526001600160a01b0386169263335525ad92610ed392600401918252602082015260400190565b600060405180830381600087803b158015610eed57600080fd5b505af1158015610f01573d6000803e3d6000fd5b50505050610f1985858360c001518460e00151612f56565b61010081015115610f905760075461010082015160405163a51ba3b760e01b81526001600160a01b038881169363a51ba3b793610f5d939290911691600401615cd0565b600060405180830381600087803b158015610f7757600080fd5b505af1158015610f8b573d6000803e3d6000fd5b505050505b610f9e858260400151613191565b6020810151606083015261010081015160408201518251610fca9291610fc49190612ad9565b90612ad9565b6080838101829052606080850151604085810151868401518251938452602084019690965290820152908101929092527f4152c73dd2614c4f9fc35e8c9cf16013cd588c75b49a4c1673ecffdcbcda9403910160405180910390a16110398533836060015184604001516132d5565b505050505050565b6001600160a01b03811660009081526010602052604081206003015460ff166004811115610c6457610c64615a74565b6110856103e8670de0b6b3a7640000615d15565b611090906005615d29565b81565b6000806110ab84846014670de0b6b3a76400006133b8565b949350505050565b6110bc816134c3565b6040805160018082528183019092526000916020808301908036833701905050905081816000815181106110f2576110f2615d40565b60200260200101906001600160a01b031690816001600160a01b03168152505061111b81610c9f565b5050565b6000806110ab848460146714d1120d7b1600006133b8565b6000610c6461114583611c99565b8361355a565b6000610c6482612c42565b6000610c64600c5483613572565b61116c612953565b80600481111561117e5761117e615a74565b6001600160a01b0383166000908152601060205260409020600301805460ff191660018360048111156111b3576111b3615a74565b02179055505050565b6111c4612953565b6112006040518060400160405280601881526020017702120a9a2902920aa22902122a327a922902222a1a0ac9d160451b815250600d546136cf565b600061120a613714565b9050670de0b6b3a764000081111561122457611224615d56565b600d81905560408051808201909152601781527602120a9a2902920aa229020a32a22a9102222a1a0ac9d1604d1b602082015261126190826136cf565b6040518181527fca870d46d67e9a1444a6b8f97a147e06e4cf71ee2a0f172d7ecd5441ae7c12019060200160405180910390a1610b5961378a565b60008060006112aa84611e40565b90506112b6818561355a565b94909350915050565b6040805160e081018252600080546001600160a01b0390811683526001548116602084015292820181905260608201819052600b548316608083015260a0820181905260c0820152600554909116611315615817565b61131d615848565b600260009054906101000a90046001600160a01b03166001600160a01b0316630fdb11cf6040518163ffffffff1660e01b81526004016020604051808303816000875af1158015611372573d6000803e3d6000fd5b505050506040513d601f19601f820116820180604052508101906113969190615c75565b826000018181525050826001600160a01b031663488df0fc6040518163ffffffff1660e01b8152600401602060405180830381865afa1580156113dd573d6000803e3d6000fd5b505050506040513d601f19601f820116820180604052508101906114019190615c75565b6020830152815161141190612c42565b1580156040840152611438576114318483600001518460200151886137e1565b9050611458565b611455846000015185602001518460000151856020015189613b5f565b90505b600081602001511161147c5760405162461bcd60e51b8152600401610d0b90615c8e565b608081015160a082015160405163335525ad60e01b81526001600160a01b0386169263335525ad926114b992600401918252602082015260400190565b600060405180830381600087803b1580156114d357600080fd5b505af11580156114e7573d6000803e3d6000fd5b50505050611507846000015185602001518360c001518460e00151612f56565b6101008101511561157e57835160075461010083015160405163a51ba3b760e01b81526001600160a01b039384169363a51ba3b79361154b93911691600401615cd0565b600060405180830381600087803b15801561156557600080fd5b505af1158015611579573d6000803e3d6000fd5b505050505b61159084600001518260400151613191565b60208101516060830152610100810151604082015182516115b69291610fc49190612ad9565b6080838101829052606080850151604085810151868401518251938452602084019690965290820152908101929092527f4152c73dd2614c4f9fc35e8c9cf16013cd588c75b49a4c1673ecffdcbcda9403910160405180910390a1611629846000015133836060015184604001516132d5565b5050505050565b611638613c90565b6116426000613cea565b565b60006116c5600260009054906101000a90046001600160a01b03166001600160a01b0316630490be836040518163ffffffff1660e01b8152600401602060405180830381865afa15801561169c573d6000803e3d6000fd5b505050506040513d601f19601f820116820180604052508101906116c09190615c75565b612c42565b905090565b60006116d4612953565b6001600160a01b0383166000908152601060205260408120600101546116fa9084613d3c565b6001600160a01b038516600090815260106020526040902060010181905591505092915050565b6017818154811061173157600080fd5b6000918252602090912001546001600160a01b0316905081565b60008054604080516315b3137b60e21b8152905183926001600160a01b0316916356cc4dec9160048083019260209291908290030181865afa158015611795573d6000803e3d6000fd5b505050506040513d601f19601f820116820180604052508101906117b99190615c75565b90506000600160009054906101000a90046001600160a01b03166001600160a01b03166356cc4dec6040518163ffffffff1660e01b8152600401602060405180830381865afa158015611810573d6000803e3d6000fd5b505050506040513d601f19601f820116820180604052508101906118349190615c75565b90506118408282613d3c565b9250505090565b61184f613c90565b6118588b613d48565b6118618a613d48565b61186a89613d48565b61187388613d48565b61187c87613d48565b61188586613d48565b61188e85613d48565b61189784613d48565b6118a083613d48565b6118a982613d48565b6118b281613d48565b600480546001600160a01b03199081166001600160a01b038e8116919091179092556000805482168d84161790556001805482168c84161790556005805482168b84161790556006805482168a8416179055600780548216898416179055600280548216888416179055600880548216878416179055600b80548216868416179055600980548216858416179055600a80549091169183169190911790556040517f3ca631ffcd2a9b5d9ae18543fc82f58eb4ca33af9e6ab01b7a8e95331e6ed98590611980908d906158dc565b60405180910390a17f78f058b189175430c48dc02699e3a0031ea4ff781536dc2fab847de4babdd8828a6040516119b791906158dc565b60405180910390a17f5ee0cae2f063ed938bb55046f6a932fb6ae792bf43624806bb90abe68a50be9b896040516119ee91906158dc565b60405180910390a17f82966d27eea39b038ee0fa30cd16532bb24f6e65d31cb58fb227aa5766cdcc7f88604051611a2591906158dc565b60405180910390a17fcfb07d791fcafc032b35837b50eb84b74df518cf4cc287e8084f47630fa70fa087604051611a5c91906158dc565b60405180910390a17fe67f36a6e961157d6eff83b91f3af5a62131ceb6f04954ef74f51c1c05e7f88d86604051611a9391906158dc565b60405180910390a17f8c537274438aa850a330284665d81a85dd38267d09e4050d416bfc94142db26485604051611aca91906158dc565b60405180910390a17f7faa560f2889840c377209fbc4b6b92d05f43f1fc60bf336ab546fd60c0051ad84604051611b0191906158dc565b60405180910390a17f65f4cf077bc01e4742eb5ad98326f6e95b63548ea24b17f8d5e823111fe7880083604051611b3891906158dc565b60405180910390a17f0d32e4ef3d389440323b172cfc07c6c01bdd1d3e8334379048eec21e8d919b7782604051611b6f91906158dc565b60405180910390a17ffe7e5f521efd6e9fda9261f1223b2cda79ba84d0393e8b6629d27db91048126f81604051611ba691906158dc565b60405180910390a1611bb6611630565b5050505050505050505050565b611bcb612953565b610b5981613ded565b600080546040805163a2f0398360e01b8152905183926001600160a01b03169163a2f039839160048083019260209291908290030181865afa158015611c1e573d6000803e3d6000fd5b505050506040513d601f19601f82011682018060405250810190611c429190615c75565b90506000600160009054906101000a90046001600160a01b03166001600160a01b031663a2f039836040518163ffffffff1660e01b8152600401602060405180830381865afa158015611810573d6000803e3d6000fd5b6000610c64611ca6613e51565b83613e95565b6001600160a01b0381166000908152601660205260408120546014548290610b879083612ad9565b6000611cde612953565b6001600160a01b038316600090815260106020526040812054610c459084613d3c565b6004546001600160a01b03163314611d735760405162461bcd60e51b815260206004820152602f60248201527f54726f76654d616e616765723a204f6e6c7920426f72726f776572206f70657260448201526e185d1a5bdb9cc81b585e4818d85b1b608a1b6064820152608401610d0b565b611d876103e8670de0b6b3a7640000615d15565b611d92906005615d29565b8110611dc957611dac6103e8670de0b6b3a7640000615d15565b611db7906005615d29565b611dc19082615d6c565b600d55611dcf565b6000600d555b6040518181527fca870d46d67e9a1444a6b8f97a147e06e4cf71ee2a0f172d7ecd5441ae7c1201906020015b60405180910390a150565b6000610c64611e13613e51565b83613572565b6000806000611e2784613f74565b915091506000611e378383613fee565b95945050505050565b6000610c64600d5483613e95565b6000610c648261401d565b6001600160a01b03811660009081526010602052604081208054600190910154909180611e8585610b5c565b9150611e9085611cac565b9050611e9c8483613d3c565b9350611ea88382613d3c565b92509193509193565b6040805160e08082018352600080546001600160a01b0390811684526001548116602080860191909152600854821685870152600a548216606080870191909152600b548316608080880191909152600754841660a08089019190915260065490941660c080890191909152885161010081018a5286815293840186905297830185905290820184905281018390529081018290529384018190529083015290611f5a83614041565b600260009054906101000a90046001600160a01b03166001600160a01b0316630fdb11cf6040518163ffffffff1660e01b81526004016020604051808303816000875af1158015611faf573d6000803e3d6000fd5b505050506040513d601f19601f82011682018060405250810190611fd39190615c75565b60c08201819052611fe3906140dc565b611fec8961414f565b611ffb8260400151338b6141b6565b61200361174b565b60e0820181905260408084015190516370a0823160e01b81526001600160a01b03909116906370a082319061203c9033906004016158dc565b602060405180830381865afa158015612059573d6000803e3d6000fd5b505050506040513d601f19601f8201168201806040525081019061207d9190615c75565b111561208b5761208b615d56565b888152608082015160c08201516000916120a6918b906142b6565b156120b25750876121c4565b82608001516001600160a01b0316634d6228316040518163ffffffff1660e01b8152600401602060405180830381865afa1580156120f4573d6000803e3d6000fd5b505050506040513d601f19601f820116820180604052508101906121189190615d7f565b90505b6001600160a01b0381161580159061214757506714d1120d7b160000612145828460c001516126bc565b105b156121c45782608001516001600160a01b031663b72703ac826040518263ffffffff1660e01b815260040161217c91906158dc565b602060405180830381865afa158015612199573d6000803e3d6000fd5b505050506040513d601f19601f820116820180604052508101906121bd9190615d7f565b905061211b565b846000036121d25760001994505b6001600160a01b038116158015906121ea5750815115155b80156121f65750600085115b15612302578461220581615d9c565b955050600083608001516001600160a01b031663b72703ac836040518263ffffffff1660e01b815260040161223a91906158dc565b602060405180830381865afa158015612257573d6000803e3d6000fd5b505050506040513d601f19601f8201168201806040525081019061227b9190615d7f565b905061229084600001518560200151846129d3565b60006122a9858486600001518760c001518e8e8e614400565b90508060400151156122bc575050612302565b805160208501516122cc91613d3c565b60208086019190915281015160408501516122e691613d3c565b6040850152805184516122f891612ad9565b84525090506121d2565b60008260400151116123685760405162461bcd60e51b815260206004820152602960248201527f54726f76654d616e616765723a20556e61626c6520746f2072656465656d20616044820152681b9e48185b5bdd5b9d60ba1b6064820152608401610d0b565b61237f82604001518360c001518460e0015161465e565b5061238d8260400151614811565b6060830190815260408051808201909152601081526f02932b232b6b83a34b7b7103332b29d160851b602082015290516123c791906136cf565b6123da826060015183604001518661481f565b82516060808501519084015160405163a51ba3b760e01b81526001600160a01b039093169263a51ba3b792612413929091600401615cd0565b600060405180830381600087803b15801561242d57600080fd5b505af1158015612441573d6000803e3d6000fd5b5050505082606001516001600160a01b031663b307829d83606001516040518263ffffffff1660e01b815260040161247b91815260200190565b600060405180830381600087803b15801561249557600080fd5b505af11580156124a9573d6000803e3d6000fd5b50505050606082015160408301516124c091612ad9565b608083019081526040805180820190915260208082527f576861742061637475616c6c792067657473207472616e736665727265643a2090820152905161250791906136cf565b7f43a3f4082a4dbc33d78e317d2497d3a730bc7fc3574159dcea1056e62e5d9ad88a83602001518460400151856060015160405161255e949392919093845260208401929092526040830152606082015260800190565b60405180910390a182604001516001600160a01b0316639dc29fac3384602001516040518363ffffffff1660e01b815260040161259c929190615cd0565b600060405180830381600087803b1580156125b657600080fd5b505af11580156125ca573d6000803e3d6000fd5b505084516020850151604051633b4009ff60e11b81526001600160a01b03909216935063768013fe92506126049160040190815260200190565b600060405180830381600087803b15801561261e57600080fd5b505af1158015612632573d6000803e3d6000fd5b50508451608085015160405163a51ba3b760e01b81526001600160a01b03909216935063a51ba3b7925061266b91339190600401615cd0565b600060405180830381600087803b15801561268557600080fd5b505af1158015612699573d6000803e3d6000fd5b5050505050505050505050505050565b6126b1612953565b610b59816002614889565b60008060006126ca85613f74565b915091506000610c0e8383876149b6565b60006126e5612953565b6001600160a01b0383166000908152601060205260408120600101546116fa9084612ad9565b6000610c6461271983611e06565b83614a05565b600080600260009054906101000a90046001600160a01b03166001600160a01b0316630490be836040518163ffffffff1660e01b8152600401602060405180830381865afa158015612775573d6000803e3d6000fd5b505050506040513d601f19601f820116820180604052508101906127999190615c75565b90506000806127a785613f74565b915091506000610c0e8383866149b6565b6000601782815481106127cd576127cd615d40565b6000918252602090912001546001600160a01b031692915050565b60006116c5600260009054906101000a90046001600160a01b03166001600160a01b0316630490be836040518163ffffffff1660e01b8152600401602060405180830381865afa158015612840573d6000803e3d6000fd5b505050506040513d601f19601f820116820180604052508101906128649190615c75565b61401d565b600060016001600160a01b03831660009081526010602052604090206003015460ff16600481111561289d5761289d615a74565b146128aa57506000919050565b506014546001600160a01b039091166000908152601660205260409020541090565b6128d4613c90565b6001600160a01b0381166129395760405162461bcd60e51b815260206004820152602660248201527f4f776e61626c653a206e6577206f776e657220697320746865207a65726f206160448201526564647265737360d01b6064820152608401610d0b565b610b5981613cea565b61294a612953565b610b5981614a8e565b6004546001600160a01b031633146116425760405162461bcd60e51b815260206004820152603b60248201527f54726f76654d616e616765723a2043616c6c6572206973206e6f74207468652060448201527f426f72726f7765724f7065726174696f6e7320636f6e747261637400000000006064820152608401610d0b565b6129dc81612869565b15612ad4576129ea816134c3565b60006129f582611cac565b90506000612a0283610b5c565b6001600160a01b038416600090815260106020526040902060010154909150612a2b9083613d3c565b6001600160a01b0384166000908152601060205260409020600181019190915554612a569082613d3c565b6001600160a01b038416600090815260106020526040902055612a7883613ded565b612a8485858385614ad8565b6001600160a01b038316600081815260106020526040808220805460018201546002909201549251600080516020615ebf83398151915294612ac99492939291615dc7565b60405180910390a250505b505050565b6000612ae58284615d6c565b9392505050565b6000612ae58284615d29565b6000612ae58284615d15565b601780546001808201835560008381527fc624b66cc0138b8fabc209247f72d758e1cf3343756d543badbf24212bed8c1590920180546001600160a01b0319166001600160a01b03861617905591549091612b5f9190612ad9565b6001600160a01b039290921660009081526010602052604090206003018054610100600160881b0319166101006001600160801b038516021790555090565b6001600160a01b0381166000908152601060205260408120600101548190612bc590614bb9565b6001600160a01b038416600090815260106020526040902060020180549082905560115491925090612c03908390612bfd9084612ad9565b90613d3c565b60118190556040519081527f6bac5e0eb3c44eb03a60ab11ec3a2c051771616aecadbcfff2630aabae5203829060200160405180910390a15092915050565b600080612c4e8361401d565b6714d1120d7b160000119392505050565b612c67615848565b612c6f615894565b612c77615848565b84825260006080830152612c8961174b565b60a0830152612c96611bd4565b60c0830152600060208301525b835182602001511015612e7b5783826020015181518110612cc657612cc6615d40565b6020908102919091018101516001600160a01b03166060840181905260009081526010909152604090206003015460019060ff166004811115612d0b57612d0b615a74565b03612e6357612d1e8260600151876126bc565b60408301526080820151612e0b576714d1120d7b160000826040015110158015612d4757508151155b612e63576000612d608360c001518460a00151896149b6565b9050612d7d8989856060015186604001518760000151868d614bfa565b60808101518451919350612d919190612ad9565b8352608082015160a0840151612da691612ad9565b8360a0018181525050612ddb826101000151610fc48460400151610fc48660a001518860c00151612ad990919063ffffffff16565b60c0840152612dea8483614eed565b9350612dff8360c001518460a0015189614fce565b15608084015250612e63565b81608001518015612e2757506714d1120d7b1600008260400151105b15612e6357612e40888884606001518560000151614fef565b60808101518351919250612e549190612ad9565b8252612e608382614eed565b92505b60208201805190612e7382615de9565b905250612ca3565b505095945050505050565b612e8e615848565b612e96615894565b612e9e615848565b848252600060208301525b835182602001511015612e7b5783826020015181518110612ecc57612ecc615d40565b60209081029190910101516001600160a01b031660608301819052612ef190876126bc565b604083018190526714d1120d7b1600001115612f3e57612f1b888884606001518560000151614fef565b60808101518351919250612f2f9190612ad9565b8252612f3b8382614eed565b92505b60208201805190612f4e82615de9565b905250612ea9565b811561318b57601854600090612f7890612bfd84670de0b6b3a7640000612aec565b90506000612f9d601954612bfd670de0b6b3a764000087612aec90919063ffffffff16565b90506000612fb660115484612af890919063ffffffff16565b90506000612fcf60115484612af890919063ffffffff16565b9050612ff0612fe960115484612aec90919063ffffffff16565b8590612ad9565b60185560115461300c90613005908390612aec565b8490612ad9565b60195560145461301c9083613d3c565b60145560155461302c9082613d3c565b60158190556014546040517f9f8bc8ab0daf5bceef75ecfd2085d1fcc6548c657ea970d9a23a60610d0737e39261306a928252602082015260400190565b60405180910390a1604051633b4009ff60e11b8152600481018790526001600160a01b0389169063768013fe90602401600060405180830381600087803b1580156130b457600080fd5b505af11580156130c8573d6000803e3d6000fd5b505060405163262b890160e01b8152600481018990526001600160a01b038a16925063262b89019150602401600060405180830381600087803b15801561310e57600080fd5b505af1158015613122573d6000803e3d6000fd5b505060405163a51ba3b760e01b81526001600160a01b038b16925063a51ba3b79150613154908a908990600401615cd0565b600060405180830381600087803b15801561316e57600080fd5b505af1158015613182573d6000803e3d6000fd5b50505050505050505b50505050565b6011546012819055506000826001600160a01b031663a2f039836040518163ffffffff1660e01b8152600401602060405180830381865afa1580156131da573d6000803e3d6000fd5b505050506040513d601f19601f820116820180604052508101906131fe9190615c75565b90506000600160009054906101000a90046001600160a01b03166001600160a01b031663a2f039836040518163ffffffff1660e01b8152600401602060405180830381865afa158015613255573d6000803e3d6000fd5b505050506040513d601f19601f820116820180604052508101906132799190615c75565b905061328981612bfd8486612ad9565b60138190556012546040517f51bf4c63ec3cba9d03d43238abbdd979dd91bd16d9895c74ceea9118c7baaf60926132c7928252602082015260400190565b60405180910390a150505050565b811561334c57600854600654604051631062c15f60e11b81526001600160a01b0391821660048201528582166024820152604481018590529116906320c582be90606401600060405180830381600087803b15801561333357600080fd5b505af1158015613347573d6000803e3d6000fd5b505050505b801561318b5760405163a51ba3b760e01b81526001600160a01b0385169063a51ba3b7906133809086908590600401615cd0565b600060405180830381600087803b15801561339a57600080fd5b505af11580156133ae573d6000803e3d6000fd5b5050505050505050565b60006001633b9aca00826133cc8287615d29565b905060006133da8388615d29565b90505b6133e9836102ee615d29565b81116134b45760006133fc8a8a846149b6565b90508681101561345857825b828111158015613421575061341d858a615d29565b8110155b1561345657876134328c8c846149b6565b10156134455795506110ab945050505050565b61344f8582615d6c565b9050613408565b505b61346a6702c68af0bb14000088615d6c565b8110156134835761347c846014615d29565b945061349f565b6134948766b1a2bc2ec50000615e02565b81111561349f578394505b509050806134ad8482615e02565b90506133dd565b50600098975050505050505050565b60016001600160a01b03821660009081526010602052604090206003015460ff1660048111156134f5576134f5615a74565b14610b595760405162461bcd60e51b815260206004820152602f60248201527f54726f76654d616e616765723a2054726f766520646f6573206e6f742065786960448201526e1cdd081bdc881a5cc818db1bdcd959608a1b6064820152608401610d0b565b6000612ae5670de0b6b3a7640000610c088585612aec565b60006136196040518060400160405280600f81526020016e082c6e8d2ecca40a0deded840cae8d608b1b81525060008054906101000a90046001600160a01b03166001600160a01b031663a2f039836040518163ffffffff1660e01b8152600401602060405180830381865afa1580156135f0573d6000803e3d6000fd5b505050506040513d601f19601f820116820180604052508101906136149190615c75565b6136cf565b612ae56136c161369e60008054906101000a90046001600160a01b03166001600160a01b031663a2f039836040518163ffffffff1660e01b8152600401602060405180830381865afa158015613673573d6000803e3d6000fd5b505050506040513d601f19601f820116820180604052508101906136979190615c75565b8590612af8565b612bfd866136b66103e8670de0b6b3a7640000615d15565b612bfd906005615d29565b670de0b6b3a7640000615130565b61111b82826040516024016136e5929190615e15565b60408051601f198184030181529190526020810180516001600160e01b0316632d839cb360e21b179052615146565b60008061371f61514f565b90506000613735670dc14847bcc53b208361516b565b90506137696040518060400160405280601081526020016f036b4b73aba32b9903830b9b9b2b21d160851b815250836136cf565b611840670de0b6b3a7640000610c0883600d54612aec90919063ffffffff16565b60006137a1600f5442612ad990919063ffffffff16565b9050603c8110610b595742600f8190556040519081527f4ac50c32a269c2cfea9cf04e466da1ab839008441fadf7108e4f05410c2bfd5f90602001611dfb565b6137e9615848565b6137f1615894565b6137f9615848565b8482526000608083015261380b61174b565b60a0830152613818611bd4565b8260c001818152505086608001516001600160a01b0316634d6228316040518163ffffffff1660e01b8152600401602060405180830381865afa158015613863573d6000803e3d6000fd5b505050506040513d601f19601f820116820180604052508101906138879190615d7f565b82606001906001600160a01b031690816001600160a01b031681525050600087608001516001600160a01b0316631e2231436040518163ffffffff1660e01b8152600401602060405180830381865afa1580156138e8573d6000803e3d6000fd5b505050506040513d601f19601f8201168201806040525081019061390c9190615d7f565b6000602085015290505b84836020015110801561393f5750806001600160a01b031683606001516001600160a01b031614155b15613b545760808801516060840151604051632dc9c0eb60e21b81526000926001600160a01b03169163b72703ac9161397b91906004016158dc565b602060405180830381865afa158015613998573d6000803e3d6000fd5b505050506040513d601f19601f820116820180604052508101906139bc9190615d7f565b90506139cc8460600151896126bc565b60408501526080840151613ac4576714d1120d7b1600008460400151101580156139f557508351155b15613a005750613b54565b6000613a158560c001518660a001518b6149b6565b8a5160208c0151606088015160408901518951949550613a3694868f614bfa565b60808101518651919550613a4a9190612ad9565b8552608084015160a0860151613a5f91612ad9565b8560a0018181525050613a94846101000151610fc48660400151610fc48860a001518a60c00151612ad990919063ffffffff16565b60c0860152613aa38685614eed565b9550613ab88560c001518660a001518b614fce565b15608086015250613b2e565b83608001518015613ae057506714d1120d7b1600008460400151105b15613b2857613b0189600001518a6020015186606001518760000151614fef565b60808101518551919450613b159190612ad9565b8452613b218584614eed565b9450613b2e565b50613b54565b6001600160a01b0316606084015260208301805190613b4c82615de9565b905250613916565b505050949350505050565b613b67615848565b613b6f615894565b613b77615848565b600b54858352600060208401526001600160a01b03165b8483602001511015613c8457806001600160a01b0316634d6228316040518163ffffffff1660e01b8152600401602060405180830381865afa158015613bd8573d6000803e3d6000fd5b505050506040513d601f19601f82011682018060405250810190613bfc9190615d7f565b6001600160a01b031660608401819052613c1690886126bc565b604084018190526714d1120d7b1600001115613c6757613c40898985606001518660000151614fef565b60808101518451919350613c549190612ad9565b8352613c608483614eed565b9350613c6c565b613c84565b60208301805190613c7c82615de9565b905250613b8e565b50505095945050505050565b6003546001600160a01b031633146116425760405162461bcd60e51b815260206004820181905260248201527f4f776e61626c653a2063616c6c6572206973206e6f7420746865206f776e65726044820152606401610d0b565b600380546001600160a01b038381166001600160a01b0319831681179093556040519116919082907f8be0079c531659141344cd1fd0a4f28419497f9722a3daafe3b4186f6b6457e090600090a35050565b6000612ae58284615e02565b6001600160a01b038116613d9e5760405162461bcd60e51b815260206004820152601e60248201527f4163636f756e742063616e6e6f74206265207a65726f206164647265737300006044820152606401610d0b565b803b8061111b5760405162461bcd60e51b815260206004820181905260248201527f4163636f756e7420636f64652073697a652063616e6e6f74206265207a65726f6044820152606401610d0b565b601480546001600160a01b038316600090815260166020526040908190209182556015546001909201829055915491517fc437f324d85e369394148dd9d62f98f534b382e01ed3dd2eb98138fb6d3ab49a92611dfb92908252602082015260400190565b600080613e5c61520f565b90506000613e72670ddd4b8c6c7d70d88361516b565b9050611840670de0b6b3a7640000610c0883600c54612aec90919063ffffffff16565b600080600860009054906101000a90046001600160a01b03166001600160a01b03166318160ddd6040518163ffffffff1660e01b8152600401602060405180830381865afa158015613eeb573d6000803e3d6000fd5b505050506040513d601f19601f82011682018060405250810190613f0f9190615c75565b905080600003613f4057613f2d6103e8670de0b6b3a7640000615d15565b613f38906005615d29565b915050610c64565b6110ab6136c1613f5c83610c0887670de0b6b3a7640000612aec565b612bfd876136b66103e8670de0b6b3a7640000615d15565b6000806000613f8284611cac565b90506000613f8f85610b5c565b6001600160a01b03861660009081526010602052604081206001015491925090613fb99084613d3c565b6001600160a01b03871660009081526010602052604081205491925090613fe09084613d3c565b919791965090945050505050565b600081156140145761400d82610c088568056bc75e2d63100000612aec565b9050610c64565b50600019610c64565b600080614028611bd4565b9050600061403461174b565b90506110ab8282866149b6565b6140556103e8670de0b6b3a7640000615d15565b614060906005615d29565b81101580156140775750670de0b6b3a76400008111155b610b595760405162461bcd60e51b815260206004820152603060248201527f4d6178206665652070657263656e74616765206d75737420626520626574776560448201526f656e20302e352520616e64203130302560801b6064820152608401610d0b565b6714d1120d7b1600006140ee8261401d565b1015610b595760405162461bcd60e51b815260206004820152602a60248201527f54726f76654d616e616765723a2043616e6e6f742072656465656d207768656e604482015269102a21a9101e1026a1a960b11b6064820152608401610d0b565b60008111610b595760405162461bcd60e51b815260206004820152602e60248201527f54726f76654d616e616765723a20416d6f756e74206d7573742062652067726560448201526d61746572207468616e207a65726f60901b6064820152608401610d0b565b6040516370a0823160e01b815281906001600160a01b038516906370a08231906141e49086906004016158dc565b602060405180830381865afa158015614201573d6000803e3d6000fd5b505050506040513d601f19601f820116820180604052508101906142259190615c75565b1015612ad45760405162461bcd60e51b815260206004820152605460248201527f54726f76654d616e616765723a2052657175657374656420726564656d70746960448201527f6f6e20616d6f756e74206d757374206265203c3d2075736572277320426173656064820152734665654c4d4120746f6b656e2062616c616e636560601b608482015260a401610d0b565b60006001600160a01b03831615806143385750604051630bb7c8fd60e31b81526001600160a01b03851690635dbe47e8906142f59086906004016158dc565b602060405180830381865afa158015614312573d6000803e3d6000fd5b505050506040513d601f19601f820116820180604052508101906143369190615e37565b155b8061435357506714d1120d7b16000061435184846126bc565b105b1561436057506000612ae5565b60405163765e015960e01b81526000906001600160a01b0386169063765e01599061438f9087906004016158dc565b602060405180830381865afa1580156143ac573d6000803e3d6000fd5b505050506040513d601f19601f820116820180604052508101906143d09190615d7f565b90506001600160a01b0381161580611e3757506714d1120d7b1600006143f682856126bc565b1095945050505050565b614426604051806060016040528060008152602001600081526020016000151581525090565b6001600160a01b0387166000908152601060205260409020546144569087906144519061c350612ad9565b615130565b8082526144639086612aec565b60208083019190915281516001600160a01b03891660009081526010909252604082205461449091612ad9565b6020808401516001600160a01b038b1660009081526010909252604082206001015492935090916144c091612ad9565b905061c350820361452a576144d489614a8e565b6144df896004614889565b6144ed8a8a61c3508461522b565b886001600160a01b0316600080516020615ebf8339815191526000806000600360405161451d9493929190615dc7565b60405180910390a2614650565b60006145368284613fee565b9050848114158061454f5750600161454d8461538a565b105b156145635750506001604083015250614653565b60808b015160405163015f109360e51b81526001600160a01b038c81166004830152602482018490528981166044830152888116606483015290911690632be2126090608401600060405180830381600087803b1580156145c357600080fd5b505af11580156145d7573d6000803e3d6000fd5b5050506001600160a01b038b166000908152601060205260409020848155600101839055506146058a612b9e565b506001600160a01b038a1660008181526010602052604090819020600201549051600080516020615ebf833981519152916146469187918791600390615dc7565b60405180910390a2505b50505b979650505050505050565b600080614669613e51565b90506146e46040518060400160405280600c81526020016b03a37ba30b61031b7b6361d160a51b81525060008054906101000a90046001600160a01b03166001600160a01b031663a2f039836040518163ffffffff1660e01b8152600401602060405180830381865afa1580156135f0573d6000803e3d6000fd5b600080546040805163a2f0398360e01b81529051614766926001600160a01b03169163a2f039839160048083019260209291908290030181865afa158015614730573d6000803e3d6000fd5b505050506040513d601f19601f820116820180604052508101906147549190615c75565b610c0888670de0b6b3a7640000612aec565b905060006147748383613d3c565b90506147ad604051806040016040528060158152602001743932b232b2b6b2b2103636b090333930b1ba34b7b760591b815250836136cf565b6147bf81670de0b6b3a7640000615130565b9050600081116147d1576147d1615d56565b600c8190556040518181527fbcd47f9685f1ffa254d0ac495b2e47d57feda8840e9d1f2a54d9d499650502a89060200160405180910390a1610c0e615398565b6000610c6461271983611156565b600061483783610c0886670de0b6b3a7640000612aec565b90508181111561318b5760405162461bcd60e51b815260206004820152601d60248201527f4665652065786365656465642070726f7669646564206d6178696d756d0000006044820152606401610d0b565b600081600481111561489d5761489d615a74565b141580156148bd575060018160048111156148ba576148ba615a74565b14155b6148c9576148c9615d56565b6017546148d5816153ef565b6001600160a01b0383166000908152601060205260409020600301805483919060ff1916600183600481111561490d5761490d615a74565b02179055506001600160a01b038316600090815260106020908152604080832060018082018590559084905560169092528220828155015561494f83826154c9565b600b54604051631484968760e11b81526001600160a01b03909116906329092d0e9061497f9086906004016158dc565b600060405180830381600087803b15801561499957600080fd5b505af11580156149ad573d6000803e3d6000fd5b50505050505050565b600082156149fc5760006149d883610c08868189670de0b6b3a7640000612aec565b90506149e385615699565b6149ec84615699565b6149f581615699565b9050612ae5565b50600019612ae5565b600080614a1e670de0b6b3a7640000610c088686612aec565b9050828110612ae55760405162461bcd60e51b815260206004820152603660248201527f54726f76654d616e616765723a2046656520776f756c642065617420757020616044820152751b1b081c995d1d5c9b99590818dbdb1b185d195c985b60521b6064820152608401610d0b565b6001600160a01b038116600090815260106020526040902060020154601154614ab79082612ad9565b601155506001600160a01b0316600090815260106020526040812060020155565b604051633b4009ff60e11b8152600481018390526001600160a01b0384169063768013fe90602401600060405180830381600087803b158015614b1a57600080fd5b505af1158015614b2e573d6000803e3d6000fd5b505060405163262b890160e01b8152600481018590526001600160a01b038716925063262b89019150602401600060405180830381600087803b158015614b7457600080fd5b505af1158015614b88573d6000803e3d6000fd5b50506040516331534de160e01b8152600481018490526001600160a01b03861692506331534de19150602401613380565b600080601354600003614bcd575081610c64565b600060125411614bdf57614bdf615d56565b612ae5601354610c0860125486612aec90919063ffffffff16565b614c02615848565b614c2660405180606001604052806000815260200160008152602001600081525090565b601754600110614c365750614653565b614c3f87611e59565b60408501526020848101919091528401819052908352614c5e906156de565b6040830181905261c35060608401526020830151614c7b91612ad9565b8152670de0b6b3a76400008611614d4657614ca0898983602001518460400151614ad8565b614ca987614a8e565b60006080830181905260a0830152815160c0830152805160e0830152614cd0876003614889565b815160208301516040516001600160a01b038a1692600080516020615e9f83398151915292614d0192600290615e59565b60405180910390a2866001600160a01b0316600080516020615ebf83398151915260008060006002604051614d399493929190615dc7565b60405180910390a2614ee1565b670de0b6b3a764000086118015614d6457506714d1120d7b16000086105b15614db457614d7d898983602001518460400151614ad8565b614d8687614a8e565b81518151614d959190876156eb565b60e086015260c085015260a08401526080830152614cd0876003614889565b6714d1120d7b1600008610158015614dcb57508386105b8015614dd8575081518510155b15614ed057614df1898983602001518460400151614ad8565b84600003614e0157614e01615d56565b614e0a87614a8e565b614e1d8260000151836020015185615745565b9150614e2a876003614889565b61010082015115614e9f57600754610100830151604051633f10abab60e01b81526001600160a01b0390921691633f10abab91614e6c918b9190600401615cd0565b600060405180830381600087803b158015614e8657600080fd5b505af1158015614e9a573d6000803e3d6000fd5b505050505b815160a08301516040516001600160a01b038a1692600080516020615e9f83398151915292614d0192600290615e59565b614ed8615848565b91506146539050565b50979650505050505050565b614ef5615848565b60408083015190840151614f0891613d3c565b604082015260608083015190840151614f2091613d3c565b606082015281516020840151614f3591613d3c565b6020808301919091528201518351614f4c91613d3c565b815260808083015190840151614f6191613d3c565b608082015260a08083015190840151614f7991613d3c565b60a082015260c08083015190840151614f9191613d3c565b60c082015260e08083015190840151614fa991613d3c565b60e08201526101008083015190840151614fc291613d3c565b61010082015292915050565b600080614fdc8585856149b6565b6714d1120d7b1600001195945050505050565b614ff7615848565b61501b60405180606001604052806000815260200160008152602001600081525090565b61502484611e59565b6040850190815260208581019283528601929092529184529051905161504e918891889190614ad8565b61505784614a8e565b61506482602001516156de565b6040830181905261c350606084015260208301516000916150859190612ad9565b9050615096836000015182866156eb565b60e087015260c086015260a085015260808401526150b5856003614889565b825160208401516040516001600160a01b03881692600080516020615e9f833981519152926150e692600190615e59565b60405180910390a2846001600160a01b0316600080516020615ebf8339815191526000806000600160405161511e9493929190615dc7565b60405180910390a25050949350505050565b600081831061513f5781612ae5565b5090919050565b610b59816157c6565b60006116c5603c610c08600f5442612ad990919063ffffffff16565b6000631f54050082111561518157631f54050091505b816000036151985750670de0b6b3a7640000610c64565b670de0b6b3a764000083835b6001811115615205576151b8600282615e74565b6000036151dd576151c982836157e7565b91506151d6816002612af8565b90506151a4565b6151e782846157e7565b92506151f382836157e7565b91506151d66002610c08836001612ad9565b610c0e82846157e7565b60006116c5603c610c08600e5442612ad990919063ffffffff16565b6040808501516006549151632770a7eb60e21b81526001600160a01b0391821692639dc29fac92615263929116908690600401615cd0565b600060405180830381600087803b15801561527d57600080fd5b505af1158015615291573d6000803e3d6000fd5b50508551604051633b4009ff60e11b8152600481018690526001600160a01b03909116925063768013fe9150602401600060405180830381600087803b1580156152da57600080fd5b505af11580156152ee573d6000803e3d6000fd5b505050508360a001516001600160a01b0316633f10abab84836040518363ffffffff1660e01b8152600401615324929190615cd0565b600060405180830381600087803b15801561533e57600080fd5b505af1158015615352573d6000803e3d6000fd5b5050855160a087015160405163a51ba3b760e01b81526001600160a01b03909216935063a51ba3b79250613380918590600401615cd0565b6000610c648261c350612ad9565b60006153af600e5442612ad990919063ffffffff16565b9050603c8110610b595742600e8190556040519081527fbab964312bdd13595266f3e549bca3102965a6d718c6c1f8cd7eaac076b9c6c290602001611dfb565b60018111801561546a5750600b546040805163de8fa43160e01b815290516001926001600160a01b03169163de8fa4319160048083019260209291908290030181865afa158015615444573d6000803e3d6000fd5b505050506040513d601f19601f820116820180604052508101906154689190615c75565b115b610b595760405162461bcd60e51b815260206004820152602a60248201527f54726f76654d616e616765723a204f6e6c79206f6e652074726f766520696e206044820152697468652073797374656d60b01b6064820152608401610d0b565b6001600160a01b03821660009081526010602052604081206003015460ff16908160048111156154fb576154fb615a74565b1415801561551b5750600181600481111561551857615518615a74565b14155b61552757615527615d56565b6001600160a01b03831660009081526010602052604081206003015461010090046001600160801b031690839061555f826001612ad9565b905080836001600160801b0316111561557a5761557a615d56565b60006017828154811061558f5761558f615d40565b600091825260209091200154601780546001600160a01b03909216925082916001600160801b0387169081106155c7576155c7615d40565b600091825260208083209190910180546001600160a01b0319166001600160a01b03948516179055918316808252601083526040918290206003018054610100600160881b0319166101006001600160801b038a16908102919091179091558251918252928101929092527f02b04ae5f7be9ca7c103293a2aa15f3c339d15d6eda53b721fef7b0e609c831a910160405180910390a1601780548061566e5761566e615e88565b600082815260209020810160001990810180546001600160a01b031916905501905550505050505050565b610b59816040516024016156af91815260200190565b60408051601f198184030181529190526020810180516001600160e01b031663f82c50f160e01b179052615146565b6000610c6460c883615d15565b6000808080841561572f576157008786615130565b935061571087610c088887612aec565b925061571c8785612ad9565b91506157288684612ad9565b905061573c565b5060009250829150859050845b93509350935093565b61574d615848565b83815260208101839052600061576f83610c08876714d1120d7b160000612aec565b905061577a816156de565b6040830181905261c35060608401526080830186905261579b908290612ad9565b60a08301526157aa8482612ad9565b61010083015250600060c0820181905260e08201529392505050565b60006a636f6e736f6c652e6c6f679050600080835160208501845afa505050565b6000806157f48484612aec565b90506110ab670de0b6b3a7640000610c08615810600283615d15565b8490613d3c565b6040518060a00160405280600081526020016000815260200160001515815260200160008152602001600081525090565b6040518061012001604052806000815260200160008152602001600081526020016000815260200160008152602001600081526020016000815260200160008152602001600081525090565b6040518060e0016040528060008152602001600081526020016000815260200160006001600160a01b0316815260200160001515815260200160008152602001600081525090565b6001600160a01b0391909116815260200190565b6001600160a01b0381168114610b5957600080fd5b8035615910816158f0565b919050565b60006020828403121561592757600080fd5b8135612ae5816158f0565b6000806040838503121561594557600080fd5b8235615950816158f0565b946020939093013593505050565b634e487b7160e01b600052604160045260246000fd5b6000602080838503121561598757600080fd5b823567ffffffffffffffff8082111561599f57600080fd5b818501915085601f8301126159b357600080fd5b8135818111156159c5576159c561595e565b8060051b604051601f19603f830116810181811085821117156159ea576159ea61595e565b604052918252848201925083810185019188831115615a0857600080fd5b938501935b82851015615a2d57615a1e85615905565b84529385019392850192615a0d565b98975050505050505050565b60008060408385031215615a4c57600080fd5b50508035926020909101359150565b600060208284031215615a6d57600080fd5b5035919050565b634e487b7160e01b600052602160045260246000fd5b858152602081018590526040810184905260a0810160058410615aaf57615aaf615a74565b60608201939093526001600160801b03919091166080909101529392505050565b60008060008060008060008060008060006101608c8e031215615af257600080fd5b8b35615afd816158f0565b9a5060208c0135615b0d816158f0565b995060408c0135615b1d816158f0565b985060608c0135615b2d816158f0565b975060808c0135615b3d816158f0565b965060a08c0135615b4d816158f0565b955060c08c0135615b5d816158f0565b945060e08c0135615b6d816158f0565b93506101008c0135615b7e816158f0565b9250615b8d6101208d01615905565b9150615b9c6101408d01615905565b90509295989b509295989b9093969950565b6000815180845260005b81811015615bd457602081850181015186830182015201615bb8565b506000602082860101526020601f19601f83011685010191505092915050565b602081526000612ae56020830184615bae565b600080600080600080600060e0888a031215615c2257600080fd5b873596506020880135615c34816158f0565b95506040880135615c44816158f0565b94506060880135615c54816158f0565b9699959850939660808101359560a0820135955060c0909101359350915050565b600060208284031215615c8757600080fd5b5051919050565b60208082526022908201527f54726f76654d616e616765723a206e6f7468696e6720746f206c697175696461604082015261746560f01b606082015260800190565b6001600160a01b03929092168252602082015260400190565b634e487b7160e01b600052601260045260246000fd5b634e487b7160e01b600052601160045260246000fd5b600082615d2457615d24615ce9565b500490565b8082028115828204841417610c6457610c64615cff565b634e487b7160e01b600052603260045260246000fd5b634e487b7160e01b600052600160045260246000fd5b81810381811115610c6457610c64615cff565b600060208284031215615d9157600080fd5b8151612ae5816158f0565b600081615dab57615dab615cff565b506000190190565b60048110615dc357615dc3615a74565b9052565b848152602081018490526040810183905260808101611e376060830184615db3565b600060018201615dfb57615dfb615cff565b5060010190565b80820180821115610c6457610c64615cff565b604081526000615e286040830185615bae565b90508260208301529392505050565b600060208284031215615e4957600080fd5b81518015158114612ae557600080fd5b83815260208101839052606081016110ab6040830184615db3565b600082615e8357615e83615ce9565b500690565b634e487b7160e01b600052603160045260246000fdfeea67486ed7ebe3eea8ab3390efd4a3c8aae48be5bea27df104a8af786c408434c3770d654ed33aeea6bf11ac8ef05d02a6a04ed4686dd2f624d853bbec43cc8ba2646970667358221220fe26cede49a54f745f6eb7c034e37c034e5f6c9c78d47f461cde5626873e962764736f6c63430008130033",
  "deployedBytecode": "0x608060405234801561001057600080fd5b50600436106104d85760003560e01c8063807d138d11610283578063bb6f030c1161015c578063d5b35635116100ce578063e2ac77b011610092578063e2ac77b014610ae3578063e324634914610af6578063f2fde38b14610aff578063f92d3433146105ff578063fb0cbd4b14610b12578063fe2ba84814610b2157600080fd5b8063d5b3563514610a79578063d66a255314610a8c578063d696629714610ab5578063d9a7244414610ac8578063e1f787e914610adb57600080fd5b8063c35bc55011610120578063c35bc55014610a24578063c3eb5c6714610a2e578063c91a7e2f14610a37578063cbd138ae14610a40578063d293c71014610a53578063d3d6f84314610a6657600080fd5b8063bb6f030c146109ed578063bcd37526146109f6578063bf9befb114610a09578063bf9ebee214610a12578063c26c880014610a1b57600080fd5b8063a2014152116101f5578063aead9dcc116101b9578063aead9dcc1461095b578063b0d8e1811461096e578063b36cd07f14610981578063b7f8cf9b14610994578063b82f263d146109a7578063b91af97c146109ba57600080fd5b8063a2014152146108f4578063a20baee6146105f0578063a22b7d68146108fd578063a3f4df7e14610910578063ae9187541461094857600080fd5b8063900e664b11610247578063900e664b14610896578063948ba6d21461089f57806396d711ff146108b2578063981c4f48146108bb5780639976cf45146108ce5780639f7adb5e146108e157600080fd5b8063807d138d1461084e57806382fe3eb914610857578063887105d31461086a5780638da5cb5b146108725780638f9137891461088357600080fd5b80634e443d9e116103b5578063715018a611610327578063756b253e116102eb578063756b253e146107fe578063794e5724146106d8578063795d26c3146108115780637985c5e4146108195780637e024ad61461082c5780637f7dde4a1461083b57600080fd5b8063715018a6146107c857806371f256e2146107d057806372423c17146107d857806372fe25aa146105f0578063741bef1a146107eb57600080fd5b80635dba4c4a116103795780635dba4c4a1461070d57806361ec893d14610715578063631203b01461071d57806364cee26014610730578063653d46e71461075c5780636ef643381461076f57600080fd5b80634e443d9e146106a2578063570dc45e146106c55780635733d58f146106d857806358b8a5d6146106e75780635d6b480f146106fa57600080fd5b806321e378011161044e5780633cc74225116104125780633cc742251461062d57806347142aa314610640578063477d66cf14610653578063480cd578146106665780634870dd9a1461069257806349eefeee1461069a57600080fd5b806321e37801146105dd57806324092669146105f057806328d28b5b146105ff5780632d81dd56146106075780632f8655681461061a57600080fd5b806315d549f1116104a057806315d549f1146105575780631673c79a1461056a57806318f2817a146105a65780631b199a64146105b95780631bf43555146105c25780631e8b1c2b146105ca57600080fd5b8063048c661d146104dd578063071a7541146105065780630b0765571461051c5780630c08ff5f1461053157806312610e9214610544575b600080fd5b6005546104f0906001600160a01b031681565b6040516104fd91906158dc565b60405180910390f35b61050e600281565b6040519081526020016104fd565b61052f61052a366004615915565b610b34565b005b61050e61053f366004615915565b610b5c565b61050e610552366004615932565b610c18565b61050e610565366004615915565b610c6a565b610591610578366004615915565b6016602052600090815260409020805460019091015482565b604080519283526020830191909152016104fd565b61050e6105b4366004615915565b610c8c565b61050e60195481565b61050e600181565b61052f6105d8366004615974565b610c9f565b61050e6105eb366004615915565b611041565b61050e670de0b6b3a764000081565b61050e611071565b61050e610615366004615a39565b611093565b61052f610628366004615915565b6110b3565b6001546104f0906001600160a01b031681565b61050e61064e366004615a39565b61111f565b61050e610661366004615a5b565b611137565b61050e610674366004615915565b6001600160a01b031660009081526010602052604090206001015490565b61050e60c881565b60175461050e565b6106b56106b0366004615a5b565b61114b565b60405190151581526020016104fd565b6009546104f0906001600160a01b031681565b61050e6714d1120d7b16000081565b61050e6106f5366004615a5b565b611156565b61052f610708366004615932565b611164565b61052f6111bc565b61050e603c81565b61059161072b366004615a5b565b61129c565b61050e61073e366004615915565b6001600160a01b031660009081526010602052604090206002015490565b61052f61076a366004615a5b565b6112bf565b6107b761077d366004615915565b60106020526000908152604090208054600182015460028301546003909301549192909160ff81169061010090046001600160801b031685565b6040516104fd959493929190615a8a565b61052f611630565b6106b5611644565b61050e6107e6366004615932565b6116ca565b6002546104f0906001600160a01b031681565b6104f061080c366004615a5b565b611721565b61050e61174b565b61052f610827366004615ad0565b611847565b61050e670ddd4b8c6c7d70d881565b6000546104f0906001600160a01b031681565b61050e60125481565b61052f610865366004615915565b611bc3565b61050e611bd4565b6003546001600160a01b03166104f0565b6008546104f0906001600160a01b031681565b61050e60155481565b61050e6108ad366004615a5b565b611c99565b61050e60135481565b61050e6108c9366004615915565b611cac565b61050e6108dc366004615932565b611cd4565b61052f6108ef366004615a5b565b611d01565b61050e61c35081565b61050e61090b366004615a5b565b611e06565b61093b6040518060400160405280600c81526020016b2a3937bb32a6b0b730b3b2b960a11b81525081565b6040516104fd9190615bf4565b600b546104f0906001600160a01b031681565b600a546104f0906001600160a01b031681565b61050e61097c366004615915565b611e19565b61050e61098f366004615a5b565b611e40565b6004546104f0906001600160a01b031681565b61050e6109b5366004615a5b565b611e4e565b6109cd6109c8366004615915565b611e59565b6040805194855260208501939093529183015260608201526080016104fd565b61050e600c5481565b61052f610a04366004615c07565b611eb1565b61050e60115481565b61050e60145481565b61050e600f5481565b61050e6212750081565b61050e600d5481565b61050e60185481565b61052f610a4e366004615915565b6126a9565b61050e610a61366004615932565b6126bc565b61050e610a74366004615932565b6126db565b61050e610a87366004615a5b565b61270b565b61050e610a9a366004615915565b6001600160a01b031660009081526010602052604090205490565b61050e610ac3366004615915565b61271f565b6104f0610ad6366004615a5b565b6127b8565b61050e6127e8565b6106b5610af1366004615915565b612869565b61050e600e5481565b61052f610b0d366004615915565b6128cc565b61050e670dc14847bcc53b2081565b61052f610b2f366004615915565b612942565b610b3c612953565b600054600154610b59916001600160a01b039081169116836129d3565b50565b6001600160a01b0381166000908152601660205260408120600101546015548290610b879083612ad9565b9050801580610bc6575060016001600160a01b03851660009081526010602052604090206003015460ff166004811115610bc357610bc3615a74565b14155b15610bd5575060009392505050565b6001600160a01b03841660009081526010602052604081206002015490610c0e670de0b6b3a7640000610c088486612aec565b90612af8565b9695505050505050565b6000610c22612953565b6001600160a01b038316600090815260106020526040812054610c459084612ad9565b6001600160a01b03851660009081526010602052604090208190559150505b92915050565b6000610c74612953565b610c7d82612b04565b6001600160801b031692915050565b6000610c96612953565b610c6482612b9e565b8051600003610d145760405162461bcd60e51b815260206004820152603660248201527f54726f76654d616e616765723a2043616c6c646174612061646472657373206160448201527572726179206d757374206e6f7420626520656d70747960501b60648201526084015b60405180910390fd5b6000546001546005546001600160a01b03928316929182169116610d36615817565b610d3e615848565b600260009054906101000a90046001600160a01b03166001600160a01b0316630fdb11cf6040518163ffffffff1660e01b81526004016020604051808303816000875af1158015610d93573d6000803e3d6000fd5b505050506040513d601f19601f82011682018060405250810190610db79190615c75565b826000018181525050826001600160a01b031663488df0fc6040518163ffffffff1660e01b8152600401602060405180830381865afa158015610dfe573d6000803e3d6000fd5b505050506040513d601f19601f82011682018060405250810190610e229190615c75565b60208301528151610e3290612c42565b1580156040840152610e5a57610e538585846000015185602001518a612c5f565b9050610e72565b610e6f8585846000015185602001518a612e86565b90505b6000816020015111610e965760405162461bcd60e51b8152600401610d0b90615c8e565b608081015160a082015160405163335525ad60e01b81526001600160a01b0386169263335525ad92610ed392600401918252602082015260400190565b600060405180830381600087803b158015610eed57600080fd5b505af1158015610f01573d6000803e3d6000fd5b50505050610f1985858360c001518460e00151612f56565b61010081015115610f905760075461010082015160405163a51ba3b760e01b81526001600160a01b038881169363a51ba3b793610f5d939290911691600401615cd0565b600060405180830381600087803b158015610f7757600080fd5b505af1158015610f8b573d6000803e3d6000fd5b505050505b610f9e858260400151613191565b6020810151606083015261010081015160408201518251610fca9291610fc49190612ad9565b90612ad9565b6080838101829052606080850151604085810151868401518251938452602084019690965290820152908101929092527f4152c73dd2614c4f9fc35e8c9cf16013cd588c75b49a4c1673ecffdcbcda9403910160405180910390a16110398533836060015184604001516132d5565b505050505050565b6001600160a01b03811660009081526010602052604081206003015460ff166004811115610c6457610c64615a74565b6110856103e8670de0b6b3a7640000615d15565b611090906005615d29565b81565b6000806110ab84846014670de0b6b3a76400006133b8565b949350505050565b6110bc816134c3565b6040805160018082528183019092526000916020808301908036833701905050905081816000815181106110f2576110f2615d40565b60200260200101906001600160a01b031690816001600160a01b03168152505061111b81610c9f565b5050565b6000806110ab848460146714d1120d7b1600006133b8565b6000610c6461114583611c99565b8361355a565b6000610c6482612c42565b6000610c64600c5483613572565b61116c612953565b80600481111561117e5761117e615a74565b6001600160a01b0383166000908152601060205260409020600301805460ff191660018360048111156111b3576111b3615a74565b02179055505050565b6111c4612953565b6112006040518060400160405280601881526020017702120a9a2902920aa22902122a327a922902222a1a0ac9d160451b815250600d546136cf565b600061120a613714565b9050670de0b6b3a764000081111561122457611224615d56565b600d81905560408051808201909152601781527602120a9a2902920aa229020a32a22a9102222a1a0ac9d1604d1b602082015261126190826136cf565b6040518181527fca870d46d67e9a1444a6b8f97a147e06e4cf71ee2a0f172d7ecd5441ae7c12019060200160405180910390a1610b5961378a565b60008060006112aa84611e40565b90506112b6818561355a565b94909350915050565b6040805160e081018252600080546001600160a01b0390811683526001548116602084015292820181905260608201819052600b548316608083015260a0820181905260c0820152600554909116611315615817565b61131d615848565b600260009054906101000a90046001600160a01b03166001600160a01b0316630fdb11cf6040518163ffffffff1660e01b81526004016020604051808303816000875af1158015611372573d6000803e3d6000fd5b505050506040513d601f19601f820116820180604052508101906113969190615c75565b826000018181525050826001600160a01b031663488df0fc6040518163ffffffff1660e01b8152600401602060405180830381865afa1580156113dd573d6000803e3d6000fd5b505050506040513d601f19601f820116820180604052508101906114019190615c75565b6020830152815161141190612c42565b1580156040840152611438576114318483600001518460200151886137e1565b9050611458565b611455846000015185602001518460000151856020015189613b5f565b90505b600081602001511161147c5760405162461bcd60e51b8152600401610d0b90615c8e565b608081015160a082015160405163335525ad60e01b81526001600160a01b0386169263335525ad926114b992600401918252602082015260400190565b600060405180830381600087803b1580156114d357600080fd5b505af11580156114e7573d6000803e3d6000fd5b50505050611507846000015185602001518360c001518460e00151612f56565b6101008101511561157e57835160075461010083015160405163a51ba3b760e01b81526001600160a01b039384169363a51ba3b79361154b93911691600401615cd0565b600060405180830381600087803b15801561156557600080fd5b505af1158015611579573d6000803e3d6000fd5b505050505b61159084600001518260400151613191565b60208101516060830152610100810151604082015182516115b69291610fc49190612ad9565b6080838101829052606080850151604085810151868401518251938452602084019690965290820152908101929092527f4152c73dd2614c4f9fc35e8c9cf16013cd588c75b49a4c1673ecffdcbcda9403910160405180910390a1611629846000015133836060015184604001516132d5565b5050505050565b611638613c90565b6116426000613cea565b565b60006116c5600260009054906101000a90046001600160a01b03166001600160a01b0316630490be836040518163ffffffff1660e01b8152600401602060405180830381865afa15801561169c573d6000803e3d6000fd5b505050506040513d601f19601f820116820180604052508101906116c09190615c75565b612c42565b905090565b60006116d4612953565b6001600160a01b0383166000908152601060205260408120600101546116fa9084613d3c565b6001600160a01b038516600090815260106020526040902060010181905591505092915050565b6017818154811061173157600080fd5b6000918252602090912001546001600160a01b0316905081565b60008054604080516315b3137b60e21b8152905183926001600160a01b0316916356cc4dec9160048083019260209291908290030181865afa158015611795573d6000803e3d6000fd5b505050506040513d601f19601f820116820180604052508101906117b99190615c75565b90506000600160009054906101000a90046001600160a01b03166001600160a01b03166356cc4dec6040518163ffffffff1660e01b8152600401602060405180830381865afa158015611810573d6000803e3d6000fd5b505050506040513d601f19601f820116820180604052508101906118349190615c75565b90506118408282613d3c565b9250505090565b61184f613c90565b6118588b613d48565b6118618a613d48565b61186a89613d48565b61187388613d48565b61187c87613d48565b61188586613d48565b61188e85613d48565b61189784613d48565b6118a083613d48565b6118a982613d48565b6118b281613d48565b600480546001600160a01b03199081166001600160a01b038e8116919091179092556000805482168d84161790556001805482168c84161790556005805482168b84161790556006805482168a8416179055600780548216898416179055600280548216888416179055600880548216878416179055600b80548216868416179055600980548216858416179055600a80549091169183169190911790556040517f3ca631ffcd2a9b5d9ae18543fc82f58eb4ca33af9e6ab01b7a8e95331e6ed98590611980908d906158dc565b60405180910390a17f78f058b189175430c48dc02699e3a0031ea4ff781536dc2fab847de4babdd8828a6040516119b791906158dc565b60405180910390a17f5ee0cae2f063ed938bb55046f6a932fb6ae792bf43624806bb90abe68a50be9b896040516119ee91906158dc565b60405180910390a17f82966d27eea39b038ee0fa30cd16532bb24f6e65d31cb58fb227aa5766cdcc7f88604051611a2591906158dc565b60405180910390a17fcfb07d791fcafc032b35837b50eb84b74df518cf4cc287e8084f47630fa70fa087604051611a5c91906158dc565b60405180910390a17fe67f36a6e961157d6eff83b91f3af5a62131ceb6f04954ef74f51c1c05e7f88d86604051611a9391906158dc565b60405180910390a17f8c537274438aa850a330284665d81a85dd38267d09e4050d416bfc94142db26485604051611aca91906158dc565b60405180910390a17f7faa560f2889840c377209fbc4b6b92d05f43f1fc60bf336ab546fd60c0051ad84604051611b0191906158dc565b60405180910390a17f65f4cf077bc01e4742eb5ad98326f6e95b63548ea24b17f8d5e823111fe7880083604051611b3891906158dc565b60405180910390a17f0d32e4ef3d389440323b172cfc07c6c01bdd1d3e8334379048eec21e8d919b7782604051611b6f91906158dc565b60405180910390a17ffe7e5f521efd6e9fda9261f1223b2cda79ba84d0393e8b6629d27db91048126f81604051611ba691906158dc565b60405180910390a1611bb6611630565b5050505050505050505050565b611bcb612953565b610b5981613ded565b600080546040805163a2f0398360e01b8152905183926001600160a01b03169163a2f039839160048083019260209291908290030181865afa158015611c1e573d6000803e3d6000fd5b505050506040513d601f19601f82011682018060405250810190611c429190615c75565b90506000600160009054906101000a90046001600160a01b03166001600160a01b031663a2f039836040518163ffffffff1660e01b8152600401602060405180830381865afa158015611810573d6000803e3d6000fd5b6000610c64611ca6613e51565b83613e95565b6001600160a01b0381166000908152601660205260408120546014548290610b879083612ad9565b6000611cde612953565b6001600160a01b038316600090815260106020526040812054610c459084613d3c565b6004546001600160a01b03163314611d735760405162461bcd60e51b815260206004820152602f60248201527f54726f76654d616e616765723a204f6e6c7920426f72726f776572206f70657260448201526e185d1a5bdb9cc81b585e4818d85b1b608a1b6064820152608401610d0b565b611d876103e8670de0b6b3a7640000615d15565b611d92906005615d29565b8110611dc957611dac6103e8670de0b6b3a7640000615d15565b611db7906005615d29565b611dc19082615d6c565b600d55611dcf565b6000600d555b6040518181527fca870d46d67e9a1444a6b8f97a147e06e4cf71ee2a0f172d7ecd5441ae7c1201906020015b60405180910390a150565b6000610c64611e13613e51565b83613572565b6000806000611e2784613f74565b915091506000611e378383613fee565b95945050505050565b6000610c64600d5483613e95565b6000610c648261401d565b6001600160a01b03811660009081526010602052604081208054600190910154909180611e8585610b5c565b9150611e9085611cac565b9050611e9c8483613d3c565b9350611ea88382613d3c565b92509193509193565b6040805160e08082018352600080546001600160a01b0390811684526001548116602080860191909152600854821685870152600a548216606080870191909152600b548316608080880191909152600754841660a08089019190915260065490941660c080890191909152885161010081018a5286815293840186905297830185905290820184905281018390529081018290529384018190529083015290611f5a83614041565b600260009054906101000a90046001600160a01b03166001600160a01b0316630fdb11cf6040518163ffffffff1660e01b81526004016020604051808303816000875af1158015611faf573d6000803e3d6000fd5b505050506040513d601f19601f82011682018060405250810190611fd39190615c75565b60c08201819052611fe3906140dc565b611fec8961414f565b611ffb8260400151338b6141b6565b61200361174b565b60e0820181905260408084015190516370a0823160e01b81526001600160a01b03909116906370a082319061203c9033906004016158dc565b602060405180830381865afa158015612059573d6000803e3d6000fd5b505050506040513d601f19601f8201168201806040525081019061207d9190615c75565b111561208b5761208b615d56565b888152608082015160c08201516000916120a6918b906142b6565b156120b25750876121c4565b82608001516001600160a01b0316634d6228316040518163ffffffff1660e01b8152600401602060405180830381865afa1580156120f4573d6000803e3d6000fd5b505050506040513d601f19601f820116820180604052508101906121189190615d7f565b90505b6001600160a01b0381161580159061214757506714d1120d7b160000612145828460c001516126bc565b105b156121c45782608001516001600160a01b031663b72703ac826040518263ffffffff1660e01b815260040161217c91906158dc565b602060405180830381865afa158015612199573d6000803e3d6000fd5b505050506040513d601f19601f820116820180604052508101906121bd9190615d7f565b905061211b565b846000036121d25760001994505b6001600160a01b038116158015906121ea5750815115155b80156121f65750600085115b15612302578461220581615d9c565b955050600083608001516001600160a01b031663b72703ac836040518263ffffffff1660e01b815260040161223a91906158dc565b602060405180830381865afa158015612257573d6000803e3d6000fd5b505050506040513d601f19601f8201168201806040525081019061227b9190615d7f565b905061229084600001518560200151846129d3565b60006122a9858486600001518760c001518e8e8e614400565b90508060400151156122bc575050612302565b805160208501516122cc91613d3c565b60208086019190915281015160408501516122e691613d3c565b6040850152805184516122f891612ad9565b84525090506121d2565b60008260400151116123685760405162461bcd60e51b815260206004820152602960248201527f54726f76654d616e616765723a20556e61626c6520746f2072656465656d20616044820152681b9e48185b5bdd5b9d60ba1b6064820152608401610d0b565b61237f82604001518360c001518460e0015161465e565b5061238d8260400151614811565b6060830190815260408051808201909152601081526f02932b232b6b83a34b7b7103332b29d160851b602082015290516123c791906136cf565b6123da826060015183604001518661481f565b82516060808501519084015160405163a51ba3b760e01b81526001600160a01b039093169263a51ba3b792612413929091600401615cd0565b600060405180830381600087803b15801561242d57600080fd5b505af1158015612441573d6000803e3d6000fd5b5050505082606001516001600160a01b031663b307829d83606001516040518263ffffffff1660e01b815260040161247b91815260200190565b600060405180830381600087803b15801561249557600080fd5b505af11580156124a9573d6000803e3d6000fd5b50505050606082015160408301516124c091612ad9565b608083019081526040805180820190915260208082527f576861742061637475616c6c792067657473207472616e736665727265643a2090820152905161250791906136cf565b7f43a3f4082a4dbc33d78e317d2497d3a730bc7fc3574159dcea1056e62e5d9ad88a83602001518460400151856060015160405161255e949392919093845260208401929092526040830152606082015260800190565b60405180910390a182604001516001600160a01b0316639dc29fac3384602001516040518363ffffffff1660e01b815260040161259c929190615cd0565b600060405180830381600087803b1580156125b657600080fd5b505af11580156125ca573d6000803e3d6000fd5b505084516020850151604051633b4009ff60e11b81526001600160a01b03909216935063768013fe92506126049160040190815260200190565b600060405180830381600087803b15801561261e57600080fd5b505af1158015612632573d6000803e3d6000fd5b50508451608085015160405163a51ba3b760e01b81526001600160a01b03909216935063a51ba3b7925061266b91339190600401615cd0565b600060405180830381600087803b15801561268557600080fd5b505af1158015612699573d6000803e3d6000fd5b5050505050505050505050505050565b6126b1612953565b610b59816002614889565b60008060006126ca85613f74565b915091506000610c0e8383876149b6565b60006126e5612953565b6001600160a01b0383166000908152601060205260408120600101546116fa9084612ad9565b6000610c6461271983611e06565b83614a05565b600080600260009054906101000a90046001600160a01b03166001600160a01b0316630490be836040518163ffffffff1660e01b8152600401602060405180830381865afa158015612775573d6000803e3d6000fd5b505050506040513d601f19601f820116820180604052508101906127999190615c75565b90506000806127a785613f74565b915091506000610c0e8383866149b6565b6000601782815481106127cd576127cd615d40565b6000918252602090912001546001600160a01b031692915050565b60006116c5600260009054906101000a90046001600160a01b03166001600160a01b0316630490be836040518163ffffffff1660e01b8152600401602060405180830381865afa158015612840573d6000803e3d6000fd5b505050506040513d601f19601f820116820180604052508101906128649190615c75565b61401d565b600060016001600160a01b03831660009081526010602052604090206003015460ff16600481111561289d5761289d615a74565b146128aa57506000919050565b506014546001600160a01b039091166000908152601660205260409020541090565b6128d4613c90565b6001600160a01b0381166129395760405162461bcd60e51b815260206004820152602660248201527f4f776e61626c653a206e6577206f776e657220697320746865207a65726f206160448201526564647265737360d01b6064820152608401610d0b565b610b5981613cea565b61294a612953565b610b5981614a8e565b6004546001600160a01b031633146116425760405162461bcd60e51b815260206004820152603b60248201527f54726f76654d616e616765723a2043616c6c6572206973206e6f74207468652060448201527f426f72726f7765724f7065726174696f6e7320636f6e747261637400000000006064820152608401610d0b565b6129dc81612869565b15612ad4576129ea816134c3565b60006129f582611cac565b90506000612a0283610b5c565b6001600160a01b038416600090815260106020526040902060010154909150612a2b9083613d3c565b6001600160a01b0384166000908152601060205260409020600181019190915554612a569082613d3c565b6001600160a01b038416600090815260106020526040902055612a7883613ded565b612a8485858385614ad8565b6001600160a01b038316600081815260106020526040808220805460018201546002909201549251600080516020615ebf83398151915294612ac99492939291615dc7565b60405180910390a250505b505050565b6000612ae58284615d6c565b9392505050565b6000612ae58284615d29565b6000612ae58284615d15565b601780546001808201835560008381527fc624b66cc0138b8fabc209247f72d758e1cf3343756d543badbf24212bed8c1590920180546001600160a01b0319166001600160a01b03861617905591549091612b5f9190612ad9565b6001600160a01b039290921660009081526010602052604090206003018054610100600160881b0319166101006001600160801b038516021790555090565b6001600160a01b0381166000908152601060205260408120600101548190612bc590614bb9565b6001600160a01b038416600090815260106020526040902060020180549082905560115491925090612c03908390612bfd9084612ad9565b90613d3c565b60118190556040519081527f6bac5e0eb3c44eb03a60ab11ec3a2c051771616aecadbcfff2630aabae5203829060200160405180910390a15092915050565b600080612c4e8361401d565b6714d1120d7b160000119392505050565b612c67615848565b612c6f615894565b612c77615848565b84825260006080830152612c8961174b565b60a0830152612c96611bd4565b60c0830152600060208301525b835182602001511015612e7b5783826020015181518110612cc657612cc6615d40565b6020908102919091018101516001600160a01b03166060840181905260009081526010909152604090206003015460019060ff166004811115612d0b57612d0b615a74565b03612e6357612d1e8260600151876126bc565b60408301526080820151612e0b576714d1120d7b160000826040015110158015612d4757508151155b612e63576000612d608360c001518460a00151896149b6565b9050612d7d8989856060015186604001518760000151868d614bfa565b60808101518451919350612d919190612ad9565b8352608082015160a0840151612da691612ad9565b8360a0018181525050612ddb826101000151610fc48460400151610fc48660a001518860c00151612ad990919063ffffffff16565b60c0840152612dea8483614eed565b9350612dff8360c001518460a0015189614fce565b15608084015250612e63565b81608001518015612e2757506714d1120d7b1600008260400151105b15612e6357612e40888884606001518560000151614fef565b60808101518351919250612e549190612ad9565b8252612e608382614eed565b92505b60208201805190612e7382615de9565b905250612ca3565b505095945050505050565b612e8e615848565b612e96615894565b612e9e615848565b848252600060208301525b835182602001511015612e7b5783826020015181518110612ecc57612ecc615d40565b60209081029190910101516001600160a01b031660608301819052612ef190876126bc565b604083018190526714d1120d7b1600001115612f3e57612f1b888884606001518560000151614fef565b60808101518351919250612f2f9190612ad9565b8252612f3b8382614eed565b92505b60208201805190612f4e82615de9565b905250612ea9565b811561318b57601854600090612f7890612bfd84670de0b6b3a7640000612aec565b90506000612f9d601954612bfd670de0b6b3a764000087612aec90919063ffffffff16565b90506000612fb660115484612af890919063ffffffff16565b90506000612fcf60115484612af890919063ffffffff16565b9050612ff0612fe960115484612aec90919063ffffffff16565b8590612ad9565b60185560115461300c90613005908390612aec565b8490612ad9565b60195560145461301c9083613d3c565b60145560155461302c9082613d3c565b60158190556014546040517f9f8bc8ab0daf5bceef75ecfd2085d1fcc6548c657ea970d9a23a60610d0737e39261306a928252602082015260400190565b60405180910390a1604051633b4009ff60e11b8152600481018790526001600160a01b0389169063768013fe90602401600060405180830381600087803b1580156130b457600080fd5b505af11580156130c8573d6000803e3d6000fd5b505060405163262b890160e01b8152600481018990526001600160a01b038a16925063262b89019150602401600060405180830381600087803b15801561310e57600080fd5b505af1158015613122573d6000803e3d6000fd5b505060405163a51ba3b760e01b81526001600160a01b038b16925063a51ba3b79150613154908a908990600401615cd0565b600060405180830381600087803b15801561316e57600080fd5b505af1158015613182573d6000803e3d6000fd5b50505050505050505b50505050565b6011546012819055506000826001600160a01b031663a2f039836040518163ffffffff1660e01b8152600401602060405180830381865afa1580156131da573d6000803e3d6000fd5b505050506040513d601f19601f820116820180604052508101906131fe9190615c75565b90506000600160009054906101000a90046001600160a01b03166001600160a01b031663a2f039836040518163ffffffff1660e01b8152600401602060405180830381865afa158015613255573d6000803e3d6000fd5b505050506040513d601f19601f820116820180604052508101906132799190615c75565b905061328981612bfd8486612ad9565b60138190556012546040517f51bf4c63ec3cba9d03d43238abbdd979dd91bd16d9895c74ceea9118c7baaf60926132c7928252602082015260400190565b60405180910390a150505050565b811561334c57600854600654604051631062c15f60e11b81526001600160a01b0391821660048201528582166024820152604481018590529116906320c582be90606401600060405180830381600087803b15801561333357600080fd5b505af1158015613347573d6000803e3d6000fd5b505050505b801561318b5760405163a51ba3b760e01b81526001600160a01b0385169063a51ba3b7906133809086908590600401615cd0565b600060405180830381600087803b15801561339a57600080fd5b505af11580156133ae573d6000803e3d6000fd5b5050505050505050565b60006001633b9aca00826133cc8287615d29565b905060006133da8388615d29565b90505b6133e9836102ee615d29565b81116134b45760006133fc8a8a846149b6565b90508681101561345857825b828111158015613421575061341d858a615d29565b8110155b1561345657876134328c8c846149b6565b10156134455795506110ab945050505050565b61344f8582615d6c565b9050613408565b505b61346a6702c68af0bb14000088615d6c565b8110156134835761347c846014615d29565b945061349f565b6134948766b1a2bc2ec50000615e02565b81111561349f578394505b509050806134ad8482615e02565b90506133dd565b50600098975050505050505050565b60016001600160a01b03821660009081526010602052604090206003015460ff1660048111156134f5576134f5615a74565b14610b595760405162461bcd60e51b815260206004820152602f60248201527f54726f76654d616e616765723a2054726f766520646f6573206e6f742065786960448201526e1cdd081bdc881a5cc818db1bdcd959608a1b6064820152608401610d0b565b6000612ae5670de0b6b3a7640000610c088585612aec565b60006136196040518060400160405280600f81526020016e082c6e8d2ecca40a0deded840cae8d608b1b81525060008054906101000a90046001600160a01b03166001600160a01b031663a2f039836040518163ffffffff1660e01b8152600401602060405180830381865afa1580156135f0573d6000803e3d6000fd5b505050506040513d601f19601f820116820180604052508101906136149190615c75565b6136cf565b612ae56136c161369e60008054906101000a90046001600160a01b03166001600160a01b031663a2f039836040518163ffffffff1660e01b8152600401602060405180830381865afa158015613673573d6000803e3d6000fd5b505050506040513d601f19601f820116820180604052508101906136979190615c75565b8590612af8565b612bfd866136b66103e8670de0b6b3a7640000615d15565b612bfd906005615d29565b670de0b6b3a7640000615130565b61111b82826040516024016136e5929190615e15565b60408051601f198184030181529190526020810180516001600160e01b0316632d839cb360e21b179052615146565b60008061371f61514f565b90506000613735670dc14847bcc53b208361516b565b90506137696040518060400160405280601081526020016f036b4b73aba32b9903830b9b9b2b21d160851b815250836136cf565b611840670de0b6b3a7640000610c0883600d54612aec90919063ffffffff16565b60006137a1600f5442612ad990919063ffffffff16565b9050603c8110610b595742600f8190556040519081527f4ac50c32a269c2cfea9cf04e466da1ab839008441fadf7108e4f05410c2bfd5f90602001611dfb565b6137e9615848565b6137f1615894565b6137f9615848565b8482526000608083015261380b61174b565b60a0830152613818611bd4565b8260c001818152505086608001516001600160a01b0316634d6228316040518163ffffffff1660e01b8152600401602060405180830381865afa158015613863573d6000803e3d6000fd5b505050506040513d601f19601f820116820180604052508101906138879190615d7f565b82606001906001600160a01b031690816001600160a01b031681525050600087608001516001600160a01b0316631e2231436040518163ffffffff1660e01b8152600401602060405180830381865afa1580156138e8573d6000803e3d6000fd5b505050506040513d601f19601f8201168201806040525081019061390c9190615d7f565b6000602085015290505b84836020015110801561393f5750806001600160a01b031683606001516001600160a01b031614155b15613b545760808801516060840151604051632dc9c0eb60e21b81526000926001600160a01b03169163b72703ac9161397b91906004016158dc565b602060405180830381865afa158015613998573d6000803e3d6000fd5b505050506040513d601f19601f820116820180604052508101906139bc9190615d7f565b90506139cc8460600151896126bc565b60408501526080840151613ac4576714d1120d7b1600008460400151101580156139f557508351155b15613a005750613b54565b6000613a158560c001518660a001518b6149b6565b8a5160208c0151606088015160408901518951949550613a3694868f614bfa565b60808101518651919550613a4a9190612ad9565b8552608084015160a0860151613a5f91612ad9565b8560a0018181525050613a94846101000151610fc48660400151610fc48860a001518a60c00151612ad990919063ffffffff16565b60c0860152613aa38685614eed565b9550613ab88560c001518660a001518b614fce565b15608086015250613b2e565b83608001518015613ae057506714d1120d7b1600008460400151105b15613b2857613b0189600001518a6020015186606001518760000151614fef565b60808101518551919450613b159190612ad9565b8452613b218584614eed565b9450613b2e565b50613b54565b6001600160a01b0316606084015260208301805190613b4c82615de9565b905250613916565b505050949350505050565b613b67615848565b613b6f615894565b613b77615848565b600b54858352600060208401526001600160a01b03165b8483602001511015613c8457806001600160a01b0316634d6228316040518163ffffffff1660e01b8152600401602060405180830381865afa158015613bd8573d6000803e3d6000fd5b505050506040513d601f19601f82011682018060405250810190613bfc9190615d7f565b6001600160a01b031660608401819052613c1690886126bc565b604084018190526714d1120d7b1600001115613c6757613c40898985606001518660000151614fef565b60808101518451919350613c549190612ad9565b8352613c608483614eed565b9350613c6c565b613c84565b60208301805190613c7c82615de9565b905250613b8e565b50505095945050505050565b6003546001600160a01b031633146116425760405162461bcd60e51b815260206004820181905260248201527f4f776e61626c653a2063616c6c6572206973206e6f7420746865206f776e65726044820152606401610d0b565b600380546001600160a01b038381166001600160a01b0319831681179093556040519116919082907f8be0079c531659141344cd1fd0a4f28419497f9722a3daafe3b4186f6b6457e090600090a35050565b6000612ae58284615e02565b6001600160a01b038116613d9e5760405162461bcd60e51b815260206004820152601e60248201527f4163636f756e742063616e6e6f74206265207a65726f206164647265737300006044820152606401610d0b565b803b8061111b5760405162461bcd60e51b815260206004820181905260248201527f4163636f756e7420636f64652073697a652063616e6e6f74206265207a65726f6044820152606401610d0b565b601480546001600160a01b038316600090815260166020526040908190209182556015546001909201829055915491517fc437f324d85e369394148dd9d62f98f534b382e01ed3dd2eb98138fb6d3ab49a92611dfb92908252602082015260400190565b600080613e5c61520f565b90506000613e72670ddd4b8c6c7d70d88361516b565b9050611840670de0b6b3a7640000610c0883600c54612aec90919063ffffffff16565b600080600860009054906101000a90046001600160a01b03166001600160a01b03166318160ddd6040518163ffffffff1660e01b8152600401602060405180830381865afa158015613eeb573d6000803e3d6000fd5b505050506040513d601f19601f82011682018060405250810190613f0f9190615c75565b905080600003613f4057613f2d6103e8670de0b6b3a7640000615d15565b613f38906005615d29565b915050610c64565b6110ab6136c1613f5c83610c0887670de0b6b3a7640000612aec565b612bfd876136b66103e8670de0b6b3a7640000615d15565b6000806000613f8284611cac565b90506000613f8f85610b5c565b6001600160a01b03861660009081526010602052604081206001015491925090613fb99084613d3c565b6001600160a01b03871660009081526010602052604081205491925090613fe09084613d3c565b919791965090945050505050565b600081156140145761400d82610c088568056bc75e2d63100000612aec565b9050610c64565b50600019610c64565b600080614028611bd4565b9050600061403461174b565b90506110ab8282866149b6565b6140556103e8670de0b6b3a7640000615d15565b614060906005615d29565b81101580156140775750670de0b6b3a76400008111155b610b595760405162461bcd60e51b815260206004820152603060248201527f4d6178206665652070657263656e74616765206d75737420626520626574776560448201526f656e20302e352520616e64203130302560801b6064820152608401610d0b565b6714d1120d7b1600006140ee8261401d565b1015610b595760405162461bcd60e51b815260206004820152602a60248201527f54726f76654d616e616765723a2043616e6e6f742072656465656d207768656e604482015269102a21a9101e1026a1a960b11b6064820152608401610d0b565b60008111610b595760405162461bcd60e51b815260206004820152602e60248201527f54726f76654d616e616765723a20416d6f756e74206d7573742062652067726560448201526d61746572207468616e207a65726f60901b6064820152608401610d0b565b6040516370a0823160e01b815281906001600160a01b038516906370a08231906141e49086906004016158dc565b602060405180830381865afa158015614201573d6000803e3d6000fd5b505050506040513d601f19601f820116820180604052508101906142259190615c75565b1015612ad45760405162461bcd60e51b815260206004820152605460248201527f54726f76654d616e616765723a2052657175657374656420726564656d70746960448201527f6f6e20616d6f756e74206d757374206265203c3d2075736572277320426173656064820152734665654c4d4120746f6b656e2062616c616e636560601b608482015260a401610d0b565b60006001600160a01b03831615806143385750604051630bb7c8fd60e31b81526001600160a01b03851690635dbe47e8906142f59086906004016158dc565b602060405180830381865afa158015614312573d6000803e3d6000fd5b505050506040513d601f19601f820116820180604052508101906143369190615e37565b155b8061435357506714d1120d7b16000061435184846126bc565b105b1561436057506000612ae5565b60405163765e015960e01b81526000906001600160a01b0386169063765e01599061438f9087906004016158dc565b602060405180830381865afa1580156143ac573d6000803e3d6000fd5b505050506040513d601f19601f820116820180604052508101906143d09190615d7f565b90506001600160a01b0381161580611e3757506714d1120d7b1600006143f682856126bc565b1095945050505050565b614426604051806060016040528060008152602001600081526020016000151581525090565b6001600160a01b0387166000908152601060205260409020546144569087906144519061c350612ad9565b615130565b8082526144639086612aec565b60208083019190915281516001600160a01b03891660009081526010909252604082205461449091612ad9565b6020808401516001600160a01b038b1660009081526010909252604082206001015492935090916144c091612ad9565b905061c350820361452a576144d489614a8e565b6144df896004614889565b6144ed8a8a61c3508461522b565b886001600160a01b0316600080516020615ebf8339815191526000806000600360405161451d9493929190615dc7565b60405180910390a2614650565b60006145368284613fee565b9050848114158061454f5750600161454d8461538a565b105b156145635750506001604083015250614653565b60808b015160405163015f109360e51b81526001600160a01b038c81166004830152602482018490528981166044830152888116606483015290911690632be2126090608401600060405180830381600087803b1580156145c357600080fd5b505af11580156145d7573d6000803e3d6000fd5b5050506001600160a01b038b166000908152601060205260409020848155600101839055506146058a612b9e565b506001600160a01b038a1660008181526010602052604090819020600201549051600080516020615ebf833981519152916146469187918791600390615dc7565b60405180910390a2505b50505b979650505050505050565b600080614669613e51565b90506146e46040518060400160405280600c81526020016b03a37ba30b61031b7b6361d160a51b81525060008054906101000a90046001600160a01b03166001600160a01b031663a2f039836040518163ffffffff1660e01b8152600401602060405180830381865afa1580156135f0573d6000803e3d6000fd5b600080546040805163a2f0398360e01b81529051614766926001600160a01b03169163a2f039839160048083019260209291908290030181865afa158015614730573d6000803e3d6000fd5b505050506040513d601f19601f820116820180604052508101906147549190615c75565b610c0888670de0b6b3a7640000612aec565b905060006147748383613d3c565b90506147ad604051806040016040528060158152602001743932b232b2b6b2b2103636b090333930b1ba34b7b760591b815250836136cf565b6147bf81670de0b6b3a7640000615130565b9050600081116147d1576147d1615d56565b600c8190556040518181527fbcd47f9685f1ffa254d0ac495b2e47d57feda8840e9d1f2a54d9d499650502a89060200160405180910390a1610c0e615398565b6000610c6461271983611156565b600061483783610c0886670de0b6b3a7640000612aec565b90508181111561318b5760405162461bcd60e51b815260206004820152601d60248201527f4665652065786365656465642070726f7669646564206d6178696d756d0000006044820152606401610d0b565b600081600481111561489d5761489d615a74565b141580156148bd575060018160048111156148ba576148ba615a74565b14155b6148c9576148c9615d56565b6017546148d5816153ef565b6001600160a01b0383166000908152601060205260409020600301805483919060ff1916600183600481111561490d5761490d615a74565b02179055506001600160a01b038316600090815260106020908152604080832060018082018590559084905560169092528220828155015561494f83826154c9565b600b54604051631484968760e11b81526001600160a01b03909116906329092d0e9061497f9086906004016158dc565b600060405180830381600087803b15801561499957600080fd5b505af11580156149ad573d6000803e3d6000fd5b50505050505050565b600082156149fc5760006149d883610c08868189670de0b6b3a7640000612aec565b90506149e385615699565b6149ec84615699565b6149f581615699565b9050612ae5565b50600019612ae5565b600080614a1e670de0b6b3a7640000610c088686612aec565b9050828110612ae55760405162461bcd60e51b815260206004820152603660248201527f54726f76654d616e616765723a2046656520776f756c642065617420757020616044820152751b1b081c995d1d5c9b99590818dbdb1b185d195c985b60521b6064820152608401610d0b565b6001600160a01b038116600090815260106020526040902060020154601154614ab79082612ad9565b601155506001600160a01b0316600090815260106020526040812060020155565b604051633b4009ff60e11b8152600481018390526001600160a01b0384169063768013fe90602401600060405180830381600087803b158015614b1a57600080fd5b505af1158015614b2e573d6000803e3d6000fd5b505060405163262b890160e01b8152600481018590526001600160a01b038716925063262b89019150602401600060405180830381600087803b158015614b7457600080fd5b505af1158015614b88573d6000803e3d6000fd5b50506040516331534de160e01b8152600481018490526001600160a01b03861692506331534de19150602401613380565b600080601354600003614bcd575081610c64565b600060125411614bdf57614bdf615d56565b612ae5601354610c0860125486612aec90919063ffffffff16565b614c02615848565b614c2660405180606001604052806000815260200160008152602001600081525090565b601754600110614c365750614653565b614c3f87611e59565b60408501526020848101919091528401819052908352614c5e906156de565b6040830181905261c35060608401526020830151614c7b91612ad9565b8152670de0b6b3a76400008611614d4657614ca0898983602001518460400151614ad8565b614ca987614a8e565b60006080830181905260a0830152815160c0830152805160e0830152614cd0876003614889565b815160208301516040516001600160a01b038a1692600080516020615e9f83398151915292614d0192600290615e59565b60405180910390a2866001600160a01b0316600080516020615ebf83398151915260008060006002604051614d399493929190615dc7565b60405180910390a2614ee1565b670de0b6b3a764000086118015614d6457506714d1120d7b16000086105b15614db457614d7d898983602001518460400151614ad8565b614d8687614a8e565b81518151614d959190876156eb565b60e086015260c085015260a08401526080830152614cd0876003614889565b6714d1120d7b1600008610158015614dcb57508386105b8015614dd8575081518510155b15614ed057614df1898983602001518460400151614ad8565b84600003614e0157614e01615d56565b614e0a87614a8e565b614e1d8260000151836020015185615745565b9150614e2a876003614889565b61010082015115614e9f57600754610100830151604051633f10abab60e01b81526001600160a01b0390921691633f10abab91614e6c918b9190600401615cd0565b600060405180830381600087803b158015614e8657600080fd5b505af1158015614e9a573d6000803e3d6000fd5b505050505b815160a08301516040516001600160a01b038a1692600080516020615e9f83398151915292614d0192600290615e59565b614ed8615848565b91506146539050565b50979650505050505050565b614ef5615848565b60408083015190840151614f0891613d3c565b604082015260608083015190840151614f2091613d3c565b606082015281516020840151614f3591613d3c565b6020808301919091528201518351614f4c91613d3c565b815260808083015190840151614f6191613d3c565b608082015260a08083015190840151614f7991613d3c565b60a082015260c08083015190840151614f9191613d3c565b60c082015260e08083015190840151614fa991613d3c565b60e08201526101008083015190840151614fc291613d3c565b61010082015292915050565b600080614fdc8585856149b6565b6714d1120d7b1600001195945050505050565b614ff7615848565b61501b60405180606001604052806000815260200160008152602001600081525090565b61502484611e59565b6040850190815260208581019283528601929092529184529051905161504e918891889190614ad8565b61505784614a8e565b61506482602001516156de565b6040830181905261c350606084015260208301516000916150859190612ad9565b9050615096836000015182866156eb565b60e087015260c086015260a085015260808401526150b5856003614889565b825160208401516040516001600160a01b03881692600080516020615e9f833981519152926150e692600190615e59565b60405180910390a2846001600160a01b0316600080516020615ebf8339815191526000806000600160405161511e9493929190615dc7565b60405180910390a25050949350505050565b600081831061513f5781612ae5565b5090919050565b610b59816157c6565b60006116c5603c610c08600f5442612ad990919063ffffffff16565b6000631f54050082111561518157631f54050091505b816000036151985750670de0b6b3a7640000610c64565b670de0b6b3a764000083835b6001811115615205576151b8600282615e74565b6000036151dd576151c982836157e7565b91506151d6816002612af8565b90506151a4565b6151e782846157e7565b92506151f382836157e7565b91506151d66002610c08836001612ad9565b610c0e82846157e7565b60006116c5603c610c08600e5442612ad990919063ffffffff16565b6040808501516006549151632770a7eb60e21b81526001600160a01b0391821692639dc29fac92615263929116908690600401615cd0565b600060405180830381600087803b15801561527d57600080fd5b505af1158015615291573d6000803e3d6000fd5b50508551604051633b4009ff60e11b8152600481018690526001600160a01b03909116925063768013fe9150602401600060405180830381600087803b1580156152da57600080fd5b505af11580156152ee573d6000803e3d6000fd5b505050508360a001516001600160a01b0316633f10abab84836040518363ffffffff1660e01b8152600401615324929190615cd0565b600060405180830381600087803b15801561533e57600080fd5b505af1158015615352573d6000803e3d6000fd5b5050855160a087015160405163a51ba3b760e01b81526001600160a01b03909216935063a51ba3b79250613380918590600401615cd0565b6000610c648261c350612ad9565b60006153af600e5442612ad990919063ffffffff16565b9050603c8110610b595742600e8190556040519081527fbab964312bdd13595266f3e549bca3102965a6d718c6c1f8cd7eaac076b9c6c290602001611dfb565b60018111801561546a5750600b546040805163de8fa43160e01b815290516001926001600160a01b03169163de8fa4319160048083019260209291908290030181865afa158015615444573d6000803e3d6000fd5b505050506040513d601f19601f820116820180604052508101906154689190615c75565b115b610b595760405162461bcd60e51b815260206004820152602a60248201527f54726f76654d616e616765723a204f6e6c79206f6e652074726f766520696e206044820152697468652073797374656d60b01b6064820152608401610d0b565b6001600160a01b03821660009081526010602052604081206003015460ff16908160048111156154fb576154fb615a74565b1415801561551b5750600181600481111561551857615518615a74565b14155b61552757615527615d56565b6001600160a01b03831660009081526010602052604081206003015461010090046001600160801b031690839061555f826001612ad9565b905080836001600160801b0316111561557a5761557a615d56565b60006017828154811061558f5761558f615d40565b600091825260209091200154601780546001600160a01b03909216925082916001600160801b0387169081106155c7576155c7615d40565b600091825260208083209190910180546001600160a01b0319166001600160a01b03948516179055918316808252601083526040918290206003018054610100600160881b0319166101006001600160801b038a16908102919091179091558251918252928101929092527f02b04ae5f7be9ca7c103293a2aa15f3c339d15d6eda53b721fef7b0e609c831a910160405180910390a1601780548061566e5761566e615e88565b600082815260209020810160001990810180546001600160a01b031916905501905550505050505050565b610b59816040516024016156af91815260200190565b60408051601f198184030181529190526020810180516001600160e01b031663f82c50f160e01b179052615146565b6000610c6460c883615d15565b6000808080841561572f576157008786615130565b935061571087610c088887612aec565b925061571c8785612ad9565b91506157288684612ad9565b905061573c565b5060009250829150859050845b93509350935093565b61574d615848565b83815260208101839052600061576f83610c08876714d1120d7b160000612aec565b905061577a816156de565b6040830181905261c35060608401526080830186905261579b908290612ad9565b60a08301526157aa8482612ad9565b61010083015250600060c0820181905260e08201529392505050565b60006a636f6e736f6c652e6c6f679050600080835160208501845afa505050565b6000806157f48484612aec565b90506110ab670de0b6b3a7640000610c08615810600283615d15565b8490613d3c565b6040518060a00160405280600081526020016000815260200160001515815260200160008152602001600081525090565b6040518061012001604052806000815260200160008152602001600081526020016000815260200160008152602001600081526020016000815260200160008152602001600081525090565b6040518060e0016040528060008152602001600081526020016000815260200160006001600160a01b0316815260200160001515815260200160008152602001600081525090565b6001600160a01b0391909116815260200190565b6001600160a01b0381168114610b5957600080fd5b8035615910816158f0565b919050565b60006020828403121561592757600080fd5b8135612ae5816158f0565b6000806040838503121561594557600080fd5b8235615950816158f0565b946020939093013593505050565b634e487b7160e01b600052604160045260246000fd5b6000602080838503121561598757600080fd5b823567ffffffffffffffff8082111561599f57600080fd5b818501915085601f8301126159b357600080fd5b8135818111156159c5576159c561595e565b8060051b604051601f19603f830116810181811085821117156159ea576159ea61595e565b604052918252848201925083810185019188831115615a0857600080fd5b938501935b82851015615a2d57615a1e85615905565b84529385019392850192615a0d565b98975050505050505050565b60008060408385031215615a4c57600080fd5b50508035926020909101359150565b600060208284031215615a6d57600080fd5b5035919050565b634e487b7160e01b600052602160045260246000fd5b858152602081018590526040810184905260a0810160058410615aaf57615aaf615a74565b60608201939093526001600160801b03919091166080909101529392505050565b60008060008060008060008060008060006101608c8e031215615af257600080fd5b8b35615afd816158f0565b9a5060208c0135615b0d816158f0565b995060408c0135615b1d816158f0565b985060608c0135615b2d816158f0565b975060808c0135615b3d816158f0565b965060a08c0135615b4d816158f0565b955060c08c0135615b5d816158f0565b945060e08c0135615b6d816158f0565b93506101008c0135615b7e816158f0565b9250615b8d6101208d01615905565b9150615b9c6101408d01615905565b90509295989b509295989b9093969950565b6000815180845260005b81811015615bd457602081850181015186830182015201615bb8565b506000602082860101526020601f19601f83011685010191505092915050565b602081526000612ae56020830184615bae565b600080600080600080600060e0888a031215615c2257600080fd5b873596506020880135615c34816158f0565b95506040880135615c44816158f0565b94506060880135615c54816158f0565b9699959850939660808101359560a0820135955060c0909101359350915050565b600060208284031215615c8757600080fd5b5051919050565b60208082526022908201527f54726f76654d616e616765723a206e6f7468696e6720746f206c697175696461604082015261746560f01b606082015260800190565b6001600160a01b03929092168252602082015260400190565b634e487b7160e01b600052601260045260246000fd5b634e487b7160e01b600052601160045260246000fd5b600082615d2457615d24615ce9565b500490565b8082028115828204841417610c6457610c64615cff565b634e487b7160e01b600052603260045260246000fd5b634e487b7160e01b600052600160045260246000fd5b81810381811115610c6457610c64615cff565b600060208284031215615d9157600080fd5b8151612ae5816158f0565b600081615dab57615dab615cff565b506000190190565b60048110615dc357615dc3615a74565b9052565b848152602081018490526040810183905260808101611e376060830184615db3565b600060018201615dfb57615dfb615cff565b5060010190565b80820180821115610c6457610c64615cff565b604081526000615e286040830185615bae565b90508260208301529392505050565b600060208284031215615e4957600080fd5b81518015158114612ae557600080fd5b83815260208101839052606081016110ab6040830184615db3565b600082615e8357615e83615ce9565b500690565b634e487b7160e01b600052603160045260246000fdfeea67486ed7ebe3eea8ab3390efd4a3c8aae48be5bea27df104a8af786c408434c3770d654ed33aeea6bf11ac8ef05d02a6a04ed4686dd2f624d853bbec43cc8ba2646970667358221220fe26cede49a54f745f6eb7c034e37c034e5f6c9c78d47f461cde5626873e962764736f6c63430008130033",
  "devdoc": {
    "kind": "dev",
    "methods": {
      "owner()": {
        "details": "Returns the address of the current owner."
      },
      "renounceOwnership()": {
        "details": "Leaves the contract without owner. It will not be possible to call `onlyOwner` functions. Can only be called by the current owner. NOTE: Renouncing ownership will leave the contract without an owner, thereby disabling any functionality that is only available to the owner."
      },
      "transferOwnership(address)": {
        "details": "Transfers ownership of the contract to a new account (`newOwner`). Can only be called by the current owner."
      }
    },
    "version": 1
  },
  "userdoc": {
    "kind": "user",
    "methods": {
      "getCurrentICR(address,uint256)": {
        "notice": "Hedgehog changes: Get Price directly from the price feed instead of param passing"
      }
    },
    "notice": "Fork of Liquity's TroveManager. Logic remains unchanged. Changes to the contract: - Raised pragma version - Removed an import of ActivePool Interface Even though SafeMath is no longer required, the decision was made to keep it to avoid human factor errors",
    "version": 1
  },
  "storageLayout": {
    "storage": [
      {
        "astId": 7268,
        "contract": "contracts/TroveManager.sol:TroveManager",
        "label": "activePool",
        "offset": 0,
        "slot": "0",
        "type": "t_contract(IActivePool)7927"
      },
      {
        "astId": 7271,
        "contract": "contracts/TroveManager.sol:TroveManager",
        "label": "defaultPool",
        "offset": 0,
        "slot": "1",
        "type": "t_contract(IDefaultPool)8256"
      },
      {
        "astId": 7275,
        "contract": "contracts/TroveManager.sol:TroveManager",
        "label": "priceFeed",
        "offset": 0,
        "slot": "2",
        "type": "t_contract(IPriceFeed)8498"
      },
      {
        "astId": 7,
        "contract": "contracts/TroveManager.sol:TroveManager",
        "label": "_owner",
        "offset": 0,
        "slot": "3",
        "type": "t_address"
      },
      {
        "astId": 2082,
        "contract": "contracts/TroveManager.sol:TroveManager",
        "label": "borrowerOperationsAddress",
        "offset": 0,
        "slot": "4",
        "type": "t_address"
      },
      {
        "astId": 2085,
        "contract": "contracts/TroveManager.sol:TroveManager",
        "label": "stabilityPool",
        "offset": 0,
        "slot": "5",
        "type": "t_contract(IStabilityPool)8803"
      },
      {
        "astId": 2087,
        "contract": "contracts/TroveManager.sol:TroveManager",
        "label": "gasPoolAddress",
        "offset": 0,
        "slot": "6",
        "type": "t_address"
      },
      {
        "astId": 2090,
        "contract": "contracts/TroveManager.sol:TroveManager",
        "label": "collSurplusPool",
        "offset": 0,
        "slot": "7",
        "type": "t_contract(ICollSurplusPool)8233"
      },
      {
        "astId": 2093,
        "contract": "contracts/TroveManager.sol:TroveManager",
        "label": "baseFeeLMAToken",
        "offset": 0,
        "slot": "8",
        "type": "t_contract(IBaseFeeLMAToken)7991"
      },
      {
        "astId": 2096,
        "contract": "contracts/TroveManager.sol:TroveManager",
        "label": "hogToken",
        "offset": 0,
        "slot": "9",
        "type": "t_contract(IHOGToken)8422"
      },
      {
        "astId": 2099,
        "contract": "contracts/TroveManager.sol:TroveManager",
        "label": "hogStaking",
        "offset": 0,
        "slot": "10",
        "type": "t_contract(IHOGStaking)8366"
      },
      {
        "astId": 2102,
        "contract": "contracts/TroveManager.sol:TroveManager",
        "label": "sortedTroves",
        "offset": 0,
        "slot": "11",
        "type": "t_contract(ISortedTroves)8630"
      },
      {
        "astId": 2130,
        "contract": "contracts/TroveManager.sol:TroveManager",
        "label": "redemptionBaseRate",
        "offset": 0,
        "slot": "12",
        "type": "t_uint256"
      },
      {
        "astId": 2132,
        "contract": "contracts/TroveManager.sol:TroveManager",
        "label": "borrowBaseRate",
        "offset": 0,
        "slot": "13",
        "type": "t_uint256"
      },
      {
        "astId": 2134,
        "contract": "contracts/TroveManager.sol:TroveManager",
        "label": "lastRedemptionTime",
        "offset": 0,
        "slot": "14",
        "type": "t_uint256"
      },
      {
        "astId": 2136,
        "contract": "contracts/TroveManager.sol:TroveManager",
        "label": "lastBorrowTime",
        "offset": 0,
        "slot": "15",
        "type": "t_uint256"
      },
      {
        "astId": 2159,
        "contract": "contracts/TroveManager.sol:TroveManager",
        "label": "Troves",
        "offset": 0,
        "slot": "16",
        "type": "t_mapping(t_address,t_struct(Trove)2154_storage)"
      },
      {
        "astId": 2161,
        "contract": "contracts/TroveManager.sol:TroveManager",
        "label": "totalStakes",
        "offset": 0,
        "slot": "17",
        "type": "t_uint256"
      },
      {
        "astId": 2163,
        "contract": "contracts/TroveManager.sol:TroveManager",
        "label": "totalStakesSnapshot",
        "offset": 0,
        "slot": "18",
        "type": "t_uint256"
      },
      {
        "astId": 2165,
        "contract": "contracts/TroveManager.sol:TroveManager",
        "label": "totalCollateralSnapshot",
        "offset": 0,
        "slot": "19",
        "type": "t_uint256"
      },
      {
        "astId": 2167,
        "contract": "contracts/TroveManager.sol:TroveManager",
        "label": "L_StETH",
        "offset": 0,
        "slot": "20",
        "type": "t_uint256"
      },
      {
        "astId": 2169,
        "contract": "contracts/TroveManager.sol:TroveManager",
        "label": "L_BaseFeeLMADebt",
        "offset": 0,
        "slot": "21",
        "type": "t_uint256"
      },
      {
        "astId": 2174,
        "contract": "contracts/TroveManager.sol:TroveManager",
        "label": "rewardSnapshots",
        "offset": 0,
        "slot": "22",
        "type": "t_mapping(t_address,t_struct(RewardSnapshot)2179_storage)"
      },
      {
        "astId": 2182,
        "contract": "contracts/TroveManager.sol:TroveManager",
        "label": "TroveOwners",
        "offset": 0,
        "slot": "23",
        "type": "t_array(t_address)dyn_storage"
      },
      {
        "astId": 2184,
        "contract": "contracts/TroveManager.sol:TroveManager",
        "label": "lastStETHError_Redistribution",
        "offset": 0,
        "slot": "24",
        "type": "t_uint256"
      },
      {
        "astId": 2186,
        "contract": "contracts/TroveManager.sol:TroveManager",
        "label": "lastBaseFeeLMADebtError_Redistribution",
        "offset": 0,
        "slot": "25",
        "type": "t_uint256"
      }
    ],
    "types": {
      "t_address": {
        "encoding": "inplace",
        "label": "address",
        "numberOfBytes": "20"
      },
      "t_array(t_address)dyn_storage": {
        "base": "t_address",
        "encoding": "dynamic_array",
        "label": "address[]",
        "numberOfBytes": "32"
      },
      "t_contract(IActivePool)7927": {
        "encoding": "inplace",
        "label": "contract IActivePool",
        "numberOfBytes": "20"
      },
      "t_contract(IBaseFeeLMAToken)7991": {
        "encoding": "inplace",
        "label": "contract IBaseFeeLMAToken",
        "numberOfBytes": "20"
      },
      "t_contract(ICollSurplusPool)8233": {
        "encoding": "inplace",
        "label": "contract ICollSurplusPool",
        "numberOfBytes": "20"
      },
      "t_contract(IDefaultPool)8256": {
        "encoding": "inplace",
        "label": "contract IDefaultPool",
        "numberOfBytes": "20"
      },
      "t_contract(IHOGStaking)8366": {
        "encoding": "inplace",
        "label": "contract IHOGStaking",
        "numberOfBytes": "20"
      },
      "t_contract(IHOGToken)8422": {
        "encoding": "inplace",
        "label": "contract IHOGToken",
        "numberOfBytes": "20"
      },
      "t_contract(IPriceFeed)8498": {
        "encoding": "inplace",
        "label": "contract IPriceFeed",
        "numberOfBytes": "20"
      },
      "t_contract(ISortedTroves)8630": {
        "encoding": "inplace",
        "label": "contract ISortedTroves",
        "numberOfBytes": "20"
      },
      "t_contract(IStabilityPool)8803": {
        "encoding": "inplace",
        "label": "contract IStabilityPool",
        "numberOfBytes": "20"
      },
      "t_enum(Status)2142": {
        "encoding": "inplace",
        "label": "enum TroveManager.Status",
        "numberOfBytes": "1"
      },
      "t_mapping(t_address,t_struct(RewardSnapshot)2179_storage)": {
        "encoding": "mapping",
        "key": "t_address",
        "label": "mapping(address => struct TroveManager.RewardSnapshot)",
        "numberOfBytes": "32",
        "value": "t_struct(RewardSnapshot)2179_storage"
      },
      "t_mapping(t_address,t_struct(Trove)2154_storage)": {
        "encoding": "mapping",
        "key": "t_address",
        "label": "mapping(address => struct TroveManager.Trove)",
        "numberOfBytes": "32",
        "value": "t_struct(Trove)2154_storage"
      },
      "t_struct(RewardSnapshot)2179_storage": {
        "encoding": "inplace",
        "label": "struct TroveManager.RewardSnapshot",
        "members": [
          {
            "astId": 2176,
            "contract": "contracts/TroveManager.sol:TroveManager",
            "label": "StETH",
            "offset": 0,
            "slot": "0",
            "type": "t_uint256"
          },
          {
            "astId": 2178,
            "contract": "contracts/TroveManager.sol:TroveManager",
            "label": "BaseFeeLMADebt",
            "offset": 0,
            "slot": "1",
            "type": "t_uint256"
          }
        ],
        "numberOfBytes": "64"
      },
      "t_struct(Trove)2154_storage": {
        "encoding": "inplace",
        "label": "struct TroveManager.Trove",
        "members": [
          {
            "astId": 2144,
            "contract": "contracts/TroveManager.sol:TroveManager",
            "label": "debt",
            "offset": 0,
            "slot": "0",
            "type": "t_uint256"
          },
          {
            "astId": 2146,
            "contract": "contracts/TroveManager.sol:TroveManager",
            "label": "coll",
            "offset": 0,
            "slot": "1",
            "type": "t_uint256"
          },
          {
            "astId": 2148,
            "contract": "contracts/TroveManager.sol:TroveManager",
            "label": "stake",
            "offset": 0,
            "slot": "2",
            "type": "t_uint256"
          },
          {
            "astId": 2151,
            "contract": "contracts/TroveManager.sol:TroveManager",
            "label": "status",
            "offset": 0,
            "slot": "3",
            "type": "t_enum(Status)2142"
          },
          {
            "astId": 2153,
            "contract": "contracts/TroveManager.sol:TroveManager",
            "label": "arrayIndex",
            "offset": 1,
            "slot": "3",
            "type": "t_uint128"
          }
        ],
        "numberOfBytes": "128"
      },
      "t_uint128": {
        "encoding": "inplace",
        "label": "uint128",
        "numberOfBytes": "16"
      },
      "t_uint256": {
        "encoding": "inplace",
        "label": "uint256",
        "numberOfBytes": "32"
      }
    }
  }
}